id,titre,phrase,motifs_phrase
803,Daudet/la_belle_Nivernaise copie_clean.txt,"Mais son trésor à lui tout seul , sans yeux autour pour le guigner .","mais DETPOSS NC à lui tout ADJ , sans NCCOR ADV pour le NCmod ."
804,Daudet/la_belle_Nivernaise copie_clean.txt,Les oreilles de Maugendre bourdonnent comme l' express .,le NCCOR de NP PRES comme le NC .
805,Daudet/la_belle_Nivernaise copie_clean.txt,Sa tête est chauffée comme la locomotive .,DETPOSS NCCOR être PPAS comme le NC .
806,Daudet/la_belle_Nivernaise copie_clean.txt,"Et son rêve roule plus vite que toutes les locomotives et que tous les express , franchissant d' un élan les jours , les mois , les années .","et DETPOSS NCs PRES plus ADV que tout le NC et que tout le NC , PPRES de un NC le NCT , le NCT , le NCT ."
807,Daudet/la_belle_Nivernaise copie_clean.txt,"Ce qu' il rêve c' est un Victor de vingt ans boutonné d' argent , habillé de vert sombre .","ce que il PRES ce être un NP de NUM NCT PPAS de NC , PPAS de ADJCOL ADJ ."
808,Daudet/la_belle_Nivernaise copie_clean.txt,Un élève de l' école forestière !,un NC de le NCmod ADJ !
809,Daudet/la_belle_Nivernaise copie_clean.txt,"On dirait même que l' élève Maugendre a l' épée à le côté et le bicorne sur l' oreille , comme un polytechnicien ; car toutes les écoles et tous les uniformes sont un peu mêlés dans le rêve de Maugendre .","on VDIC même que le NCs NP PRES le NCo à le NC et le NC sur le NCCOR , comme un NCmod ; car tout le NCs et tout le NC être un peu ADJ dans le NC de NP ."
810,Daudet/la_belle_Nivernaise copie_clean.txt,Et qu' importe !,et que PRES !
811,Daudet/la_belle_Nivernaise copie_clean.txt,Les galons et les dorures ne coûtent pas à le charpentier .,le NCs et le NC ne PRES pas à le NC .
812,Daudet/la_belle_Nivernaise copie_clean.txt,On a de la denrée pour payer tout ça ... Et Victor sera un monsieur chamarré de les pieds à la tête .,on avoir de le NC pour INF tout ça ... et NP être un monsieur PPAS de le NCCOR à le NCCOR .
813,Daudet/la_belle_Nivernaise copie_clean.txt,Les hommes lui parleront chapeau bas .,le NCs lui VF NCo ADJ .
814,Daudet/la_belle_Nivernaise copie_clean.txt,Les belles dames en seront folles .,le ADJ NCs en être ADJ .
815,Daudet/la_belle_Nivernaise copie_clean.txt,"Et , dans un coin , il y aura un vieux à les mains calleuses qui dira en se rengorgeant : Voilà mon fils !","et , dans un NC , il y avoir un ADJ à le NCCOR ADJ qui VDIC en se PPRES : voilà DETPOSS NCo !"
816,Daudet/la_belle_Nivernaise copie_clean.txt,"Allons , mon fils !","NP , DETPOSS NC !"
817,Daudet/la_belle_Nivernaise copie_clean.txt,"Il songe aussi , mon fils , son petit béret sur les yeux , en attendant le tricorne doré .","il PRES aussi , DETPOSS NCo , DETPOSS ADJ NC sur le NCCOR , en PPRES le NCo ADJCOL ."
818,Daudet/la_belle_Nivernaise copie_clean.txt,Il ne voudrait pas que son père le vit pleurer .,il ne vouloir pas que DETPOSS NCs le VCOG INF .
819,Daudet/la_belle_Nivernaise copie_clean.txt,Ça a été si brusque la séparation !,ça avoir être si ADJ le NC !
820,Daudet/la_belle_Nivernaise copie_clean.txt,Clara lui a donné un baiser qui lui brûle encore la joue .,NP lui avoir PPAS un NCo qui lui PRES encore le NCCOR .
821,Daudet/la_belle_Nivernaise copie_clean.txt,Le père Louveau s' est détourné .,le NCs NP se être PPAS .
822,Daudet/la_belle_Nivernaise copie_clean.txt,La mère Louveau était toute pâle .,le NCs NP être tout ADJ .
823,Daudet/la_belle_Nivernaise copie_clean.txt,"Et Mimile lui a apporté son écuelle de soupe , pour le consoler .","et NP lui avoir PPAS DETPOSS NCo de NCmod , pour le INF ."
824,Daudet/la_belle_Nivernaise copie_clean.txt,Tous !,tout !
825,Daudet/la_belle_Nivernaise copie_clean.txt,jusqu' à Mimile !,jusque à NP !
826,Daudet/la_belle_Nivernaise copie_clean.txt,Oh !,INTJ !
827,Daudet/la_belle_Nivernaise copie_clean.txt,comment vivront -ils sans lui ?,comment VF il sans lui ?
828,Daudet/la_belle_Nivernaise copie_clean.txt,Comment vivra -t -il sans eux ?,comment VF t il sans eux ?
829,Daudet/la_belle_Nivernaise copie_clean.txt,"Et le futur élève de l' école forestière est si troublé qu' il répond : Oui , monsieur Maugendre .","et le ADJ NCs de le NCmod ADJ être si VSENT que il VDIC : oui , monsieur NP ."
830,Daudet/la_belle_Nivernaise copie_clean.txt,Toutes les fois que son père lui parle .,tout le fois que DETPOSS NCs lui PRES .
831,Daudet/la_belle_Nivernaise copie_clean.txt,"Et il n' est pas à le bout de ses tribulations , le petit marinier de la Belle-Nivernaise .","et il ne être pas à le NC de DETPOSS NCmod , le ADJ NC de le NP ."
832,Daudet/la_belle_Nivernaise copie_clean.txt,"Cela ne coûte pas seulement de l' argent de devenir un monsieur , mais bien de les sacrifices et de les tristesses .","cela ne PRES pas seulement de le NC de devenir un monsieur , mais bien de le NC et de le NCSENT ."
833,Daudet/la_belle_Nivernaise copie_clean.txt,"Victor en a le sentiment , tandis que le train rapide passe en sifflant , sur les ponts , au-dessus de le faubourg de Nevers .","NP en avoir le NCSENT , PHASE que le NCs ADJ PRES en PPRES , sur le NC , ADVLIEU de le NC de NP ."
834,Daudet/la_belle_Nivernaise copie_clean.txt,"Il lui semble qu' il les a déjà vues quelque part , dans un passé éloigné et douloureux , ces rues étroites , ces fenêtres étranglées comme de les soupiraux de prisons , d' où pendent de les loques effilochées ... Maintenant ils ont le pavé sous les pieds .","il lui sembler que il le avoir déjà PPAS quelque NCo , dans un NC ADJ et ADJ , ce NC ADJ , ce NC PPAS comme de le NC de NCmod , de où PRES de le NC ADJ ... ADVT il avoir le NCo sous le NCCOR ."
835,Daudet/la_belle_Nivernaise copie_clean.txt,"Autour d' eux circule et bourdonne la cohue de les débarcadères , presse de curieux , bousculade de gens chargés de colis , roulement de les fiacres et de les lourds omnibus de le chemin de fer , que de les voyageurs , chargés de couvertures serrées dans de les courroies , prennent bruyamment d' assaut .","ADV de eux PRES et PRES le NCo de le NCmod , NC de NCmod , NC de NCmod PPAS de NC , NC de le NCmod et de le ADJ NC de le NCmod de NCmod , que de le NC , PPAS de NC PPAS dans un le NC , PRES ADVMAN de NC ."
836,Daudet/la_belle_Nivernaise copie_clean.txt,Victor et son père sortent en voiture de les grilles de la gare .,NP et DETPOSS NC PRES en NC de le NCmod de le NCmod .
837,Daudet/la_belle_Nivernaise copie_clean.txt,Le charpentier ne lâche pas son idée .,le NCs ne PRES pas DETPOSS NCo .
838,Daudet/la_belle_Nivernaise copie_clean.txt,Il lui faut une transformation subite .,il lui PRES un NCo ADJ .
839,Daudet/la_belle_Nivernaise copie_clean.txt,Et il conduit son fils tout droit chez le tailleur de le collège .,et il PRES DETPOSS NCo tout ADJ chez le NC de le NCmod .
840,Daudet/la_belle_Nivernaise copie_clean.txt,"La boutique est neuve , les comptoirs luisants , de les messieurs bien mis , qui ressemblent à ceux que l' on voit dans les gravures coloriées , appendues à les murailles , ouvrent la porte à les clients avec un petit sourire protecteur .","le NCs être ADJ , le NC ADJ , de le NCmod bien mettre , qui PRES à celui que l' on VCOG dans le NC PPAS , PPAS à le NC , PRES le NCo à le NCmod avec un ADJ NCMAN ADJ ."
841,Daudet/la_belle_Nivernaise copie_clean.txt,"Ils mettent sous les yeux de le père Maugendre une prime de les Modes illustrées , où un collégien fume en compagnie d' une amazone , d' un gentleman en complet de chasse , et d' une mariée vêtue de satin blanc .","il mettre sous le NCCOR de le NCmod NP un NCo de le NP ADJ , où un NC ADJ en NCmod de un NCmod , de un NCmod en NCmod de NCmod , et de un NC PPAS de NC ADJCOL ."
842,Daudet/la_belle_Nivernaise copie_clean.txt,"Justement le tailleur a sous la main la tunique type rembourrée devant et derrière , à basques carrées , à boutons d' or .","ADVMAN le NCs avoir sous le NCCOR le ADJ NCo PPAS ADVLIEU et ADVLIEU , à NC ADJ , à NC de NCmod ."
843,Daudet/la_belle_Nivernaise copie_clean.txt,"Il l' étale sous les yeux de le charpentier , qui s' écrie rayonnant d' orgueil .","il le PRES sous le NCCOR de le NCmod , qui se VDIC PPRES de NCSENT ."
844,Daudet/la_belle_Nivernaise copie_clean.txt,Tu auras l' air d' un militaire là-dedans !,je ADJ le NCMAN de un ADJ NCmod !
845,Daudet/la_belle_Nivernaise copie_clean.txt,"Un monsieur en bras de chemise , qui porte un mètre autour de le cou , s' approche de l' élève Maugendre .","un monsieur en NCCOR de NCmod , qui PRES un NCo ADV de le NCCOR , se PRES de le NC NP ."
846,Daudet/la_belle_Nivernaise copie_clean.txt,"Il lui mesure le tour de les cuisses , la taille et la colonne vertébrale .","il lui PRES le NCo de le NCCOR , le NC et le NC ADJ ."
847,Daudet/la_belle_Nivernaise copie_clean.txt,Cette opération rappelle à le petit marinier de les souvenirs qui lui noient les yeux de larmes !,ce NCs PRES à le ADJ NC de le NCmod qui lui PRES le NCCOR de NCmod !
848,Daudet/la_belle_Nivernaise copie_clean.txt,"Les tics de le pauvre père Louveau , les colères de la femme de tête , tout ce qu' il a laissé derrière lui .","le NC de le ADJ NCmod NP , le NCSENT de le NCmod de NCCOR , tout ce que il avoir laisser ADVLIEU lui ."
849,Daudet/la_belle_Nivernaise copie_clean.txt,"C' est bien fini , maintenant .","ce être bien ADJ , ADVT ."
850,Daudet/la_belle_Nivernaise copie_clean.txt,"Le jeune homme correct que Victor aperçoit en pantalon d' uniforme , dans la grande glace d' essayage , n' a plus rien de commun avec le petit derrière de la Belle-Nivernaise .","le ADJ NCs ADJ que NP PRES en NC de NCmod , dans le ADJ NC de NCmod , ne avoir plus rien de ADJ avec le ADJ ADVLIEU de le NP ."
851,Daudet/la_belle_Nivernaise copie_clean.txt,"Le tailleur pousse dédaigneusement de le bout de le pied , sous l' établi , la vareuse humiliée , comme un paquet de loques .","le NCs PRES ADVMAN de le NC de le NCCOR , sous le NC , le NCo VSENT , comme un NCmod de NCmod ."
852,Daudet/la_belle_Nivernaise copie_clean.txt,Victor sent que c' est tout son passé qu' on lui a fait quitter là .,NP sentir que ce être tout DETPOSS NC que on lui avoir faire INF ADVLIEU .
853,Daudet/la_belle_Nivernaise copie_clean.txt,"Qu' est -ce à dire , quitter !","que être ce à VDIC , INF !"
854,Daudet/la_belle_Nivernaise copie_clean.txt,Voici qu' on lui défend même de se souvenir !,voici que on lui PRES même de se INF !
855,Daudet/la_belle_Nivernaise copie_clean.txt,"Il faut rompre avec les vices de votre éducation première , dit sévèrement M. le principal , qui ne dissimule pas sa méfiance .","il PRES ADJ avec le NC de DETPOSS NCmod ADJ , VDIC ADVMAN monsieur le NCmod , qui ne PRES pas DETPOSS NCo ."
856,Daudet/la_belle_Nivernaise copie_clean.txt,"Et , pour faciliter cette régénération , on décide que l' élève Maugendre ne sortira de le collège que tous les premiers dimanches de les mois .","et , pour INF ce NCo , on PRES que le NCs NP ne VF de le NC que tout le ADJ ADVT de le NCT ."
857,Daudet/la_belle_Nivernaise copie_clean.txt,Oh !,INTJ !
858,Daudet/la_belle_Nivernaise copie_clean.txt,"comme il pleure , le premier soir , à le fond de le dortoir triste et froid , tandis que les autres écoliers ronflent dans leurs lits de fer , et que le pion dévore un roman , en cachette , à la lueur d' une veilleuse !","comme il VSUBP , le ADJ NCT , à le NC de le NCmod ADJ et ADJ , PHASE que le autre NCs PRES dans DETPOSS NC de NCmod , et que le NCs VSENT un NCo , en NCmod , à le NC de un NCmod !"
859,Daudet/la_belle_Nivernaise copie_clean.txt,"Comme il souffre pendant l' heure maudite de récréations , tandis que les camarades le bousculent et le houspillent !","comme il VSENT PHASE le NCT ADJ de NCmod , PHASE que le NC le NC et le NC !"
860,Daudet/la_belle_Nivernaise copie_clean.txt,"Comme il est triste en étude , le nez dans son pupitre , tremblant à les colères de le pion qui tape à tour de bras sur la chaire en répétant toujours la même phrase : Un peu de silence , messieurs .","comme il être ADJ en NC , le NCCOR dans DETPOSS NCmod , PPRES à le NCSENT de le NCmod qui PRES à NC de NCCOR sur le NCmod en PPRES ADVTEMPS le même NCo : un peu de NC , NC ."
861,Daudet/la_belle_Nivernaise copie_clean.txt,"Cette voix criarde remue toute la lie de les mauvais souvenirs , empoisonne sa vie .","ce NCMAN ADJ PPAS tout le NCo de le ADJ NCmod , PRES DETPOSS NCo ."
862,Daudet/la_belle_Nivernaise copie_clean.txt,"Elle lui rappelle les jours noirs de la première enfance , le taudis de le faubourg de le Temple , les coups , les querelles , tout ce qu' il avait oublié .","il lui PRES le NCT ADJ de le ADJ NCmod , le NC de le NCmod de le NP , le NC , le NC , tout ce que il avoir VCOG ."
863,Daudet/la_belle_Nivernaise copie_clean.txt,"Et il se raccroche désespérément à les images de Clara , de la Belle-Nivernaise comme à une éclaircie de soleil , dans le sombre de sa vie .","et il se PRES ADVMAN à le NC de NP , de le NP comme à un NCmod de NCmod , dans le NC de DETPOSS NCmod ."
864,Daudet/la_belle_Nivernaise copie_clean.txt,Et c' est sans doute pour cela que le pion trouve avec stupéfaction de les dessins de bateaux à toutes les pages de les livres de l' élève Maugendre .,et ce être sans NCSENT pour cela que le NCs PRES avec NCSENT de le NCmod de NCmod à tout le NCmod de le NCmod de le NCmod NP .
865,Daudet/la_belle_Nivernaise copie_clean.txt,Toujours la même chaloupe reproduite à tous les feuillets avec une obstination d' obsédé .,ADVTEMPS le même NC PPAS à tout le NC avec un NC de NCmod .
866,Daudet/la_belle_Nivernaise copie_clean.txt,"Tantôt , elle gravit lentement , resserrée comme dans un canal , l' échelle étroite de les marges .","ADV , il VPS ADV , PPAS comme dans un NC , le NC ADJ de le NCmod ."
867,Daudet/la_belle_Nivernaise copie_clean.txt,"Tantôt , elle vient s' échouer en plein théorème , éclaboussant les figures intercalées et les corollaires en petit texte .","ADV , il venir se INF en ADJ NC , PPRES le NCCOR PPAS et le NC en ADJ NCmod ."
868,Daudet/la_belle_Nivernaise copie_clean.txt,"Tantôt , elle navigue à pleines voiles sur les océans de les planisphères .","ADV , il PRES à NC ADJ sur le NCmod de le NCmod ."
869,Daudet/la_belle_Nivernaise copie_clean.txt,"C' est là qu' elle se carre à l' aise , qu' elle déploie ses voiles , qu' elle fait flotter son drapeau .","ce être ADVLIEU que il se PRES à le NC , que il PRES DETPOSS NCo , que il faire INF DETPOSS NC ."
870,Daudet/la_belle_Nivernaise copie_clean.txt,Le charpentier n' en revient pas .,le NCs ne en PRES pas .
871,Daudet/la_belle_Nivernaise copie_clean.txt,Un garçon si doux !,un NC si ADJ !
872,Daudet/la_belle_Nivernaise copie_clean.txt,Il est têtu comme un âne .,il être PPAS comme un NC .
873,Daudet/la_belle_Nivernaise copie_clean.txt,Si intelligent !,si ADJ !
874,Daudet/la_belle_Nivernaise copie_clean.txt,On ne peut rien lui apprendre .,on ne pouvoir rien lui VCOG .
875,Daudet/la_belle_Nivernaise copie_clean.txt,"Et personne ne peut comprendre que l' élève Maugendre a appris à lire en plein bois , par-dessus l' épaule de Clara , et que ce n' est pas la même chose que d' étudier la géométrie , sous la férule d' un pion hirsute .","et personne ne pouvoir VCOG que le NCs NP avoir VCOG à INF en ADJ NC , ADV le NCCOR de NP , et que ce ne être pas le même chose que de INF le NCo , sous le NCmod de un NCmod ADV ."
876,Daudet/la_belle_Nivernaise copie_clean.txt,Voilà pourquoi l' élève Maugendre dégringole de l' étude de les moyens dans l' étude de les petits .,voilà pourquoi le NCs NP PRES de le NC de le NCmod dans le NCmod de le NCmod .
877,Daudet/la_belle_Nivernaise copie_clean.txt,C' est qu' il y a une singulière différence entre les leçons de le Magister de Corbigny et celles de MM. les professeurs de le collège de Nevers .,ce être que il y avoir un ADJ NC entre le NCmod de le NP de NP et celui de NP le NC de le NCmod de NP .
878,Daudet/la_belle_Nivernaise copie_clean.txt,Toute la distance qui sépare un enseignement en bonnet de peau de lapin d' un enseignement en toque d' hermine .,tout le NC qui PRES un NCo en NCmod de NCCOR de NCmod de un NCmod en NCmod de NCmod .
879,Daudet/la_belle_Nivernaise copie_clean.txt,Le père Maugendre se désespère .,le NCs NP se VSENT .
880,Daudet/la_belle_Nivernaise copie_clean.txt,Il lui semble que le forestier en bicorne s' éloigne à grandes enjambées .,il lui sembler que le NCs en NCmod se PRES à ADJ NC .
881,Daudet/la_belle_Nivernaise copie_clean.txt,"Il gronde , il supplie , il promet .","il PRES , il PRES , il PRES ."
882,Daudet/la_belle_Nivernaise copie_clean.txt,Veux -tu de les leçons ?,PRES -tre de le NCmod ?
883,Daudet/la_belle_Nivernaise copie_clean.txt,Veux -tu de les maîtres ?,vouloir il de le NCmod ?
884,Daudet/la_belle_Nivernaise copie_clean.txt,Je te donnerai les meilleurs .,je me VF le meilleur .
885,Daudet/la_belle_Nivernaise copie_clean.txt,Les plus chers !,le plus ADJ !
886,Daudet/la_belle_Nivernaise copie_clean.txt,"En attendant , l' élève Maugendre devient un cancre , et les bulletins trimestriels constatent impitoyablement sa turpitude .","en PPRES , le NCs NP devenir un NC , et le NCs ADJ PRES ADV DETPOSS NCo ."
887,Daudet/la_belle_Nivernaise copie_clean.txt,"Lui-même , il a le sentiment de sa sottise .","lui-même , il avoir le NCSENT de DETPOSS NCmod ."
888,Daudet/la_belle_Nivernaise copie_clean.txt,Il s' enfonce tous les jours davantage dans l' ombre et dans la tristesse .,il se PRES tout le NCT davantage dans le NCmod et dans le NCSENT .
889,Daudet/la_belle_Nivernaise copie_clean.txt,Si Clara et les autres pouvaient voir ce qu' on a fait de leur Victor !,si NP et le autre pouvoir VCOG ce que on avoir faire de lui NP !
890,Daudet/la_belle_Nivernaise copie_clean.txt,Comme ils viendraient ouvrir toutes grandes les portes de sa prison !,comme il VIMP INF tout ADJ le NCo de DETPOSS NCmod !
891,Daudet/la_belle_Nivernaise copie_clean.txt,"Comme ils lui offriraient de bon cœur de partager avec lui leur dernier morceau de pain , leur dernier bout de planche !","comme il lui VCOND de ADJ NC de INF avec lui lui ADJ NCo de NCmod , lui ADJ NC de NCmod !"
892,Daudet/la_belle_Nivernaise copie_clean.txt,"Car ils sont malheureux eux aussi , les autres .","car il être ADJ eux aussi , le autre ."
893,Daudet/la_belle_Nivernaise copie_clean.txt,Les affaires vont de mal en pis .,le NCs aller de mal en NC .
894,Daudet/la_belle_Nivernaise copie_clean.txt,Le bateau est de plus en plus vieux .,le NCs être de plus en plus ADJ .
895,Daudet/la_belle_Nivernaise copie_clean.txt,"Victor sait cela par les lettres de Clara , qui lui arrivent de temps en temps marquées d' un vu à le crayon rouge , énorme , furieux , grisonné par M. le principal , qui déteste ces correspondances interlopes .","NP VCOG cela par le NC de NP , qui lui PRES de temps en temps PPAS de un NC à le NCmod ADJCOL , ADJ , ADJ , PPAS par monsieur le NCmod , qui VSENT ce NCo ADJ ."
896,Daudet/la_belle_Nivernaise copie_clean.txt,Ah !,INTJ !
897,Daudet/la_belle_Nivernaise copie_clean.txt,Quand tu étais là !,quand je être ADVLIEU !
898,Daudet/la_belle_Nivernaise copie_clean.txt,"disent les épîtres de Clara , toujours aussi tendres , mais de plus en plus affligées ... Ah !","VDIC le NCo de NP , ADVTEMPS aussi ADJ , mais de plus en plus PPAS ... INTJ !"
899,Daudet/la_belle_Nivernaise copie_clean.txt,si tu étais avec nous !,si je être avec nous !
900,Daudet/la_belle_Nivernaise copie_clean.txt,"Ne dirait -on pas , vraiment , que tout allait bien dans ce temps -là , et que tout serait sauvé si Victor revenait ?","ne VDIC on pas , ADVINT , que tout aller bien dans ce temps ADVLIEU , et que tout être PPAS si NP VIMP ?"
901,Daudet/la_belle_Nivernaise copie_clean.txt,Eh bien !,INTJ bien !
902,Daudet/la_belle_Nivernaise copie_clean.txt,Victor sauvera tout .,NP VF tout .
903,Daudet/la_belle_Nivernaise copie_clean.txt,Il achètera un bateau neuf .,il VF un NCo ADJ .
904,Daudet/la_belle_Nivernaise copie_clean.txt,Il consolera Clara .,il VF NP .
905,Daudet/la_belle_Nivernaise copie_clean.txt,Il relèvera le commerce .,il VF le NCo .
906,Daudet/la_belle_Nivernaise copie_clean.txt,Il montrera qu' on n' a pas aimé un ingrat et recueilli un inutile .,il VF que on ne avoir pas VSENT un NCo et PPAS un NCo .
907,Daudet/la_belle_Nivernaise copie_clean.txt,"Mais pour cela , il faut devenir un homme .","mais pour cela , il PRES devenir un NC ."
908,Daudet/la_belle_Nivernaise copie_clean.txt,Il faut gagner de l' argent .,il PRES INF de le NCo .
909,Daudet/la_belle_Nivernaise copie_clean.txt,Il faut être savant .,il PRES être ADJ .
910,Daudet/la_belle_Nivernaise copie_clean.txt,Et Victor rouvre les livres à la bonne page .,et NP PRES le NCo à le ADJ NCmod .
911,Daudet/la_belle_Nivernaise copie_clean.txt,"À présent , les flèches peuvent voler , le pion peut frapper à tour de bras sur la chaire en lançant sa phrase de perroquet : Messieurs , un peu de silence !","à NC , le NCs pouvoir INF , le NCs pouvoir frapper à NC de NCCOR sur le NC en PPRES DETPOSS NCo de NCmod : NP , un peu de NC !"
912,Daudet/la_belle_Nivernaise copie_clean.txt,Victor ne lève plus le nez .,NP ne PRES plus le NCCOR .
913,Daudet/la_belle_Nivernaise copie_clean.txt,Il ne dessine plus de bateaux .,il ne PRES plus de NC .
914,Daudet/la_belle_Nivernaise copie_clean.txt,Il méprise les boulettes qui s' aplatissent sur sa figure .,il VSENT le NCo qui se PRES sur DETPOSS NCCOR .
915,Daudet/la_belle_Nivernaise copie_clean.txt,Il bûche ... il bûche ... Une lettre pour l' élève Maugendre .,il PRES ... il PRES ... un NC pour le NCmod NP .
916,Daudet/la_belle_Nivernaise copie_clean.txt,"C' est une bénédiction que ce souvenir de Clara qui vient le surprendre en pleine étude , pour l' encourager et lui apporter un parfum de liberté et de tendresse .","ce être un NC que ce NCmod de NP qui venir le VSENT en ADJ NC , pour le INF et lui INF un NCo de NCmod et de NCSENT ."
917,Daudet/la_belle_Nivernaise copie_clean.txt,"Victor se cache la tête dans son pupitre pour baiser l' adresse zigzagante , péniblement tracée , tremblée , comme si un perpétuel tangage de bateau balançait la table sur laquelle Clara écrit .","NP se PRES le NCCOR dans DETPOSS NCmod pour INF le NCo ADJ , ADV PPAS , PPAS , comme si un ADJ NCs de NCmod VIMP le NCo sur lequel NP PRES ."
918,Daudet/la_belle_Nivernaise copie_clean.txt,Hélas !,NP !
919,Daudet/la_belle_Nivernaise copie_clean.txt,"ce n' est pas le tangage , c' est l' émotion qui a fait trembler la main de Clara .","ce ne être pas le NC , ce être le NCSENT qui avoir faire INF le NCCOR de NP ."
920,Daudet/la_belle_Nivernaise copie_clean.txt,"C' est fini , mon cher Victor , la Belle-Nivernaise ne naviguera plus .","ce être VASP , DETPOSS NC NP , le NP ne VF plus ."
921,Daudet/la_belle_Nivernaise copie_clean.txt,"Elle est bien morte , et , en mourant , elle nous ruine .","il être bien ADJ , et , en PPRES , il nous PRES ."
922,Daudet/la_belle_Nivernaise copie_clean.txt,On a suspendu un écriteau noir à l' arrière : provenant de démolitions .,on avoir PPAS un NCo ADJ à le NC : PPRES de NC .
923,Daudet/la_belle_Nivernaise copie_clean.txt,"De les gens sont venus , qui ont tout estimé , tout numéroté , depuis la gaffe de l' Équipage jusqu' à le berceau où dormait la petite sœur .","de le NC être venir , qui avoir tout PPAS , tout NC , depuis le NC de le NCmod jusque à le NCmod où VIMP le ADJ NCs ."
924,Daudet/la_belle_Nivernaise copie_clean.txt,"Il paraît que l' on va tout vendre , et nous n' avons plus rien .","il paraître que l' on aller tout INF , et nous ne avoir plus rien ."
925,Daudet/la_belle_Nivernaise copie_clean.txt,Qu' allons -nous devenir ?,que aller le devenir ?
926,Daudet/la_belle_Nivernaise copie_clean.txt,"Maman est capable d' en mourir de chagrin , et papa est si changé ... Victor n' acheva pas la lettre .","NP être ADJ de en INF de NCSENT , et NCspas être si PPAS ... NP ne VPS pas le NCo ."
927,Daudet/la_belle_Nivernaise copie_clean.txt,"Les mots dansaient devant ses yeux ; il avait comme un coup de feu sur la face , un bourdonnement dans les oreilles .","le NCs VIMP ADVLIEU DETPOSS NCCOR ; il avoir comme un NC de NCmod sur le NC , un NCo dans le NCCOR ."
928,Daudet/la_belle_Nivernaise copie_clean.txt,Ah !,INTJ !
929,Daudet/la_belle_Nivernaise copie_clean.txt,"il était loin de l' étude , maintenant .","il être ADVLIEU de le NC , ADVT ."
930,Daudet/la_belle_Nivernaise copie_clean.txt,"Épuisé par le travail , le chagrin et la fièvre , il délirait .","PPAS par le NC , le NCSENT et le VSENT , il VIMP ."
931,Daudet/la_belle_Nivernaise copie_clean.txt,"Il croyait s' en aller à la dérive , en pleine Seine sur le beau fleuve frais .","il VCOG se en aller à le NC , en ADJ NP sur le ADJ NCmod ADJ ."
932,Daudet/la_belle_Nivernaise copie_clean.txt,Il voulait tremper son front dans la rivière .,il vouloir INF DETPOSS NCCOR dans le NC .
933,Daudet/la_belle_Nivernaise copie_clean.txt,"Puis , il entendit vaguement un son de cloche .","puis , il VCOG ADV un NCo de NCmod ."
934,Daudet/la_belle_Nivernaise copie_clean.txt,"Sans doute , un remorqueur qui passait dans le brouillard; puis , ce fut comme un bruit de grandes eaux , et il cria : La crue !","sans NCSENT , un NC qui VIMP dans le brouillard; puis , ce être comme un NC de ADJ NCmod , et il VPS : le NCo !"
935,Daudet/la_belle_Nivernaise copie_clean.txt,la crue !,le NC !
