id,titre,phrase,motifs_phrase
1584,Daudet/tartarin_sur_les_alpes copie_clean.txt,Où était -il ?,où être il ?
1585,Daudet/tartarin_sur_les_alpes copie_clean.txt,"Tartarin le comprit en entendant l' officier de gendarmerie discuter avec le concierge de le château , un gros homme en bonnet grec agitant un trousseau de clefs rouillées .","NP le VCOG en VCOG le NCo de NCmod INF avec le NC de le NCmod , un ADJ NCo en NCmod ADJ PPRES un NCo de NCmod ADJ ."
1586,Daudet/tartarin_sur_les_alpes copie_clean.txt,"À le secret , à le secret ... mais je n' ai plus de place , les autres ont tout pris ... À moins de le mettre dans le cachot de Bonnivard ?","à le NC , à le NCmod ... mais je ne avoir plus de NC , le autre avoir tout prendre ... à moins de le mettre dans le NC de NP ?"
1587,Daudet/tartarin_sur_les_alpes copie_clean.txt,"Mettez -le dans le cachot de Bonnivard , c' est bien assez bon pour lui ... commanda le capitaine , et il fut fait comme il avait dit .","mettre le dans le NC de NP , ce être bien ADV ADJ pour lui ... VPS le NCo , et il être faire comme il avoir VDIC ."
1588,Daudet/tartarin_sur_les_alpes copie_clean.txt,"Ce château de Chillon , dont le P. C .","ce NC de NP , dont le NP NC ."
1589,Daudet/tartarin_sur_les_alpes copie_clean.txt,A .,à .
1590,Daudet/tartarin_sur_les_alpes copie_clean.txt,"ne cessait de parler depuis deux jours à ses chers alpinistes , et dans lequel , par une ironie de la destinée , il se trouvait brusquement incarcéré sans savoir pourquoi , est un de les monuments historiques les plus visités de toute la Suisse .","ne VASP de INF depuis NUM NCT à DETPOSS NC ADJ , et dans lequel , par un NC de le NCmod , il se VIMP ADV PPAS sans VCOG pourquoi , être un de le NCmod ADJ le plus ADJ de tout le NP ."
1591,Daudet/tartarin_sur_les_alpes copie_clean.txt,"Après avoir servi de résidence d' été à les comtes de Savoie , puis de prison d' État , de dépôt d' armes et de munitions , il n' est plus aujourd'hui qu' un prétexte à excursion , comme le Rigi-Kulm ou la Tellsplatte .","PHASE avoir PPAS de NC de NCmod à le NCmod de NP , puis de NC de NCmod , de NCmod de NCmod et de NC , il ne être plus ADVT que un NC à NCmod , comme le NP ou le NP ."
1592,Daudet/tartarin_sur_les_alpes copie_clean.txt,"On y a laissé cependant un poste de gendarmerie et un violon pour les ivrognes et les mauvais garçons de le pays ; mais ils sont si rares , dans ce paisible canton de Vaud , que le violon est toujours vide et que le concierge y renferme sa provision de bois pour l' hiver .","on y avoir laisser cependant un NCo de NCmod et un NC pour le NCmod et le ADJ NC de le NCmod ; mais il être si ADJ , dans ce ADJ NC de NP , que le NCs être ADVTEMPS ADJ et que le NCs y PRES DETPOSS NCo de NCmod pour le NC ."
1593,Daudet/tartarin_sur_les_alpes copie_clean.txt,"Aussi l' arrivée de tous ces prisonniers l' avait mis de fort méchante humeur , l' idée surtout qu' il n' allait plus pouvoir faire visiter le célèbre cachot , à cette époque de l' année le plus sérieux profit de la place .","aussi le NCs de tout ce NCmod le avoir mettre de fort ADJ NC , le NCo surtout que il ne aller plus pouvoir faire INF le ADJ NC , à ce NC de le NCT le plus ADJ NCmod de le NCmod ."
1594,Daudet/tartarin_sur_les_alpes copie_clean.txt,"Furieux , il montrait la route à Tartarin , qui suivait , sans le courage de la moindre résistance .","ADJ , il VIMP le NCo à NP , qui VIMP , sans le NC de le ADJ NCmod ."
1595,Daudet/tartarin_sur_les_alpes copie_clean.txt,"Quelques marches branlantes , un corridor moisi , sentant la cave , une porte épaisse comme un mur , avec de les gonds énormes , et ils se trouvèrent dans un vaste souterrain voûté , à le sol battu , à les lourds piliers romains où restent scellés de les anneaux de fer enchaînant jadis les prisonniers d' État .","quelque NC ADJ , un NC ADJ , sentir le NCo , un NC ADJ comme un NCmod , avec de le NCmod ADJ , et il se VPS dans un ADJ NC PPAS , à le NCmod PPAS , à le ADJ NC ADJ où PRES PPAS de le NC de NCmod PPRES ADV le NCo de NCmod ."
1596,Daudet/tartarin_sur_les_alpes copie_clean.txt,"Un demi-jour tombait avec le tremblotement , le miroitement de le lac à travers d' étroites meurtrières qui ne laissaient voir qu' un peu de ciel .","un NCs VIMP avec le NC , le NCo de le NCmod à travers de NC ADJ qui ne VIMP VCOG que un peu de NCo ."
1597,Daudet/tartarin_sur_les_alpes copie_clean.txt,"Vous voilà chez vous , dit le geôlier ... Surtout , n' allez pas dans le fond , il y a les oubliettes !","vous voilà chez vous , VDIC le NCo ... surtout , ne aller pas dans le NC , il y avoir le NCo !"
1598,Daudet/tartarin_sur_les_alpes copie_clean.txt,"Tartarin recula épouvanté : Les oubliettes , Boudiou !","NP VPS VSENT : le NC , NP !"
1599,Daudet/tartarin_sur_les_alpes copie_clean.txt,"... Qu' est -ce que vous voulez , mon garçon !","... que être ce que vous vouloir , DETPOSS NC !"
1600,Daudet/tartarin_sur_les_alpes copie_clean.txt,"... On m' a commandé de vous mettre dans le cachot de Bonnivard ... Je vous mets dans le cachot de Bonnivard ... Maintenant , si vous avez de les moyens , on pourra vous fournir quelques douceurs , par exemple une couverture et un matelas pour la nuit .","... on le avoir PPAS de vous mettre dans le NC de NP ... je vous mettre dans le NC de NP ... ADVT , si vous avoir de le NC , on pouvoir vous INF quelque NCo , par NC un NC et un NC pour le NCT ."
1601,Daudet/tartarin_sur_les_alpes copie_clean.txt,"D' abord , à manger !","de NC , à INF !"
1602,Daudet/tartarin_sur_les_alpes copie_clean.txt,"dit Tartarin , à qui , fort heureusement , on n' avait pas ôté sa bourse .","VDIC NP , à qui , fort heureusement , on ne avoir pas PPAS DETPOSS NCo ."
1603,Daudet/tartarin_sur_les_alpes copie_clean.txt,"Le concierge revint avec un pain frais , de la bière , un cervelas , dévorés avidement par le nouveau prisonnier de Chillon , à jeun depuis la veille , creusé de fatigues et d' émotions .","le NCs VPS avec un NC ADJ , de le NC , un NC , VSENT ADVMAN par le ADJ NC de NP , à jeun depuis le NCmod , PPAS de NCSENT et de NCSENT ."
1604,Daudet/tartarin_sur_les_alpes copie_clean.txt,"Pendant qu' il mangeait sur son banc de pierre dans la lueur de le soupirail , le geôlier l' examinait d' un œil bonasse .","PHASE que il VIMP sur DETPOSS NC de NCmod dans le NCmod de le NCmod , le NCs le VIMP de un NC NC ."
1605,Daudet/tartarin_sur_les_alpes copie_clean.txt,"Ma foi , dit -il , je ne sais pas ce que vous avez fait ni pourquoi l' on vous traite si sévèrement ... Eh !","DETPOSS NCs , VDIC il , je ne VCOG pas ce que vous avoir faire ni pourquoi l' on vous VSUBP si ADVMAN ... INTJ !"
1606,Daudet/tartarin_sur_les_alpes copie_clean.txt,"coquin de sort , moi non plus , je ne sais rien , fit Tartarin la bouche pleine .","NC de NCmod , soi non plus , je ne VCOG rien , faire NP le NCCOR ADJ ."
1607,Daudet/tartarin_sur_les_alpes copie_clean.txt,"Ce qu' il y a de sûr , c' est que vous n' avez pas l' air d' un mauvais homme , et , certainement , vous ne voudriez pas empêcher un pauvre père de famille de gagner sa vie , n' est ce pas ?","ce que il y avoir de NC , ce être que vous ne avoir pas le NCMAN de un ADJ NCmod , et , ADVINT , vous ne PRES pas INF un ADJ NCo de NCmod de INF DETPOSS NCo , ne être ce pas ?"
1608,Daudet/tartarin_sur_les_alpes copie_clean.txt,"... Eh ben , voilà !","... Eh ben , voilà !"
1609,Daudet/tartarin_sur_les_alpes copie_clean.txt,"... J' ai là-haut toute une société venue pour visiter le cachot de Bonnivard ... Si vous vouliez me promettre de vous tenir tranquille , de ne pas essayer de vous sauver ... Le bon Tartarin s' y engagea par serment , et cinq minutes après , il voyait son cachot envahi par ses anciennes connaissances de le Rigi-Kulm et de la Tellsplatte , l' âne bâté Schwanthaler , l' ineptissimus Astier-Réhu , le membre de le Jockey-Club avec sa nièce ( hum !","... je avoir VPS tout un NCo venir pour INF le NCo de NP ... si vous PRES me INF de vous INF ADJ , de ne pas INF de vous INF ... le ADJ NP se y VPS par NC , et NUM NCT PHASE , il VCOG DETPOSS NCo PPAS par DETPOSS ADJ NC de le NP et de le NP , le NC PPAS NP , le NC NP , le NC de le NP avec DETPOSS NCmod ( NC !"
1610,Daudet/tartarin_sur_les_alpes copie_clean.txt,hum !,NCmod !
1611,Daudet/tartarin_sur_les_alpes copie_clean.txt,"... ) , tous les voyageurs de le circulaire Cook .","... ) , tout le NC de le NCmod NP ."
1612,Daudet/tartarin_sur_les_alpes copie_clean.txt,"Honteux , craignant d' être reconnu , le malheureux se dissimulait derrière les piliers , reculant , se dérobant à mesure qu' approchait le groupe de les touristes précédés de le concierge et de son boniment débité d' une voix dolente : C' est ici que l' infortuné Bonnivard ... Ils avançaient lentement , retardés par les discussions de les deux savants toujours en querelle , prêts à se sauter dessus , agitant l' un son pliant , l' autre son sac de voyage , en de les attitudes fantastiques que le demi-jour de les soupiraux allongeait sur les voûtes .","ADJ , VSENT de être VCOG , le NCs se VIMP ADVLIEU le NC , PPRES , se PPRES à NC que VIMP le NCs de le NCmod ADJ de le NCmod et de DETPOSS NC PPAS de un NCMAN ADJ : ce être ADVLIEU que le NC NP ... il VIMP ADV , PPAS par le NC de le NUM NCmod ADVTEMPS en NCmod , PPAS à se INF ADV , PPRES le un NCo ADJ , le autre DETPOSS NC de NCmod , en de le NCmod ADJ que le NCs de le NCmod VIMP sur le NC ."
1613,Daudet/tartarin_sur_les_alpes copie_clean.txt,"À force de reculer , Tartarin se trouva tout près de le trou de les oubliettes , un puits noir , ouvert à le ras de le sol , soufflant l' haleine de les siècles passés , marécageuse et glaciale .","à NCSENT de INF , NP se VPS tout ADVLIEU de le NC de le NCmod , un NC ADJ , PPAS à le NC de le NCmod , PPRES le NCo de le NCT PPAS , ADJ et ADJ ."
1614,Daudet/tartarin_sur_les_alpes copie_clean.txt,"Effrayé , il s' arrêta , se pelotonna dans un coin , sa casquette sur les yeux ; mais le salpêtre humide de les murailles l' impressionnait ; et tout à coup un formidable éternuement , qui fit reculer les touristes , les avertissait de sa présence .","PPAS , il se VPS , se VPS dans un NC , DETPOSS NCo sur le NCCOR ; mais le NCs ADJ de le NCmod le VIMP ; et tout à NC un ADJ NCmod , qui faire INF le NC , le VIMP de DETPOSS NC ."
1615,Daudet/tartarin_sur_les_alpes copie_clean.txt,"Tiens , Bonnivard ... s' écria l' effrontée petite Parisienne coiffée d' un chapeau Directoire , que le monsieur de le Jockey-Club faisait passer pour sa nièce .","NP , NP ... se VDIC le NCo ADJ NP PPAS de un NC NP , que le monsieur de le NP faire INF pour DETPOSS NC ."
1616,Daudet/tartarin_sur_les_alpes copie_clean.txt,Le Tarasconnais ne se laissa pas démonter .,le NP ne se laisser pas INF .
1617,Daudet/tartarin_sur_les_alpes copie_clean.txt,"C' est vraiment très gentil , vé , ces oubliettes !","ce être ADVINT très ADJ , PPAS , ce NC !"
1618,Daudet/tartarin_sur_les_alpes copie_clean.txt,"... dit -il de le ton le plus naturel de le monde , comme s' il était en train , lui aussi , de visiter le cachot par plaisir , et il se mêla à les autres voyageurs qui souriaient en reconnaissant l' alpiniste de le Rigi-Kulm , le boute-en-train de le fameux bal .","... VDIC il de le NC le plus ADJ de le NCmod , comme si il être en NC , lui aussi , de INF le NCo par NCSENT , et il se VPS à le autre NC qui VIMP en VCOG le NCo de le NP , le NC de le ADJ NCmod ."
1619,Daudet/tartarin_sur_les_alpes copie_clean.txt,Hé !,PPAS !
1620,Daudet/tartarin_sur_les_alpes copie_clean.txt,"mossié ... ballir , dantsir! ... La silhouette falote de la petite fée Schwanthaler se dressait devant lui , prête à partir pour une contredanse .","PPAS ... INF , dantsir! ... le NCs ADJ de le ADJ NCmod NP se VIMP ADVLIEU lui , ADJ à INF pour un NC ."
1621,Daudet/tartarin_sur_les_alpes copie_clean.txt,"Vraiment , il avait bien envie de danser !","ADVINT , il avoir bien NCo de INF !"
1622,Daudet/tartarin_sur_les_alpes copie_clean.txt,"Alors , ne sachant comment se débarrasser de l' enragé petit bout de femme , il lui offrit le bras , lui montra fort galamment son cachot , l' anneau où se rivait la chaîne de le captif , la trace appuyée de ses pas sur les dalles autour de le même pilier ; et jamais , à l' entendre parler avec tant d' aisance , la bonne dame ne se serait doutée que celui qui la promenait était aussi prisonnier d' État , une victime de l' injustice et de la méchanceté de les hommes .","alors , ne VCOG comment se INF de le NC ADJ NCmod de NCmod , il lui VPS le NCCOR , lui VPS fort ADVMAN DETPOSS NCo , le NC où se VIMP le NCs de le NCmod , le NC PPAS de DETPOSS pas sur le NCmod ADV de le même NC ; et ADVTEMPS , à le VCOG INF avec tant de NC , le ADJ NCs ne se être PPAS que celui qui le VIMP être aussi ADJ de NP , un NC de le NCmod et de le NC de le NCmod ."
1623,Daudet/tartarin_sur_les_alpes copie_clean.txt,"Terrible , par exemple , fut le départ , quand l' infortuné Bonnivard , ayant reconduit sa danseuse jusqu' à la porte , prit congé avec un sourire d' homme de le monde : Non , merci , vé ... Je reste encore un petit moment .","ADJ , par NC , être le NC , quand le NCs NP , avoir PPAS DETPOSS NCo jusque à le NC , prendre PPAS avec un NCMAN de NCmod de le NCmod : non , INTJ , PPAS ... je PRES encore un ADJ NCo ."
1624,Daudet/tartarin_sur_les_alpes copie_clean.txt,"Là-dessus il salua , et le geôlier , qui le guettait , ferma et verrouilla la porte à la stupéfaction de tous .","ADV il VPS , et le NC , qui le VIMP , VPS et VPS le NCo à le NCSENT de tout ."
1625,Daudet/tartarin_sur_les_alpes copie_clean.txt,Quel affront !,quel VF !
1626,Daudet/tartarin_sur_les_alpes copie_clean.txt,"Il en suait d' angoisse , le malheureux , en écoutant les exclamations de les touristes qui s' éloignaient .","il en VIMP de NCSENT , le NC , en VCOG le NCo de le NCmod qui se VIMP ."
1627,Daudet/tartarin_sur_les_alpes copie_clean.txt,"Par bonheur , ce supplice ne se renouvela plus de la journée .","par NCSENT , ce NCSENT ne se VPS plus de le NCT ."
1628,Daudet/tartarin_sur_les_alpes copie_clean.txt,Pas de visiteurs à cause de le mauvais temps .,pas de NC à NC de le ADJ temps .
1629,Daudet/tartarin_sur_les_alpes copie_clean.txt,"Un vent terrible sous les vieux ais , de les plaintes montant de les oubliettes comme de les victimes mal enterrées , et le clapotis de le lac , criblé de pluie , battant les murailles à le ras de les soupiraux d' où les éclaboussures jaillissaient jusque sur le captif .","un NC ADJ sous le ADJ NCmod , de le NCmod PPRES de le NC comme de le NC mal PPAS , et le NC de le NCmod , PPAS de NC , PPRES le NCo à le NC de le NCmod de où le NCs VIMP jusque sur le NC ."
1630,Daudet/tartarin_sur_les_alpes copie_clean.txt,"Par intervalles , la cloche d' un vapeur , le claquement de ses roues scandant les réflexions de le pauvre Tartarin , pendant que le soir descendait gris et morne dans le cachot qui semblait s' agrandir .","par NC , le NC de un NCmod , le NC de DETPOSS NCmod PPRES le NCo de le ADJ NP , PHASE que le NCT VIMP ADJCOL et ADJ dans le NC qui sembler se INF ."
1631,Daudet/tartarin_sur_les_alpes copie_clean.txt,"Comment s' expliquer cette arrestation , son emprisonnement dans ce lieu sinistre ?","comment se VDIC ce NCo , DETPOSS NC dans ce NCmod ADJ ?"
1632,Daudet/tartarin_sur_les_alpes copie_clean.txt,"Costecalde , peut-être ... une manœuvre électorale de la dernière heure ?","NP , peut-être ... un NC ADJ de le ADJ NCT ?"
1633,Daudet/tartarin_sur_les_alpes copie_clean.txt,"... Ou , encore , la police russe avertie de ses paroles imprudentes , de sa liaison avec Sonia , et demandant l' extradition ?","... ADV , encore , le NC ADJ PPAS de DETPOSS NC ADJ , de DETPOSS NCmod avec NP , et PPRES le NCo ?"
1634,Daudet/tartarin_sur_les_alpes copie_clean.txt,"Mais alors , pourquoi arrêter les délégués ?","mais alors , pourquoi INF le NCo ?"
1635,Daudet/tartarin_sur_les_alpes copie_clean.txt,"... Que pouvait -on reprocher à ces infortunés dont il se représentait l' effarement , le désespoir , quoiqu' ils ne fussent pas comme lui dans le cachot de Bonnivard , sous ces voûtes à les pierres serrées , traversées à l' approche de la nuit d' un passage de rats énormes , de cancrelats , de silencieuses araignées à les pattes frôleuses et difformes .","... que pouvoir on INF à ce NC dont il se VIMP le NCSENT , le NCSENT , quoique il ne PRES pas comme lui dans le NC de NP , sous ce NCmod à le NCmod ADJ , PPAS à le NC de le NCT de un NCmod de NCmod ADJ , de NC , un ADJ NC à le NCmod ADJ et ADJ ."
1636,Daudet/tartarin_sur_les_alpes copie_clean.txt,Voyez pourtant ce que peut une bonne conscience !,IMP pourtant ce que pouvoir un ADJ NCs !
1637,Daudet/tartarin_sur_les_alpes copie_clean.txt,"Malgré les rats , le froid , les araignées , le grand Tartarin trouva dans l' horreur de la prison d' État , hantée d' ombres martyres , le sommeil rude et sonore , bouche ouverte et poings fermés , qu' il avait dormi entre les cieux et les abîmes dans la cabane de le Club Alpin .","malgré le NC , le NCs , le NC , le ADJ NP VPS dans le NC de le NCmod de NCmod , VSENT de NC ADJ , le NCo ADJ et ADJ , NCCOR PPAS et NC ADJ , que il avoir PPAS entre le NC et le NC dans le NC de le NP NP ."
1638,Daudet/tartarin_sur_les_alpes copie_clean.txt,"Il croyait rêver encore , à le matin , en entendant son geôlier : Levez -vous , le préfet de le district est là ... Il vient vous interroger ... L' homme ajouta avec un certain respect : Pour que le préfet se soit dérangé ... Il faut que vous soyez un fameux scélérat. Scélérat !","il VCOG INF encore , à le NCT , en VCOG DETPOSS NCo : PRES vous , le NCo de le NCmod être ADVLIEU ... il venir vous VDIC ... le NCs VPS avec un ADJ NC : pour que le NCs se être VSENT ... il PRES que vous être un ADJ NC NC !"
1639,Daudet/tartarin_sur_les_alpes copie_clean.txt,"non , mais on peut le paraître après une nuit de cachot humide et poussiéreux , sans avoir eu le temps d' une toilette , même sommaire .","non , mais on pouvoir le paraître PHASE un NCT de NCmod ADJ et ADJ , sans avoir avoir le temps de un NCmod , même NCmod ."
1640,Daudet/tartarin_sur_les_alpes copie_clean.txt,"Et dans l' ancienne écurie de le château , transformée en gendarmerie , garnie de mousquetons en râtelier sur le crépissage de les murs , quand Tartarin après un coup d' œil rassurant à ses alpinistes assis entre les gendarmes apparaît devant le préfet de le district , il a le sentiment de sa mauvaise tenue en face de ce magistrat correct et noir , la barbe soignée , et qui l' interpelle sévèrement : Vous vous appelez Manilof , n' est -ce pas ?","et dans le ADJ NC de le NCmod , PPAS en NC , PPAS de NC en NCmod sur le NC de le NCmod , quand NP PHASE un NCmod de NCmod VSENT à DETPOSS NC PPAS entre le NC PRES ADVLIEU le NC de le NCmod , il avoir le NCSENT de DETPOSS ADJ NCmod en NC de ce NCmod ADJ et ADJ , le NCCOR ADJ , et qui le PRES ADVMAN : vous vous PRES NP , ne être ce pas ?"
1641,Daudet/tartarin_sur_les_alpes copie_clean.txt,... sujet russe ... incendiaire à Pétersbourg ... réfugié et assassin en Suisse .,... NC ADJ ... ADJ à NP ... NC et NC en NP .
1642,Daudet/tartarin_sur_les_alpes copie_clean.txt,"Mais jamais de la vie ... C' est une erreur , une méprise ... Taisez -vous , ou je vous bâillonne ... interrompt le capitaine .","mais ADVTEMPS de le NC ... ce être un NC , un NC ... IMP lui , ou je vous PRES ... PRES le NCo ."
1643,Daudet/tartarin_sur_les_alpes copie_clean.txt,"Le préfet correct reprend : D' ailleurs , pour couper court à toutes vos dénégations ... Connaissez -vous cette corde ?","le NCs ADJ PRES : de ADVLIEU , pour INF ADJ à tout DETPOSS NC ... PRES vous ce NCo ?"
1644,Daudet/tartarin_sur_les_alpes copie_clean.txt,"Sa corde , coquin de sort !","DETPOSS NC , NC de NCmod !"
1645,Daudet/tartarin_sur_les_alpes copie_clean.txt,"Sa corde tissée de fer , fabriquée en Avignon .","DETPOSS NC PPAS de NC , PPAS en NP ."
1646,Daudet/tartarin_sur_les_alpes copie_clean.txt,"Il baisse la tête , à la stupeur de les délégués , et dit : Je la connais .","il PRES le NCCOR , à le NCSENT de le NCmod , et VDIC : je le PRES ."
1647,Daudet/tartarin_sur_les_alpes copie_clean.txt,"Avec cette corde , un homme a été pendu dans le canton d' Unterwald ... Tartarin frémissant jure qu' il n' y est pour rien .","avec ce NC , un NCspas avoir être PPAS dans le NC de NP ... NCs ADJ PRES que il ne y être pour rien ."
1648,Daudet/tartarin_sur_les_alpes copie_clean.txt,Nous allons bien voir !,nous aller bien VCOG !
1649,Daudet/tartarin_sur_les_alpes copie_clean.txt,"Et l' on introduit le ténor italien , le policier que les nihilistes avaient accroché à la branche d' un chêne à le Brünig , mais que de les bûcherons ont sauvé miraculeusement .","et l' on PRES le NCo ADJ , le NC que le NCs avoir PPAS à le NC de un NCmod à le NP , mais que de le NCs avoir PPAS ADV ."
1650,Daudet/tartarin_sur_les_alpes copie_clean.txt,Le mouchard regarde Tartarin : Ce n' est pas lui !,le NCs VCOG NP : ce ne être pas lui !
1651,Daudet/tartarin_sur_les_alpes copie_clean.txt,les délégués : Ni ceux -là non plus ... On s' est trompé .,le NC : Ni celui ADVLIEU non plus ... on se être PPAS .
1652,Daudet/tartarin_sur_les_alpes copie_clean.txt,"Le préfet , furieux , à Tartarin : Mais , alors , qu' est -ce que vous faites ici ?","le NC , ADJ , à NP : mais , alors , que être ce que vous faire ADVLIEU ?"
1653,Daudet/tartarin_sur_les_alpes copie_clean.txt,"C' est ce que je me demande , vé! ... répond le président avec l' aplomb de l' innocence .","ce être ce que je me PRES , vé! ... VDIC le NCo avec le NCmod de le NCmod ."
1654,Daudet/tartarin_sur_les_alpes copie_clean.txt,"Après une courte explication , les alpinistes de Tarascon , rendus à la liberté , s' éloignent de le château de Chillon dont nul n' a ressenti plus fort qu' eux la mélancolie oppressante et romantique .","PHASE un ADJ NC , le NCs de NP , PPAS à le NC , se PRES de le NC de NP dont nul ne avoir VSENT plus fort que eux le NCSENT ADJ et ADJ ."
1655,Daudet/tartarin_sur_les_alpes copie_clean.txt,"Ils s' arrêtent à la pension Müller pour prendre les bagages , la bannière , payer le déjeuner de la veille qu' ils n' ont pas eu le temps de manger , puis filent vers Genève par le train .","il se PRES à le NC NP pour INF le NCo , le NC , INF le NCo de le NCmod que il ne avoir pas avoir le temps de INF , puis PRES vers NP par le NC ."
1656,Daudet/tartarin_sur_les_alpes copie_clean.txt,Il pleut .,il PRES .
1657,Daudet/tartarin_sur_les_alpes copie_clean.txt,"À travers les vitres ruisselantes se lisent de les noms de stations d' aristocratique villégiature , Clarens , Vevey , Lausanne ; les chalets rouges , les jardinets d' arbustes rares passent sous un voile humide où s' égouttent les branches , les clochetons de les toits , les terrasses de les hôtels .","à travers le NC ADJ se PRES de le NC de NCmod de ADJ NCmod , NP , NP , NP ; le NCs ADJCOL , le NC de NCmod ADJ PRES sous un NC ADJ où se PRES le NCs , le NC de le NCmod , le NC de le NCmod ."
1658,Daudet/tartarin_sur_les_alpes copie_clean.txt,"Installés dans un petit coin de le long wagon suisse , deux banquettes se faisant face , les alpinistes ont la mine défaite et déconfite .","PPAS dans un ADJ NC de le ADJ NCmod ADJ , NUM NC se faire ADV , le NCs avoir le NCo ADJ et ADJ ."
1659,Daudet/tartarin_sur_les_alpes copie_clean.txt,"Bravida , très aigre , se plaint de douleurs et , tout le temps , demande à Tartarin avec une ironie féroce : Eh bé !","NP , très ADJ , se PRES de NCSENT et , tout le temps , PRES à NP avec un NC ADJ : INTJ ADJ !"
1660,Daudet/tartarin_sur_les_alpes copie_clean.txt,"vous l' avez vu , le cachot de Bonnivard ... Vous vouliez tant le voir ... Je crois que vous l' avez vu , qué ?","vous le avoir VCOG , le NCo de NP ... vous PRES tant le VCOG ... je VCOG que vous le avoir VCOG , PPAS ?"
1661,Daudet/tartarin_sur_les_alpes copie_clean.txt,"Excourbaniès , aphone , pour la première fois , regarde piteusement le lac qui les escorte à les portières : En voilà de l' eau , Boudiou !","ADV , PRES , pour le ADJ fois , VCOG ADVMAN le NCo qui le PRES à le NC : en voilà de le NCmod , NP !"
1662,Daudet/tartarin_sur_les_alpes copie_clean.txt,"... après ça , je ne prends plus de bain de ma vie ... Abruti d' une épouvante qui dure encore , Pascalon , la bannière entre ses jambes , se dissimule derrière , regardant à droite et à gauche comme un lièvre , crainte qu' on le rattrape ... Et Tartarin ?","... PHASE ça , je ne PRES plus de NC de DETPOSS NCmod ... PPAS de un NC qui PRES encore , NP , le NCs entre DETPOSS NCCOR , se PRES ADVLIEU , VCOG à NC et à NC comme un NC , VSENT que on le PRES ... et NP ?"
1663,Daudet/tartarin_sur_les_alpes copie_clean.txt,... Oh !,... INTJ !
1664,Daudet/tartarin_sur_les_alpes copie_clean.txt,"lui , toujours digne et calme , il se délecte en lisant de les journaux de le Midi , un paquet de journaux expédiée à la pension Müller et qui , tous , reproduisent d' après le Forum le récit de son ascension , celui qu' il a dicté , mais agrandi , enjolivé d' éloges mirifiques .","lui , ADVTEMPS ADJ et NCSENT , il se VSENT en PPRES de le NC de le NCmod , un NCo de NCmod PPAS à le NC NP et qui , tout , reproduire de PHASE le NP le NCo de DETPOSS NCmod , celui que il avoir PPAS , mais NC , PPAS de NC ADJ ."
1665,Daudet/tartarin_sur_les_alpes copie_clean.txt,"Tout à coup le héros pousse un cri , un cri formidable qui roule jusqu' à le bout de le wagon .","tout à NC le NCs PRES un NCo , un NC ADJ qui PRES jusque à le NC de le NCmod ."
1666,Daudet/tartarin_sur_les_alpes copie_clean.txt,Tous les voyageurs se sont dressés ; on croit à un tamponnement .,tout le NCs se être PPAS ; on VCOG à un NC .
