id,titre,phrase,motifs_phrase
1017,Daudet/tartarin_sur_les_alpes copie_clean.txt,"De les trois , le seul vrai , c' était Pégoulade .","de le NUM , le ADJ vrai , ce être NP ."
1018,Daudet/tartarin_sur_les_alpes copie_clean.txt,"Embarqué sur la Méduse avec ses parents , il avait subi le désastre à six mois , ce qui ne l' empêchait pas de le raconter , de visu , dans les moindres détails , la famine , les canots , le radeau , et comment il avait pris à la gorge le commandant qui se sauvait : Sur ton banc de quart , misérable !","PPAS sur le NP avec DETPOSS NC , il avoir PPAS le NCo à NUM NCT , ce qui ne le VIMP pas de le INF , de NC , dans le NC ADJ , le NC , le NC , le NC , et comment il avoir PPAS à le NCCOR le NCo qui se VIMP : sur DETPOSS NC de NCmod , ADJ !"
1019,Daudet/tartarin_sur_les_alpes copie_clean.txt,"... À six mois , outre! ... Assommant , de le reste , avec cette éternelle histoire que tout le monde connaissait , ressassait depuis cinquante ans , et dont il prenait prétexte pour se donner un air désolé , détaché de la vie .","... à NUM NCT , outre! ... PPRES , de le NC , avec ce ADJ NC que tout le NCs VIMP , VIMP depuis NUM NCT , et dont il VIMP NCo pour se INF un NCMAN VSENT , PPAS de le NC ."
1020,Daudet/tartarin_sur_les_alpes copie_clean.txt,Après ce que j' ai vu !,PHASE ce que je avoir VCOG !
1021,Daudet/tartarin_sur_les_alpes copie_clean.txt,"disait -il , et bien injustement , puisqu' il devait à cela son poste de receveur conservé sous tous les régimes .","VDIC il , et bien ADVMAN , puisque il devoir à cela DETPOSS NCo de NCmod PPAS sous tout le NC ."
1022,Daudet/tartarin_sur_les_alpes copie_clean.txt,"Près de lui , les frères Rognonas , jumeaux et sexagénaires , ne se quittant pas , mais toujours en querelle et disant de les monstruosités l' un de l' autre ; une telle ressemblance que leurs deux vieilles têtes frustes et irrégulières , regardant à l' opposé par antipathie , auraient pu figurer dans un médaillier avec IANVS BIFRONS pour exergue .","ADVLIEU de lui , le NCs NP , NC et NC , ne se PPRES pas , mais ADVTEMPS en NC et VDIC de le NC le un de le autre ; un tel NC que DETPOSS NUM NCs NCCOR ADJ et ADJ , VCOG à le NC par NCmod , avoir pouvoir INF dans un NC avec NP NP pour NCmod ."
1023,Daudet/tartarin_sur_les_alpes copie_clean.txt,"De-ci , de -là , le président Bédaride , Barjavel l' avoué , le notaire Cambalalette , et le terrible docteur Tournatoire dont Bravida disait qu' il aurait tiré de le sang d' une rave .","NP , de ADVLIEU , le NC NP , NP le NC , le NC NP , et le ADJ NC NP dont NP VDIC que il avoir PPAS de le NCCOR de un NCmod ."
1024,Daudet/tartarin_sur_les_alpes copie_clean.txt,"Vu la chaleur accablante , accrue par l' éclairage à le gaz , ces messieurs siégeaient en bras de chemise , ce qui ôtait beaucoup de solennité à la réunion .","vu le NC ADJ , PPAS par le NC à le NCmod , ce NCs VIMP en NCCOR de NCmod , ce qui VIMP beaucoup de NC à le NCmod ."
1025,Daudet/tartarin_sur_les_alpes copie_clean.txt,"Il est vrai qu' on était en petit comité , et l' infâme Costecalde voulait en profiter pour fixer à le plus tôt la date de les élections , sans attendre le retour de Tartarin .","il être vrai que on être en ADJ NCs , et le NC NP vouloir en INF pour INF à le plus tôt le NCo de le NCmod , sans INF le NCo de NP ."
1026,Daudet/tartarin_sur_les_alpes copie_clean.txt,"Assuré de son coup , il triomphait d' avance , et lorsque , après la lecture de l' ordre de le jour par Excourbaniès , il se leva pour intriguer , un infernal sourire retroussait sa lèvre mince .","PPAS de DETPOSS NC , il VIMP de NC , et lorsque , PHASE le NC de le NCmod de le NCT par NP , il se VPS pour VSENT , un ADJ NCMAN VIMP DETPOSS NCCOR NC ."
1027,Daudet/tartarin_sur_les_alpes copie_clean.txt,"Méfie -toi de celui qui rit avant de parler , murmura le commandant .","PPAS soi de celui qui PRES PHASE de INF , VF le NCs ."
1028,Daudet/tartarin_sur_les_alpes copie_clean.txt,"Costecalde , sans broncher , et clignant de l' œil à le fidèle Tournatoire , commença d' une voix fielleuse : Messieurs , l' inqualifiable conduite de notre président , l' incertitude où il nous laisse ... C' est faux !","NP , sans NCmod , et PPRES de le NC à le ADJ NP , VPS de un NCMAN ADJ : NP , le ADJ NC de DETPOSS NCmod , le NC où il nous laisser ... ce être ADJ !"
1029,Daudet/tartarin_sur_les_alpes copie_clean.txt,"... Le Président a écrit ... Bézuquet frémissant se campait devant le bureau ; mais comprenant ce que son attitude avait d' antiréglementaire , il changea de ton et , la main levée selon l' usage , demanda la parole pour une communication pressante .","... le NP avoir PPAS ... NP PPRES se VIMP ADVLIEU le NC ; mais VCOG ce que DETPOSS NCs avoir de NC , il VPS de NC et , le NCCOR PPAS selon le NC , VPS le NCo pour un NC ADJ ."
1030,Daudet/tartarin_sur_les_alpes copie_clean.txt,Parlez !,IMP !
1031,Daudet/tartarin_sur_les_alpes copie_clean.txt,Parlez !,IMP !
1032,Daudet/tartarin_sur_les_alpes copie_clean.txt,"Costecalde , très jaune , la gorge serrée , lui donna la parole d' un mouvement de tête .","NP , très ADJCOL , le NCCOR ADJ , lui VPS le NCo de un NCmod de NCCOR ."
1033,Daudet/tartarin_sur_les_alpes copie_clean.txt,"Alors , mais alors seulement , Bézuquet commença : Tartarin est à le pied de la Jungfrau ... Il va monter ... Il demande la bannière !","alors , mais alors seulement , NP VASP : NP être à le NCCOR de le NP ... il aller INF ... il PRES le NCo !"
1034,Daudet/tartarin_sur_les_alpes copie_clean.txt,"... Un silence coupé de le rauque halètement de les poitrines , de le crépitement de le gaz ; puis un hurrah formidable , de les bravos , de les trépignements , que dominait le gong d' Excourbaniès poussant son cri de guerre : Ah !","... un NC PPAS de le ADJ NC de le NCmod , de le NCmod de le NCmod ; puis un NC ADJ , de le NC , de le NC , que VIMP le NCs de NP PPRES DETPOSS NCo de NCmod : INTJ !"
1035,Daudet/tartarin_sur_les_alpes copie_clean.txt,ah !,INTJ !
1036,Daudet/tartarin_sur_les_alpes copie_clean.txt,ah !,INTJ !
1037,Daudet/tartarin_sur_les_alpes copie_clean.txt,fen dè brut !,ADV NP ADJ !
1038,Daudet/tartarin_sur_les_alpes copie_clean.txt,à lequel la foule anxieuse répondait de le dehors .,à lequel le NCs ADJ VDIC de le NC .
1039,Daudet/tartarin_sur_les_alpes copie_clean.txt,"Costecalde , de plus en plus jaune , agitait désespérément la sonnette présidentielle ; enfin Bézuquet continua , s' épongeant le front , soufflant comme s' il venait de monter cinq étages .","NP , de plus en plus ADJCOL , VIMP ADVMAN le NCo ADJ ; PHASE NP VPS , se PPRES le NCCOR , PPRES comme si il venir de INF NUM NCo ."
1040,Daudet/tartarin_sur_les_alpes copie_clean.txt,"Différemment , cette bannière que leur président réclamait pour la planter sur les cimes vierges , allait -on la ficeler , l' empaqueter par la grande vitesse comme un simple colis ?","ADV , ce NCs que lui NCs VIMP pour le INF sur le NC ADJ , aller on le INF , le INF par le ADJ NC comme un ADJ NC ?"
1041,Daudet/tartarin_sur_les_alpes copie_clean.txt,Jamais !,ADVTEMPS !
1042,Daudet/tartarin_sur_les_alpes copie_clean.txt,"... , ah !","... , INTJ !"
1043,Daudet/tartarin_sur_les_alpes copie_clean.txt,ah !,INTJ !
1044,Daudet/tartarin_sur_les_alpes copie_clean.txt,ah !,INTJ !
1045,Daudet/tartarin_sur_les_alpes copie_clean.txt,rugit Excourbaniès .,PPAS ADV .
1046,Daudet/tartarin_sur_les_alpes copie_clean.txt,"Ne vaudrait -il pas mieux nommer une délégation , tirer à le sort trois membres de le bureau ?","ne VCOND il pas mieux INF un NCo , INF à le NC NUM NCo de le NCmod ?"
1047,Daudet/tartarin_sur_les_alpes copie_clean.txt,... On ne le laissa pas finir .,... on ne le laisser pas VASP .
1048,Daudet/tartarin_sur_les_alpes copie_clean.txt,Le temps de dire zou !,le temps de VDIC ADJ !
1049,Daudet/tartarin_sur_les_alpes copie_clean.txt,"la proposition de Bézuquet était votée , acclamée , les noms de les trois délégués sortis dans l' ordre suivant: 1 , Bravida; 2 , Pégoulade; 3 , le pharmacien .","le NCspas de NP être PPAS , PPAS , le NC de le NUM NCmod PPAS dans le NC suivant: NUM , NP NUM , NP NUM , le NC ."
1050,Daudet/tartarin_sur_les_alpes copie_clean.txt,Le 2 protesta .,le NUM VDIC .
1051,Daudet/tartarin_sur_les_alpes copie_clean.txt,"Ce grand voyage lui faisait peur , si faible et mal portant comme il était , péchère , depuis le sinistre de la Méduse .","ce ADJ NCs lui faire NCSENT , si ADJ et mal ADV comme il être , NC , depuis le NC de le NP ."
1052,Daudet/tartarin_sur_les_alpes copie_clean.txt,"Je partirai pour vous , Pégoulade ... gronda Excourbaniès dans une télégraphie de tous ses membres .","je VF pour vous , NP ... VPS NP dans un NC de tout DETPOSS NCmod ."
1053,Daudet/tartarin_sur_les_alpes copie_clean.txt,"Quant à Bézuquet , il ne pouvait quitter la pharmacie .","quant à NP , il ne pouvoir INF le NCo ."
1054,Daudet/tartarin_sur_les_alpes copie_clean.txt,Il y allait de le salut de la ville .,il y aller de le NC de le NCmod .
1055,Daudet/tartarin_sur_les_alpes copie_clean.txt,"Une imprudence de l' élève et voilà Tarascon empoisonné , décimé .","un NC de le NCmod et voilà NP PPAS , PPAS ."
1056,Daudet/tartarin_sur_les_alpes copie_clean.txt,Outre !,outre !
1057,Daudet/tartarin_sur_les_alpes copie_clean.txt,fit le bureau se levant comme un seul homme .,faire le NCo se PPRES comme un ADJ NC .
1058,Daudet/tartarin_sur_les_alpes copie_clean.txt,"Bien sûr que le pharmacien ne pouvait partir , mais il enverrait Pascalon , Pascalon se chargerait de la bannière .","bien ADJ que le NCs ne pouvoir INF , mais il VIMP NP , NP se VCOND de le NC ."
1059,Daudet/tartarin_sur_les_alpes copie_clean.txt,Ça le connaissait !,ça le VIMP !
1060,Daudet/tartarin_sur_les_alpes copie_clean.txt,"Là-dessus , nouvelles exclamations , nouvelle explosion de le gong et , sur le cours , une telle tempête populaire , qu' Excourbaniès dut se montrer à la fenêtre , au-dessus de les hurlements que maîtrisa bientôt sa voix sans rivale .","ADV , ADJ NC , ADJ NC de le NCmod et , sur le NC , un tel NCs ADJ , que NP devoir se INF à le NC , ADVLIEU de le NC que VPS bientôt DETPOSS NCMAN sans NCmod ."
1061,Daudet/tartarin_sur_les_alpes copie_clean.txt,"Mes amis , Tartarin est retrouvé .","DETPOSS NC , NP être PPAS ."
1062,Daudet/tartarin_sur_les_alpes copie_clean.txt,Il est en train de se couvrir de gloire .,il être en NC de se INF de NC .
1063,Daudet/tartarin_sur_les_alpes copie_clean.txt,Sans rien ajouter de plus que Vive Tartarin !,sans rien INF de plus que NP NP !
1064,Daudet/tartarin_sur_les_alpes copie_clean.txt,"et son cri de guerre lancé à toute gorge , il savoura une minute la clameur épouvantable de toute cette foule sous les arbres de le Cours , roulant et s' agitant confuse dans une fumée de poussière , tandis que , sur les branches , tout un tremblement de cigales faisait aller ses petites crécelles comme en plein jour .","et DETPOSS NC de NCmod PPAS à tout NCCOR , il VPS un NCT le NC ADJ de tout ce NCmod sous le NC de le NCmod , ADJ et se PPRES ADJ dans un NC de NCmod , PHASE que , sur le NC , tout un NC de NCmod faire aller DETPOSS ADJ NCo comme en ADJ NCT ."
1065,Daudet/tartarin_sur_les_alpes copie_clean.txt,"Entendant cela , Costecalde , qui s' était approché d' une croisée avec tous les autres , revint vers son fauteuil en chancelant .","PPRES cela , NP , qui se être PPAS de un NC avec tout le autre , VPS vers DETPOSS NC en NCmod ."
1066,Daudet/tartarin_sur_les_alpes copie_clean.txt,"Vé Costecalde , dit quelqu'un ... Qu' est -ce qu' il a ?","NP NP , VDIC quelqu'un ... que être ce que il avoir ?"
1067,Daudet/tartarin_sur_les_alpes copie_clean.txt,... Comme il est jaune !,... comme il être ADJCOL !
1068,Daudet/tartarin_sur_les_alpes copie_clean.txt,"On s' élança ; déjà le terrible Tournatoire tirait sa trousse , mais l' armurier , tordu par le mal , en une grimace horrible , murmurait ingénument : Rien ... rien ... laissez -moi ... Je sais ce que c' est ... c' est l' envie !","on se VPS ; déjà le ADJ NP VIMP DETPOSS NCo , mais le NCs , PPAS par le mal , en un NC ADJ , VDIC NCo : rien ... rien ... laisser soi ... je VCOG ce que ce être ... ce être le NC !"
1069,Daudet/tartarin_sur_les_alpes copie_clean.txt,"Pauvre Costecalde , il avait l' air de bien souffrir .","NP NP , il avoir le NCMAN de bien VSENT ."
1070,Daudet/tartarin_sur_les_alpes copie_clean.txt,"Pendant que se passaient ces choses , à l' autre bout de le Tour de ville , dans la pharmacie de la placette , l' élève de Bézuquet , assis à le bureau de le patron , collait patiemment et remettait bout à bout les fragments oubliés par le pharmacien à le fond de la corbeille ; mais de nombreux morceaux échappaient à la reconstruction , car voici l' énigme singulière et farouche , étalée devant lui , assez pareille à une carte de l' Afrique centrale , avec de les manques , de les blancs de terra incognita , qu' explorait dans la terreur l' imagination de le naïf porte-bannière : Dialogue mémorable entre la Jungfrau et Tartarin .","PHASE que se VIMP ce chose , à le autre NC de le NCmod de NCmod , dans le NC de le NCmod , le NC de NP , PPAS à le NC de le NCmod , VIMP ADVMAN et VIMP ADV à NC le NCo PPAS par le NC à le NC de le NCmod ; mais un ADJ NCs VIMP à le NC , car voici le NCo ADJ et ADJ , PPAS ADVLIEU lui , ADV ADJ à un NC de le NP ADJ , avec de le NC , de le ADJCOL de NCmod ADJ , que VIMP dans le NCSENT le NCs de le NCmod NC : NC ADJ entre le NP et NP ."
1071,Daudet/tartarin_sur_les_alpes copie_clean.txt,Un salon nihiliste .,un NC ADJ .
1072,Daudet/tartarin_sur_les_alpes copie_clean.txt,Le duel à le couteau de chasse .,le NC à le NCmod de NCmod .
1073,Daudet/tartarin_sur_les_alpes copie_clean.txt,Affreux cauchemar .,ADJ NC .
1074,Daudet/tartarin_sur_les_alpes copie_clean.txt,"C' est moi que vous cherchez , messieurs ?","ce être soi que vous PRES , NCo ?"
1075,Daudet/tartarin_sur_les_alpes copie_clean.txt,Étrange accueil fait par l' hôtelier Meyer à la délégation tarasconnaise .,ADJ NC faire par le NC NP à le NC ADJ .
1076,Daudet/tartarin_sur_les_alpes copie_clean.txt,"Comme tous les hôtels chics d' Interlaken , l' hôtel Jungfrau , tenu par Meyer , est situé sur le Hœheweg , large promenade à la double allée de noyers qui rappelait vaguement à Tartarin son cher Tour de ville , moins le soleil , la poussière et les cigales ; car , depuis une semaine de séjour , la pluie n' avait cessé de tomber .","comme tout le NC ADJ de NP , le NCs NP , PPAS par NP , être PPAS sur le NP , ADJ NCo à le ADJ NCmod de NCmod qui VIMP ADV à NP DETPOSS ADJ NCo de NCmod , moins le NC , le NC et le NC ; car , depuis un NC de NCmod , le NCs ne avoir VASP de INF ."
1077,Daudet/tartarin_sur_les_alpes copie_clean.txt,"Il habitait une très belle chambre avec balcon , à le premier étage ; et le matin , faisant sa barbe devant la petite glace à main pendue à la croisée , une vieille habitude de voyage , le premier objet qui frappait ses yeux par-delà de les blés , de les luzernes , de les sapinières , un cirque de sombres verdures étagées , c' était la Jungfrau sortant de les nuages sa cime en corne , d' un blanc pur de neige amoncelée , où s' accrochait toujours le rayon furtif d' un invisible levant .","il VIMP un très ADJ NCo avec NCmod , à le ADJ NC ; et le NCT , faire DETPOSS NCCOR ADVLIEU le ADJ NC à NCCOR ADJ à le NCmod , un ADJ NCo de NCmod , le ADJ NC qui frapper DETPOSS NCCOR ADV de le NC , de le NC , de le NC , un NC de NCmod ADJ PPAS , ce être le NP PPRES de le NCmod DETPOSS NC en NCmod , de un ADJCOL ADJ de NCmod PPAS , où se VIMP ADVTEMPS le NCs ADJ de un ADJ NCmod ."
1078,Daudet/tartarin_sur_les_alpes copie_clean.txt,"Alors entre l' Alpe rose et blanche et l' Alpiniste de Tarascon , s' établissait un court dialogue qui ne manquait pas de grandeur .","alors entre le NP ADJCOL et ADJCOL et le NP de NP , se VIMP un ADJ NCo qui ne VIMP pas de NC ."
1079,Daudet/tartarin_sur_les_alpes copie_clean.txt,"Tartarin , y sommes-nous ?","NP , y sommes-le ?"
1080,Daudet/tartarin_sur_les_alpes copie_clean.txt,demandait la Jungfrau sévèrement .,VIMP le NP ADVMAN .
1081,Daudet/tartarin_sur_les_alpes copie_clean.txt,"Voilà , voilà ... répondait le héros , son pouce sous le nez , se hâtant de finir sa barbe ; et , bien vite , il atteignait son complet à carreaux d' ascensionniste , à le rancart depuis quelques jours , le passait en s' injuriant : Coquin de sort !","voilà , voilà ... VDIC le NCo , DETPOSS NCCOR sous le NCCOR , se PPRES de VASP DETPOSS NCCOR ; et , bien ADV , il VIMP DETPOSS NCo à NCmod de NCmod , à le NC depuis quelque NCT , le VIMP en se VDIC : NP de NCmod !"
1082,Daudet/tartarin_sur_les_alpes copie_clean.txt,"c' est vrai que ça n' a pas de nom ... Mais une petite voix discrète et claire montait entre les myrtes en bordure devant les fenêtres de le rez-de-chaussée : Bonjour ... disait Sonia , le voyant paraître à le balcon ... le landau nous attend ... dépêchez -vous donc , paresseux ... Je viens , je viens ... En deux temps , il remplaçait sa grosse chemise de laine par de le linge empesé fin , ses knickers-bockers de montagne par la jaquette vert-serpent qui , le dimanche , à la musique , tournait la tête à toutes les dames de Tarascon .","ce être vrai que ça ne avoir pas un NCo ... mais un ADJ NCMAN ADJ et ADJ VIMP entre le NC en NCmod ADVLIEU le NCmod de le NCmod : INTJ ... VDIC NP , le VCOG paraître à le NC ... le NCs nous PRES ... PRES vous donc , ADJ ... je venir , je venir ... en NUM temps , il VIMP DETPOSS ADJ NCo de NCmod par un le NCmod PPAS NC , DETPOSS NC de NCmod par le NCmod NCmod qui , le ADVT , à le NC , VIMP le NCCOR à tout le NCmod de NP ."
1083,Daudet/tartarin_sur_les_alpes copie_clean.txt,"Le landau piaffait devant l' hôtel , Sonia déjà installée à côté de son frère , plus pâle et creusé de jour en jour malgré le bienfaisant climat d' Interlaken; mais , à le moment de partir , Tartarin voyait régulièrement se lever d' un banc de la promenade et s' approcher , avec le lourd dandinement d' ours de montagne , deux guides fameux de Grindelwald , Rodolphe Kaufmann et Christian Inebnit , retenus par lui pour l' ascension de la Jungfrau et qui , chaque matin , venaient voir si leur monsieur était disposé .","le NC PPAS ADVLIEU le NC , NP déjà PPAS à NC de DETPOSS NC , plus ADJ et PPAS de NCT en NCT malgré le ADJ NC de NP mais , à le NC de INF , NP VCOG ADVTEMPS se INF de un NC de le NCmod et se INF , avec le ADJ NC de NCmod de NCmod , NUM NCo ADJ de NP , NP NP et NP NP , PPAS par lui pour le NC de le NP et qui , chaque NCT , venir VCOG si lui monsieur être PPAS ."
1084,Daudet/tartarin_sur_les_alpes copie_clean.txt,"L' apparition de ces deux hommes à les fortes chaussures ferrées , à les vestes de futaine , râpées à le dos et sur l' épaule par le sac et les cordes d' ascension , leurs faces naïves et sérieuses , les quatre mots de français qu' ils baragouinaient péniblement en tortillant leurs grands chapeaux de feutre , c' était pour Tartarin un véritable supplice .","le NC de ce NUM NCmod à le fort NCmod ADJ , à le NCmod de NCmod , PPAS à le NCCOR et sur le NCCOR par le NC et le NC de NCmod , DETPOSS NC ADJ et ADJ , le NUM NC de NCmod que il VIMP ADV en PPRES DETPOSS ADJ NCo de NCmod , ce être pour NP un véritable NCSENT ."
1085,Daudet/tartarin_sur_les_alpes copie_clean.txt,"Il avait beau leur dire : Ne vous dérangez pas ... je vous préviendrai ... Tous les jours , il les retrouvait à la même place et s' en débarrassait par une grosse pièce proportionnée à l' énormité de son remords .","il avoir PPAS lui VDIC : ne vous PRES pas ... je vous VF ... tout le NCT , il le VIMP à le même NC et se en VIMP par un ADJ NC PPAS à le NC de DETPOSS NCSENT ."
1086,Daudet/tartarin_sur_les_alpes copie_clean.txt,"Enchantés de cette façon de faire la Jungfrau , les montagnards empochaient le trinkgeld gravement et reprenaient d' un pas résigné , sous la fine pluie , le chemin de leur village , laissant Tartarin confus et désespéré de sa faiblesse .","PPAS de ce façon de faire le NP , le NCs VIMP le NCo ADVMAN et VIMP de un pas PPAS , sous le ADJ NCmod , le NC de lui NCmod , PPRES NP ADJ et VSENT de DETPOSS NC ."
1087,Daudet/tartarin_sur_les_alpes copie_clean.txt,"Puis le grand air , les plaines fleuries reflétées à les prunelles limpides de Sonia , le frôlement d' un petit pied contre sa botte à le fond de la voiture ... À le diable la Jungfrau !","puis le ADJ NCMAN , le NC ADJ PPAS à le NC ADJ de NP , le NC de un ADJ NCCOR contre DETPOSS NCmod à le NCmod de le NCmod ... à le NC le NP !"
1088,Daudet/tartarin_sur_les_alpes copie_clean.txt,"Le héros ne songeait qu' à ses amours , ou plutôt à la mission qu' il s' était donnée de ramener dans le droit chemin cette pauvre petite Sonia , criminelle inconsciente , jetée par dévouement fraternel hors la loi et hors la nature .","le NCs ne VIMP que à DETPOSS NCSENT , ou plutôt à le NC que il se être PPAS de INF dans le NC NC ce NCo ADJ NP , NC ADJ , PPAS par NC ADJ hors le NC et hors le NC ."
1089,Daudet/tartarin_sur_les_alpes copie_clean.txt,"C' était le motif qui le retenait à Interlaken , dans le même hôtel que les Wassilief .","ce être le NC qui le VIMP à NP , dans le même NC que le NP ."
1090,Daudet/tartarin_sur_les_alpes copie_clean.txt,"À son âge , avec son air papa , il ne pouvait songer se faire aimer de cette enfant ; seulement , il la voyait si douce , si bravette , si généreuse envers tous les misérables de son parti , si dévouée pour ce frère , que les mines sibériennes lui avaient renvoyé le corps rongé d' ulcères , empoisonné de vert-de-gris , condamné à mort par la phtisie plus sûrement que par toutes les cours martiales !","à DETPOSS NC , avec DETPOSS NCMAN ADJ , il ne pouvoir INF se faire VSENT de ce NC ; seulement , il le VCOG si ADJ , si ADJ , si ADJ envers tout le NC de DETPOSS NCmod , si PPAS pour ce NC , que le NCs sibérien lui avoir PPAS le NCCOR VSENT de NC , PPAS de NC , PPAS à PPAS par le NC plus ADVINT que par tout le NC ADJ !"
1091,Daudet/tartarin_sur_les_alpes copie_clean.txt,"Il y avait de quoi s' attendrir , allons !","il y avoir de quoi se VSENT , NCo !"
1092,Daudet/tartarin_sur_les_alpes copie_clean.txt,"Tartarin leur proposait de les emmener à Tarascon , de les installer dans un bastidon plein de soleil à les portes de la ville , cette bonne petite ville où il ne pleut jamais , où la vie se passe en chansons et en fêtes .","NP lui VDIC de le INF à NP , de le INF dans un NC ADJ de NCmod à le NCmod de le NCmod , ce ADJ ADJ NC où il ne PRES ADVTEMPS , où le NCs se PRES en NC et en NC ."
1093,Daudet/tartarin_sur_les_alpes copie_clean.txt,"Il s' exaltait , esquissait un air de tambourin sur son chapeau , entonnait le gai refrain national sur une mesure de farandole : Lagadigade ù La Tarasco , la Tarasco , Lagadigadeù La Tarasco de Casteù .","il se VIMP , VIMP un NCMAN de NCmod sur DETPOSS NC , VIMP le NCo ADJ ADJ sur un NC de NCmod : NP ADV le NP , le NP , NP le NP de NP ."
1094,Daudet/tartarin_sur_les_alpes copie_clean.txt,"Mais tandis qu' un sourire ironique amincissait encore les lèvres de le malade , Sonia secouait la tête .","mais PHASE que un NCMAN ADJ VIMP encore le NCCOR de le NCmod , NP VIMP le NCCOR ."
1095,Daudet/tartarin_sur_les_alpes copie_clean.txt,"Ni fêtes ni soleil pour elle , tant que le peuple russe râlerait sous le tyran .","Ni NC ni NC pour il , tant que le NCs ADJ VDIC sous le NC ."
1096,Daudet/tartarin_sur_les_alpes copie_clean.txt,"Sitôt son frère guéri , ses yeux navrés disaient autre chose , rien ne l' empêcherait de retourner là-bas souffrir et mourir pour la cause sacrée .","ADV DETPOSS NCs ADJ , DETPOSS NCCOR VSENT VDIC autre chose , rien ne le VCOND de INF ADVLIEU VSENT et INF pour le NC ADJ ."
1097,Daudet/tartarin_sur_les_alpes copie_clean.txt,"Mais , coquin de bon sort !","mais , NC de ADJ NCmod !"
1098,Daudet/tartarin_sur_les_alpes copie_clean.txt,"criait le Tarasconnais , après ce tyran-là , si vous le faites sauter , il en viendra un autre ... Il faudra donc recommencer ... Et les années se passent , vé !","VDIC le NP , PHASE ce tyran-là , si vous le faire INF , il en venir un autre ... il VF donc INF ... et le NCT se PRES , PPAS !"
1099,Daudet/tartarin_sur_les_alpes copie_clean.txt,"le temps de le bonheur et de les jeunes amours ... Sa façon de dire amour à la tarasconnaise , avec les r et les yeux hors de le front , amusait la jeune fille ; puis , sérieuse , elle déclarait qu' elle n' aimerait jamais que l' homme qui délivrerait sa patrie .","le temps de le NCSENT et de le ADJ NCSENT ... DETPOSS façon de VDIC NCSENT à le NC , avec le INF et le NCCOR ADV de le NCCOR , VSENT le ADJ NCo ; puis , ADJ , il VIMP que il ne VSENT ADVTEMPS que le NC qui VCOND DETPOSS NCo ."
1100,Daudet/tartarin_sur_les_alpes copie_clean.txt,Oh !,INTJ !
1101,Daudet/tartarin_sur_les_alpes copie_clean.txt,"celui-là , fut -il laid comme Bolibine , plus rustique et grossier que Manilof , elle était prête à se donner toute à lui , à vivre à ses côtés en libre grâce , aussi longtemps que durerait sa jeunesse de femme , et que cet homme voudrait d' elle .","celui-là , être il PRES comme NP , plus ADJ et ADJ que NP , il être ADJ à se INF tout à lui , à INF à DETPOSS NC en ADJ NC , aussi longtemps que VCOND DETPOSS NCs de NCmod , et que ce NCs vouloir de il ."
1102,Daudet/tartarin_sur_les_alpes copie_clean.txt,En libre grâce !,en ADJ NC !
1103,Daudet/tartarin_sur_les_alpes copie_clean.txt,le mot dont se servent les nihilistes pour qualifier ces unions illégales contractées entre eux par le consentement réciproque .,le NC dont se PRES le NCs pour INF ce NCo ADJ PPAS entre eux par le NC ADJ .
