id,titre,phrase,motifs_phrase
1,Daudet/tartarin_sur_les_alpes copie_clean.txt,Apparition à le Rigi-Kulm .,NC à le NP .
2,Daudet/tartarin_sur_les_alpes copie_clean.txt,Qui ?,Qui ?
3,Daudet/tartarin_sur_les_alpes copie_clean.txt,Ce qu' on dit autour d' une table de six cents couverts .,ce que on VDIC ADV de un NC de NUM NCmod ADJ .
4,Daudet/tartarin_sur_les_alpes copie_clean.txt,Riz et pruneaux .,IMP et NC .
5,Daudet/tartarin_sur_les_alpes copie_clean.txt,Un bal improvisé .,un NC ADJ .
6,Daudet/tartarin_sur_les_alpes copie_clean.txt,L' inconnu signe son nom sur le registre de l' hôtel .,le NCs PRES DETPOSS NCo sur le NC de le NCmod .
7,Daudet/tartarin_sur_les_alpes copie_clean.txt,P. C .,ADV NC .
8,Daudet/tartarin_sur_les_alpes copie_clean.txt,A .,à .
9,Daudet/tartarin_sur_les_alpes copie_clean.txt,"Le 10 août 1880 , à l' heure fabuleuse de ce coucher de soleil sur les Alpes , si fort vanté par les guides Joanne et Baedeker , un brouillard jaune hermétique , compliqué d' une tourmente de neige en blanches spirales , enveloppait la cime de le Rigi ( Regina montium ) et cet hôtel gigantesque , extraordinaire à voir dans l' aride paysage de les hauteurs , ce Rigi-Kulm vitré comme un observatoire , massif comme une citadelle , où pose pour un jour et une nuit la foule de les touristes adorateurs de le soleil .","le NUM MOIS NUM , à le NCT ADJ de ce NCmod de NCmod sur le NP , si fort PPAS par le NC NP et NP , un NC ADJCOL ADJ , PPAS de un NC de NCmod en NCmod ADJ , VIMP le NCo de le NP ( NP NP ) et ce NC ADJ , ADJ à VCOG dans le NC ADJ de le NCmod , ce NP PPAS comme un NC , NC comme un NCmod , où PRES pour un NCT et un NCT le NCo de le NCmod ADJ de le NCmod ."
10,Daudet/tartarin_sur_les_alpes copie_clean.txt,"En attendant le second coup de le dîner , les passagers de l' immense et fastueux caravansérail , morfondus en haut dans les chambres ou pâmés sur les divans de les salons de lecture dans la tiédeur moite de les calorifères allumés , regardaient , à défaut de les splendeurs promises , tournoyer les petites mouchetures blanches et s' allumer devant le perron les grands lampadaires dont les doubles verres de phares grinçaient à le vent .","en PPRES le ADJ NCo de le NCmod , le NCs de le ADJ et ADJ NCmod , PPAS en NC dans le NC ou PPAS sur le NC de le NCmod de NCmod dans le NC ADJ de le NCmod PPAS , VCOG , à NC de le NCmod ADJ , INF le ADJ NCo ADJCOL et se INF ADVLIEU le NC le NCo ADJ dont le ADJ NCs de NCmod VIMP à le NC ."
11,Daudet/tartarin_sur_les_alpes copie_clean.txt,"Monter si haut , venir de les quatre coins de le monde pour voir cela ... Ô Baedeker !","INF si ADV , venir de le NUM NC de le NCmod pour VCOG cela ... INTJ NP !"
12,Daudet/tartarin_sur_les_alpes copie_clean.txt,"... Soudain quelque chose émergea de le brouillard , s' avançant vers l' hôtel avec un tintement de ferrailles , une exagération de mouvements causée par d' étranges accessoires .","... soudain quelque chose VPS de le NC , se PPRES vers le NC avec un NCmod de NCmod , un NC de NCmod PPAS par un ADJ NC ."
13,Daudet/tartarin_sur_les_alpes copie_clean.txt,"À vingt pas , à travers la neige , les touristes désœuvrés , le nez contre les vitres , les misses à les curieuses petites têtes coiffées en garçons , prirent cette apparition pour une vache égarée , puis pour un rétameur chargé de ses ustensiles .","à NUM pas , à travers le NCmod , le NCs PPAS , le NCCOR contre le NCmod , le NC à le NCmod ADJ NCCOR PPAS en NC , VPS ce NCo pour un NC PPAS , puis pour un NC PPAS de DETPOSS NC ."
14,Daudet/tartarin_sur_les_alpes copie_clean.txt,"À dix pas , l' apparition changea encore et montra l' arbalète à l' épaule , le casque à visière baissée d' un archer de le Moyen Âge , encore plus invraisemblable à rencontrer sur ces hauteurs qu' une vache ou qu' un ambulant .","à NUM pas , le NCs VPS encore et VPS le NCo à le NCCOR , le NC à NCmod PPAS de un NC de le ADJ NP , encore plus ADJ à INF sur ce NC que un NCmod ou que un NC ."
15,Daudet/tartarin_sur_les_alpes copie_clean.txt,"À le perron , l' arbalétrier ne fut plus qu' un gros homme , trapu , râblé , qui s' arrêtait pour souffler , secouer la neige de ses jambières en drap jaune comme sa casquette , de son passe-montagne tricoté ne laissant guère voir de le visage que quelques touffes de barbe grisonnante et d' énormes lunettes vertes , bombées en verres de stéréoscope .","à le NC , le NCs ne être plus que un ADJ NC , NC , PPAS , qui se VIMP pour VSENT , INF le NCo de DETPOSS NCmod en NCmod ADJCOL comme DETPOSS NCmod , de DETPOSS NCmod ADJ ne laisser guère VCOG de le NCCOR que quelque NC de NCCOR ADJ et de ADJ NC ADJCOL , NC en NCmod de NCmod ."
16,Daudet/tartarin_sur_les_alpes copie_clean.txt,"Le piolet , l' alpenstock , un sac sur le dos , un paquet de cordes en sautoir , de les crampons et crochets de fer à la ceinture d' une blouse anglaise à larges pattes complétaient le harnachement de ce parfait alpiniste .","le NCs , le NC , un NC sur le NCCOR , un NC de NCmod en NCmod , de le NC et NC de NCmod à le NCmod de un NCmod ADJ à ADJ NCmod VIMP le NCo de ce NCmod ADJ ."
17,Daudet/tartarin_sur_les_alpes copie_clean.txt,"Sur les cimes désolées de le Mont-Blanc ou de le Finsteraarhorn , cette tenue d' escalade aurait semblé naturelle ; mais à le Rigi-Kulm , à deux pas de le chemin de fer !","sur le NC VSENT de le NP ou de le NP , ce NCs de NCmod avoir sembler ADJ ; mais à le NP , à NUM pas de le NCmod de NCmod !"
18,Daudet/tartarin_sur_les_alpes copie_clean.txt,"L' Alpiniste , il est vrai , venait de le côté opposé à la station , et l' état de ses jambières témoignait d' une longue marche dans la neige et la boue .","le NP , il être vrai , venir de le NC PPAS à le NC , et le NCs de DETPOSS NCmod VIMP de un ADJ NC dans le NC et le NC ."
19,Daudet/tartarin_sur_les_alpes copie_clean.txt,"Un moment il regarda l' hôtel et ses dépendances , stupéfait de trouver à deux mille mètres au-dessus de la mer une bâtisse de cette importance , de les galeries vitrées , de les colonnades , sept étages de fenêtres et le large perron s' étalant entre deux rangées de pots à feu qui donnaient à ce sommet de montagne l' aspect de la place de l' Opéra par un crépuscule d' hiver .","un NC il VCOG le NCo et DETPOSS NC , VIMP de INF à NUM NUM NC ADVLIEU de le NC un NCo de ce NCmod , de le NC ADJ , de le NC , NUM NC de NCmod et le ADJ NC se PPRES entre NUM NC de NCmod à NCmod qui VIMP à ce NC de NCmod le NCo de le NCmod de le NP par un NCmod de NCmod ."
20,Daudet/tartarin_sur_les_alpes copie_clean.txt,"Mais si surpris qu' il pût être , les gens de l' hôtel le paraissaient bien davantage , et lorsqu' il pénétra dans l' immense antichambre , une poussée curieuse se fit à l' entrée de toutes les salles : de les messieurs armés de queues de billard , d' autres avec de les journaux déployés , de les dames tenant leur livre ou leur ouvrage , tandis que tout à le fond , dans le développement de l' escalier , de les têtes se penchaient par-dessus la rampe , entre les chaînes de l' ascenseur .","mais si VSENT que il VSUBI être , le NCs de le NCmod le VIMP bien davantage , et lorsque il VF dans le ADJ NC , un NC ADJ se faire à le NC de tout le NCmod : de le NCmod PPAS de NC de NCmod , un autre avec de le NCmod ADJ , de le NC PPRES lui NCo ou lui NC , PHASE que tout à le NC , dans le NCmod de le NCmod , de le NCCOR se VIMP ADV le NCs , entre le NCmod de le NCmod ."
21,Daudet/tartarin_sur_les_alpes copie_clean.txt,"L' homme dit haut , très fort , d' une voix de basse profonde , un creux de le Midi sonnant comme une paire de cymbales : Coquin de bon sort !","le NC VDIC ADJ , très fort , de un NCMAN de NCmod ADJ , un NC de le NCmod PPRES comme un NC de NCmod : NP de ADJ NCmod !"
22,Daudet/tartarin_sur_les_alpes copie_clean.txt,En voilà un temps !,en voilà un temps !
23,Daudet/tartarin_sur_les_alpes copie_clean.txt,"... Et tout de suite il s' arrêta , quitta sa casquette et ses lunettes .","... et tout de ADV il se VPS , VPS DETPOSS NCo et DETPOSS NC ."
24,Daudet/tartarin_sur_les_alpes copie_clean.txt,Il suffoquait .,il VIMP .
25,Daudet/tartarin_sur_les_alpes copie_clean.txt,"L' éblouissement de les lumières , le chaleur de le gaz , de les calorifères , en contraste avec le froid noir de le dehors , puis cet appareil somptueux , ces hauts plafonds , ces portiers chamarrés avec REGINA MONTIUM en lettres d' or sur leurs casquettes d' amiraux , les cravates blanches de les maîtres d' hôtel et le bataillon de les Suissesses en costumes nationaux accouru sur un coup de timbre , tout cela l' étourdit une seconde , pas plus d' une .","le NC de le NCmod , le NC de le NCmod , de le NC , en NC avec le NCmod ADJ de le NCmod , puis ce NC ADJ , ce ADJ NC , ce NC PPAS avec NP NP en NCmod de NCmod sur DETPOSS NCmod de NCmod , le NC ADJCOL de le NCmod de NCmod et le NC de le NCmod en NCmod ADJ PPAS sur un NC de NCmod , tout cela le VPS un NCT , pas plus de NUM ."
26,Daudet/tartarin_sur_les_alpes copie_clean.txt,"Il se sentit regardé et , sur-le-champ , retrouva son aplomb , comme un comédien devant les loges pleines .","il se sentir VCOG et , ADV , VPS DETPOSS NCo , comme un NCmod ADVLIEU le NCmod ADJ ."
27,Daudet/tartarin_sur_les_alpes copie_clean.txt,Monsieur désire ?,monsieur VSENT ?
28,Daudet/tartarin_sur_les_alpes copie_clean.txt,"... C' était le gérant qui l' interrogeait de le bout de les dents , un gérant très chic , jaquette rayée , favoris soyeux , une tête de couturier pour dames .","... ce être le NC qui le VDIC de le NC de le NCCOR , un NC très ADJ , jaquette NC , NC ADJ , un NCCOR de NCmod pour NCmod ."
29,Daudet/tartarin_sur_les_alpes copie_clean.txt,"L' Alpiniste , sans s' émouvoir , demanda une chambre , une bonne petite chambre , à le moins , à l' aise avec ce majestueux gérant comme avec un vieux camarade de collège .","le NP , sans se VSENT , VPS un NCo , un ADJ ADJ NC , à le moins , à le NC avec ce ADJ NCmod comme avec un ADJ NC de NCmod ."
30,Daudet/tartarin_sur_les_alpes copie_clean.txt,"Il fut par exemple bien près de se fâcher quand la servante bernoise , qui s' avançait un bougeoir à la main , toute raide dans son plastron d' or et les bouffants de tulle de ses manches , s' informa si monsieur désirait prendre l' ascenseur .","il être par NC bien ADVLIEU de se VSENT quand le NCs ADJ , qui se VIMP un NCo à le NCCOR , tout NC dans DETPOSS NCmod de NCmod et le NC de NCmod de DETPOSS NCmod , se VPS si monsieur VSENT INF le NCo ."
31,Daudet/tartarin_sur_les_alpes copie_clean.txt,La proposition d' un crime à commettre ne l' eût pas indigné davantage .,le NCs de un NCmod à INF ne le avoir pas VSENT davantage .
32,Daudet/tartarin_sur_les_alpes copie_clean.txt,"Un ascenseur , à lui! ... à lui !","un NC , à lui! ... à lui !"
33,Daudet/tartarin_sur_les_alpes copie_clean.txt,"... Et son cri , son geste , secouèrent toute sa ferraille .","... et DETPOSS NCs , DETPOSS NC , VPS tout DETPOSS NCo ."
34,Daudet/tartarin_sur_les_alpes copie_clean.txt,"Subitement radouci , il dit à la Suissesse d' un ton aimable : Pedibusse cum jambisse , ma belle chatte ... et il monta derrière elle , son large dos tenant l' escalier , écartant les gens sur son passage , pendant que par tout l' hôtel courait une clameur , un long Qu' est -ce que c' est que ça ?","ADV ADV , il VDIC à le NC de un NCmod ADJ : NC cum NCmod , DETPOSS ADJ NC ... et il VPS ADVLIEU il , DETPOSS ADJ NCCOR PPRES le NCo , PPRES le NCo sur DETPOSS NC , PHASE que par tout le NCs VIMP un NCo , un NCs que être ce que ce être que ça ?"
35,Daudet/tartarin_sur_les_alpes copie_clean.txt,chuchoté dans les langues diverses de les quatre parties de le monde .,VDIC dans le NCCOR ADJ de le NUM NCmod de le NCmod .
36,Daudet/tartarin_sur_les_alpes copie_clean.txt,"Puis le second coup de le dîner sonna , et nul ne s' occupa plus de l' extraordinaire personnage .","puis le ADJ NCs de le NCmod VPS , et nul ne se VPS plus de le ADJ NC ."
37,Daudet/tartarin_sur_les_alpes copie_clean.txt,"Un spectacle , cette salle à manger de le Rigi-Kulm .","un NC , ce NC à INF de le NP ."
38,Daudet/tartarin_sur_les_alpes copie_clean.txt,"Six cents couverts autour d' une immense table en fer à cheval où de les compotiers de riz et de pruneaux alternaient en longues files avec de les plantes vertes , reflétant dans leur sauce claire ou brune les petites flammes droites de les lustres et les dorures de le plafond caissonné .","NUM NC PPAS ADV de un ADJ NC en NCmod à NCmod où de le NCs de NCmod et de NC VIMP en NC ADJ avec de le NC ADJCOL , PPRES dans lui NC ADJ ou ADJ le ADJ NCo ADJ de le NCmod et le NC de le NCmod PPAS ."
39,Daudet/tartarin_sur_les_alpes copie_clean.txt,"Comme dans toutes les tables d' hôte suisses , ce riz et ces pruneaux divisaient le dîner en deux factions rivales , et rien qu' à les regards de haine ou de convoitise jetés d' avance sur les compotiers de le dessert , on devinait aisément à quel parti les convives appartenaient .","comme dans tout le NC de NCmod ADJ , ce NCs et ce NC VIMP le NCo en NUM NC ADJ , et rien que à le NCMAN de VSENT ou de NCSENT PPAS de NC sur le NC de le NCmod , on VCOG ADV à quel NC le NCs VIMP ."
40,Daudet/tartarin_sur_les_alpes copie_clean.txt,"Les Riz se reconnaissaient à leur pâleur défaite , les Pruneaux à leurs faces congestionnées .","le NP se VIMP à lui NC NC , le NC à DETPOSS NCmod ADJ ."
41,Daudet/tartarin_sur_les_alpes copie_clean.txt,"Ce soir -là , les derniers étaient en plus grand nombre , comptaient surtout de les personnalités plus importantes , de les célébrités européennes , telles que le grand historien Astier-Réhu , de l' Académie française , le baron de Stoltz , vieux diplomate austro-hongrois , lord Chipendale ( ?","ce NCT ADVLIEU , le NCs être en plus ADJ NC , VIMP surtout de le NC plus ADJ , de le NC ADJ , tel que le ADJ NC NP , de le NC ADJ , le NC de NP , ADJ NC ADJ , NC NP ( ?"
42,Daudet/tartarin_sur_les_alpes copie_clean.txt,") , un membre de le Jockey-Club avec sa nièce ( hum !",") , un NC de le NP avec DETPOSS NCmod ( NC !"
43,Daudet/tartarin_sur_les_alpes copie_clean.txt,hum !,NCmod !
44,Daudet/tartarin_sur_les_alpes copie_clean.txt,") , l' illustre docteur-professeur Schwanthaler , de l' Université de Bonn , un général péruvien et ses huit demoiselles .",") , le ADJ NC NP , de le NC de NP , un NC ADJ et DETPOSS NUM NC ."
45,Daudet/tartarin_sur_les_alpes copie_clean.txt,"À quoi les Riz ne pouvaient guère opposer comme grandes vedettes qu' un sénateur belge et sa famille , Mme Schwanthaler , la femme de le professeur , et un ténor italien retour de Russie , étalant sur la nappe de les boutons de manchettes larges comme de les soucoupes .","à quoi le NP ne pouvoir guère INF comme ADJ NC que un NC ADJ et DETPOSS NC , madame NP , le NC de le NCmod , et un NC ADJ NC de NP , PPRES sur le NC de le NCmod de NCmod ADJ comme de le NC ."
46,Daudet/tartarin_sur_les_alpes copie_clean.txt,C' est ce double courant opposé qui faisait sans doute la gêne et la raideur de la table .,ce être ce NC ADJ PPAS qui faire sans NCSENT le NCSENT et le NC de le NCmod .
47,Daudet/tartarin_sur_les_alpes copie_clean.txt,"Comment expliquer autrement le silence de ces six cents personnes , gourmées , renfrognées , méfiantes , et le souverain mépris qu' elles semblaient affecter les unes pour les autres ?","comment VDIC ADVINT le NCo de ce NUM NUM NCmod , PPAS , PPAS , ADJ , et le NC ADJ que il VIMP VSENT le NCo pour le autre ?"
48,Daudet/tartarin_sur_les_alpes copie_clean.txt,"Un observateur superficiel aurait pu l' attribuer à la stupide morgue anglo-saxonne qui , maintenant , par tous pays donne le ton de le monde voyageur .","un NCs ADJ avoir pouvoir le INF à le NC ADJ ADJ qui , ADVT , par tout NC PRES le NCo de le NCmod NC ."
49,Daudet/tartarin_sur_les_alpes copie_clean.txt,Mais non !,mais non !
50,Daudet/tartarin_sur_les_alpes copie_clean.txt,"De les êtres à face humaine n' arrivent pas à se haïr ainsi à première vue , à se dédaigner de le nez , de la bouche et de les yeux faute de présentation préalable .","de le être à NCmod ADJ ne PRES pas à se VSENT ainsi à ADJ NC , à se VSENT de le NCCOR , de le NCCOR et de le NCCOR ADV de NC ADJ ."
51,Daudet/tartarin_sur_les_alpes copie_clean.txt,Il doit y avoir autre chose .,il devoir y avoir autre chose .
52,Daudet/tartarin_sur_les_alpes copie_clean.txt,"Riz et Pruneaux , je vous dis .","NP et NP , je vous VDIC ."
53,Daudet/tartarin_sur_les_alpes copie_clean.txt,"Et vous avez l' explication de le morne silence pesant sur ce dîner de le Rigi-Kulm qui , vu le nombre et la variété internationale de les convives , aurait dû être animé , tumultueux , comme on se figure les repas à le pied de la tour de Babel .","et vous avoir le NCo de le ADJ NCmod ADJ sur ce NCmod de le NP qui , vu le NC et le NC ADJ de le NCmod , avoir devoir être ADJ , ADJ , comme on se PRES le NCo à le NCCOR de le NCmod de NP ."
54,Daudet/tartarin_sur_les_alpes copie_clean.txt,"L' Alpiniste entra , un peu troublé devant ce réfectoire de chartreux en pénitence sous le flamboiement de les lustres , toussa bruyamment sans que personne prît garde à lui , s' assit à son rang de dernier venu , à le bout de la salle .","le NP ADJ , un peu VSENT ADVLIEU ce NC de NCmod en NCmod sous le NCmod de le NCmod , VPS ADVMAN sans que personne PRES NCo à lui , se PRES à DETPOSS NC de ADJ venir , à le NC de le NCmod ."
55,Daudet/tartarin_sur_les_alpes copie_clean.txt,"Défublé maintenant , c' était un touriste comme un autre , mais d' aspect plus aimable , chauve , bedonnant , la barbe en pointe et touffue , le nez majestueux , d' épais sourcils féroces sur un regard bon enfant .","PPAS ADVT , ce être un NC comme un autre , mais de NC plus ADJ , NC , PPRES , le NCCOR en NCmod et NC , le NCCOR ADJ , de NC NCCOR NC sur un NCMAN ADJ NCmod ."
56,Daudet/tartarin_sur_les_alpes copie_clean.txt,Riz ou Pruneau ?,NP ou NP ?
57,Daudet/tartarin_sur_les_alpes copie_clean.txt,on ne savait encore .,on ne VCOG encore .
58,Daudet/tartarin_sur_les_alpes copie_clean.txt,"À peine installé , il s' agita avec inquiétude , puis quittant sa place d' un bond effrayé : Outre! ... un courant d' air! ... dit -il tout haut , et il s' élança vers une chaise libre , rabattue à le milieu de la table .","à NCSENT PPAS , il se VPS avec NCSENT , puis PPRES DETPOSS NCo de un NCmod VSENT : NP ... un NC de air! ... VDIC il tout ADJ , et il se VPS vers un NC ADJ , PPAS à le milieu de le NCmod ."
59,Daudet/tartarin_sur_les_alpes copie_clean.txt,"Il fut arrêté par une Suissesse de service , de le canton d' Uri , celle -là , chaînettes d' argent et guimpe blanche : Monsieur , c' est retenu ... Alors , de la table , une jeune fille dont il ne voyait que la chevelure en blonds relevés sur de les blancheurs de neige vierge dit sans se retourner , avec un accent d' étrangère : Cette place est libre ... mon frère est malade , il ne descend pas .","il être PPAS par un NP de NCmod , de le NC de NP , celui ADVLIEU , NC de NCmod et NC ADJCOL : monsieur , ce être PPAS ... alors , de le NC , un ADJ NCs dont il ne VCOG que le NCo en NCmod PPAS sur de le NC de NCmod ADJ VDIC sans se INF , avec un NC de NCmod : ce NCs être ADJ ... DETPOSS NCs être ADJ , il ne PRES pas ."
60,Daudet/tartarin_sur_les_alpes copie_clean.txt,Malade ?,NC ?
61,Daudet/tartarin_sur_les_alpes copie_clean.txt,"demanda l' Alpiniste en s' asseyant , l' air empressé , presque affectueux ... Malade ?","VPS le NP en se PPRES , le NCMAN PPAS , presque ADJ ... NP ?"
62,Daudet/tartarin_sur_les_alpes copie_clean.txt,Pas dangereusement à le moins ?,pas ADVINT à le moins ?
63,Daudet/tartarin_sur_les_alpes copie_clean.txt,"Il prononçait à le mouain , et le mot revenait dans toutes ses phrases avec quelques autres vocables parasites hé , qué , té , zou , vé , vaï , allons , et autrement , différemment , qui soulignaient encore son accent méridional , déplaisant sans doute pour la jeune blonde , car elle ne répondit que par un regard glacé , d' un bleu noir , d' un bleu d' abîme .","il VIMP à le NC , et le NCs VIMP dans tout DETPOSS NC avec quelque autre NCmod ADJ PPAS , PPAS , PPAS , zou , ver , vaï , NC , et ADVINT , ADV , qui VIMP encore DETPOSS NCo ADJ , PPRES sans NCSENT pour le ADJ NC , car il ne VDIC que par un NCMAN ADJ , de un ADJCOL ADJ , de un ADJCOL de NCmod ."
64,Daudet/tartarin_sur_les_alpes copie_clean.txt,"Le voisin de droite n' avait rien d' encourageant non plus ; c' était le ténor italien , fort gaillard à le front bas , à les prunelles huileuses , avec de les moustaches de matamore qu' il frisait d' un doigt furibond , depuis qu' on l' avait séparé de sa jolie voisine .","le NCs de NCmod ne avoir rien de PPRES non plus ; ce être le NC ADJ , fort NC à le NCCOR ADJ , à le NC ADJ , avec de le NCCOR de INF que il VIMP de un NCCOR ADJ , depuis que on le avoir PPAS de DETPOSS ADJ NC ."
65,Daudet/tartarin_sur_les_alpes copie_clean.txt,"Mais le bon Alpiniste avait l' habitude de parler en mangeant , il lui fallait cela pour sa santé .","mais le ADJ NP avoir le NCo de INF en PPRES , il lui VIMP cela pour DETPOSS NC ."
66,Daudet/tartarin_sur_les_alpes copie_clean.txt,Vé !,PPAS !
67,Daudet/tartarin_sur_les_alpes copie_clean.txt,"Les jolis boutons ... se dit -il tout haut à lui-même en guignant les manchettes de l' Italien ... Ces notes de musique , incrustées dans le jaspe , c' est d' un effet charmain ... Sa voix cuivrée sonnait dans le silence sans y trouver le moindre écho .","le ADJ NCs ... se VDIC il tout PRES à soi-même en PPRES le NCo de le NP ... ce NC de NCmod , PPAS dans le NC , ce être de un NC ADJ ... DETPOSS NCMAN ADJCOL VIMP dans le NC sans y INF le ADJ NCo ."
68,Daudet/tartarin_sur_les_alpes copie_clean.txt,"Sûr que monsieur est chanteur , qué ?","ADV que monsieur être NC , PPAS ?"
69,Daudet/tartarin_sur_les_alpes copie_clean.txt,Non capisco ... grogna l' Italien dans ses moustaches .,non NCs ... VDIC le NP dans DETPOSS NCCOR .
70,Daudet/tartarin_sur_les_alpes copie_clean.txt,"Pendant un moment l' homme se résigna à dévorer sans rien dire , mais les morceaux l' étouffaient .","PHASE un NC le NCs se VPS à VSENT sans rien VDIC , mais le NCs le VIMP ."
71,Daudet/tartarin_sur_les_alpes copie_clean.txt,"Enfin , comme son vis-à-vis le diplomate austro-hongrois essayait d' atteindre le moutardier de le bout de ses vieilles petites mains grelottantes , enveloppées de mitaines , il le lui passa obligeamment : À votre service , monsieur le baron ... car il venait de l' entendre appeler ainsi .","PHASE , comme DETPOSS NC le NCs ADJ VIMP de INF le NCo de le NCmod de DETPOSS NCmod ADJ NCCOR ADJ , PPAS de NC , il le lui VPS ADV : à DETPOSS NCmod , monsieur le NC ... car il venir de le VCOG INF ainsi ."
72,Daudet/tartarin_sur_les_alpes copie_clean.txt,"Malheureusement le pauvre M. de Stoltz , malgré l' air finaud et spirituel contracté dans les chinoiseries diplomatiques , avait perdu depuis longtemps ses mots et ses idées , et voyageait dans la montagne spécialement pour les rattraper .","malheureusement le ADJ monsieur de NP , malgré le NCMAN ADJ et ADJ PPAS dans le NC ADJ , avoir PPAS depuis longtemps DETPOSS NCo et DETPOSS NC , et VIMP dans le NC ADVINT pour le INF ."
73,Daudet/tartarin_sur_les_alpes copie_clean.txt,"Il ouvrit ses yeux vides sur ce visage inconnu , les referma sans rien dire .","il VPS DETPOSS NCCOR ADJ sur ce NCCOR ADJ , le VPS sans rien VDIC ."
74,Daudet/tartarin_sur_les_alpes copie_clean.txt,"Il en eût fallu dix , anciens diplomates de sa force intellectuelle , pour trouver en commun la formule d' un remerciement .","il en avoir PPAS NUM , ADJ NCo de DETPOSS NCSENT ADJ , pour INF en ADJ le NCo de un NCmod ."
75,Daudet/tartarin_sur_les_alpes copie_clean.txt,"À ce nouvel insuccès , l' Alpiniste fit une moue terrible , et la brusque façon dont il s' empara de la bouteille aurait pu faire croire qu' il allait achever de fendre , avec , la tête fêlée de le vieux diplomate .","à ce ADJ NC , le NP faire un NCo ADJ , et le ADJ façon dont il se VPS de le NC avoir pouvoir faire VCOG que il aller VASP de INF , avec , le NCCOR ADJ de le ADJ NCmod ."
76,Daudet/tartarin_sur_les_alpes copie_clean.txt,Pas plus !,pas plus !
77,Daudet/tartarin_sur_les_alpes copie_clean.txt,"C' était pour offrir à boire à sa voisine , qui ne l' entendit pas , perdue dans une causerie à mi-voix , d' un gazouillis étranger doux et vif , avec deux jeunes gens assis tout près d' elle .","ce être pour INF à INF à DETPOSS NC , qui ne le VCOG pas , PPAS dans un NC à NCmod , de un NCmod ADJ ADJ et ADJ , avec NUM ADJ NC PPAS tout ADVLIEU de il ."
78,Daudet/tartarin_sur_les_alpes copie_clean.txt,"Elle se penchait , s' animait .","il se VIMP , se VIMP ."
79,Daudet/tartarin_sur_les_alpes copie_clean.txt,"On voyait de les petits frisons briller dans la lumière contre une oreille menue , transparente et toute rose ... Polonaise , Russe , Norvégienne ?","on VCOG de le ADJ NC INF dans le NC contre un NCCOR ADJ , ADJ et tout ADJCOL ... NP , NP , NP ?"
80,Daudet/tartarin_sur_les_alpes copie_clean.txt,"... mais de le Nord bien certainement ; et une jolie chanson de son pays lui revenant à les lèvres , l' homme de le Midi se mit à fredonner tranquillement : Ô coumtesso gènto , Estelo dou Nord Qué la neu argento , Qu' Amour friso en or.[279 ] Toute la table se retourna ; on crut qu' il devenait fou .","... mais de le NC bien ADVINT ; et un ADJ NC de DETPOSS NCmod lui PPRES à le NCCOR , le NC de le NCmod se mettre à INF ADVMAN : INTJ ADJ NC , NP ADV NCmod NP le ADJ NCo , que NCSENT friso en NCmod ] tout le NCs se VPS ; on VPS que il devenir ADJ ."
