id,titre,phrase,motifs_phrase
1,Zola/1866_Le_voeu_d_une_morte._clean.txt,La chambre se trouvait à peine éclairée par la clarté pâle de le crépuscule .,le NCs se VIMP à NCSENT PPAS par le NC ADJ de le NCmod .
2,Zola/1866_Le_voeu_d_une_morte._clean.txt,"Les rideaux de les fenêtres , à demi écartés , laissaient voir les branches hautes de les arbres , que rougissaient les derniers rayons de le soleil .","le NCs de le NCmod , à ADJ NCmod , VIMP VCOG le NCo ADJ de le NCmod , que VIMP le ADJ NCs de le NCmod ."
3,Zola/1866_Le_voeu_d_une_morte._clean.txt,"En bas , sur le boulevard de les Invalides , de les enfants jouaient , et leurs rires aigus montaient , adoucis et caressants .","en NC , sur le NC de le NCmod , de le NCs VIMP , et DETPOSS NCMAN ADV VIMP , NC et NC ."
4,Zola/1866_Le_voeu_d_une_morte._clean.txt,Le printemps qui suivit les terribles journées de l' insurrection de février eut de les fraîcheurs pénétrantes .,le NCs qui VPS le ADJ NCT de le NCmod de MOIS avoir de le NC ADJ .
5,Zola/1866_Le_voeu_d_une_morte._clean.txt,Les tièdes soirées de mai gardent ainsi parfois les frissons de l' hiver .,le ADJ NCs de MOIS PRES ainsi ADVTEMPS le NCSENT de le NCmod .
6,Zola/1866_Le_voeu_d_une_morte._clean.txt,De les souffles frais agitaient les rideaux et apportaient les roulements lointains de les voitures .,de le NCs ADJ VIMP le NCo et VIMP le NCo ADJ de le NCmod .
7,Zola/1866_Le_voeu_d_une_morte._clean.txt,"Ici , tombait une mélancolie .","ADVLIEU , VIMP un NCSENT ."
8,Zola/1866_Le_voeu_d_une_morte._clean.txt,"Les meubles , vagues dans l' ombre , tachaient de noir les tentures claires ; le tapis , à rosaces bleues , pâlissait peu à peu .","le NCs , NC dans le NCmod , VIMP de NC le NCs ADJ ; le NC , à NCmod ADJCOL , VIMP peu à peu ."
9,Zola/1866_Le_voeu_d_une_morte._clean.txt,La nuit avait déjà envahi le plafond et les coins de la pièce .,le NCT avoir déjà PPAS le NCo et le NC de le NCmod .
10,Zola/1866_Le_voeu_d_une_morte._clean.txt,"Il n' y avait plus qu' une longue traînée blanche , qui partait d' une de les fenêtres et venait éclairer d' une lueur blafarde le lit , sur lequel madame de Rionne râlait , dans les angoisses de la mort .","il ne y avoir plus que un ADJ NCs ADJCOL , qui VIMP de un de le NCmod et venir INF de un NC ADJ le NC , sur lequel madame de NP VDIC , dans le NCSENT de le NCmod ."
11,Zola/1866_Le_voeu_d_une_morte._clean.txt,"À cette heure dernière , dans cette douceur naissante de le printemps , cette chambre , où se mourait une jeune femme , avait comme une pitié navrée et recueillie .","à ce NCT ADJ , dans ce NC ADJ de le NCmod , ce NC , où se VIMP un ADJ NCo , avoir comme un VSENT PPAS et PPAS ."
12,Zola/1866_Le_voeu_d_une_morte._clean.txt,"L' ombre s' y faisait transparente ; le silence y prenait une tristesse indicible ; les bruits de le dehors s' y changeaient en murmures de regrets , et il semblait qu' on y entendait de les voix lointaines qui se lamentaient .","le NCs se y faire NCo ; le NCs y VIMP un NCSENT ADJ ; le NCs de le NCmod se y VIMP en NC de NCSENT , et il sembler que on y VCOG de le NCMAN ADJ qui se VIMP ."
13,Zola/1866_Le_voeu_d_une_morte._clean.txt,"Blanche de Rionne , la tête appuyée sur de les oreillers , se tenait assise , les yeux grands ouverts , regardant l' ombre .","ADJ de NP , le NCCOR PPAS sur de le NCmod , se VIMP NC , le NCCOR ADJ ADJ , VCOG le NCo ."
14,Zola/1866_Le_voeu_d_une_morte._clean.txt,"La clarté pâle éclairait sa face amaigrie ; ses bras nus s' allongeaient sur le drap; ses mains s' agitaient et tordaient la toile , sans qu' elle en eût conscience .","le NCs ADJ VIMP DETPOSS NCo ADJ ; DETPOSS NCCOR ADJ se VIMP sur le drap; DETPOSS NCCOR se VIMP et VIMP le NCo , sans que il en avoir NCo ."
15,Zola/1866_Le_voeu_d_une_morte._clean.txt,"Et , muette , les lèvres ouvertes , la chair secouée par de longs frissons , elle songeait en attendant la mort , roulant la tête avec lenteur comme font les mourants .","et , NC , le NCCOR ADJ , le NCCOR PPAS par un ADJ NCSENT , il VIMP en PPRES le NCo , PPRES le NCCOR avec NCmod comme faire le NCo ."
16,Zola/1866_Le_voeu_d_une_morte._clean.txt,Elle avait trente ans à peine .,il avoir NUM NCT à NCSENT .
17,Zola/1866_Le_voeu_d_une_morte._clean.txt,"C' était une frêle créature , que la maladie rendait plus délicate encore .","ce être un ADJ NC , que le NCs VIMP plus ADJ encore ."
18,Zola/1866_Le_voeu_d_une_morte._clean.txt,"Cette femme devait être une intelligence rare , une bonté et une tendresse suprêmes .","ce NCs devoir être un NC ADJ , un NCSENT et un NCSENT ADJ ."
19,Zola/1866_Le_voeu_d_une_morte._clean.txt,"La mort est la grande épreuve , et ce n' est que dans l' agonie qu' il faut juger les courages .","le NCs être le ADJ NC , et ce ne être que dans le NC que il PRES INF le NCo ."
20,Zola/1866_Le_voeu_d_une_morte._clean.txt,"Et , cependant , on sentait de les révoltes en elle .","et , cependant , on sentir de le NCSENT en il ."
21,Zola/1866_Le_voeu_d_une_morte._clean.txt,"Par moments , ses lèvres tremblaient , ses mains tordaient le drap avec plus de violence .","par NC , DETPOSS NCCOR VIMP , DETPOSS NCCOR VIMP le NCo avec plus de NC ."
22,Zola/1866_Le_voeu_d_une_morte._clean.txt,"Une angoisse contractait sa face , et de ses yeux coulaient de grosses larmes , que la fièvre séchait sur ses joues .","un NCSENT VIMP DETPOSS NCo , et de DETPOSS NCCOR VIMP un ADJ NCo , que le VSENT VIMP sur DETPOSS NC ."
23,Zola/1866_Le_voeu_d_une_morte._clean.txt,"Elle semblait vouloir écarter la mort , dans un élan soudain de volonté .","il sembler vouloir INF le NCo , dans un NC soudain de NCmod ."
24,Zola/1866_Le_voeu_d_une_morte._clean.txt,"Alors , elle se penchait , et elle regardait longuement une petite fille de six ans , assise sur le tapis , et qui jouait avec les glands de la couverture .","alors , il se VIMP , et il VCOG ADV un ADJ NCo de NUM NCT , PPAS sur le NC , et qui VIMP avec le NC de le NCmod ."
25,Zola/1866_Le_voeu_d_une_morte._clean.txt,"Parfois , l' enfant levait la tête , prise d' une peur subite , près de pleurer sans savoir pourquoi; puis , comme elle allait crier , elle se mettait à rire , en voyant sa mère rire doucement , et elle reprenait ses jeux , parlant tout bas à un de les coins de le drap dont elle avait fait une poupée .","ADVTEMPS , le NCs VIMP le NCCOR , PPAS de un NCSENT PPAS , ADVLIEU de INF sans VCOG pourquoi; puis , comme il aller VDIC , il se mettre à INF , en VCOG DETPOSS NCo PRES ADVMAN , et il VIMP DETPOSS NCo , PPRES tout NCo à un de le NCmod de le NCmod dont il avoir faire un NCo ."
26,Zola/1866_Le_voeu_d_une_morte._clean.txt,Rien n' était plus triste que ce sourire de la mourante .,rien ne être plus ADJ que ce NCMAN de le NCmod .
27,Zola/1866_Le_voeu_d_une_morte._clean.txt,"Elle voulait garder Jeanne près d' elle jusqu' à la dernière minute , et elle mentait à la douleur pour ne pas l' effrayer .","il vouloir INF NP ADVLIEU de il jusque à le ADJ NCT , et il VIMP à le NCSENT pour ne pas le VSENT ."
28,Zola/1866_Le_voeu_d_une_morte._clean.txt,"Elle la regardait jouer , écoutait son babil , se perdait dans la contemplation de cette tête blonde , oubliant qu' elle allait mourir et qu' il lui fallait quitter la chère tendresse .","il le VCOG INF , VCOG DETPOSS NCo , se VIMP dans le NC de ce NCCOR ADJCOL , VCOG que il aller INF et que il lui VIMP INF le ADJ NCo ."
29,Zola/1866_Le_voeu_d_une_morte._clean.txt,"Puis , elle se souvenait , se sentait froide déjà , et l' épouvante la reprenait à la gorge , car son seul désespoir était l' abandon de ce pauvre être .","puis , il se VIMP , se sentir ADJ déjà , et le NCs le VIMP à le NCCOR , car DETPOSS ADJ NCSENT être le NC de ce NCmod être ."
30,Zola/1866_Le_voeu_d_une_morte._clean.txt,La maladie avait été implacable envers elle .,le NCs avoir être ADJ envers il .
31,Zola/1866_Le_voeu_d_une_morte._clean.txt,"Un soir , comme elle se couchait , le mal l' avait prise et n' avait pas mis quinze jours pour la réduire à l' agonie .","un NCT , comme il se VIMP , le mal le avoir PPAS et ne avoir pas mettre NUM NCT pour le NC à le NC ."
32,Zola/1866_Le_voeu_d_une_morte._clean.txt,"Elle ne s' était plus relevée , elle mourait sans avoir pu assurer l' avenir de Jeanne .","il ne se être plus PPAS , il VCOND sans avoir pouvoir INF le NCo de NP ."
33,Zola/1866_Le_voeu_d_une_morte._clean.txt,"Elle se disait qu' elle la laissait sans soutien , n' ayant pour guide que son père ; et , à cette pensée , elle tremblait , sachant quel triste guide celui-ci serait pour sa fille .","il se VDIC que il le laisser sans NC , ne avoir pour NC que DETPOSS NCmod ; et , à ce NC , il VIMP , VCOG quel ADJ NC celui-ci être pour DETPOSS NCo ."
34,Zola/1866_Le_voeu_d_une_morte._clean.txt,"Blanche , soudain , se sentit défaillir .","ADJ , soudain , se sentir INF ."
35,Zola/1866_Le_voeu_d_une_morte._clean.txt,Elle crut que la mort venait .,il VPS que le NCs venir .
36,Zola/1866_Le_voeu_d_une_morte._clean.txt,"Éperdue , elle reposa la tête sur l' oreiller .","PPAS , il VPS le NCCOR sur le INF ."
37,Zola/1866_Le_voeu_d_une_morte._clean.txt,"Jeanne , dit -elle , va dire à ton père que je désire le voir .","NP , VDIC il , aller VDIC à DETPOSS NC que je VSENT le VCOG ."
38,Zola/1866_Le_voeu_d_une_morte._clean.txt,"Puis , lorsque l' enfant fut sortie , elle se remit à rouler doucement la tête .","puis , lorsque le NCspas être PPAS , il se PRES à INF ADVMAN le NCCOR ."
39,Zola/1866_Le_voeu_d_une_morte._clean.txt,"Les yeux grands ouverts , les lèvres serrées , elle avait l' énergique volonté de vivre , de ne point partir , avant d' avoir rassuré son cœur .","le NCCOR ADJ ADJ , le NCCOR ADJ , il avoir le ADJ NCo de INF , de ne ADV INF , PHASE de avoir VSENT DETPOSS NCo ."
40,Zola/1866_Le_voeu_d_une_morte._clean.txt,"On n' entendait plus les rires de les enfants sur le boulevard , et les arbres se détachaient par masses sombres , dans le gris pâle de le ciel .","on ne VCOG plus le NCMAN de le NCmod sur le NCmod , et le NCs se VIMP par NC ADJ , dans le ADJCOL ADJ de le NCmod ."
41,Zola/1866_Le_voeu_d_une_morte._clean.txt,Les bruits de la ville montaient plus vagues .,le NCs de le NCmod VIMP plus ADJ .
42,Zola/1866_Le_voeu_d_une_morte._clean.txt,"Le silence grandissait , interrompu seulement par la respiration lente de la moribonde et par de les sanglots étouffés qui sortaient de l' embrasure d' une de les fenêtres .","le NCspas VIMP , PPAS seulement par le NC ADJ de le NCmod et par de le NC ADJ qui VIMP de le NC de un de le NCmod ."
43,Zola/1866_Le_voeu_d_une_morte._clean.txt,"Là , caché derrière un rideau , pleurait à chaudes larmes un garçon de dix-huit ans , Daniel Raimbault , qui venait d' entrer dans la chambre et qui n' avait point osé s' avancer jusqu' à le lit .","ADVLIEU , PPAS ADVLIEU un NC , VCOND à NC ADJ un NCs de NUM NCT , NP NP , qui venir de INF dans le NC et qui ne avoir ADV PPAS se INF jusque à le NC ."
44,Zola/1866_Le_voeu_d_une_morte._clean.txt,"La garde étant absente , il s' oubliait à sangloter dans un coin .","le NCs être ADJ , il se VCOG à INF dans un NC ."
45,Zola/1866_Le_voeu_d_une_morte._clean.txt,"Daniel était un être chétif , à qui l' on aurait donné à le plus une quinzaine d' années .","NP être un être ADJ , à qui l' on avoir PPAS à le plus NUM NCo de NCT ."
46,Zola/1866_Le_voeu_d_une_morte._clean.txt,"Il n' était pas contrefait , mais ses membres maigres et courts s' emmanchaient d' une façon bizarre .","il ne être pas PPAS , mais DETPOSS NCs ADJ et ADJ se VIMP de un façon ADJ ."
47,Zola/1866_Le_voeu_d_une_morte._clean.txt,"Ses cheveux blonds , presque jaunes , tombant par mèches raides , encastraient un visage long , à la bouche grande , à les pommettes saillantes .","DETPOSS NCCOR ADJCOL , presque ADJCOL , PPRES par NC ADJ , VIMP un NCCOR ADJ , à le NCCOR ADJ , à le NC ADJ ."
48,Zola/1866_Le_voeu_d_une_morte._clean.txt,"Cependant , à le regarder , on se sentait de la sympathie pour son front large et haut , pour ses yeux pleins de douceur .","cependant , à le VCOG , on se sentir de le NCSENT pour DETPOSS NCCOR ADJ et ADJ , pour DETPOSS NCCOR ADJ de NCmod ."
49,Zola/1866_Le_voeu_d_une_morte._clean.txt,Les jeunes filles riaient lorsqu' il passait .,le ADJ NCs VIMP lorsque il VIMP .
50,Zola/1866_Le_voeu_d_une_morte._clean.txt,"Il avait l' allure gauche , et tout son pauvre être vacillait de honte .","il avoir le NCMAN ADJ , et tout DETPOSS NC être VIMP de NCSENT ."
51,Zola/1866_Le_voeu_d_une_morte._clean.txt,Madame de Rionne avait été la bonne fée de sa vie .,madame de NP avoir être le ADJ NC de DETPOSS NCmod .
52,Zola/1866_Le_voeu_d_une_morte._clean.txt,"Elle s' était cachée pour le combler de ses bienfaits ; et , le jour où il la voyait enfin , où il lui était permis de la remercier , il la trouvait mourante .","il se être PPAS pour le VSENT de DETPOSS NCmod ; et , le NCT où il le VCOG PHASE , où il lui être permettre de le VDIC , il le VIMP ADJ ."
53,Zola/1866_Le_voeu_d_une_morte._clean.txt,"Il se tenait là , derrière le rideau , et ses sanglots , qu' il ne pouvait réprimer , éclataient .","il se VIMP ADVLIEU , ADVLIEU le NC , et DETPOSS NC , que il ne pouvoir INF , VIMP ."
54,Zola/1866_Le_voeu_d_une_morte._clean.txt,"Blanche , dans le silence , entendit ces cris étouffés .","ADJ , dans le NC , VCOG ce NCo PPAS ."
55,Zola/1866_Le_voeu_d_une_morte._clean.txt,"Elle se leva à demi et , cherchant à voir : Qui est là ?","il se PRES à ADJ et , PPRES à VCOG : qui être ADVLIEU ?"
56,Zola/1866_Le_voeu_d_une_morte._clean.txt,demanda -t -elle; qui pleure près de moi ?,VPS t -elle; qui PRES ADVLIEU de soi ?
57,Zola/1866_Le_voeu_d_une_morte._clean.txt,"Alors , Daniel vint s' agenouiller devant le lit. Blanche le reconnut .","alors , NP venir se INF ADVLIEU le NC ADJ le NC ."
58,Zola/1866_Le_voeu_d_une_morte._clean.txt,"C' est vous , Daniel , dit -elle .","ce être vous , NP , VDIC il ."
59,Zola/1866_Le_voeu_d_une_morte._clean.txt,"Relevez-vous , mon ami , ne pleurez pas .","Relevez-le , DETPOSS NC , ne IMP pas ."
60,Zola/1866_Le_voeu_d_une_morte._clean.txt,Daniel oublia sa timidité et sa gaucherie .,NP VCOG DETPOSS NCSENT et DETPOSS NC .
61,Zola/1866_Le_voeu_d_une_morte._clean.txt,Son cœur était sur ses lèvres .,DETPOSS NCs être sur DETPOSS NCCOR .
62,Zola/1866_Le_voeu_d_une_morte._clean.txt,Il tendit ses mains suppliantes .,il VPS DETPOSS NCCOR ADJ .
63,Zola/1866_Le_voeu_d_une_morte._clean.txt,Oh !,INTJ !
64,Zola/1866_Le_voeu_d_une_morte._clean.txt,"madame , s' écria -t -il d' une voix déchirée , laissez -moi m' agenouiller , laissez -moi pleurer .","madame , se VDIC t il de un NCMAN PPAS , laisser soi se INF , laisser soi INF ."
65,Zola/1866_Le_voeu_d_une_morte._clean.txt,"J' étais descendu pour vous voir ; le désespoir m' a pris , et je n' ai pu retenir mes larmes .","je être PPAS pour vous VCOG ; le NCSENT lui avoir PPAS , et je ne avoir pouvoir INF DETPOSS NCo ."
66,Zola/1866_Le_voeu_d_une_morte._clean.txt,"Je suis bien là , il n' y a personne , et j' ai besoin de vous dire combien vous êtes bonne et combien je vous aime .","je être bien ADVLIEU , il ne y avoir NCo , et je avoir NC de vous VDIC combien vous être ADJ et combien je vous VSENT ."
67,Zola/1866_Le_voeu_d_une_morte._clean.txt,"Voici plus de dix ans que j' ai tout compris , plus de dix ans que je me tais , que j' étouffe de reconnaissance et de tendresse .","voici plus de NUM NCT que je avoir tout VCOG , plus de NUM NCT que je me VIMP , que je PRES de NC et de NCSENT ."
68,Zola/1866_Le_voeu_d_une_morte._clean.txt,Il faut me permettre de pleurer .,il PRES me permettre de INF .
69,Zola/1866_Le_voeu_d_une_morte._clean.txt,"Vous comprenez , n' est -ce pas ?","vous VCOG , ne être ce pas ?"
70,Zola/1866_Le_voeu_d_une_morte._clean.txt,"Souvent , j' avais songé à l' heure bienheureuse où je pourrais m' agenouiller ainsi devant vous ; c' était là mon rêve qui me reposait dans mes amertumes d' enfant .","ADVTEMPS , je avoir PPAS à le NCT ADJ où je pouvoir se INF ainsi ADVLIEU vous ; ce être ADVLIEU DETPOSS NC qui me VIMP dans DETPOSS NCSENT de NCmod ."
71,Zola/1866_Le_voeu_d_une_morte._clean.txt,"Je me plaisais à imaginer les plus petites circonstances de notre rencontre , je me disais que je vous verrais belle et souriante , que vous auriez tel regard , que vous feriez tel geste .","je me VIMP à VCOG le plus ADJ NCo de DETPOSS NCmod , je me VIMP que je vous VCOND ADJ et ADJ , que vous avoir tel NCMAN , que vous VSUBP tel NCo ."
72,Zola/1866_Le_voeu_d_une_morte._clean.txt,Et voilà que vous êtes là ... J' ignorais qu' on pût devenir orphelin deux fois .,et voilà que vous être ADVLIEU ... je VCOND que on VSUBI devenir ADV NUM fois .
73,Zola/1866_Le_voeu_d_une_morte._clean.txt,Sa voix se brisait dans sa gorge .,DETPOSS NCMAN se VIMP dans DETPOSS NCCOR .
74,Zola/1866_Le_voeu_d_une_morte._clean.txt,"Blanche , à les dernières lueurs , le regardait , et elle reprenait un peu de vie en face de cette adoration et de ce désespoir .","ADJ , à le ADJ NC , le VCOG , et il VIMP un peu de NCmod en NC de ce NCSENT et de ce NCSENT ."
75,Zola/1866_Le_voeu_d_une_morte._clean.txt,"À l' heure suprême , elle était récompensée de sa bonne œuvre , elle sentait son agonie adoucie par cette affection qu' elle laisserait derrière elle .","à le NCT ADJ , il être PPAS de DETPOSS ADJ NC , il sentir DETPOSS NCo VSENT par ce NCSENT que il laisser ADVLIEU il ."
76,Zola/1866_Le_voeu_d_une_morte._clean.txt,"Daniel reprit : Je vous dois tout , et je n' ai que mes larmes aujourd'hui pour vous prouver mon dévouement .","NP PRES : je vous devoir tout , et je ne avoir que DETPOSS NCo ADVT pour vous INF DETPOSS NCo ."
77,Zola/1866_Le_voeu_d_une_morte._clean.txt,"Je me considérais comme votre œuvre , je voulais que cette œuvre fût bonne et belle .","je me VCOND comme DETPOSS NC , je VIMP que ce NCs être ADJ et ADJ ."
78,Zola/1866_Le_voeu_d_une_morte._clean.txt,"Ma vie entière devait vous montrer ma reconnaissance , je désirais vous rendre fière de moi .","DETPOSS NCs ADJ devoir vous INF DETPOSS NCo , je VCOND vous INF NCo de soi ."
79,Zola/1866_Le_voeu_d_une_morte._clean.txt,"Et , maintenant , je n' ai que quelques minutes pour vous remercier .","et , ADVT , je ne avoir que quelque NCT pour vous VDIC ."
80,Zola/1866_Le_voeu_d_une_morte._clean.txt,"Vous allez croire que je suis un ingrat , car je sens que mes lèvres sont inhabiles , qu' elles disent mal ce que j' ai dans le cœur .","vous aller VCOG que je être un NC , car je sentir que DETPOSS NCCOR être ADJ , que il VDIC mal ce que je avoir dans le NC ."
81,Zola/1866_Le_voeu_d_une_morte._clean.txt,"J' ai vécu seul , je ne sais point parler ... Que vais -je devenir , si Dieu n' a pas pitié de vous et de moi ?","je avoir PPAS ADJ , je ne VCOG ADV INF ... que aller je devenir , si NP ne avoir pas PPAS de vous et de soi ?"
82,Zola/1866_Le_voeu_d_une_morte._clean.txt,"Madame de Rionne écoutait ces paroles entrecoupées , et une grande douceur descendait en elle .","madame de NP VIMP ce NCo ADJ , et un ADJ NCs VIMP en il ."
83,Zola/1866_Le_voeu_d_une_morte._clean.txt,Elle prit la main de Daniel .,il VPS le NCCOR de NP .
84,Zola/1866_Le_voeu_d_une_morte._clean.txt,"Mon ami , dit -elle , je sais que vous n' êtes pas un ingrat .","DETPOSS NCs , VDIC il , je VCOG que vous ne être pas un NC ."
85,Zola/1866_Le_voeu_d_une_morte._clean.txt,"Je veillais sur vous , et on m' a dit quelle est votre gratitude .","je VIMP sur vous , et on lui avoir VDIC quel être DETPOSS NCSENT ."
86,Zola/1866_Le_voeu_d_une_morte._clean.txt,"Vous n' avez que faire de chercher de les mots pour me remercier , vos larmes apaisent mes souffrances .","vous ne avoir que faire de INF de le NC pour me VDIC , DETPOSS NCs VSENT DETPOSS NCSENT ."
87,Zola/1866_Le_voeu_d_une_morte._clean.txt,Daniel retenait ses sanglots .,NP VIMP DETPOSS NCo .
88,Zola/1866_Le_voeu_d_une_morte._clean.txt,Il y eut un court silence .,il y avoir un ADJ NCo .
89,Zola/1866_Le_voeu_d_une_morte._clean.txt,"Lorsque je vous ai appelé à Paris , reprit la mourante , j' étais encore debout , j' avais la pensée de vous faire continuer vos études .","lorsque je vous avoir PPAS à NP , VPS le NCo , je être encore ADV , je avoir le NCo de vous faire INF DETPOSS NCo ."
90,Zola/1866_Le_voeu_d_une_morte._clean.txt,"Puis , la maladie m' a prise , vous êtes venu trop tard , avant que j' aie pu assurer votre avenir .","puis , le NCs lui avoir PPAS , vous être venir trop tard , PHASE que je avoir pouvoir INF DETPOSS NCo ."
91,Zola/1866_Le_voeu_d_une_morte._clean.txt,"En m' en allant , j' emporte le regret de n' avoir pas achevé ma tâche .","en lui en aller , je PRES le NCSENT de ne avoir pas VASP DETPOSS NCo ."
92,Zola/1866_Le_voeu_d_une_morte._clean.txt,"Vous avez fait une œuvre de sainte , interrompit Daniel .","vous avoir faire un NCo de NCmod , NC NP ."
93,Zola/1866_Le_voeu_d_une_morte._clean.txt,"Vous ne me devez rien , et je vous dois ma vie entière .","vous ne me devoir rien , et je vous devoir DETPOSS NCo ADJ ."
94,Zola/1866_Le_voeu_d_une_morte._clean.txt,Le bienfait est déjà trop grand .,le NCs être déjà trop ADJ .
95,Zola/1866_Le_voeu_d_une_morte._clean.txt,"Regardez -moi , voyez le pauvre être que vous avez adopté et protégé .","IMP soi , IMP le NCo être que vous avoir PPAS et PPAS ."
96,Zola/1866_Le_voeu_d_une_morte._clean.txt,"Lorsque je me trouvais si chétif et si gauche , lorsqu' on riait de moi , je pleurais de honte pour vous .","lorsque je me VIMP si ADJ et si ADJ , lorsque on VIMP de soi , je VCOND de NCSENT pour vous ."
97,Zola/1866_Le_voeu_d_une_morte._clean.txt,"Pardonnez -moi une pensée mauvaise : j' ai eu peur , souvent , que mon visage ne vous déplût ; je tremblais de vous rencontrer , je craignais que ma laideur ne m' ôtât un peu de votre bonté .","IMP soi un NCo ADJ : je avoir avoir NCSENT , ADVTEMPS , que DETPOSS NCCOR ne vous VSUBI ; je VIMP de vous INF , je PRES que DETPOSS NCs ne lui VSUBI un peu de DETPOSS NCSENT ."
98,Zola/1866_Le_voeu_d_une_morte._clean.txt,Et dire que vous m' accueilliez comme votre fils !,et VDIC que vous se PRES comme DETPOSS NC !
99,Zola/1866_Le_voeu_d_une_morte._clean.txt,"Vous , si belle , vous avez tendu la main à un misérable enfant que personne n' a encore voulu aimer .","vous , si ADJ , vous avoir PPAS le NCCOR à un ADJ NC que personne ne avoir encore vouloir VSENT ."
100,Zola/1866_Le_voeu_d_une_morte._clean.txt,"Plus je me voyais raillé et repoussé , plus je me sentais laid et faible , et plus je vous adorais , car je comprenais quelle bonté vous deviez avoir pour descendre jusqu' à moi .","plus je me VCOG PPAS et PPAS , plus je me VIMP ADJ et ADJ , et plus je vous VCOND , car je PRES quel NCSENT vous PRES avoir pour INF jusque à soi ."
101,Zola/1866_Le_voeu_d_une_morte._clean.txt,"En venant ici , je souhaitais ardemment d' être beau .","en venir ADVLIEU , je VSENT ADVINT de être ADJ ."
102,Zola/1866_Le_voeu_d_une_morte._clean.txt,Blanche souriait .,ADJ VIMP .
103,Zola/1866_Le_voeu_d_une_morte._clean.txt,"Tant d' adoration jeune , tant d' humilité caressante lui faisait oublier la mort .","tant de NCSENT ADJ , tant de NCSENT ADJ lui faire VCOG le NC ."
104,Zola/1866_Le_voeu_d_une_morte._clean.txt,"Vous êtes un enfant , dit -elle .","vous être un NC , VDIC il ."
105,Zola/1866_Le_voeu_d_une_morte._clean.txt,"Puis , elle se tut , songeuse .","puis , il se PRES , NC ."
106,Zola/1866_Le_voeu_d_une_morte._clean.txt,Elle tâchait de voir dans l' ombre le visage de Daniel .,il VIMP de VCOG dans le NC le NCCOR de NP .
107,Zola/1866_Le_voeu_d_une_morte._clean.txt,"Un sang plus chaud courait dans ses veines , et elle pensait à sa jeunesse .","un NCCOR plus ADJ VIMP dans DETPOSS NC , et il VCOG à DETPOSS NC ."
108,Zola/1866_Le_voeu_d_une_morte._clean.txt,"Elle reprit : Vous êtes un passionné , la vie sera rude pour vous .","il VPS : vous être un NC , le NCs être ADJ pour vous ."
109,Zola/1866_Le_voeu_d_une_morte._clean.txt,"Je ne puis , à cette heure dernière , que vous dire de garder mon souvenir comme une sauvegarde .","je ne puis , à ce NCT ADJ , que vous VDIC de INF DETPOSS NCo comme un NC ."
110,Zola/1866_Le_voeu_d_une_morte._clean.txt,"S' il ne m' a pas été permis d' assurer votre existence , j' ai pu heureusement vous mettre en état de gagner votre vie , de marcher droit et ferme , et cette pensée me console un peu de l' abandon forcé dans lequel je vous laisse .","si il ne lui avoir pas être permettre de INF DETPOSS NCo , je avoir pouvoir heureusement vous mettre en NC de INF DETPOSS NCo , de NCmod ADJ et ADJ , et ce NCs me PRES un peu de le NC PPAS dans lequel je vous laisser ."
111,Zola/1866_Le_voeu_d_une_morte._clean.txt,"Songez à moi parfois , aimez -moi , contentez -moi dans la mort , comme vous m' avez aimée et contentée dans la vie .","IMP à soi ADVTEMPS , VSENT soi , VSENT soi dans le NC , comme vous lui avoir VSENT et VSENT dans le NC ."
112,Zola/1866_Le_voeu_d_une_morte._clean.txt,"Elle disait cela d' une voix si douce et si profonde , que Daniel se remit à pleurer .","il VDIC cela de un NCMAN si ADJ et si ADJ , que NP se VPS à INF ."
113,Zola/1866_Le_voeu_d_une_morte._clean.txt,"Non , s' écria -t -il , ne me quittez pas ainsi , donnez -moi une tâche à accomplir .","non , se VDIC t il , ne me IMP pas ainsi , IMP soi un NCo à INF ."
114,Zola/1866_Le_voeu_d_une_morte._clean.txt,"Mon existence va être vide demain , si vous en disparaissez brusquement .","DETPOSS NCs aller être ADJ ADVT , si vous en PRES ADV ."
