id,titre,phrase,motifs_phrase
1904,Zola/1866_Le_voeu_d_une_morte._clean.txt,"À le fond , il craignait que le mariage ne se fît pas .","à le NC , il VSENT que le NCs ne se PRES pas ."
1905,Zola/1866_Le_voeu_d_une_morte._clean.txt,Lorin lui donna l' assurance que Jeanne l' aimait .,NP lui VPS le NCSENT que NP le VSENT .
1906,Zola/1866_Le_voeu_d_une_morte._clean.txt,"Cela le tranquillisa , et il devint plus expansif .","cela le VPS , et il devenir plus ADJ ."
1907,Zola/1866_Le_voeu_d_une_morte._clean.txt,"Il parlait de sa fille avec une émotion vraiment paternelle ; il ne voulait , disait -il , que son bonheur .","il VIMP de DETPOSS NC avec un NCSENT ADVINT ADJ ; il ne vouloir , VDIC il , que DETPOSS NCSENT ."
1908,Zola/1866_Le_voeu_d_une_morte._clean.txt,"Il fut décidé qu' ils partiraient tous deux le lendemain pour le Mesnil-Rouge , afin d' arrêter le mariage avant que Jeanne rentrât à Paris .","il être PPAS que il VCOND tout NUM le NCmod pour le NP , ADV de INF le NCo PHASE que NP VSUBI à NP ."
1909,Zola/1866_Le_voeu_d_une_morte._clean.txt,"Lorin n' était pas fâché de conduire les choses rondement , car il hésitait toujours et se disait qu' une fois la folie commise , il lui faudrait bien l' accepter .","NP ne être pas VSENT de INF le chose NCmod , car il VIMP ADVTEMPS et se VDIC que un fois le NC PPAS , il lui VCOND bien le INF ."
1910,Zola/1866_Le_voeu_d_une_morte._clean.txt,Dès leur arrivée la question fut posée et l' on consulta la jeune fille .,dès lui NC le NCspas être PPAS et l' on VPS le ADJ NCo .
1911,Zola/1866_Le_voeu_d_une_morte._clean.txt,Daniel ne dormit pas de la nuit .,NP ne PRES pas de le NCT .
1912,Zola/1866_Le_voeu_d_une_morte._clean.txt,"Les idées se heurtaient dans son cerveau , sans qu' il pût savoir à quoi s' arrêter .","le NCs se VIMP dans DETPOSS NCCOR , sans que il VSUBI VCOG à quoi se INF ."
1913,Zola/1866_Le_voeu_d_une_morte._clean.txt,"Par instants , il se disait que Lorin mentait , que jamais Jeanne ne l' épouserait ; puis , il lui prenait de les peurs terribles , il était persuadé que le mariage allait avoir lieu .","par NC , il se VDIC que NP VIMP , que ADVTEMPS NP ne le VCOND ; puis , il lui VIMP de le NCSENT ADJ , il être PPAS que le NCs aller avoir NCo ."
1914,Zola/1866_Le_voeu_d_une_morte._clean.txt,"Ce qui dominait en lui , c' était une douleur dont la flamme cuisante lui brûlait la poitrine .","ce qui VIMP en lui , ce être un NCSENT dont le NCs ADJ lui VIMP le NCo ."
1915,Zola/1866_Le_voeu_d_une_morte._clean.txt,"Lorsque Jeanne et Lorin lui apparaissaient côte à côte , il avait de les emportements de rage furieuse .","lorsque NP et NP lui VIMP NCo à NCmod , il avoir de le NCSENT de NCSENT ADJ ."
1916,Zola/1866_Le_voeu_d_une_morte._clean.txt,"Quand vint le jour , il tâcha de se calmer .","quand venir le NCT , il VPS de se VSENT ."
1917,Zola/1866_Le_voeu_d_une_morte._clean.txt,"Il n' avait , après tout , pour se désespérer et s' irriter de la sorte , que les paroles de Lorin .","il ne avoir , PHASE tout , pour se VSENT et se VSENT de le sorte , que le NC de NP ."
1918,Zola/1866_Le_voeu_d_une_morte._clean.txt,Rien peut-être n' était décidé .,rien peut-être ne être PPAS .
1919,Zola/1866_Le_voeu_d_une_morte._clean.txt,Il fallait voir .,il VIMP VCOG .
1920,Zola/1866_Le_voeu_d_une_morte._clean.txt,"Et il descendit , cherchant à lire sur les visages .","et il VPS , PPRES à INF sur le NCCOR ."
1921,Zola/1866_Le_voeu_d_une_morte._clean.txt,rien sur cette face épaisse .,rien sur ce NCmod ADJ .
1922,Zola/1866_Le_voeu_d_une_morte._clean.txt,"M. de Rionne était visiblement enchanté ; il avait mille attentions pour sa fille , il la regardait comme une chose précieuse qu' on craint de perdre .","monsieur de NP être ADVINT VSENT ; il avoir NUM NCo pour DETPOSS NC , il le VCOG comme un chose ADJ que on VSENT de INF ."
1923,Zola/1866_Le_voeu_d_une_morte._clean.txt,"Quant à madame Tellier , elle riait nerveusement .","quant à madame NP , il VIMP ADVMAN ."
1924,Zola/1866_Le_voeu_d_une_morte._clean.txt,"Elle semblait , elle aussi , avoir passé une mauvaise nuit .","il sembler , il aussi , avoir PPAS un ADJ NCT ."
1925,Zola/1866_Le_voeu_d_une_morte._clean.txt,"La vérité était que la demande de Lorin l' avait exaspérée , et il avait fallu qu' elle se raisonnât longtemps pour ne point provoquer un éclat .","le NCs être que le NCs de NP le avoir VSENT , et il avoir PPAS que il se VSUBI longtemps pour ne ADV INF un NCo ."
1926,Zola/1866_Le_voeu_d_une_morte._clean.txt,"Elle s' était dit que Jeanne devenait une rivale dangereuse , et qu' elle ferait bien de s' en débarrasser à le plus tôt .","il se être VDIC que NP devenir un NCo ADJ , et que il faire bien de se en INF à le plus tôt ."
1927,Zola/1866_Le_voeu_d_une_morte._clean.txt,"Cela lui coûtait un ami , elle appelait Lorin mon ami; mais il valait mieux en sacrifier un que de garder près d' elle cette petite fille , qui avait le rire trop clair .","cela lui VIMP un NCo , il VIMP NP ADJ ami; mais il VIMP mieux en NC un que de INF ADVLIEU de il ce ADJ NCo , qui avoir le NCMAN trop ADJ ."
1928,Zola/1866_Le_voeu_d_une_morte._clean.txt,"Elle cherchait à se consoler ainsi , et elle était hors d' elle .","il VIMP à se INF ainsi , et il être ADV de il ."
1929,Zola/1866_Le_voeu_d_une_morte._clean.txt,Lorin faisait sa cour .,NP faire DETPOSS NCo .
1930,Zola/1866_Le_voeu_d_une_morte._clean.txt,"Le cœur libre , il jouait à merveille son rôle de galant .","le NC ADJ , il VIMP à NC DETPOSS NCo de NCmod ."
1931,Zola/1866_Le_voeu_d_une_morte._clean.txt,Il sentait d' ailleurs tout son prix et n' avait pas d' empressement ridicule .,il sentir de ADVLIEU tout DETPOSS NCo et ne avoir pas un NCo ADJ .
1932,Zola/1866_Le_voeu_d_une_morte._clean.txt,Mais le visage que Daniel étudia avec le plus d' anxiété fut celui de Jeanne .,mais le NCCOR que NP VPS avec le plus de NCSENT être celui de NP .
1933,Zola/1866_Le_voeu_d_une_morte._clean.txt,La jeune fille avait retrouvé ses allures de Parisienne heureuse d' être courtisée .,le ADJ NCs avoir PPAS DETPOSS NCMAN de NP ADJ de être PPAS .
1934,Zola/1866_Le_voeu_d_une_morte._clean.txt,Elle s' abandonnait volontiers .,il se VIMP ADV .
1935,Zola/1866_Le_voeu_d_une_morte._clean.txt,"Si elle ne montrait pas une joie trop vive , elle paraissait charmée de les attentions de Lorin et parlait de Paris comme une pensionnaire parle d' un bal .","si il ne VIMP pas un NCSENT trop ADJ , il paraître NCo de le NCmod de NP et VIMP de NP comme un NC PRES de un NC ."
1936,Zola/1866_Le_voeu_d_une_morte._clean.txt,"Alors , Daniel comprit avec terreur qu' il avait été lâche , qu' il s' était trop oublié dans la volupté douce de le Mesnil-Rouge .","alors , NP VCOG avec NCSENT que il avoir être NC , que il se être trop VCOG dans le NC ADJ de le NP ."
1937,Zola/1866_Le_voeu_d_une_morte._clean.txt,"Il aurait dû se faire connaître pendant les longues promenades ; tandis qu' ils étaient là , la jeune fille et lui , dans le silence et la fraîcheur de les îles , loin de le monde , il aurait dû ouvrir son cœur .","il avoir devoir se faire INF PHASE le ADJ NC ; PHASE que il être ADVLIEU , le ADJ NC et lui , dans le NC et le NC de le NCmod , ADVLIEU de le NC , il avoir devoir INF DETPOSS NCo ."
1938,Zola/1866_Le_voeu_d_une_morte._clean.txt,"Et , maintenant , le monde se mettait entre eux de nouveau .","et , ADVT , le NCs se mettre entre eux de ADJ ."
1939,Zola/1866_Le_voeu_d_une_morte._clean.txt,"Jeanne s' était simplement amusée à courir , comme une grande enfant .","NP se être ADVMAN VSENT à INF , comme un ADJ NC ."
1940,Zola/1866_Le_voeu_d_une_morte._clean.txt,La présence de Lorin avait suffi pour lui rendre son esprit mauvais .,le NCs de NP avoir PPAS pour lui INF DETPOSS NCo ADJ .
1941,Zola/1866_Le_voeu_d_une_morte._clean.txt,"Cet homme lui semblait un excellent garçon , un peu sot , très convenable d' ailleurs .","ce NCs lui sembler un ADJ NCo , un peu NC , très ADJ de ADVLIEU ."
1942,Zola/1866_Le_voeu_d_une_morte._clean.txt,"Lorsqu' elle connut sa demande , qu' elle attendait , elle accepta étourdiment , ne voyant dans le mariage qu' un moyen d' avoir un salon à elle .","lorsque il VPS DETPOSS NCo , que il VIMP , il VPS ADVMAN , ne VCOG dans le NC que un NCmod de avoir un NCo à il ."
1943,Zola/1866_Le_voeu_d_une_morte._clean.txt,"Daniel eut conscience de ce qui se passait dans cette jeune tête , et il se dit avec emportement qu' il ne pouvait laisser s' accomplir un pareil mariage .","NP avoir NCo de ce qui se VIMP dans ce ADJ NCCOR , et il se VDIC avec ADV que il ne pouvoir laisser se INF un NCo NC ."
1944,Zola/1866_Le_voeu_d_une_morte._clean.txt,Son cœur se révoltait .,DETPOSS NCs se VIMP .
1945,Zola/1866_Le_voeu_d_une_morte._clean.txt,"Il avait oublié sa tâche , il ne cherchait plus à se conformer uniquement à le vœu de la morte ; son être entier le poussait à arracher Jeanne de les bras de Lorin .","il avoir VCOG DETPOSS NCo , il ne VIMP plus à se INF ADV à le NC de le NCmod ; DETPOSS être ADJ le VIMP à INF NP de le NCCOR de NP ."
1946,Zola/1866_Le_voeu_d_une_morte._clean.txt,"Le soir , après une longue journée d' angoisse , il arrêta la jeune fille à le bord de la Seine .","le NCT , PHASE un ADJ NCT de NCSENT , il VPS le ADJ NCo à le NC de le NP ."
1947,Zola/1866_Le_voeu_d_une_morte._clean.txt,Vous vous mariez ?,vous vous VCOND ?
1948,Zola/1866_Le_voeu_d_une_morte._clean.txt,demanda -t -il brusquement .,VPS t il ADV .
1949,Zola/1866_Le_voeu_d_une_morte._clean.txt,"Oui , répondit -elle , étonnée de l' émotion de sa voix .","oui , VDIC il , PPAS de le NCSENT de DETPOSS NCMAN ."
1950,Zola/1866_Le_voeu_d_une_morte._clean.txt,Connaissez -vous bien M. Lorin ?,PRES vous bien monsieur NP ?
1951,Zola/1866_Le_voeu_d_une_morte._clean.txt,Certainement .,ADVINT .
1952,Zola/1866_Le_voeu_d_une_morte._clean.txt,"Moi , voici douze ans que je l' ai rencontré pour la première fois , et je ne l' estime pas .","soi , voici NUM NCT que je le avoir PPAS pour le ADJ fois , et je ne le VSENT pas ."
1953,Zola/1866_Le_voeu_d_une_morte._clean.txt,Jeanne releva la tête avec hauteur .,NP VPS le NCCOR avec NC .
1954,Zola/1866_Le_voeu_d_une_morte._clean.txt,Elle voulut répondre .,il vouloir VDIC .
1955,Zola/1866_Le_voeu_d_une_morte._clean.txt,"Ne dites rien , reprit Daniel violemment .","ne VDIC rien , VPS NP ADVMAN ."
1956,Zola/1866_Le_voeu_d_une_morte._clean.txt,"Croyez-moi , ce mariage est impossible .","NP , ce NCs être ADJ ."
1957,Zola/1866_Le_voeu_d_une_morte._clean.txt,Je ne veux pas que vous épousiez cet homme .,je ne vouloir pas que vous PRES ce NCo .
1958,Zola/1866_Le_voeu_d_une_morte._clean.txt,"Il parlait en maître , en père courroucé qui entend être obéi .","il VIMP en NC , en NCmod VSENT qui VCOG être PPAS ."
1959,Zola/1866_Le_voeu_d_une_morte._clean.txt,Jeanne le regardait d' un air de stupéfaction dédaigneuse .,NP le VCOG de un NCMAN de NCSENT ADJ .
1960,Zola/1866_Le_voeu_d_une_morte._clean.txt,"Un instant , Daniel eut la pensée de tout lui dire et de lui commander , à le nom de sa mère , de chasser Lorin .","un NC , NP avoir le NCo de tout lui VDIC et de lui INF , à le NC de DETPOSS NCmod , de INF NP ."
1961,Zola/1866_Le_voeu_d_une_morte._clean.txt,"Puis , il différa l' aveu , il ajouta d' une voix moins dure : Par grâce , réfléchissez , ne me désespérez pas .","puis , il VPS le NCo , il VPS de un NCMAN moins ADJ : par ADV , IMP , ne me IMP pas ."
1962,Zola/1866_Le_voeu_d_une_morte._clean.txt,Jeanne se mit à rire .,NP se mettre à INF .
1963,Zola/1866_Le_voeu_d_une_morte._clean.txt,L' audace étrange de le secrétaire la désarmait .,le NCs ADJ de le NCmod le VSENT .
1964,Zola/1866_Le_voeu_d_une_morte._clean.txt,"Et simplement : Monsieur Daniel , dit -elle , est -ce que vous seriez amoureux de moi , par hasard ?","et ADVMAN : monsieur NP , VDIC il , être ce que vous être NCo de soi , par NC ?"
1965,Zola/1866_Le_voeu_d_une_morte._clean.txt,"Puis , d' un ton plus doux , comme avertie de le dévouement et de la tendresse de le pauvre garçon : Allons , mon camarade , ajouta -t -elle , pas de folie .","puis , de un NC plus ADJ , comme NCmod de le NCmod et de le NCSENT de le ADJ NCmod : NP , DETPOSS NC , VPS t il , pas de NC ."
1966,Zola/1866_Le_voeu_d_une_morte._clean.txt,Il ne faut pas nous quitter fâchés .,il ne PRES pas nous INF VSENT .
1967,Zola/1866_Le_voeu_d_une_morte._clean.txt,"Quand elle se fut retirée , Daniel demeura immobile , écrasé .","quand il se être PPAS , NP VPS ADJ , PPAS ."
1968,Zola/1866_Le_voeu_d_une_morte._clean.txt,"Il répétait machinalement la phrase de la jeune fille : Est -ce que vous seriez amoureux de moi , par hasard ?","il VIMP ADV le NCo de le ADJ NCmod : être ce que vous être ADJ de soi , par NC ?"
1969,Zola/1866_Le_voeu_d_une_morte._clean.txt,et il y avait comme un grand bourdonnement dans sa tête qui l' empêchait de s' entendre .,et il y avoir comme un ADJ NC dans DETPOSS NCCOR qui le VIMP de se VCOG .
1970,Zola/1866_Le_voeu_d_une_morte._clean.txt,"Et , brusquement , il s' enfuit de le côté de le parc , en balbutiant : Elle l' a dit , elle l' a dit : je suis amoureux .","et , ADV , il se PRES de le NC de le NCmod , en VDIC : il le avoir VDIC , il le avoir VDIC : je être ADJ ."
1971,Zola/1866_Le_voeu_d_une_morte._clean.txt,"Sa poitrine brûlait , il chancelait comme un homme ivre .","DETPOSS NCs VIMP , il VIMP comme un NC VSUBP ."
1972,Zola/1866_Le_voeu_d_une_morte._clean.txt,"Une pluie fine et froide se mit à tomber , et il s' en alla ainsi dans la nuit obscure , délirant , sanglotant , voyant enfin clair dans son cœur .","un NCs ADJ et ADJ se mettre à INF , et il se en aller ainsi dans le NCT ADJ , PPRES , PPRES , VCOG PHASE ADJ dans DETPOSS NC ."
1973,Zola/1866_Le_voeu_d_une_morte._clean.txt,"Il aimait Jeanne , le misérable enfant , et il se disait cela avec un immense désespoir .","il VSENT NP , le ADJ NC , et il se VDIC cela avec un ADJ NCSENT ."
1974,Zola/1866_Le_voeu_d_une_morte._clean.txt,Eh quoi !,INTJ quoi !
1975,Zola/1866_Le_voeu_d_une_morte._clean.txt,"il avait réussi à se mentir à lui-même , tout ce dévouement n' était que de l' amour , il ne protégeait la jeune fille contre Lorin que pour la garder pour lui !","il avoir PPAS à se INF à soi-même , tout ce NCs ne être que de le NCSENT , il ne VIMP le ADJ NCo contre NP que pour le INF pour lui !"
1976,Zola/1866_Le_voeu_d_une_morte._clean.txt,"À cette pensée , la honte le faisait défaillir , il comprenait qu' il n' aurait plus le courage de lutter .","à ce NC , le NCSENT le faire INF , il VCOG que il ne avoir plus le NC de INF ."
1977,Zola/1866_Le_voeu_d_une_morte._clean.txt,"Qu' était -il , après tout , pour Jeanne ?","que être il , PHASE tout , pour NP ?"
1978,Zola/1866_Le_voeu_d_une_morte._clean.txt,pas même un ami .,pas même un NC .
1979,Zola/1866_Le_voeu_d_une_morte._clean.txt,"De quel droit viendrait -il parler en maître dans cette famille , et quel cas ferait -on de ses ordres ?","de quel NC venir il INF en NC dans ce NC , et quel NCs faire on de DETPOSS NCmod ?"
1980,Zola/1866_Le_voeu_d_une_morte._clean.txt,Toujours son impuissance et sa misère l' écrasaient .,ADVTEMPS DETPOSS NCs et DETPOSS NC le VIMP .
1981,Zola/1866_Le_voeu_d_une_morte._clean.txt,"Il crierait que Lorin était un malhonnête homme , et il n' aurait aucune preuve à donner ; il parlerait de la mission qu' il avait à accomplir , et on le traiterait de fou , on rirait en le mettant à la porte , on lui dirait : Vous êtes amoureux .","il VDIC que NP être un ADJ NC , et il ne avoir aucun NCo à INF ; il VCOND de le NC que il avoir à INF , et on le VCOND de ADJ , on VCOND en le mettre à le NC , on lui VDIC : vous être ADJ ."
1982,Zola/1866_Le_voeu_d_une_morte._clean.txt,Et on aurait raison .,et on avoir NC .
1983,Zola/1866_Le_voeu_d_une_morte._clean.txt,Il avait aimé Jeanne à six ans .,il avoir VSENT NP à NUM NCT .
1984,Zola/1866_Le_voeu_d_une_morte._clean.txt,Il le sentait bien maintenant .,il le sentir bien ADVT .
1985,Zola/1866_Le_voeu_d_une_morte._clean.txt,"À l' impasse Saint-Dominique-d'Enfer , il avait gardé pour maîtresse la vision chère de l' enfant .","à le NC NP , il avoir PPAS pour NC le NCo ADJ de le NCmod ."
1986,Zola/1866_Le_voeu_d_une_morte._clean.txt,"Plus tard , il s' était mis à adorer la jeune fille , il était devenu jaloux et méchant , la suivant partout , craignant que son cœur ne lui fût volé .","plus tard , il se être mettre à VSENT le ADJ NCo , il être devenir ADJ et ADJ , le PPRES ADV , VSENT que DETPOSS NCspas ne lui être PPAS ."
1987,Zola/1866_Le_voeu_d_une_morte._clean.txt,"Puis , il songeait à les courses dans les îles , à tous les apaisements tendres de son amour .","puis , il VIMP à le NC dans le NC , à tout le NCSENT ADJ de DETPOSS NCSENT ."
1988,Zola/1866_Le_voeu_d_une_morte._clean.txt,"Comme il se trouvait heureux , quand il s' ignorait lui-même !","comme il se VIMP ADJ , quand il se VCOND soi-même !"
1989,Zola/1866_Le_voeu_d_une_morte._clean.txt,comme il était bon de veiller en père sur sa chère tendresse !,comme il être ADJ de INF en NC sur DETPOSS ADJ NCSENT !
1990,Zola/1866_Le_voeu_d_une_morte._clean.txt,"Maintenant , il savait tout .","ADVT , il VCOG tout ."
1991,Zola/1866_Le_voeu_d_une_morte._clean.txt,"Le remords le torturait , la passion le mordait à le cœur .","le NCs le VIMP , le NCSENT le VIMP à le NC ."
1992,Zola/1866_Le_voeu_d_une_morte._clean.txt,"Il se laissa tomber sur la terre , et la pluie le pénétrait de frissons .","il se laisser INF sur le NC , et le NC le NC de NCSENT ."
1993,Zola/1866_Le_voeu_d_une_morte._clean.txt,"Dans son angoisse , dans les injures qu' il s' adressait , dans ses hontes et ses souffrances , une pensée brutale revenait sans cesse , implacable et aiguë : c' était que Jeanne allait appartenir à un autre .","dans DETPOSS NCSENT , dans le NC que il se VIMP , dans DETPOSS NCSENT et DETPOSS NCSENT , un NCo ADJ VIMP sans NC , ADJ et ADJ : ce être que NP aller INF à un autre ."
1994,Zola/1866_Le_voeu_d_une_morte._clean.txt,"Il se défendait contre cette image , il voulait tuer son désir ; il appelait avec désespoir le souvenir de sa bonne sainte .","il se VIMP contre ce NC , il vouloir INF DETPOSS NCSENT ; il VIMP avec INF le NCo de DETPOSS ADJ NCmod ."
1995,Zola/1866_Le_voeu_d_une_morte._clean.txt,"Et toujours Jeanne et Lorin étaient là , devant lui , jeunes et souriants .","et ADVTEMPS NP et NP être ADVLIEU , ADVLIEU lui , ADJ et ADJ ."
1996,Zola/1866_Le_voeu_d_une_morte._clean.txt,"Alors , sa tête éclatait , il voyait rouge .","alors , DETPOSS NCCOR VIMP , il VCOG ADJCOL ."
1997,Zola/1866_Le_voeu_d_une_morte._clean.txt,Il passa de la sorte une partie de la nuit .,il VPS de le sorte un NCo de le NCT .
1998,Zola/1866_Le_voeu_d_une_morte._clean.txt,Un accablement hébété succéda à cette crise de désespoir .,un NCSENT ADJ VPS à ce NC de INF .
1999,Zola/1866_Le_voeu_d_une_morte._clean.txt,"Le matin , il se dit qu' il n' avait plus rien à faire chez les Tellier , que la lutte était terminée , et qu' il était vaincu .","le NCT , il se VDIC que il ne avoir plus rien à faire chez le NP , que le NCs être VASP , et que il être PPAS ."
2000,Zola/1866_Le_voeu_d_une_morte._clean.txt,"Il s' abandonnait à les faits , lâchement ; tout son être endolori réclamait le calme .","il se VIMP à le NC , ADVMAN ; tout PRES être ADV VIMP le NCSENT ."
2001,Zola/1866_Le_voeu_d_une_morte._clean.txt,"Il voulut partir seul , il regagna Paris , précédant de quelques heures les hôtes de le Mesnil-Rouge .","il vouloir INF ADJ , il VPS NP , PPRES de quelque NCT le NCo de le NP ."
2002,Zola/1866_Le_voeu_d_une_morte._clean.txt,"Il alla chez Georges , qui s' abstint de toute question , et il passa là plusieurs mois dans une prostration profonde .","il aller chez NP , qui se VPS de tout NC , et il VPS ADVLIEU plusieurs NCT dans un NC ADJ ."
2003,Zola/1866_Le_voeu_d_une_morte._clean.txt,"Une seule fois , il se rendit rue d' Amsterdam , pour faire ses adieux à le député .","un ADJ fois , il se VPS NCo de NP , pour faire DETPOSS NCo à le NC ."
2004,Zola/1866_Le_voeu_d_une_morte._clean.txt,"Un désir irrésistible qu' il ne voulait pas s' avouer , le poussait dans cette maison : il éprouvait le besoin de connaître le jour exact de la célébration de le mariage .","un NCSENT ADJ que il ne vouloir pas se VDIC , le VIMP dans ce NC : il VSENT le NCo de INF le NCT ADJ de le NCmod de le NCmod ."
2005,Zola/1866_Le_voeu_d_une_morte._clean.txt,L' incertitude le torturait .,le NC le NC .
2006,Zola/1866_Le_voeu_d_une_morte._clean.txt,"Lorsqu' il eut contenté sa curiosité , il souffrit davantage .","lorsque il avoir VSENT DETPOSS NCSENT , il VSENT davantage ."
2007,Zola/1866_Le_voeu_d_une_morte._clean.txt,"Il compta les jours , et chaque heure nouvelle qui le rapprochait de la date fatale , devint plus lourde .","il VPS le NCT , et chaque NCT ADJ qui le VIMP de le NC ADJ , devenir plus ADJ ."
2008,Zola/1866_Le_voeu_d_une_morte._clean.txt,Il s' était juré de ne point assister à la cérémonie .,il se être PPAS de ne ADV INF à le NC .
2009,Zola/1866_Le_voeu_d_une_morte._clean.txt,"La fièvre le prit la veille de la terrible journée , et il fut poussé malgré lui dans l' église .","le VSENT le VPS le NCo de le ADJ NCT , et il être PPAS malgré lui dans le NC ."
2010,Zola/1866_Le_voeu_d_une_morte._clean.txt,"Là , il passa par toutes les horreurs de l' agonie : il se tint derrière un pilier , frissonnant , croyant faire un cauchemar .","ADVLIEU , il VPS par tout le NC de le NCmod : il se VPS ADVLIEU un NC , PPRES , VCOG faire un NCo ."
2011,Zola/1866_Le_voeu_d_une_morte._clean.txt,"Quand il rentra , Georges pensa qu' il était ivre et le coucha comme un enfant .","quand il VPS , NP VCOG que il être INF et le VPS comme un NC ."
2012,Zola/1866_Le_voeu_d_une_morte._clean.txt,"Mais , le lendemain , Daniel se leva , malgré la fièvre qui le secouait , et il déclara qu' il allait quitter Paris , s' enfuir , retourner là-bas à le bord de la mer , à Saint-Henri , dans les larges horizons où il avait vécu si paisible .","mais , le NC , NP se VPS , malgré le VSENT qui le VIMP , et il VPS que il aller INF NP , se INF , INF ADVLIEU à le NC de le NCmod , à NP , dans le ADJ NC où il avoir PPAS si ADJ ."
2013,Zola/1866_Le_voeu_d_une_morte._clean.txt,"Georges ne voulait pas le laisser partir ; il le voyait trop faible ; et , devant sa résolution farouche , il le suppliait de permettre à le moins qu' il l' accompagnât .","NP ne vouloir pas le laisser INF ; il le VCOG trop ADJ ; et , ADVLIEU DETPOSS NC ADJ , il le VIMP de permettre à le moins que il le VSUBI ."
2014,Zola/1866_Le_voeu_d_une_morte._clean.txt,"Daniel s' irrita , refusa toute consolation .","NP se VSENT , VPS tout NCSENT ."
2015,Zola/1866_Le_voeu_d_une_morte._clean.txt,Il avait un immense besoin de solitude .,il avoir un ADJ NC de NCmod .
2016,Zola/1866_Le_voeu_d_une_morte._clean.txt,"Il partit , laissant Georges désespéré , ignorant tout .","il PPAS , laisser NP VSENT , VCOG tout ."
2017,Zola/1866_Le_voeu_d_une_morte._clean.txt,"Lorsqu' il vit la grande mer bleue s' étendre devant lui , il se sentit plus calme , il ne lui resta qu' une tristesse profonde .","lorsque il PRES le ADJ NCo ADJCOL se INF ADVLIEU lui , il se sentir plus NCSENT , il ne lui VPS que un NCSENT ADJ ."
2018,Zola/1866_Le_voeu_d_une_morte._clean.txt,"Il loua une chambre dont la fenêtre donnait sur les vagues , et il vécut pendant un an , oisif et ne s' ennuyant point , mangeant à le jour le jour les quelques économies qu' il avait faites .","il VPS un NCo dont le INF VIMP sur le NC , et il VPS PHASE un NCT , ADJ et ne se VSENT ADV , PPRES à le NCT le NCT le quelque NC que il avoir faire ."
2019,Zola/1866_Le_voeu_d_une_morte._clean.txt,"Il demeurait de les journées entières immobile , en face de la mer .","il VIMP de le NCT ADJ ADJ , en NC de le NC ."
2020,Zola/1866_Le_voeu_d_une_morte._clean.txt,"Le bruit de les flots avait comme un écho dans sa poitrine , et il laissait bercer ses pensées .","le NCs de le NCmod avoir comme un NC dans DETPOSS NCmod , et il laisser INF DETPOSS NCo ."
2021,Zola/1866_Le_voeu_d_une_morte._clean.txt,"Il s' asseyait sur une pointe de rocher , tournant le dos à les vivants , s' absorbant dans l' infini .","il se VIMP sur un NC de NCmod , PPRES le NCCOR à le NC , se PPRES dans le ADJ ."
2022,Zola/1866_Le_voeu_d_une_morte._clean.txt,"Et il était seulement heureux , lorsque les vagues avaient endormi sa mémoire et qu' il était là , inerte , en extase , dormant les yeux ouverts .","et il être seulement ADJ , lorsque le NCs avoir PPAS DETPOSS NCo et que il être ADVLIEU , ADJ , en NCSENT , PPRES le NCCOR ADJ ."
2023,Zola/1866_Le_voeu_d_une_morte._clean.txt,"Alors , une étrange hallucination le hantait .","alors , un ADJ NCs le VSENT ."
2024,Zola/1866_Le_voeu_d_une_morte._clean.txt,"Il croyait être le jouet de les flots , il s' imaginait que la mer était montée le prendre et qu' elle le balançait maintenant avec douceur .","il VCOG être le NC de le NCmod , il se VCOG que le NCs être PPAS le prendre et que il le VIMP ADVT avec NC ."
2025,Zola/1866_Le_voeu_d_une_morte._clean.txt,"Ce fut dans cette contemplation incessante , dans cette absorption de son être , qu' il apaisa son cœur .","ce être dans ce NC ADJ , dans ce NCmod de DETPOSS être , que il VSENT DETPOSS NC ."
2026,Zola/1866_Le_voeu_d_une_morte._clean.txt,"Il en arriva à ne plus souffrir , à ne plus songer à Jeanne en amant .","il en VPS à ne plus VSENT , à ne plus INF à NP en NC ."
2027,Zola/1866_Le_voeu_d_une_morte._clean.txt,Sa plaie s' était fermée et ne lui avait laissé qu' une lourdeur sourde .,DETPOSS NCs se être PPAS et ne lui avoir laisser que un NCo ADJ .
2028,Zola/1866_Le_voeu_d_une_morte._clean.txt,Il se crut guéri .,il se VPS NC .
