id,titre,phrase,motifs_phrase
1321,Zola/1866_Le_voeu_d_une_morte._clean.txt,"L' affection n' avait , en effet , jamais existé pour elle .","le NCSENT ne avoir , en NC , ADVTEMPS PPAS pour il ."
1322,Zola/1866_Le_voeu_d_une_morte._clean.txt,"Alors , elle s' abandonnait .","alors , il se VIMP ."
1323,Zola/1866_Le_voeu_d_une_morte._clean.txt,"Elle tâchait de se satisfaire par la vanité seule , elle tirait tout le bonheur possible de le froissement de les belles étoffes , de l' admiration de la foule , de le bien-être , de la richesse .","il VIMP de se VSENT par le NC ADJ , il VCOND tout le NCSENT ADJ de le NCmod de le ADJ NCmod , de le NCSENT de le NCmod , de le NCSENT , de le NC ."
1324,Zola/1866_Le_voeu_d_une_morte._clean.txt,Et elle croyait vivre .,et il VCOG INF .
1325,Zola/1866_Le_voeu_d_une_morte._clean.txt,"L' aveugle Daniel ne pouvait pénétrer dans cette âme compliquée et il voyait bien les regards méprisants , mais il n' apercevait pas , tout à le fond de les yeux , une lueur tendre .","le NCs NP ne pouvoir INF dans ce NC PPAS et il VCOG bien le NCMAN ADJ , mais il ne VIMP pas , tout à le NC de le NCCOR , un NCo INF ."
1326,Zola/1866_Le_voeu_d_une_morte._clean.txt,"Il entendait bien les paroles brèves et rieuses , mais il ne reconnaissait pas les pleurs cachés dans les éclats de joie .","il VCOG bien le NCo ADJ et ADJ , mais il ne VCOG pas le NCo ADJ dans le NC de NCSENT ."
1327,Zola/1866_Le_voeu_d_une_morte._clean.txt,Il décida donc que Jeanne était une méchante nature et il souffrit horriblement de cette belle découverte .,il VPS donc que NP être un ADJ NC et il VSENT ADVINT de ce ADJ NC .
1328,Zola/1866_Le_voeu_d_une_morte._clean.txt,Aussi résolut -il de ne point se faire connaître .,aussi PRES il de ne ADV se faire INF .
1329,Zola/1866_Le_voeu_d_une_morte._clean.txt,"Il voulait jouer le rôle d' un gardien invisible , et non celui d' un banal protecteur .","il vouloir INF le NCo de un NCmod ADJ , et non celui de un NCmod ADJ ."
1330,Zola/1866_Le_voeu_d_une_morte._clean.txt,"D' ailleurs , il comprit que le caractère altier de Jeanne secouerait le joug , si léger qu' il fût .","de ADVLIEU , il VCOG que le NCs ADJ de NP VCOND le NCo , si INF que il être ."
1331,Zola/1866_Le_voeu_d_une_morte._clean.txt,"Puis , à vrai dire , s' il lui avait fallu confesser à la jeune fille qui il était et de quelle mission madame de Rionne l' avait chargé , jamais il n' aurait trouvé l' audace ni les mots nécessaires .","puis , à vrai VDIC , si il lui avoir PPAS INF à le ADJ NC qui il être et de quel NC madame de NP le avoir PPAS , ADVTEMPS il ne avoir PPAS le NCo ni le NC ADJ ."
1332,Zola/1866_Le_voeu_d_une_morte._clean.txt,"Ce qui l' étonnait , c' était de sentir son dévouement et sa tendresse croître pour Jeanne , depuis qu' il la déclarait mauvaise .","ce qui le VSENT , ce être de sentir DETPOSS NCo et DETPOSS NCSENT PRES pour NP , depuis que il le PRES ADJ ."
1333,Zola/1866_Le_voeu_d_une_morte._clean.txt,Il avait contre elle de les colères mêlées d' adoration .,il avoir contre il de le NCSENT PPAS de NCSENT .
1334,Zola/1866_Le_voeu_d_une_morte._clean.txt,"Quand il la voyait moqueuse , mettant ses joies dans une robe ou un bijou , il courait s' enfermer dans sa chambre ; puis là , il la retrouvait telle qu' il venait de la quitter , grande , si belle , qu' elle en devenait bonne .","quand il le VCOG ADJ , mettre DETPOSS NCSENT dans un NC ou un NC , il VCOND se INF dans DETPOSS NC ; puis ADVLIEU , il le VIMP tel que il venir de le INF , ADJ , si ADJ , que il en devenir ADJ ."
1335,Zola/1866_Le_voeu_d_une_morte._clean.txt,"Il se jurait alors d' éveiller son cœur , pour pouvoir l' adorer à son aise .","il se VCOND alors de INF DETPOSS NCo , pour pouvoir le VSENT à DETPOSS NC ."
1336,Zola/1866_Le_voeu_d_une_morte._clean.txt,"Jusque -là , il ne s' était pas expliqué nettement la position faite à la jeune fille chez sa tante .","jusque ADVLIEU , il ne se être pas VDIC ADVINT le NCo faire à le ADJ NC chez DETPOSS tant ."
1337,Zola/1866_Le_voeu_d_une_morte._clean.txt,"Il se rappelait que madame de Rionne lui avait parlé d' une ruine prochaine ; et , depuis douze ans , le père devait avoir consommé largement cette ruine .","il se VIMP que madame de NP lui avoir PPAS de un NC ADJ ; et , depuis NUM NCT , le NCs devoir avoir PPAS ADVINT ce NCo ."
1338,Zola/1866_Le_voeu_d_une_morte._clean.txt,"Il alla à les informations , discrètement , il apprit qu' en effet le viveur en était à ses derniers louis .","il aller à le NC , ADVMAN , il VCOG que en NC le NCs en être à DETPOSS ADJ NCo ."
1339,Zola/1866_Le_voeu_d_une_morte._clean.txt,"Quant à Jeanne , elle ne devait avoir aucune fortune .","quant à NP , il ne devoir avoir aucun NCo ."
1340,Zola/1866_Le_voeu_d_une_morte._clean.txt,Daniel s' étonna dès lors de la large hospitalité offerte par madame Tellier à sa nièce .,NP se VSENT dès lors de le ADJ NC PPAS par madame NP à DETPOSS NC .
1341,Zola/1866_Le_voeu_d_une_morte._clean.txt,"La vérité était que madame Tellier avait compris , dès le premier jour , qu' elle adoptait en quelque sorte la fille de son frère , et ce fut pour cela qu' elle la laissa le plus longtemps possible à le couvent .","le NCs être que madame NP avoir VCOG , dès le ADJ NCT , que il VIMP en quelque sorte le NCo de DETPOSS NCmod , et ce être pour cela que il le laisser le plus longtemps ADJ à le NC ."
1342,Zola/1866_Le_voeu_d_une_morte._clean.txt,"Puis , comme elle approchait de la quarantaine , de les tristesses l' avaient prise , à la suite de chagrins secrets .","puis , comme il VIMP de le NC , de le NCSENT le avoir PPAS , à le NC de NCSENT ADJ ."
1343,Zola/1866_Le_voeu_d_une_morte._clean.txt,"Elle se souvint de Jeanne , elle l' appela près d' elle , ayant résolu de la marier .","il se VPS de NP , il le VPS ADVLIEU de il , avoir PPAS de le NC ."
1344,Zola/1866_Le_voeu_d_une_morte._clean.txt,"D' ailleurs , les dépenses qu' elle faisait pour la jeune fille entraient dans ses plaisirs .","de ADVLIEU , le NCs que il faire pour le ADJ NC VIMP dans DETPOSS NCSENT ."
1345,Zola/1866_Le_voeu_d_une_morte._clean.txt,On retrouvait toujours en elle la femme positive .,on VIMP ADVTEMPS en il le NCo ADJ .
1346,Zola/1866_Le_voeu_d_une_morte._clean.txt,"Elle se parait elle-même en la parant , elle contentait uniquement son amour de le luxe et sa vanité .","il se paraître elle-même en le PPRES , il VSENT ADV DETPOSS NCSENT de le NCmod et DETPOSS NC ."
1347,Zola/1866_Le_voeu_d_une_morte._clean.txt,"Puisque sa nièce devait être là , dans son salon , elle n' aurait pas souffert qu' elle y fût sans être merveilleusement mise .","puisque DETPOSS NCs devoir être ADVLIEU , dans DETPOSS NC , il ne avoir pas PPAS que il y être sans être ADVINT mettre ."
1348,Zola/1866_Le_voeu_d_une_morte._clean.txt,Il y avait peut-être encore un autre sentiment à le fond de son cœur .,il y avoir peut-être encore un autre NCSENT à le NCmod de DETPOSS NCmod .
1349,Zola/1866_Le_voeu_d_une_morte._clean.txt,Elle n' était sans doute pas fâchée de passionner les dernières années de sa beauté .,il ne être sans NCSENT pas VSENT de VSENT le ADJ NCT de DETPOSS NCmod .
1350,Zola/1866_Le_voeu_d_une_morte._clean.txt,"C' était une sorte de lutte qu' elle engageait avec cette enfant ; de les joies profondes la prenaient , quand ses invités négligeaient Jeanne pour venir l' entourer elle-même .","ce être un sorte de NCmod que il VIMP avec ce NC ; de le NCSENT ADJ le VIMP , quand DETPOSS NCs VIMP NP pour venir le INF elle-même ."
1351,Zola/1866_Le_voeu_d_une_morte._clean.txt,"Elle se donnait la récréation de dire à tout le monde que sa nièce n' avait pas de dot , et elle riait lorsque les prétendants s' enfuyaient .","il se VIMP le NCo de VDIC à tout le NC que DETPOSS NCs ne avoir pas un NCo , et il VIMP lorsque le NCs se VIMP ."
1352,Zola/1866_Le_voeu_d_une_morte._clean.txt,"Peut-être même calculait -elle l' effet désastreux que produisaient sur les épouseurs les riches toilettes de Jeanne , quand ils apprenaient que cette belle demoiselle n' avait pas un sou .","peut-être même VIMP il le NCo ADJ que VIMP sur le NC le ADJ NC de NP , quand il VIMP que ce ADJ NCs ne avoir pas un NCo ."
1353,Zola/1866_Le_voeu_d_une_morte._clean.txt,"Sa nièce devenait pour eux une fleur rare , mais dangereuse , d' un entretien trop coûteux .","DETPOSS NCs devenir pour eux un NCo ADJ , mais ADJ , de un NC trop ADJ ."
1354,Zola/1866_Le_voeu_d_une_morte._clean.txt,"Elle la mettait ainsi loin de toutes les mains , se plaisant à ce jeu .","il le mettre ainsi ADVLIEU de tout le NCCOR , se PPRES à ce NC ."
1355,Zola/1866_Le_voeu_d_une_morte._clean.txt,"D' ailleurs , elle s' attendait à trouver une niaise , et le caractère aigri froid et mordant de Jeanne l' avait agréablement surprise .","de ADVLIEU , il se VIMP à INF un NCo , et le NC VSENT ADJ et ADJ de NP le avoir ADV NCSENT ."
1356,Zola/1866_Le_voeu_d_une_morte._clean.txt,"Elle était devenue l' amie de cette moqueuse qui la divertissait ; elle l' excitait , la poussait à la méchanceté , sans songer à mal .","il être devenir le NCo de ce NCmod qui le VIMP ; il le VSENT , le VIMP à le NC , sans INF à mal ."
1357,Zola/1866_Le_voeu_d_une_morte._clean.txt,"N' ayant pas elle-même cette bonté qui aurait éveillé la bonté de ce cœur fermé , elle croyait rendre à Jeanne un véritable service en faisant son éducation mondaine .","ne avoir pas elle-même ce NCSENT qui avoir PPAS le NCSENT de ce NCmod PPAS , il VCOG INF à NP un véritable NCo en faire DETPOSS NCo ADJ ."
1358,Zola/1866_Le_voeu_d_une_morte._clean.txt,"Toutes deux vivaient de la même vie : la tante avec un calme parfait , la nièce avec de les inquiétudes sourdes .","tout deux VIMP de le même NC : le tant avec un NCSENT ADJ , le NC avec de le NCSENT ADJ ."
1359,Zola/1866_Le_voeu_d_une_morte._clean.txt,"Elles étaient acceptées dans Paris , l' une comme la reine de la mode , l' autre comme une infante qui devait être reine tôt ou tard .","il être PPAS dans NP , le un comme le NCmod de le NCmod , le autre comme un NCmod qui devoir être ADJ tôt ou tard ."
1360,Zola/1866_Le_voeu_d_une_morte._clean.txt,"Daniel , de sa chambre , lorsqu' il les voyait monter dans la même voiture , avait de les colères soudaines .","NP , de DETPOSS NCmod , lorsque il le VCOG INF dans le même NC , avoir de le NCSENT soudain ."
1361,Zola/1866_Le_voeu_d_une_morte._clean.txt,"Il se rappelait les paroles de la mourante , qui prévoyait les mauvaises leçons que donnerait à sa fille la sœur de son mari , et il se demandait comment il pourrait réagir contre ces leçons .","il se VIMP le NCo de le NCmod , qui VIMP le ADJ NCo que VCOND à DETPOSS NC le NCs de DETPOSS NCmod , et il se VIMP comment il pouvoir INF contre ce NC ."
1362,Zola/1866_Le_voeu_d_une_morte._clean.txt,"Un matin , M. Tellier , qui se prenait d' amitié pour son secrétaire , l' invita à une soirée qu' il devait donner le soir .","un NCT , monsieur NP , qui se VIMP de NC pour DETPOSS NC , le VPS à un NCT que il devoir INF le NCT ."
1363,Zola/1866_Le_voeu_d_une_morte._clean.txt,"La première pensée de Daniel fut de refuser avec effroi : l' idée de se trouver dans un salon , en plein dans la lumière éclatante de les bougies , à le milieu d' une foule élégante , lui était insupportable .","le ADJ NCs de NP être de INF avec NC : le NCs de se INF dans un NC , en NCmod dans le NCmod ADJ de le NCmod , à le milieu de un NCmod ADJ , lui être ADJ ."
1364,Zola/1866_Le_voeu_d_une_morte._clean.txt,"Puis , il entendit une voix la voix éteinte de madame de Rionne qui disait à le fond de lui : Vous irez partout où elle ira , vous la protégerez contre le monde .","puis , il VCOG un NCMAN le NCMAN ADJ de madame de NP qui VDIC à le NC de lui : vous PRES ADV où il VF , vous le PRES contre le NC ."
1365,Zola/1866_Le_voeu_d_une_morte._clean.txt,Et il accepta en tremblant l' invitation de M. Tellier .,et il VPS en PPRES le NCo de monsieur NP .
1366,Zola/1866_Le_voeu_d_une_morte._clean.txt,"Le soir , il passa plus d' une heure dans sa chambre , en face d' une glace .","le NCT , il VPS plus de un NCT dans DETPOSS NCmod , en NC de un NC ."
1367,Zola/1866_Le_voeu_d_une_morte._clean.txt,"Le pauvre garçon n' avait guère de coquetterie pour son compte , mais il craignait d' être ridicule devant Jeanne .","le ADJ NCs ne avoir guère de NC pour DETPOSS NC , mais il VSENT de être ADJ ADVLIEU NP ."
1368,Zola/1866_Le_voeu_d_une_morte._clean.txt,"Il réussit à s' habiller le plus simplement possible , de façon à passer inaperçu .","il PRES à se INF le plus ADVMAN ADJ , de façon à INF ADJ ."
1369,Zola/1866_Le_voeu_d_une_morte._clean.txt,"Puis , il descendit et se glissa dans le salon .","puis , il VPS et se VPS dans le NC ."
1370,Zola/1866_Le_voeu_d_une_morte._clean.txt,"Daniel , en entrant , éprouva cette sensation d' étouffement et d' aveuglement que ressent un nageur , lorsqu' il plonge la tête sous l' eau : les lumières tournèrent devant ses yeux , le bruit de les voix bourdonna à ses oreilles , et il perdit la respiration .","NP , en PPRES , VSENT ce NCSENT de NCmod et de NC que PRES un NCs , lorsque il PRES le NCCOR sous le NC : le NCs VPS ADVLIEU DETPOSS NCCOR , le NCo de le NCMAN VPS à DETPOSS NCCOR , et il VPS le NCo ."
1371,Zola/1866_Le_voeu_d_une_morte._clean.txt,"Il se tint un instant immobile , oppressé , luttant contre le malaise qui l' envahissait .","il se VPS un NCo ADJ , PPAS , PPRES contre le NCSENT qui le VIMP ."
1372,Zola/1866_Le_voeu_d_une_morte._clean.txt,Personne n' avait remarqué son entrée .,personne ne avoir PPAS DETPOSS NCo .
1373,Zola/1866_Le_voeu_d_une_morte._clean.txt,"Peu à peu , le poids qui l' écrasait diminua .","peu à peu , le NC qui le VIMP VPS ."
1374,Zola/1866_Le_voeu_d_une_morte._clean.txt,Il respira librement .,il VF ADVMAN .
1375,Zola/1866_Le_voeu_d_une_morte._clean.txt,Il distinguait avec netteté la scène qu' il avait devant lui .,il VCOG avec NC le NCo que il avoir ADVLIEU lui .
1376,Zola/1866_Le_voeu_d_une_morte._clean.txt,"Le grand salon , blanc et or , resplendissait à les clartés de les bougies ; les bronzes dorés jetaient de les lueurs vives , et les murs avaient de les reflets qui faisaient cligner les yeux .","le ADJ NCs , ADJCOL et NC , VIMP à le NC de le NCmod ; le NCs ADJ VIMP de le NC ADJ , et le NCs avoir de le NC qui faire INF le NCCOR ."
1377,Zola/1866_Le_voeu_d_une_morte._clean.txt,"Un air tiède s' alourdissait dans la pièce , apportant les odeurs de les bouquets mêlées à les parfums de les épaules .","un NCMAN ADJ se VIMP dans le NC , PPRES le NCo de le NCmod PPAS à le NC de le NCCOR ."
1378,Zola/1866_Le_voeu_d_une_morte._clean.txt,"Daniel remarqua que les femmes se tenaient assises dans le fond , tandis que les hommes , faisant bande à part , causaient entre eux , près de les fenêtres et de les portes .","NP VPS que le NCs se VIMP PPAS dans le NC , PHASE que le NCs , faire NCo à NCmod , VIMP entre eux , ADVLIEU de le NC et de le NC ."
1379,Zola/1866_Le_voeu_d_une_morte._clean.txt,"Tout ce monde se trouvait ainsi disséminé par groupes de quelques personnes , les habits noirs debout , les jupes de soie étalées dans les fauteuils .","tout ce NCs se VIMP ainsi PPAS par NC de quelque NCmod , le NC ADJ ADV , le NCo de NCmod PPAS dans le NC ."
1380,Zola/1866_Le_voeu_d_une_morte._clean.txt,"On n' entendait qu' un murmure adouci , dans lequel s' élevaient , par moments , de petits rires aussitôt réprimés .","on ne VCOG que un NCo ADV , dans lequel se VIMP , par NC , de ADJ NCMAN aussitôt PPAS ."
1381,Zola/1866_Le_voeu_d_une_morte._clean.txt,Une sorte de respect instinctif s' était emparé de Daniel .,un sorte de NCmod ADJ se être PPAS de NP .
1382,Zola/1866_Le_voeu_d_une_morte._clean.txt,"Il regardait ces hommes graves , ces jeunes gens élégants , et il était prêt à les admirer de bonne foi .","il VCOG ce NCo ADJ , ce ADJ NC ADJ , et il être ADJ à le VSENT de ADJ NC ."
1383,Zola/1866_Le_voeu_d_une_morte._clean.txt,Jamais il ne s' était trouvé à pareille fête .,ADVTEMPS il ne se être PPAS à ADJ NC .
1384,Zola/1866_Le_voeu_d_une_morte._clean.txt,"Il y avait surprise , il se disait qu' il était subitement transporté dans une sphère de lumière , où tout devait être bon et beau .","il y avoir NCSENT , il se VDIC que il être ADV PPAS dans un NC de NCmod , où tout devoir être ADJ et ADJ ."
1385,Zola/1866_Le_voeu_d_une_morte._clean.txt,"Ces rangées de fauteuils où les dames , avec de les sourires , montraient leur cou et leurs bras nus chargés de bijoux , le jetaient surtout dans un ravissement .","ce NCs de NCmod où le NCs , avec de le NCMAN , VIMP lui NCCOR et DETPOSS NCCOR ADJ PPAS de NC , le VIMP surtout dans un NCSENT ."
1386,Zola/1866_Le_voeu_d_une_morte._clean.txt,"Puis , à le milieu , il apercevait Jeanne fière , victorieuse , entourée d' adorateurs , et c' était là , pour lui , l' endroit sacré d' où partaient tous les rayons .","puis , à le milieu , il VIMP NP ADJ , ADJ , PPAS de NC , et ce être ADVLIEU , pour lui , le NC ADJ de où VIMP tout le NCs ."
1387,Zola/1866_Le_voeu_d_une_morte._clean.txt,"Il voulut jouir de la conversation de ces êtres supérieurs , et il s' approcha discrètement d' un groupe , dans lequel M. Tellier paraissait discuter une grave question .","il vouloir INF de le NC de ce être ADJ , et il se VPS ADVMAN de un NC , dans lequel NC NP paraître INF un ADJ NCo ."
1388,Zola/1866_Le_voeu_d_une_morte._clean.txt,"Voici ce qu' il entendit : Je suis un peu enrhumé depuis hier , disait solennellement le député .","voici ce que il VCOG : je être un peu PPAS depuis ADV , VDIC ADV le NCs ."
1389,Zola/1866_Le_voeu_d_une_morte._clean.txt,"Il faut soigner cela , répondit un vieux monsieur .","il PRES INF cela , VDIC un ADJ monsieur ."
1390,Zola/1866_Le_voeu_d_une_morte._clean.txt,Bah !,INTJ !
1391,Zola/1866_Le_voeu_d_une_morte._clean.txt,"ça s' en ira comme c' est venu ... Daniel n' en écouta pas davantage , et il regretta d' avoir oublié que Il fit quelques pas , et il se trouva derrière une jeune femme et un jeune homme .","ça se en VPS comme ce être venir ... NP ne en VCOG pas davantage , et il VPS de avoir VCOG que il faire quelque pas , et il se VPS ADVLIEU un ADJ NC et un ADJ NC ."
1392,Zola/1866_Le_voeu_d_une_morte._clean.txt,"La jeune femme , languissamment assise , un sourire à les lèvres , penchait à demi son front rêveur ; elle paraissait écouter la musique de les anges et vivre loin de la terre , dans un monde idéal .","le ADJ NCs , ADV PPAS , un NCMAN à le NCCOR , VIMP à ADJ DETPOSS NCCOR ADJ ; il paraître VCOG le NCo de le NCmod et INF ADVLIEU de le NC , dans un NC ADJ ."
1393,Zola/1866_Le_voeu_d_une_morte._clean.txt,"Le jeune homme , appuyé légèrement à le dossier de le fauteuil , ressemblait à un chérubin qui porterait un habit noir .","le ADJ NCs , PPAS ADVINT à le NC de le NCmod , VIMP à un NC qui VCOND un NCo ADJ ."
1394,Zola/1866_Le_voeu_d_une_morte._clean.txt,Daniel crut surprendre une de ces causeries d' amour comme on en trouve chez les poètes .,NP VPS VSENT un de ce NCmod de NCSENT comme on en PRES chez le NC .
1395,Zola/1866_Le_voeu_d_une_morte._clean.txt,Quel vilain temps il a fait aujourd'hui !,quel ADJ temps il avoir faire ADVT !
1396,Zola/1866_Le_voeu_d_une_morte._clean.txt,murmurait le jeune homme .,VCOND le ADJ NCo .
1397,Zola/1866_Le_voeu_d_une_morte._clean.txt,Oh !,INTJ !
1398,Zola/1866_Le_voeu_d_une_morte._clean.txt,"ne m' en parlez pas , répondait la jeune femme avec émotion , la pluie me donne la migraine , et je dois être laide , ce soir .","ne le en PRES pas , VDIC le ADJ NCo avec NCSENT , le NCs me PRES le NCo , et je devoir être ADJ , ce NCT ."
1399,Zola/1866_Le_voeu_d_une_morte._clean.txt,"Vous êtes adorablement jolie ... Avez -vous remarqué que , quand il pleut , la frisure de les cheveux ne tient pas ?","vous être ADVINT ADJ ... avoir vous PPAS que , quand il PRES , le NCo de le NCCOR ne PRES pas ?"
1400,Zola/1866_Le_voeu_d_une_morte._clean.txt,Certes .,ADV .
1401,Zola/1866_Le_voeu_d_une_morte._clean.txt,"J' ai été obligée de me faire coiffer trois fois , et , voyez , mes cheveux s' ébouriffent .","je avoir être PPAS de me faire INF NUM fois , et , IMP , DETPOSS NCCOR se PRES ."
1402,Zola/1866_Le_voeu_d_une_morte._clean.txt,"Moi , dans ces cas -là , je me sers de gomme mise en poudre .","soi , dans ce NCmod ADVLIEU , je me NCo de NCmod mettre en NC ."
1403,Zola/1866_Le_voeu_d_une_morte._clean.txt,Vraiment !,ADVINT !
1404,Zola/1866_Le_voeu_d_une_morte._clean.txt,... Je vous remercie de la recette .,... je vous VDIC de le NC .
1405,Zola/1866_Le_voeu_d_une_morte._clean.txt,"Daniel crut avoir affaire à un coiffeur , et il s' éloigna vite pour ne pas troubler de si tendres confidences .","NP VPS avoir NCo à un NC , et il se VPS ADV pour ne pas VSENT un si ADJ NCo ."
1406,Zola/1866_Le_voeu_d_une_morte._clean.txt,Il s' approcha alors de deux grands garçons qui causaient à l' écart .,il se VPS alors de NUM ADJ NC qui VIMP à le NC .
1407,Zola/1866_Le_voeu_d_une_morte._clean.txt,"Il pensait que ceux -là , n' ayant pas de femme à amuser , devaient parler comme de les hommes .","il VCOG que celui ADVLIEU , ne avoir pas un NC à VSENT , devoir INF comme de le NC ."
1408,Zola/1866_Le_voeu_d_une_morte._clean.txt,"En effet , ils parlaient comme de les cochers .","en NC , il VIMP comme de le NC ."
1409,Zola/1866_Le_voeu_d_une_morte._clean.txt,Daniel ne comprit pas entièrement leur langage : l' argot de les salons était une nouvelle langue pour lui et il les prit d' abord pour de les étrangers .,NP ne VCOG pas ADVINT lui NCo : le NCs de le NCmod être un ADJ NCCOR pour lui et il le VPS de NC pour de le NC .
1410,Zola/1866_Le_voeu_d_une_morte._clean.txt,"Puis , il reconnut certains mots français ; il devina qu' ils parlaient de femmes et de chevaux , sans bien savoir quelles phrases s' appliquaient à les chevaux et quelles phrases à les femmes , car ils les traitaient avec la même tendresse et la même grossièreté .","puis , il VCOG certain NCo ADJ ; il VCOG que il VIMP de NC et de NC , sans bien VCOG quel NCo se VIMP à le NC et quel NC à le NCmod , car il le VIMP avec le même NCSENT et le même NC ."
1411,Zola/1866_Le_voeu_d_une_morte._clean.txt,"Alors , Daniel jeta un regard clair dans le salon .","alors , NP VPS un NCMAN ADJ dans le NC ."
1412,Zola/1866_Le_voeu_d_une_morte._clean.txt,Il commençait à comprendre qu' il venait d' être dupe d' un décor .,il VASP à VCOG que il venir de être ADJ de un NC .
1413,Zola/1866_Le_voeu_d_une_morte._clean.txt,"Les platitudes , les niaiseries lui arrivaient nettes et brutales , pareilles à ces lambeaux de dialogue qui se traînent misérablement dans les féeries , à le milieu de les splendeurs de la mise en scène .","le NC , le NCs lui VIMP ADJ et ADJ , NC à ce NCmod de NCmod qui se PRES ADVMAN dans le NC , à le milieu de le NCmod de le NCmod en NCmod ."
1414,Zola/1866_Le_voeu_d_une_morte._clean.txt,Il se dit qu' il n' y avait là que de les jeux de lumière sur de les bijoux et sur de les étoffes riches .,il se VDIC que il ne y avoir ADVLIEU que de le NC de NCmod sur un le NCmod et sur de le NC ADJ .
1415,Zola/1866_Le_voeu_d_une_morte._clean.txt,"Ces têtes , les jeunes et les vieilles , étaient creuses , ou se faisaient creuses par politesse et savoir-vivre .","ce NCCOR , le NC et le NC , être ADJ , ou se faire PPAS par NC et NC ."
1416,Zola/1866_Le_voeu_d_une_morte._clean.txt,"Tous ces hommes étaient de les comédiens chez lesquels on ne pouvait distinguer ni le cœur ni le cerveau ; toutes ces femmes étaient de les poupées montrant leurs épaules , posées dans de les fauteuils comme on pose de les statuettes de porcelaine sur une étagère .","tout ce NCs être de le NC chez lequel on ne pouvoir VCOG ni le NC ni le NCCOR ; tout ce NCs être de le NC PPRES DETPOSS NCCOR , PPAS dans de le NC comme on VSUBP de le NC de NCmod sur un NC ."
1417,Zola/1866_Le_voeu_d_une_morte._clean.txt,Et il vint à Daniel un orgueil immense .,et il venir à NP un NCSENT ADJ .
1418,Zola/1866_Le_voeu_d_une_morte._clean.txt,"Il fut fier , en ce moment , de sa gaucherie et de ses ignorances mondaines .","il être ADJ , en ce NC , de DETPOSS NC et de DETPOSS NC ADJ ."
1419,Zola/1866_Le_voeu_d_une_morte._clean.txt,"Il n' eut plus peur d' être vu , il releva la tête et marcha à le milieu de le salon .","il ne avoir plus NCSENT de être VCOG , il VPS le NCCOR et VPS à le milieu de le NCmod ."
1420,Zola/1866_Le_voeu_d_une_morte._clean.txt,"Dans sa rudesse , il s' estimait si supérieur à ces gens -là , que leurs sourires lui importaient peu .","dans DETPOSS NC , il se VSENT si ADJ à ce NC ADVLIEU , que DETPOSS NCMAN lui VIMP peu ."
1421,Zola/1866_Le_voeu_d_une_morte._clean.txt,"Il avait comme un réveil d' orgueil et il reprenait avec tranquillité la place qui lui était due , en pleine lumière .","il avoir comme un NC de NCSENT et il VIMP avec NCSENT le NCo qui lui être devoir , en ADJ NC ."
1422,Zola/1866_Le_voeu_d_une_morte._clean.txt,Il n' avait pas encore osé s' approcher de le groupe à le milieu de lequel Jeanne trônait en souveraine .,il ne avoir pas encore PPAS se INF de le NC à le milieu de lequel NP VIMP en NC .
1423,Zola/1866_Le_voeu_d_une_morte._clean.txt,"Il marcha droit à ce groupe et se tint derrière les autres , attendant de pouvoir passer à le premier rang .","il VPS NCo à ce NC et se VPS ADVLIEU le autre , PPRES de pouvoir INF à le ADJ NC ."
1424,Zola/1866_Le_voeu_d_une_morte._clean.txt,"Jeanne semblait distraite , elle écoutait à peine les adorateurs qui se pressaient autour d' elle .","NP sembler ADJ , il VCOG à NCSENT le NCo qui se VIMP ADV de il ."
