id,titre,phrase,motifs_phrase
741,Zola/1866_Le_voeu_d_une_morte._clean.txt,"Il y avait , tombant de les arbres , une lueur verte et transparente ; le plafond de feuilles était bas , cachant le ciel ; et , à l' horizon , par de les échappées , on apercevait les blancheurs de les statues et de les balustrades .","il y avoir , PPRES de le NC , un NC ADJCOL et ADJ ; le NCs de NCmod être ADJ , PPRES le NCo ; et , à le NC , NCmod un le NCmod , on VIMP le NCo de le NCmod et de le NC ."
742,Zola/1866_Le_voeu_d_une_morte._clean.txt,Daniel eut de la peine à trouver un banc libre .,NP avoir de le NCSENT à INF un NCo ADJ .
743,Zola/1866_Le_voeu_d_une_morte._clean.txt,"Il finit par en découvrir un , dans un coin écarté , et il s' assit , en poussant un soupir de soulagement .","il VASP par en VCOG un , dans un NCo ADJ , et il se PRES , en PPRES un NCo de NCSENT ."
744,Zola/1866_Le_voeu_d_une_morte._clean.txt,"À l' autre extrémité de le banc , un jeune homme lisait .","à le autre NC de le NCmod , un ADJ NCs VIMP ."
745,Zola/1866_Le_voeu_d_une_morte._clean.txt,"Il leva la tête , regarda le nouveau venu , et ils échangèrent un sourire .","il PRES le NCCOR , VCOG le ADJ NCo , et il VPS un NCMAN ."
746,Zola/1866_Le_voeu_d_une_morte._clean.txt,"Comme l' ombre grandissait , le jeune homme ferma son livre .","comme le NC VIMP , le ADJ NCs VPS DETPOSS NCo ."
747,Zola/1866_Le_voeu_d_une_morte._clean.txt,"Puis , il promena un regard insouciant sur ce qui l' entourait .","puis , il VPS un NCMAN PPRES sur ce qui le VIMP ."
748,Zola/1866_Le_voeu_d_une_morte._clean.txt,"Daniel , pris de sympathie , oubliait ses propres affaires , pour suivre de les yeux chaque mouvement de son voisin .","NP , PPAS de NCSENT , VCOG DETPOSS ADJ NCo , pour INF de le NCCOR chaque NCo de DETPOSS NCmod ."
749,Zola/1866_Le_voeu_d_une_morte._clean.txt,"C' était un grand garçon , à la figure belle , un peu sévère .","ce être un ADJ NC , à le NCCOR ADJ , un peu ADJ ."
750,Zola/1866_Le_voeu_d_une_morte._clean.txt,"Ses yeux largement ouverts regardaient en face , ses lèvres fermes et fortes avaient on ne savait quoi de puissant et de loyal , et on lisait , dans la hauteur de son front , un grand cœur .","DETPOSS NCCOR ADVINT ADJ VCOG en NC , DETPOSS NCCOR ADJ et fort avoir on ne VCOG quoi de ADJ et de NC , et on VIMP , dans le NC de DETPOSS NCCOR , un ADJ NCo ."
751,Zola/1866_Le_voeu_d_une_morte._clean.txt,Il paraissait avoir vingt ans .,il paraître avoir NUM NCT .
752,Zola/1866_Le_voeu_d_une_morte._clean.txt,"Ses mains blanches , ses vêtements simples , son attitude grave décelaient un étudiant laborieux .","DETPOSS NCCOR ADJCOL , DETPOSS NC ADJ , DETPOSS NC ADJ VIMP un NCo ADJ ."
753,Zola/1866_Le_voeu_d_une_morte._clean.txt,"À le bout de quelques minutes , il tourna la tête , il fixa sur Daniel ses regards droits et pénétrants .","à le NC de quelque NCT , il VPS le NCCOR , il VPS sur NP DETPOSS NCMAN ADJ et ADJ ."
754,Zola/1866_Le_voeu_d_une_morte._clean.txt,"Celui-ci baissa le front , s' attendant à trouver sur son visage la moquerie avec laquelle chacun l' accueillait .","celui-ci VPS le NCCOR , se PPRES à INF sur DETPOSS NCCOR le NCo avec lequel chacun le VIMP ."
755,Zola/1866_Le_voeu_d_une_morte._clean.txt,"Il sentait la curiosité de ce garçon peser sur lui , et il se figurait voir l' expression méchante de ses lèvres .","il sentir le NCSENT de ce NCmod INF sur lui , et il se VCOND VCOG le NCo ADJ de DETPOSS NCCOR ."
756,Zola/1866_Le_voeu_d_une_morte._clean.txt,"Puis , il s' enhardit , et il ne vit sur la face de son voisin qu' un bon sourire d' amitié et d' encouragement .","puis , il se PRES , et il ne PRES sur le NC de DETPOSS NCmod que un ADJ NCMAN de NCmod et de NC ."
757,Zola/1866_Le_voeu_d_une_morte._clean.txt,"Plein de gratitude , il osa se rapprocher et dire à cet ami inconnu qu' il faisait beau , que le Luxembourg était un lieu de délices pour les promeneurs fatigués .","ADV de NCSENT , il VPS se INF et VDIC à ce NC ADJ que il faire ADJ , que le NP être un NC de NCmod pour le NCmod VSENT ."
758,Zola/1866_Le_voeu_d_une_morte._clean.txt,Ah !,INTJ !
759,Zola/1866_Le_voeu_d_une_morte._clean.txt,"ces bonnes causeries , qui naissent d' une rencontre , et qui parfois décident de l' amitié de toute une vie .","ce ADJ NC , qui PRES de un NC , et qui ADVTEMPS PRES de le NC de tout un NCmod ."
760,Zola/1866_Le_voeu_d_une_morte._clean.txt,"On se voit pour la première fois , le hasard vous met face à face , et voilà que le cœur se vide , voilà qu' on se livre tout entier , pris d' une confiance soudaine et irréfléchie .","on se VCOG pour le ADJ fois , le NCs vous mettre ADV à NC , et voilà que le NCs se PRES , voilà que on se PRES tout ADJ , PPAS de un NC soudain et ADJ ."
761,Zola/1866_Le_voeu_d_une_morte._clean.txt,"On éprouve une jouissance à se confesser ainsi à le hasard ; on trouve une douceur dans cet abandon de soi-même , dans cette entrée brusque d' un inconnu à le plus profond de son être .","on VSENT un NCSENT à se INF ainsi à le NC ; on PRES un NCo dans ce NCmod de soi-même , dans ce NCmod ADJ de un NCmod à le plus ADJ de DETPOSS être ."
762,Zola/1866_Le_voeu_d_une_morte._clean.txt,"En quelques minutes , les deux jeunes gens se connaissaient comme s' ils ne s' étaient jamais quittés depuis leur enfance .","en quelque NCT , le NUM ADJ NCs se VIMP comme si il ne se être ADVTEMPS PPAS depuis lui NC ."
763,Zola/1866_Le_voeu_d_une_morte._clean.txt,"Ils avaient fini par se mettre côte à côte sur le banc , et ils riaient en frères .","il avoir VASP par se mettre NC à NCmod sur le NCmod , et il VIMP en NC ."
764,Zola/1866_Le_voeu_d_une_morte._clean.txt,La sympathie naît à la fois de les ressemblances et de les dissemblances .,le NCSENT PRES à le fois de le NC et de le NC .
765,Zola/1866_Le_voeu_d_une_morte._clean.txt,"Le nouvel ami de Daniel s' était sans doute senti attiré vers lui par son visage inquiet , sa gaucherie , son aspect doux et bizarre .","le ADJ NCs de NP se être sans NCSENT sentir VSENT vers lui par DETPOSS NCCOR ADJ , DETPOSS NC , DETPOSS NC ADJ et ADJ ."
766,Zola/1866_Le_voeu_d_une_morte._clean.txt,"Lui qui avait la force et la beauté , il se plaisait à être bon pour les êtres chétifs .","il qui avoir le NCSENT et le NC , il se VIMP à être ADJ pour le être ADJ ."
767,Zola/1866_Le_voeu_d_une_morte._clean.txt,"Puis , lorsqu' ils eurent causé , ils se sentirent frères pour la vie .","puis , lorsque il avoir PPAS , il se sentir NC pour le NCmod ."
768,Zola/1866_Le_voeu_d_une_morte._clean.txt,"Tous deux étaient orphelins , tous deux avaient choisi l' âpre recherche de le vrai par la voie de les sciences , tous deux ne devaient compter que sur eux-mêmes .","tout deux être ADJ , tout deux avoir PPAS le ADJ NCo de le vrai par le NC de le NCmod , tout NUM ne devoir INF que sur soi-même ."
769,Zola/1866_Le_voeu_d_une_morte._clean.txt,"Ils se ressemblaient , et les idées de l' un éveillaient dans l' esprit de l' autre de les idées semblables .","il se VIMP , et le NCs de le un VIMP dans le NC de le autre de le NCmod ADJ ."
770,Zola/1866_Le_voeu_d_une_morte._clean.txt,"Daniel , à le milieu de les hasards de la conversation , conta son histoire , en ayant soin de ne pas parler de la tâche pour laquelle il allait vivre désormais .","NP , à le milieu de le NCmod de le NCmod , VPS DETPOSS NCo , en avoir NCo de ne pas INF de le NC pour lequel il aller INF ADV ."
771,Zola/1866_Le_voeu_d_une_morte._clean.txt,"D' ailleurs , il n' eut pas besoin de se faire violence : il avait mis son dévouement à le plus profond de son cœur , et il le tenait là , loin de les regards de tous .","de ADVLIEU , il ne avoir pas NCo de se faire NC : il avoir mettre DETPOSS NCo à le plus ADJ de DETPOSS NC , et il le VIMP ADVLIEU , ADVLIEU de le NCMAN de tout ."
772,Zola/1866_Le_voeu_d_une_morte._clean.txt,Il apprit que son compagnon luttait avec courage contre la pauvreté .,il VPS que DETPOSS NCs VIMP avec NC contre le NCmod .
773,Zola/1866_Le_voeu_d_une_morte._clean.txt,"Arrivé à Paris sans un sou , ce garçon à l' âme virile , à l' intelligence puissante , s' était dit qu' il deviendrait un de les savants distingués de son âge .","PPAS à NP sans un NC , ce NCs à le NCmod ADJ , à le NCmod ADJ , se être VDIC que il devenir un de le NCmod VCOG de DETPOSS NC ."
774,Zola/1866_Le_voeu_d_une_morte._clean.txt,"En attendant de s' élever , il tâchait de vivre ; il gagnait quelque argent à faire de les besognes ingrates ; puis , le soir , il étudiait , il veillait parfois la nuit entière .","en PPRES de se INF , il VIMP de INF ; il VIMP quelque NCo à faire de le NC ADJ ; puis , le NCT , il VIMP , il VIMP ADVTEMPS le NCT ADJ ."
775,Zola/1866_Le_voeu_d_une_morte._clean.txt,"Tandis qu' ils se confiaient l' un à l' autre avec l' abandon de la jeunesse , l' ombre , sous les marronniers , devenait plus noire .","PHASE que il se VIMP le un à le autre avec le NCmod de le NCmod , le NCs , sous le NCmod , devenir plus ADJ ."
776,Zola/1866_Le_voeu_d_une_morte._clean.txt,On n' apercevait plus que les taches faites par les tabliers et par les coiffes de les bonnes .,on ne VIMP plus que le NC faire par le NC et par le NC de le ADJ .
777,Zola/1866_Le_voeu_d_une_morte._clean.txt,"Il venait de les coins de le jardin un murmure vague , mêlé de rires , qui s' éteignait doucement dans le crépuscule .","il venir de le NC de le NCmod un NC ADJ , PPAS de NCMAN , qui se VIMP ADVMAN dans le NC ."
778,Zola/1866_Le_voeu_d_une_morte._clean.txt,"Les tambours battirent , les derniers promeneurs gagnèrent les portes .","le NCs VPS , le ADJ NCs VPS le NCo ."
779,Zola/1866_Le_voeu_d_une_morte._clean.txt,"Daniel et son camarade se levèrent , et tout en causant se dirigèrent ensemble vers la petite grille qui faisait alors face à la rue Royer-Collard .","NP et DETPOSS NC se VPS , et tout en PPRES se VPS ensemble vers le ADJ NC qui faire alors ADV à le NC NP ."
780,Zola/1866_Le_voeu_d_une_morte._clean.txt,"Arrivés sur le trottoir de la rue d' Enfer , ils s' arrêtèrent un instant , continuant leurs confidences .","PPAS sur le NC de le NCmod de NP , il se VPS un NCo , PPRES DETPOSS NCo ."
781,Zola/1866_Le_voeu_d_une_morte._clean.txt,"À le milieu d' une phrase , le jeune homme s' interrompit , et interrogeant son compagnon : Où allez-vous ?","à le milieu de un NCmod , le ADJ NCs se PRES , et VDIC DETPOSS NCo : où allez-vous ?"
782,Zola/1866_Le_voeu_d_une_morte._clean.txt,lui demanda -t -il .,lui VPS t il .
783,Zola/1866_Le_voeu_d_une_morte._clean.txt,"Je ne sais pas , répondit tranquillement Daniel .","je ne VCOG pas , VDIC ADVMAN NP ."
784,Zola/1866_Le_voeu_d_une_morte._clean.txt,Comment !,comment !
785,Zola/1866_Le_voeu_d_une_morte._clean.txt,"vous n' avez pas de demeure , vous ne savez où coucher ?","vous ne avoir pas un NC , vous ne VCOG où INF ?"
786,Zola/1866_Le_voeu_d_une_morte._clean.txt,Non .,non .
787,Zola/1866_Le_voeu_d_une_morte._clean.txt,"Vous avez mangé , à le moins ?","vous avoir PPAS , à le moins ?"
788,Zola/1866_Le_voeu_d_une_morte._clean.txt,"Ma foi , non .","DETPOSS NC , non ."
789,Zola/1866_Le_voeu_d_une_morte._clean.txt,Ils se mirent à rire tous deux .,il se PRES à INF tout NUM .
790,Zola/1866_Le_voeu_d_une_morte._clean.txt,Daniel paraissait enchanté .,NP VIMP VSENT .
791,Zola/1866_Le_voeu_d_une_morte._clean.txt,"Alors , l' autre , d' une voix simple : Venez avec moi , dit -il .","alors , le autre , de un NCMAN ADJ : venir avec soi , VDIC il ."
792,Zola/1866_Le_voeu_d_une_morte._clean.txt,Et il le conduisit chez une fruitière où il prenait ses repas .,et il le VPS chez un NC où il VIMP DETPOSS NCo .
793,Zola/1866_Le_voeu_d_une_morte._clean.txt,On fit réchauffer un restant de ragoût que Daniel dévora : il n' avait pas mangé depuis l' avant-veille .,on faire INF un NCo de NCmod que NP VSENT : il ne avoir pas PPAS depuis le NC .
794,Zola/1866_Le_voeu_d_une_morte._clean.txt,"Puis , son compagnon le mena dans la petite chambre qu' il occupait , impasse Saint-Dominique-d'Enfer , à le n° 7 .","puis , DETPOSS NCs le VPS dans le ADJ NC que il VIMP , NC NP , à le ° NUM ."
795,Zola/1866_Le_voeu_d_une_morte._clean.txt,La maison est aujourd'hui démolie .,le NCspas être ADVT PPAS .
796,Zola/1866_Le_voeu_d_une_morte._clean.txt,"C' était un vaste logis , à les larges escaliers , à les longues fenêtres , qui avait servi autrefois de couvent ; les mansardes , situées sur le derrière , dominaient de grands jardins plantés de beaux arbres .","ce être un ADJ NC , à le ADJ NC , à le ADJ NC , qui avoir PPAS ADVT de NC ; le NCs , PPAS sur le ADVLIEU , VIMP un ADJ NCo PPAS de ADJ NC ."
797,Zola/1866_Le_voeu_d_une_morte._clean.txt,"Les deux jeunes gens , assis devant la fenêtre ouverte , regardant les ombres noires de les ormes , achevèrent de mettre leur cœur à nu .","le NUM ADJ NCs , PPAS ADVLIEU le NC ADJ , VCOG le NCo ADJ de le NCmod , VASP de mettre lui NCo à NC ."
798,Zola/1866_Le_voeu_d_une_morte._clean.txt,"À minuit , ils causaient encore , la main dans la main .","à NC , il VIMP encore , le NCCOR dans le NCCOR ."
799,Zola/1866_Le_voeu_d_une_morte._clean.txt,Daniel se coucha sur un petit canapé dont l' étoffe rouge s' en allait par lambeaux .,NP se VPS sur un ADJ NC dont le NCs ADJCOL se en aller par NC .
800,Zola/1866_Le_voeu_d_une_morte._clean.txt,"Quand la lampe fut éteinte : À propos , lui dit son ami , je me nomme Georges Raymond .","quand le NCspas être PPAS : à NC , lui VDIC DETPOSS NCo , je me PRES NP NP ."
801,Zola/1866_Le_voeu_d_une_morte._clean.txt,Et vous ?,et vous ?
802,Zola/1866_Le_voeu_d_une_morte._clean.txt,"Moi , répondit -il , je me nomme Daniel Raimbault .","soi , VDIC il , je me PRES NP NP ."
803,Zola/1866_Le_voeu_d_une_morte._clean.txt,"Le lendemain , Georges présentait Daniel à une sorte d' auteur-éditeur pour lequel il travaillait , et le faisait admettre comme collaborateur à un dictionnaire encyclopédique qui occupait une trentaine de jeunes gens .","le NC , NP VIMP NP à un sorte de NCmod pour lequel il VIMP , et le faire INF comme NC à un NC ADJ qui VIMP un NCo de ADJ NCmod ."
804,Zola/1866_Le_voeu_d_une_morte._clean.txt,"On était là , pour ainsi dire , à titre de commis ; on compilait , on collationnait pendant dix heures et on touchait quatre-vingts à cent francs par mois , selon les mérites .","on être ADVLIEU , pour ainsi VDIC , à NC de NCmod ; on VIMP , on VIMP PHASE NUM NCT et on VIMP NCo à NUM NC par NCT , selon le NC ."
805,Zola/1866_Le_voeu_d_une_morte._clean.txt,"Le patron se promenait dans le bureau , de le pas d' un maître d' étude qui surveille de les élèves ; il ne lisait même pas les manuscrits , et il signait le tout .","le NCs se VIMP dans le NC , de le pas de un NCmod de NCmod qui PRES de le NC ; il ne VIMP même pas le NCo , et il VIMP le tout ."
806,Zola/1866_Le_voeu_d_une_morte._clean.txt,Ce métier de garde-chiourme lui rapportait environ vingt mille francs par an .,ce NCs de NCmod lui VIMP environ NUM NUM NCo par NCT .
807,Zola/1866_Le_voeu_d_une_morte._clean.txt,Daniel accepta avec joie et reconnaissance le labeur de brute qu' on lui offrait .,NP VPS avec NCSENT et VSUBP le NCo de NCmod que on lui VIMP .
808,Zola/1866_Le_voeu_d_une_morte._clean.txt,"Georges , qui lui avait avancé quelque argent , toutes ses économies , lui ouvrit un crédit chez la fruitière et lui loua , dans la maison de l' impasse Saint-Dominique-d'Enfer , une chambre voisine de la sienne .","NP , qui lui avoir PPAS quelque NCo , tout DETPOSS NC , lui VPS un NCo chez le NC et lui VPS , dans le NC de le NCmod NP , un NCo ADJ de le sien ."
809,Zola/1866_Le_voeu_d_une_morte._clean.txt,"Pendant les premiers quinze jours , Daniel fut comme écrasé par la vie nouvelle qu' il menait .","PHASE le ADJ NUM NCT , NP être comme PPAS par le NC ADJ que il VIMP ."
810,Zola/1866_Le_voeu_d_une_morte._clean.txt,"Il n' était pas accoutumé à un pareil travail ; le soir , il avait la tête pleine de ce qu' il avait fait dans la journée .","il ne être pas PPAS à un NC NCmod ; le NCT , il avoir le NCCOR ADJ de ce que il avoir faire dans le NCT ."
811,Zola/1866_Le_voeu_d_une_morte._clean.txt,Il ne pensait presque plus pour son propre compte .,il ne VCOG presque plus pour DETPOSS ADJ NC .
812,Zola/1866_Le_voeu_d_une_morte._clean.txt,"Un dimanche matin , comme il avait tout un jour de liberté devant lui , il fut pris de le désir ardent de revoir Jeanne .","un ADVT NCT , comme il avoir tout un NCT de NCmod ADVLIEU lui , il être PPAS de le NCSENT ADJ de VCOG NP ."
813,Zola/1866_Le_voeu_d_une_morte._clean.txt,"La nuit , il avait rêvé de la pauvre morte , et tout son enthousiasme lui était revenu .","le NCT , il avoir PPAS de le NC ADJ , et tout DETPOSS NCs lui être PPAS ."
814,Zola/1866_Le_voeu_d_une_morte._clean.txt,"Il sortit furtivement , sans prévenir Georges , et se dirigea vers le boulevard de les Invalides .","il VPS ADV , sans INF NP , et se VPS vers le NC de le NCmod ."
815,Zola/1866_Le_voeu_d_une_morte._clean.txt,"Gaiement , il fit le chemin .","ADV , il faire le NCo ."
816,Zola/1866_Le_voeu_d_une_morte._clean.txt,"Ses membres s' étaient raidis pendant les quinze jours qu' il venait de passer , assis sur une chaise , feuilletant de vieux livres ; il lui semblait qu' il se trouvait en congé , comme un écolier qui doit , le lendemain , retourner à son collège .","DETPOSS NCs se être VPS PHASE le NUM NCT que il venir de INF , PPAS sur un NC , PPRES un ADJ NCo ; il lui sembler que il se VIMP en NC , comme un NC qui devoir , le NC , INF à DETPOSS NC ."
817,Zola/1866_Le_voeu_d_une_morte._clean.txt,"Il ne songeait guère , il se disait qu' il allait voir Jeanne , et il jouissait en enfant de l' air et de la marche .","il ne VIMP guère , il se VDIC que il aller VCOG NP , et il VIMP en NC de le NCMAN et de le NC ."
818,Zola/1866_Le_voeu_d_une_morte._clean.txt,"De l' impasse Saint-Dominique-d'Enfer à le boulevard de les Invalides , tout lui parut joyeux : pas la moindre tristesse , pas la plus mince inquiétude .","de le NC NP à le NCmod de le NP , tout lui paraître ADJ : pas le ADJ NCSENT , pas le plus NC ADJ ."
819,Zola/1866_Le_voeu_d_une_morte._clean.txt,"Quand il fut devant la grille de l' hôtel , une peur subite le prit .","quand il être ADVLIEU le NC de le NCmod , un NCSENT PPAS le NCo ."
820,Zola/1866_Le_voeu_d_une_morte._clean.txt,"Il se demanda ce qu' il ferait là , ce qu' il dirait et ce qu' on lui répondrait .","il se VPS ce que il faire ADVLIEU , ce que il VDIC et ce que on lui VDIC ."
821,Zola/1866_Le_voeu_d_une_morte._clean.txt,Il eut une défaillance .,il avoir un NCo .
822,Zola/1866_Le_voeu_d_une_morte._clean.txt,"Ce qui l' embarrassait surtout , c' était d' expliquer sa visite .","ce qui le VSENT surtout , ce être de VDIC DETPOSS NCo ."
823,Zola/1866_Le_voeu_d_une_morte._clean.txt,"Mais il ne voulut pas réfléchir , car il sentait le courage lui échapper , et il sonna bravement , tout frémissant à le fond de lui .","mais il ne vouloir pas INF , car il sentir le NCo lui INF , et il VPS ADVMAN , tout PPRES à le NC de lui ."
824,Zola/1866_Le_voeu_d_une_morte._clean.txt,"La porte s' ouvrit , il traversa le jardin , et , comprenant que jamais il n' avait été plus gauche , il s' arrêta sur la première marche de le perron .","le NCs se VPS , il VPS le NCo , et , VCOG que ADVTEMPS il ne avoir être plus ADJ , il se VPS sur le ADJ NC de le NCmod ."
825,Zola/1866_Le_voeu_d_une_morte._clean.txt,"Quand il eut repris haleine , il se hasarda à lever les yeux .","quand il avoir PPAS ADJ , il se VPS à INF le NCCOR ."
826,Zola/1866_Le_voeu_d_une_morte._clean.txt,"On entendait dans l' hôtel un bruit violent de marteaux ; de les menuisiers réparaient les portes dans le vestibule ; et il y avait de les peintres , accrochés le long de la façade , qui grattaient les murs .","on VCOG dans le NC un NCo ADJ de NCmod ; de le NCs VIMP le NCo dans le NC ; et il y avoir de le NC , PPAS le NC de le NCmod , qui VIMP le NCo ."
827,Zola/1866_Le_voeu_d_une_morte._clean.txt,"Daniel , étonné , peut-être même un peu satisfait , s' approcha d' un ouvrier et lui demanda où était M. de Rionne .","NP , VSENT , peut-être même un peu ADJ , se VPS de un NC et lui VPS où être monsieur de NP ."
828,Zola/1866_Le_voeu_d_une_morte._clean.txt,"L' ouvrier le renvoya à le concierge , qui lui apprit que M. de Rionne venait de vendre l' hôtel et qu' il habitait maintenant rue de Provence .","le NCs le VPS à le NC , qui lui VCOG que monsieur de NP venir de INF le NCo et que il VIMP ADVT NCo de NP ."
829,Zola/1866_Le_voeu_d_une_morte._clean.txt,"Le lendemain de la mort de sa femme , le veuf s' était mis à exécrer ce logis , qui restait plein de sanglots .","le NC de le NCmod de DETPOSS NCmod , le NCs se être mettre à VSENT ce NCo , qui VIMP ADV de NC ."
830,Zola/1866_Le_voeu_d_une_morte._clean.txt,"Les senteurs de l' enterrement traînaient encore dans les chambres , et il frissonnait lorsqu' il descendait l' escalier , croyant toujours entendre le bruit de la bière heurtant les marches .","le NCs de le NCmod VIMP encore dans le NC , et il VIMP lorsque il VIMP le NCo , VCOG ADVTEMPS VCOG le NCo de le NCmod VSENT le NCo ."
831,Zola/1866_Le_voeu_d_une_morte._clean.txt,Il résolut de changer de demeure à le plus vite .,il PRES de INF de NC à le plus ADV .
832,Zola/1866_Le_voeu_d_une_morte._clean.txt,"Puis , il songea que la vente de l' hôtel lui mettrait entre les mains une somme assez ronde .","puis , il VPS que le NCs de le NCmod lui mettre entre le NCCOR un NCmod ADV ADJ ."
833,Zola/1866_Le_voeu_d_une_morte._clean.txt,"D' autre part , il n' était pas fâché de quitter le boulevard de les Invalides et d' aller se loger en plein quartier élégant .","de autre NC , il ne être pas VSENT de INF le NCo de le NCmod et de aller se INF en ADJ NC ADJ ."
834,Zola/1866_Le_voeu_d_une_morte._clean.txt,"Quand il pourrait reprendre sa vie de garçon , le vice y serait à portée de sa main .","quand il pouvoir INF DETPOSS NCo de NCmod , le NCs y être à NC de DETPOSS NCCOR ."
835,Zola/1866_Le_voeu_d_une_morte._clean.txt,Il loua tout un premier étage et déménagea .,il VPS tout un ADJ NCo et VPS .
836,Zola/1866_Le_voeu_d_une_morte._clean.txt,"Daniel prit la nouvelle adresse , et poussé par son désir de voir Jeanne à tout prix , il se dirigea vers la rue de Provence .","NP VPS le ADJ NCo , et PPAS par DETPOSS NCSENT de VCOG NP à tout NC , il se VPS vers le NC de NP ."
837,Zola/1866_Le_voeu_d_une_morte._clean.txt,"Mais , pendant cette longue course , son cœur ne chantait plus si gaiement : les difficultés de sa tâche , l' incertitude de la vie se présentaient à lui plus menaçantes que jamais .","mais , PHASE ce ADJ NC , DETPOSS NCs ne VIMP plus si NC : le NCs de DETPOSS NCmod , le NCs de le NCmod se VIMP à lui plus ADJ que ADVTEMPS ."
838,Zola/1866_Le_voeu_d_une_morte._clean.txt,"Une averse l' obligea à se mettre sous une porte , il lui fallut marcher dans la boue , et , quand il monta l' escalier somptueux de la maison où habitait M. de Rionne , il remarqua avec terreur qu' il était horriblement crotté .","un NCs le VPS à se mettre sous un NC , il lui VPS INF dans le NC , et , quand il VPS le NCo ADJ de le NCmod où VIMP monsieur de NP , il VPS avec NCSENT que il être ADVINT PPAS ."
839,Zola/1866_Le_voeu_d_une_morte._clean.txt,Ce fut Louis qui lui ouvrit .,ce être NP qui lui VPS .
840,Zola/1866_Le_voeu_d_une_morte._clean.txt,"Sa face froide n' exprima pas la moindre surprise ; on eût dit qu' il ne reconnaissait pas le jeune homme ; mais il y avait , dans les coins de ses lèvres , cet imperceptible sourire qui ne le quittait point .","DETPOSS NCs ADJ ne VPS pas le ADJ NCSENT ; on avoir VDIC que il ne VCOG pas le ADJ NCo ; mais il y avoir , dans le NC de DETPOSS NCCOR , ce ADJ NCMAN qui ne le VIMP ADV ."
841,Zola/1866_Le_voeu_d_une_morte._clean.txt,"Il dit poliment à Daniel que Monsieur n' était pas là , mais qu' il ne tarderait pas à rentrer ; et il l' introduisit dans un magnifique salon , où il le laissa seul .","il VDIC ADVMAN à NP que monsieur ne être pas ADVLIEU , mais que il ne VCOND pas à INF ; et il le VPS dans un ADJ NC , où il le laisser ADJ ."
842,Zola/1866_Le_voeu_d_une_morte._clean.txt,Daniel n' osa pas s' asseoir .,NP ne VPS pas se INF .
843,Zola/1866_Le_voeu_d_une_morte._clean.txt,"Ses pieds faisaient sur le tapis de larges taches , et il restait planté sur les jambes , redoutant d' avancer d' un pas , car le cœur lui manquait à chaque nouvelle trace qu' il laissait de son passage .","DETPOSS NCCOR faire sur le NC de NCmod ADJ , et il VIMP PPAS sur le NCCOR , VSENT de INF de un pas , car le NCs lui VIMP à chaque ADJ NC que il laisser de DETPOSS NC ."
844,Zola/1866_Le_voeu_d_une_morte._clean.txt,"En levant les yeux , il vint à se voir en pied dans une grande glace : rien ne lui parut plus étrange que sa personne , et cela le mit presque en gaieté .","en PPRES le NCCOR , il venir à se VCOG en NCCOR dans un ADJ NC : rien ne lui paraître plus ADJ que DETPOSS NC , et cela le mettre presque en NCSENT ."
845,Zola/1866_Le_voeu_d_une_morte._clean.txt,"À le fond , il était enchanté de la tournure que prenaient les choses .","à le NC , il être VSENT de le NC que VIMP le chose ."
846,Zola/1866_Le_voeu_d_une_morte._clean.txt,"Il ne tenait pas de le tout à voir M. de Rionne , et il espérait qu' il allait pouvoir embrasser Jeanne , puis se retirer bien vite avant que le père rentrât .","il ne VIMP pas de le tout à VCOG monsieur de NP , et il VCOG que il aller pouvoir INF NP , puis se INF bien ADV PHASE que le NCs VSUBI ."
847,Zola/1866_Le_voeu_d_une_morte._clean.txt,"Il se penchait , il écoutait avec anxiété .","il se VIMP , il VCOG avec NCSENT ."
