id,titre,phrase,motifs_phrase
2686,Zola/1888_16_Le_reve._clean.txt,"Il n' eut pas une parole , pas un geste .","il ne avoir pas un NCo , pas un NC ."
2687,Zola/1888_16_Le_reve._clean.txt,"Il attendait , haut , rigide .","il VIMP , ADJ , ADJ ."
2688,Zola/1888_16_Le_reve._clean.txt,"Ô monseigneur , je suis venue , pour que vous puissiez me voir ... Vous m' avez refusée , seulement vous ne me connaissiez pas .","INTJ NC , je être venir , pour que vous PRES me VCOG ... vous le avoir PPAS , seulement vous ne me PRES pas ."
2689,Zola/1888_16_Le_reve._clean.txt,"Et me voilà , regardez -moi , avant de me repousser encore ... Je suis celle qui aime et qui est aimée , et rien autre , rien en dehors de cet amour , rien qu' une enfant pauvre , recueillie à la porte de cette église ... Vous me voyez à vos pieds , combien je suis petite , faible et humble .","et me voilà , VCOG soi , PHASE de me INF encore ... je être celui qui VSENT et qui être VSENT , et rien autre , rien en NCmod de ce NCSENT , rien que un NCs ADJ , PPAS à le NC de ce NCmod ... vous me VCOG à DETPOSS NCCOR , combien je être ADJ , ADJ et ADJ ."
2690,Zola/1888_16_Le_reve._clean.txt,"Cela vous sera facile de m' écarter , si je vous gêne .","cela vous être ADJ de se INF , si je vous PRES ."
2691,Zola/1888_16_Le_reve._clean.txt,"Vous n' avez qu' à lever un doigt , pour me détruire ... Mais , que de larmes !","vous ne avoir que à INF un NCCOR , pour me INF ... mais , que de NC !"
2692,Zola/1888_16_Le_reve._clean.txt,Il faut savoir ce qu' on souffre .,il PRES VCOG ce que on VSENT .
2693,Zola/1888_16_Le_reve._clean.txt,"Alors , on est pitoyable ... J' ai voulu , à mon tour , défendre ma cause , monseigneur .","alors , on être ADJ ... je avoir vouloir , à DETPOSS NC , INF DETPOSS NCo , NC ."
2694,Zola/1888_16_Le_reve._clean.txt,"Je suis une ignorante , je sais uniquement que j' aime et que je suis aimée ... Cela ne suffit -il point ?","je être un NC , je VCOG ADV que je VSENT et que je être VSENT ... cela ne PRES il ADV ?"
2695,Zola/1888_16_Le_reve._clean.txt,"Aimer , aimer et le dire !","VSENT , VSENT et le VDIC !"
2696,Zola/1888_16_Le_reve._clean.txt,"Et elle continuait en phrases coupées et soupirées , elle se confessait toute , dans un élan de naïveté , de passion croissante .","et il VIMP en NC ADJ et ADJ , il se VIMP tout , dans un NC de NCmod , de NCSENT ADJ ."
2697,Zola/1888_16_Le_reve._clean.txt,C' était l' amour qui avoue .,ce être le NCSENT qui VDIC .
2698,Zola/1888_16_Le_reve._clean.txt,"Elle osait ainsi , parce qu' elle était chaste .","il VIMP ainsi , parce que il être ADJ ."
2699,Zola/1888_16_Le_reve._clean.txt,"Peu à peu , elle avait relevé la tête .","peu à peu , il avoir PPAS le NCCOR ."
2700,Zola/1888_16_Le_reve._clean.txt,"Nous nous aimons , monseigneur .","nous nous VSENT , NC ."
2701,Zola/1888_16_Le_reve._clean.txt,"Lui , sans doute , vous a expliqué comment cette chose a pu se faire .","il , sans NCSENT , vous avoir VDIC comment ce chose avoir pouvoir se faire ."
2702,Zola/1888_16_Le_reve._clean.txt,"Moi , souvent , je me le suis demandé , sans parvenir à me répondre ... Nous nous aimons , et si c' est un crime , pardonnez -le , car il est venu de loin , de les arbres et de les pierres mêmes qui nous entouraient .","soi , ADVTEMPS , je me le être PPAS , sans INF à me VDIC ... nous nous VSENT , et si ce être un NC , IMP le , car il être venir de ADVLIEU , de le NC et de le NC même qui nous VIMP ."
2703,Zola/1888_16_Le_reve._clean.txt,"Quand j' ai su que je l' aimais , il était trop tard pour ne plus l' aimer ... Maintenant , est -ce possible de vouloir cela ?","quand je avoir VCOG que je le aimais , il être trop tard pour ne plus le VSENT ... ADVT , être ce ADJ de vouloir cela ?"
2704,Zola/1888_16_Le_reve._clean.txt,"Vous pouvez le garder chez vous , le marier ailleurs , mais vous n' arriverez pas à faire qu' il ne m' aime point .","vous pouvoir le INF chez vous , le NC ADVLIEU , mais vous ne IMP pas à faire que il ne le VSENT ADV ."
2705,Zola/1888_16_Le_reve._clean.txt,"Il mourra sans moi , comme je mourrai sans lui .","il VF sans soi , comme je VF sans lui ."
2706,Zola/1888_16_Le_reve._clean.txt,"Lorsqu' il n' est pas là , à mon côté , je sens bien qu' il y est encore , que nous ne nous séparons plus , que l' un emporte le cœur de l' autre .","lorsque il ne être pas ADVLIEU , à DETPOSS NC , je sentir bien que il y être encore , que nous ne nous VF plus , que le un PRES le NCo de le autre ."
2707,Zola/1888_16_Le_reve._clean.txt,"Je n' ai qu' à fermer les yeux , je le revois , il est en moi ... Et vous nous arracheriez de cette union ?","je ne avoir que à INF le NCCOR , je le NC , il être en soi ... et vous nous VCOND de ce NC ?"
2708,Zola/1888_16_Le_reve._clean.txt,"monseigneur , cela est divin , ne nous empêchez pas de nous aimer .","NC , cela être ADJ , ne nous IMP pas de nous VSENT ."
2709,Zola/1888_16_Le_reve._clean.txt,"Il la regardait , si fraîche , si simple , d' une odeur de bouquet , dans sa petite robe d' ouvrière .","il le VCOG , si NC , si ADJ , de un NC de NCmod , dans DETPOSS ADJ NC de NCmod ."
2710,Zola/1888_16_Le_reve._clean.txt,"Il l' écoutait dire le cantique de son amour , d' une voix pénétrante de charme , peu à peu raffermie .","il le VCOG VDIC le NC de DETPOSS NCSENT , de un NCMAN ADJ de NCmod , peu à peu NCmod ."
2711,Zola/1888_16_Le_reve._clean.txt,"Mais le chapeau de jardin glissa sur ses épaules , ses cheveux de lumière lui nimbèrent le visage d' or fin ; et elle lui apparut comme une de ces vierges légendaires de les anciens missels , avec quelque chose de frêle , de primitif , d' élancé dans la passion , de passionnément pur .","mais le NCs de NCmod VPS sur DETPOSS NCCOR , DETPOSS NCCOR de NCmod lui VPS le NCCOR de NCmod NC ; et il lui VPS comme un de ce NCmod ADJ de le ADJ NCmod , avec quelque chose de NCmod , de NC , de NC dans le NCSENT , de ADVINT ADJ ."
2712,Zola/1888_16_Le_reve._clean.txt,"Soyez bon , monseigneur ... Vous êtes le maître , faites que nous soyons heureux .","être ADJ , NC ... vous être le NC , faire que nous PRES ADJ ."
2713,Zola/1888_16_Le_reve._clean.txt,"Elle l' implorait , elle courbait de nouveau le front , en le voyant si froid , toujours sans une parole , sans un geste .","il le VIMP , il VIMP de ADJ le NCCOR , en le VCOG si ADJ , ADVTEMPS sans un NC , sans un NC ."
2714,Zola/1888_16_Le_reve._clean.txt,Ah !,INTJ !
2715,Zola/1888_16_Le_reve._clean.txt,"cette enfant éperdue à ses pieds , cette odeur de jeunesse qui s' exhalait de sa nuque ployée devant lui !","ce NCs PPAS à DETPOSS NCCOR , ce NC de NCmod qui se VIMP de DETPOSS NC PPAS ADVLIEU lui !"
2716,Zola/1888_16_Le_reve._clean.txt,"Là , il retrouvait les petits cheveux blonds , si follement baisés autrefois .","ADVLIEU , il VIMP le ADJ NCCOR ADJCOL , si ADVINT PPAS ADVT ."
2717,Zola/1888_16_Le_reve._clean.txt,"Celle dont le souvenir le torturait après vingt ans de pénitence avait cette jeunesse odorante , ce col d' une fierté et d' une grâce de lis .","celui dont le INF le NCs PHASE NUM NCT de NCmod avoir ce NCo ADJ , ce NC de un NCSENT et de un NC de NCmod ."
2718,Zola/1888_16_Le_reve._clean.txt,"Elle renaissait , c' était elle-même qui sanglotait , qui le suppliait d' être doux à la passion .","il VIMP , ce être elle-même qui VIMP , qui le VIMP de être ADJ à le NCSENT ."
2719,Zola/1888_16_Le_reve._clean.txt,"Les larmes étaient venues , Angélique continuait pourtant , voulait tout dire .","le NCs être venir , NP VIMP pourtant , vouloir tout VDIC ."
2720,Zola/1888_16_Le_reve._clean.txt,"Et , monseigneur , ce n' est pas seulement lui que j' aime , j' aime encore la noblesse de son nom , l' éclat de sa royale fortune ... Oui , je sais que , n' étant rien , n' ayant rien , j' ai l' air de le vouloir pour son argent; et , c' est vrai , c' est aussi pour son argent que je le veux ... Je vous dis cela , puisqu' il faut que vous me connaissiez ... Ah !","et , NC , ce ne être pas seulement lui que je VSENT , je VSENT encore le NCo de DETPOSS NCmod , le NC de DETPOSS ADJ NCmod ... oui , je VCOG que , ne être rien , ne avoir rien , je avoir le NCMAN de le vouloir pour DETPOSS argent; et , ce être vrai , ce être aussi pour DETPOSS NC que je le vouloir ... je vous VDIC cela , puisque il PRES que vous me PRES ... INTJ !"
2721,Zola/1888_16_Le_reve._clean.txt,"devenir riche par lui , avec lui , vivre dans la douceur et la splendeur de le luxe , lui devoir toutes les joies , être libres de notre amour , ne plus laisser de larmes , plus de misères , autour de nous !","devenir ADJ par lui , avec lui , INF dans le NC et le NC de le NCmod , lui devoir tout le NCSENT , être ADJ de DETPOSS NCSENT , ne plus laisser un NCo , plus de NC , ADV de nous !"
2722,Zola/1888_16_Le_reve._clean.txt,"... Depuis qu' il m' aime , je me vois vêtue de brocart , comme dans l' ancien temps ; j' ai à le cou , à les poignets , de les ruissellements de pierreries et de perles ; j' ai de les chevaux , de les carrosses , de grands bois où je me promène à pied , suivie par de les pages ... Jamais je ne pense à lui , sans recommencer ce rêve ; et je me dis que cela doit être , il a rempli mon désir d' être reine .","... depuis que il lui VSENT , je me ADV PPAS de NC , comme dans le ADJ temps ; je avoir à le NCCOR , à le NCCOR , de le NCmod de NCmod et de NC ; je avoir de le NC , de le NC , de ADJ NC où je me PRES à NCCOR , PPAS par de le NC ... ADVTEMPS je ne VCOG à lui , sans INF ce NCo ; et je me VDIC que cela devoir être , il avoir PPAS DETPOSS NCSENT de être ADJ ."
2723,Zola/1888_16_Le_reve._clean.txt,"Monseigneur , est -ce donc vilain , de l' aimer davantage , parce qu' il comblera tous mes souhaits d' enfant , les pluies d' or miraculeuses de les contes de fées ?","NCs , être ce donc ADJ , de le VSENT davantage , parce que il VSENT tout DETPOSS NCo de NCmod , le NC de NCmod ADJ de le NCmod de NCmod ?"
2724,Zola/1888_16_Le_reve._clean.txt,"Il la trouvait fière , redressée , avec son grand air charmant de princesse , dans sa simplicité .","il le VIMP NC , PPAS , avec DETPOSS ADJ NCMAN ADJ de NCmod , dans DETPOSS NC ."
2725,Zola/1888_16_Le_reve._clean.txt,"Et c' était bien l' autre , la même délicatesse de fleur , les mêmes larmes tendres , claires comme de les sourires .","et ce être bien le autre , le même NCSENT de NCmod , le même NC ADJ , ADJ comme de le NCMAN ."
2726,Zola/1888_16_Le_reve._clean.txt,"Toute une ivresse émanait d' elle , dont il sentait monter à sa face le frisson tiède , ce même frisson de le souvenir qui le jetait , la nuit , sanglotant à son prie-Dieu , troublant de ses plaintes le silence religieux de l' évêché .","tout un NCSENT VIMP de il , dont il sentir INF à DETPOSS NC le NCSENT ADJ , ce même NCSENT de le NCmod qui le VIMP , le NCT , PPRES à DETPOSS NC , PPRES de DETPOSS NC le NC ADJ de le NCmod ."
2727,Zola/1888_16_Le_reve._clean.txt,"Jusqu' à trois heures de le matin , la veille , il avait lutté encore ; et cette aventure d' amour , cette passion remuée ainsi , irritait son inguérissable blessure .","jusque à NUM NCT de le NCT , le NC , il avoir PPAS encore ; et ce NC de NCSENT , ce NCSENT PPAS ainsi , VSENT DETPOSS ADJ NCo ."
2728,Zola/1888_16_Le_reve._clean.txt,"Mais , derrière son impassibilité , rien n' apparaissait , ne trahissait l' effort de le combat , pour dompter les battements de le cœur .","mais , ADVLIEU DETPOSS NC , rien ne VIMP , ne VIMP le NCo de le NCmod , pour INF le NCo de le NCmod ."
2729,Zola/1888_16_Le_reve._clean.txt,"S' il perdait son sang goutte à goutte , personne ne le voyait couler : il n' en était que plus pâle et plus muet .","si il VIMP DETPOSS NCCOR PRES à NC , personne ne le VCOG INF : il ne en être que plus ADJ et plus ADJ ."
2730,Zola/1888_16_Le_reve._clean.txt,"Alors , ce grand silence obstiné désespéra Angélique , qui redoubla de supplications .","alors , ce ADJ NCs ADJ VPS NP , qui VPS de NC ."
2731,Zola/1888_16_Le_reve._clean.txt,"Je me remets entre vos mains , monseigneur .","je me PRES entre DETPOSS NCCOR , NC ."
2732,Zola/1888_16_Le_reve._clean.txt,"Ayez pitié , décidez de mon sort .","avoir PPAS , IMP de DETPOSS NC ."
2733,Zola/1888_16_Le_reve._clean.txt,"Et il ne parlait toujours pas , il la terrifiait , comme s' il avait grandi devant elle , d' une redoutable majesté .","et il ne VIMP ADVTEMPS pas , il le VSENT , comme si il avoir PPAS ADVLIEU il , de un ADJ NC ."
2734,Zola/1888_16_Le_reve._clean.txt,"La cathédrale déserte , avec ses bas-côtés déjà sombres , ses voûtes hautes où se mourait le jour , élargissait encore l' angoisse de l' attente .","le NC ADJ , avec DETPOSS NCmod déjà ADJ , DETPOSS NCs ADJ où se VCOND le NCT , VIMP encore le NCSENT de le NCmod ."
2735,Zola/1888_16_Le_reve._clean.txt,"Dans la chapelle , on ne distinguait même plus les pierres tombales , il ne restait que lui , avec sa soutane noire , sa longue face blanche , qui semblait seule avoir gardé de la lumière .","dans le NC , on ne VCOG même plus le NCo ADJ , il ne VIMP que lui , avec DETPOSS NC ADJ , DETPOSS ADJ NCo ADJCOL , qui sembler ADJ avoir PPAS de le NC ."
2736,Zola/1888_16_Le_reve._clean.txt,"Elle en voyait les yeux luire , s' attacher sur elle avec un éclat croissant .","il en VCOG le NCCOR ADV , se INF sur il avec un NC ADJ ."
2737,Zola/1888_16_Le_reve._clean.txt,Était -ce donc de la colère qui les allumait de la sorte ?,être ce donc de le NCSENT qui le VIMP de le sorte ?
2738,Zola/1888_16_Le_reve._clean.txt,"Monseigneur , si je n' étais pas venue , je me serais éternellement reproché d' avoir fait notre malheur à tous deux , par manque de courage ... Dites , je vous en supplie , dites que j' ai eu raison , que vous consentez .","NC , si je ne être pas venir , je me être ADV PPAS de avoir faire DETPOSS NCo à tout NUM , par NC de NCmod ... NP , je vous en NC , VDIC que je avoir avoir NCo , que vous PRES ."
2739,Zola/1888_16_Le_reve._clean.txt,À quoi bon discuter avec cette enfant ?,à quoi ADJ INF avec ce NC ?
2740,Zola/1888_16_Le_reve._clean.txt,"Il avait donné à son fils les raisons de son refus , cela suffisait .","il avoir PPAS à DETPOSS NC le NCo de DETPOSS NCmod , cela VIMP ."
2741,Zola/1888_16_Le_reve._clean.txt,"S' il ne parlait pas , c' était qu' il croyait n' avoir rien à dire .","si il ne VIMP pas , ce être que il VCOG ne avoir rien à VDIC ."
2742,Zola/1888_16_Le_reve._clean.txt,"Elle le comprit sans doute , elle voulut se hausser jusqu' à ses mains , pour les baiser .","il le VCOG sans NCSENT , il vouloir se INF jusque à DETPOSS NCCOR , pour le INF ."
2743,Zola/1888_16_Le_reve._clean.txt,"Mais il les écarta violemment en arrière ; et elle s' effara , en remarquant que sa face pâle s' empourprait d' un brusque flot de sang .","mais il le VPS ADVMAN en NC ; et il se VSENT , en PPRES que DETPOSS NCs ADJ se VCOND de un ADJ NC de NCCOR ."
2744,Zola/1888_16_Le_reve._clean.txt,"Monseigneur ... Monseigneur ... Enfin , il ouvrit les lèvres , il lui dit un seul mot , le mot jeté à son fils : Jamais !","NCs ... NP ... PHASE , il VPS le NCCOR , il lui VDIC un ADJ NCo , le NC PPAS à DETPOSS NC : ADVTEMPS !"
2745,Zola/1888_16_Le_reve._clean.txt,"Et , sans même faire ses dévotions , ce jour -là , il partit .","et , sans même faire DETPOSS NCo , ce NCT ADVLIEU , il VPS ."
2746,Zola/1888_16_Le_reve._clean.txt,Ses pas graves se perdirent derrière les piliers de l' abside .,DETPOSS pas ADJ se VPS ADVLIEU le NC de le NCmod .
2747,Zola/1888_16_Le_reve._clean.txt,"Tombée sur les dalles , Angélique pleura longtemps à gros sanglots , dans la grande paix vide de l' église .","PPAS sur le NC , NP VPS longtemps à ADJ NC , dans le ADJ NCmod ADJ de le NCmod ."
2748,Zola/1888_16_Le_reve._clean.txt,"Dès le soir , dans la cuisine , en sortant de table , Angélique se confessa à les Hubert , dit sa démarche près de l' évêque et le refus de celui-ci .","dès le NCT , dans le NCmod , en PPRES de NC , NP se VPS à le NP , VDIC DETPOSS NCo ADVLIEU de le NC et le NC de celui-ci ."
2749,Zola/1888_16_Le_reve._clean.txt,"Elle était toute pâle , mais très calme .","il être tout ADJ , mais très NCSENT ."
2750,Zola/1888_16_Le_reve._clean.txt,Hubert fut bouleversé .,NP être VSENT .
2751,Zola/1888_16_Le_reve._clean.txt,Eh quoi !,INTJ quoi !
2752,Zola/1888_16_Le_reve._clean.txt,"déjà , sa chère enfant souffrait !","déjà , DETPOSS NC NCmod ADJ !"
2753,Zola/1888_16_Le_reve._clean.txt,Elle aussi était frappée à le cœur .,il aussi être frapper à le NC .
2754,Zola/1888_16_Le_reve._clean.txt,"Il en avait de les larmes plein les yeux , dans sa parenté de passion avec elle , cette fièvre de l' au-delà qui les emportait si aisément ensemble , à le moindre souffle .","il en avoir de le NC ADJ le NCCOR , dans DETPOSS NC de NCSENT avec il , ce VSENT de le ADV qui le VIMP si ADV ensemble , à le ADJ NC ."
2755,Zola/1888_16_Le_reve._clean.txt,Ah !,INTJ !
2756,Zola/1888_16_Le_reve._clean.txt,"ma pauvre chérie , pourquoi ne m' as -tu pas consulté ?","DETPOSS ADJ NC , pourquoi ne le avoir -tre pas PPAS ?"
2757,Zola/1888_16_Le_reve._clean.txt,"Je serais allé avec toi , j' aurais peut-être fléchi monseigneur .","je être aller avec soi , je avoir peut-être VSENT NCo ."
2758,Zola/1888_16_Le_reve._clean.txt,"D' un regard , Hubertine le fit taire .","de un NCMAN , NP le faire NC ."
2759,Zola/1888_16_Le_reve._clean.txt,Il était vraiment déraisonnable .,il être ADVINT ADJ .
2760,Zola/1888_16_Le_reve._clean.txt,"Ne valait -il pas mieux saisir l' occasion , pour enterrer ce mariage impossible ?","ne VIMP il pas mieux INF le NCo , pour INF ce NCo ADJ ?"
2761,Zola/1888_16_Le_reve._clean.txt,"Elle prit la jeune fille entre ses bras , elle la baisa tendrement à le front .","il VPS le ADJ NCo entre DETPOSS NCCOR , il le VPS ADVMAN à le NCCOR ."
2762,Zola/1888_16_Le_reve._clean.txt,"Alors , c' est fini , mignonne , bien fini ?","alors , ce être ADJ , mignonne , bien ADJ ?"
2763,Zola/1888_16_Le_reve._clean.txt,"Angélique , d' abord , ne parut pas comprendre .","ADJ , de NC , ne paraître pas VCOG ."
2764,Zola/1888_16_Le_reve._clean.txt,"Puis , les mots lui revinrent , de loin .","puis , le NCs lui VPS , de ADVLIEU ."
2765,Zola/1888_16_Le_reve._clean.txt,"Elle regarda devant elle , comme si elle eût interrogé le vide; et elle répondit : Sans doute , mère .","il VCOG ADVLIEU il , comme si il avoir VDIC le vide; et il VDIC : sans NCSENT , NC ."
2766,Zola/1888_16_Le_reve._clean.txt,"En effet , le lendemain , elle s' assit à son métier , elle broda , de son air habituel .","en NC , le NC , il se PRES à DETPOSS NC , il VPS , de DETPOSS NCMAN ADJ ."
2767,Zola/1888_16_Le_reve._clean.txt,"Sa vie d' autrefois reprenait , elle semblait ne point souffrir .","DETPOSS NCs de ADVT VIMP , il sembler ne ADV VSENT ."
2768,Zola/1888_16_Le_reve._clean.txt,"Aucune allusion d' ailleurs , pas un regard vers la fenêtre , à peine un reste de pâleur .","aucun NC de ADVLIEU , pas un NCMAN vers le NCmod , à NCSENT un NC de NCmod ."
2769,Zola/1888_16_Le_reve._clean.txt,Le sacrifice parut accompli .,le NCs paraître PPAS .
2770,Zola/1888_16_Le_reve._clean.txt,"Hubert lui-même le crut , se rendit à la sagesse d' Hubertine , travailla à écarter Félicien , qui , n' osant encore se révolter contre son père , s' enfiévrait , à le point de ne plus tenir la promesse qu' il avait faite d' attendre , sans tâcher de revoir Angélique .","NP soi-même le NC , se VPS à le NC de NP , VPS à INF NP , qui , ne PPRES encore se VSENT contre DETPOSS NC , se VSENT , à le NC de ne plus INF le NCo que il avoir faire de INF , sans NC de VCOG NP ."
2771,Zola/1888_16_Le_reve._clean.txt,"Il lui écrivit , et les lettres furent interceptées .","il lui VPS , et le NCspas être PPAS ."
2772,Zola/1888_16_Le_reve._clean.txt,"Il se présenta un matin , et ce fut Hubert qui le reçut .","il se VPS un NCT , et ce être NP qui le VPS ."
2773,Zola/1888_16_Le_reve._clean.txt,"L' explication les désespéra autant l' un que l' autre , tellement le jeune homme montra sa peine , lorsque le brodeur lui dit le calme convalescent de sa fille , en le suppliant d' être loyal , de disparaître , pour ne pas la rejeter à le trouble affreux de le dernier mois .","le NCs le VSENT autant le un que le autre , ADVINT le ADJ NCs VPS DETPOSS NCSENT , lorsque le NCs lui VDIC le NCSENT ADJ de DETPOSS NCmod , en le NCmod de être ADJ , de INF , pour ne pas le INF à le NCSENT ADJ de le ADJ NCT ."
2774,Zola/1888_16_Le_reve._clean.txt,"Félicien s' engagea de nouveau à la patience ; mais il refusa violemment de reprendre sa parole , il espérait toujours convaincre son père .","NP se VPS de ADJ à le NCSENT ; mais il VPS ADVMAN de INF DETPOSS NCo , il VCOG ADVTEMPS INF DETPOSS NCo ."
2775,Zola/1888_16_Le_reve._clean.txt,"Il attendrait , il laisserait les choses en l' état avec les Voincourt , où il dînait deux fois par semaine , dans l' unique but d' éviter une rébellion ouverte .","il VCOND , il laisser le chose en le NC avec le NP , où il VIMP NUM fois par NCmod , dans le ADJ NC de INF un NCo PPAS ."
2776,Zola/1888_16_Le_reve._clean.txt,"Et , comme il partait , il supplia Hubert d' expliquer à Angélique pourquoi il consentait à le tourment de ne pas la voir : il ne pensait qu' à elle , tous ses actes n' avaient d' autre fin que de la conquérir .","et , comme il VIMP , il VPS NP de VDIC à NP pourquoi il VIMP à le NCSENT de ne pas le VCOG : il ne VCOG que à il , tout DETPOSS NCs ne avoir de autre NC que de le VSENT ."
2777,Zola/1888_16_Le_reve._clean.txt,"Hubertine , quand son mari lui rapporta cet entretien , devint grave .","NP , quand DETPOSS NCs lui VPS ce NCo , devenir ADJ ."
2778,Zola/1888_16_Le_reve._clean.txt,"Puis , après un silence : Répéteras -tu à l' enfant ce qu' il t' a chargé de lui dire ?","puis , PHASE un NC : NP -tre à le NCmod ce que il lui avoir PPAS de lui VDIC ?"
2779,Zola/1888_16_Le_reve._clean.txt,Je le devrais .,je le VCOND .
2780,Zola/1888_16_Le_reve._clean.txt,"Elle le regarda fixement , déclara ensuite : Agis selon ta conscience ... Seulement , il s' illusionne , il finira par plier sous la volonté de son père , et ce sera notre pauvre chère fillette qui en mourra .","il le VCOG ADV , VPS PHASE : NP selon VPS NCo ... seulement , il se PRES , il VASP par INF sous le NC de DETPOSS NCmod , et ce être DETPOSS ADJ NC ADJ qui en VF ."
2781,Zola/1888_16_Le_reve._clean.txt,"Alors , Hubert , combattu , plein d' angoisse , hésita , se résigna à ne répéter rien .","alors , NP , PPAS , ADJ de NCSENT , hésita , se VPS à ne INF rien ."
2782,Zola/1888_16_Le_reve._clean.txt,"D' ailleurs , chaque jour , il se rassurait un peu , lorsque sa femme lui faisait remarquer l' attitude tranquille d' Angélique .","de ADVLIEU , chaque NCT , il se VCOND un peu , lorsque DETPOSS NC lui faire INF le NCo ADJ de NP ."
2783,Zola/1888_16_Le_reve._clean.txt,Tu vois bien que la blessure se ferme ... Elle oublie .,je ADV bien que le NCSENT se PRES ... il VCOG .
2784,Zola/1888_16_Le_reve._clean.txt,"Elle n' oubliait pas , elle attendait , elle aussi , simplement .","il ne VCOG pas , il VIMP , il aussi , ADVMAN ."
2785,Zola/1888_16_Le_reve._clean.txt,"Toute espérance humaine était morte , elle en revenait à l' idée d' un prodige .","tout NCs ADJ être PPAS , il en VIMP à le NC de un NCmod ."
2786,Zola/1888_16_Le_reve._clean.txt,"Il s' en produirait sûrement un , si Dieu la voulait heureuse .","il se en VCOND ADVINT un , si NP le vouloir ADJ ."
2787,Zola/1888_16_Le_reve._clean.txt,"Elle n' avait qu' à s' abandonner entre ses mains , elle se croyait punie , par cette nouvelle épreuve , de ce qu' elle avait essayé de forcer sa volonté , en importunant monseigneur .","il ne avoir que à se INF entre DETPOSS NCCOR , il se VCOG PPAS , par ce ADJ NC , de ce que il avoir PPAS de INF DETPOSS NCo , en VSENT NCo ."
2788,Zola/1888_16_Le_reve._clean.txt,"Sans la grâce , la créature était débile , incapable de victoire .","sans le NC , le NCs être ADJ , ADJ de NC ."
2789,Zola/1888_16_Le_reve._clean.txt,"Son besoin de la grâce la rendait à l' humilité , à la seule espérance de le secours de l' invisible , n' agissant plus , laissant agir les forces mystérieuses , épandues à son entour .","DETPOSS NCs de le NCmod le VIMP à le NCSENT , à le ADJ NC de le NCmod de le NCmod , ne PPRES plus , laisser INF le NCSENT ADJ , PPAS à DETPOSS NC ."
2790,Zola/1888_16_Le_reve._clean.txt,"Elle recommença , chaque soir , sous la lampe , à relire son antique exemplaire de la Légende dorée ; et elle en sortait ravie , comme dans la naïveté de son enfance ; et elle ne mettait en doute aucun miracle , convaincue que la puissance de l' inconnu est sans bornes pour le triomphe de les âmes pures .","il VPS , chaque NCT , sous le NC , à INF DETPOSS ADJ NCo de le NP ADJCOL ; et il en VIMP NCo , comme dans le NC de DETPOSS NCmod ; et il ne mettre en NCSENT aucun NCo , PPAS que le NCs de le NCmod être sans NC pour le NCmod de le NCmod ADJ ."
2791,Zola/1888_16_Le_reve._clean.txt,"Justement , le tapissier de la cathédrale était venu commander à les Hubert un panneau de très riche broderie , pour le siège épiscopal de monseigneur .","ADVMAN , le NCs de le NCmod être venir INF à le NP un NCo de très ADJ NCmod , pour le NC ADJ de NCmod ."
2792,Zola/1888_16_Le_reve._clean.txt,"Ce panneau , large d' un mètre cinquante , haut de trois , devait s' encadrer dans la boiserie de le fond , et représentait deux anges de grandeur naturelle , tenant une couronne , sous laquelle se trouvaient les armoiries de les Hautecœur .","ce NCs , ADJ de NUM NC NUM , ADV de NUM , devoir se INF dans le NC de le NCmod , et VIMP NUM NCo de NCmod ADJ , PPRES un NCo , sous lequel se VIMP le NCs de le NP ."
