id,titre,phrase,motifs_phrase
880,Zola/1888_16_Le_reve._clean.txt,Ce Clos-Marie était l' ancien verger de les moines .,ce NP être le ADJ NC de le NCmod .
881,Zola/1888_16_Le_reve._clean.txt,"Un ruisseau d' eau vive le traversait , la Chevrotte , où les ménagères de les maisons voisines avaient l' autorisation de laver leur linge ; de les familles de pauvres se terraient dans les ruines d' un ancien moulin écroulé ; et personne autre n' habitait le champ , que la ruelle de les Guerdaches reliait seule à la rue Magloire , entre les hautes murailles de l' évêché et celles de l' hôtel Voincourt .","un NCs de NCmod ADJ le VIMP , le NP , où le NCs de le NCmod ADJ avoir le NCo de INF lui NCo ; de le NCs de NCmod se VIMP dans le NC de un ADJ NCmod PPAS ; et NCs autre ne VIMP le NCo , que le NCs de le NP VIMP ADJ à le NC NP , entre le ADJ NC de le NCmod et celui de le NCmod NP ."
882,Zola/1888_16_Le_reve._clean.txt,"En été , les ormes centenaires de les deux parcs barraient de leurs cimes de feuillage l' horizon étroit , qui était fermé à le midi par la croupe géante de l' église .","en NC , le NCs ADJ de le NUM NCmod VIMP de DETPOSS NC de NCmod le NCo ADJ , qui être PPAS à le NC par le NC ADJ de le NCmod ."
883,Zola/1888_16_Le_reve._clean.txt,"Ainsi enclavé de toutes parts , le Clos-Marie dormait dans la paix de son abandon , envahi d' herbes folles , planté de peupliers et de saules que le vent avait semés .","ainsi PPAS de tout NC , le NP VIMP dans le NC de DETPOSS NCmod , PPAS de NC ADJ , NC de NCmod et de NC que le NCs avoir PPAS ."
884,Zola/1888_16_Le_reve._clean.txt,"Parmi les cailloux , la Chevrotte bondissait , chantante , d' une musique continue de cristal .","parmi le NC , le NP VIMP , NCo , de un NCmod ADJ de NCmod ."
885,Zola/1888_16_Le_reve._clean.txt,"Jamais Angélique ne se lassait , en face de ce coin perdu .","ADVTEMPS NP ne se VSENT , en NC de ce NC ADJ ."
886,Zola/1888_16_Le_reve._clean.txt,"Et , pendant sept années pourtant , elle n' y avait retrouvé chaque matin que le spectacle déjà regardé la veille .","et , PHASE NUM NCT pourtant , il ne y avoir PPAS chaque NCT que le NC déjà VCOG le NCo ."
887,Zola/1888_16_Le_reve._clean.txt,"Les arbres de l' hôtel Voincourt , dont la façade donnait sur la Grand-Rue , étaient si touffus , que , l' hiver seulement , elle distinguait la fille de la comtesse , Claire , une enfant de son âge .","le NCs de le NCmod NP , dont le NCs VIMP sur le NP , être si ADJ , que , le NC seulement , il VCOG le NCo de le NCmod , NP , un NC de DETPOSS NCmod ."
888,Zola/1888_16_Le_reve._clean.txt,"Dans le jardin de l' évêché , c' était une épaisseur de branches plus profonde encore , elle avait tenté en vain de reconnaître la soutane de monseigneur ; et la vieille grille garnie de volets , qui s' ouvrait sur le clos , devait être condamnée depuis longtemps , car elle ne se souvenait pas de l' avoir vue entrebâillée une seule fois , même pour livrer passage à un jardinier .","dans le NC de le NCmod , ce être un NC de NCmod plus ADJ encore , il avoir PPAS en ADJ de VCOG le NCo de NCmod ; et le ADJ NC PPAS de NC , qui se VCOND sur le NC , devoir être PPAS depuis longtemps , car il ne se VIMP pas de le avoir VCOG PPAS un ADJ fois , même pour INF NCo à un NC ."
889,Zola/1888_16_Le_reve._clean.txt,"En dehors de les ménagères battant leur linge , elle n' apercevait toujours là que les mêmes petits pauvres en guenilles , couchés dans les herbes .","en NC de le NCmod PPRES lui NCo , il ne VIMP ADVTEMPS ADVLIEU que le même NC ADJ en NCmod , PPAS dans le NC ."
890,Zola/1888_16_Le_reve._clean.txt,"Le printemps , cette année , fut d' une douceur exquise .","le NCs , ce NCT , être de un NC ADJ ."
891,Zola/1888_16_Le_reve._clean.txt,"Elle avait seize ans , et jusqu' à ce jour , ses regards seuls s' étaient plu à voir reverdir le Clos-Marie , sous les soleils d' avril .","il avoir NUM NCT , et jusque à ce NCT , DETPOSS NCMAN ADJ se être PPAS à VCOG INF le NP , sous le NC de MOIS ."
892,Zola/1888_16_Le_reve._clean.txt,"La poussée de les feuilles tendres , la transparence de les soirées chaudes , tout le renouveau odorant de la terre , simplement , l' amusait .","le NC de le NCmod ADJ , le NC de le NCT ADJ , tout le NC ADJ de le NCmod , ADVMAN , le VSENT ."
893,Zola/1888_16_Le_reve._clean.txt,"Mais , cette année , à le premier bourgeon , son cœur venait de battre .","mais , ce NCT , à le ADJ NC , DETPOSS NCs venir de INF ."
894,Zola/1888_16_Le_reve._clean.txt,"Il y avait , en elle , un émoi grandissant , depuis que montaient les herbes , et que le vent lui apportait l' odeur plus forte de les verdures .","il y avoir , en il , un NCo ADJ , depuis que VIMP le NCo , et que le NCs lui VIMP le NCo plus fort de le NCmod ."
895,Zola/1888_16_Le_reve._clean.txt,"De les angoisses brusques , sans cause , la serraient à la gorge .","de le NCSENT ADJ , sans NCmod , le VIMP à le NCCOR ."
896,Zola/1888_16_Le_reve._clean.txt,"Un soir , elle se jeta dans les bras d' Hubertine , pleurant , n' ayant aucun sujet de chagrin , bien heureuse à le contraire .","un NCT , il se VPS dans le NCCOR de NP , PPRES , ne avoir aucun NCo de NCSENT , bien ADJ à le NC ."
897,Zola/1888_16_Le_reve._clean.txt,"La nuit , surtout , elle faisait de les rêves délicieux , elle voyait passer de les ombres , elle défaillait en de les ravissements , qu' elle n' osait se rappeler à le réveil , confuse de ce bonheur que lui donnaient les anges .","le NCT , surtout , il faire de le NC ADJ , il VCOG INF de le NC , il VIMP en de le NCSENT , que il ne VIMP se INF à le NC , NC de ce NCSENT que lui VIMP le NCs ."
898,Zola/1888_16_Le_reve._clean.txt,"Parfois , à le fond de son grand lit , elle s' éveillait en sursaut , les deux mains jointes , serrées contre sa poitrine ; et il lui fallait sauter pieds nus sur le carreau de sa chambre , tant elle étouffait ; et elle courait ouvrir la fenêtre , elle restait là , frissonnante , éperdue , dans ce bain d' air frais qui la calmait .","ADVTEMPS , à le NC de DETPOSS ADJ NCmod , il se VIMP en NC , le NUM NCCOR ADJ , PPAS contre DETPOSS NC ; et il lui VIMP INF NCCOR ADJ sur le NC de DETPOSS NCmod , tant il VIMP ; et il VCOND INF le NCo , il VIMP ADVLIEU , ADJ , PPAS , dans ce NC de NCMAN ADJ qui le VSENT ."
899,Zola/1888_16_Le_reve._clean.txt,"C' était un émerveillement continuel , une surprise de ne pas se reconnaître , de se sentir comme agrandie de joies et de douleurs qu' elle ignorait , toute la floraison enchantée de la femme .","ce être un VSENT ADJ , un NCSENT de ne pas se VCOG , de se sentir comme NC de NCSENT et de NCSENT que il VCOG , tout le NC ADJ de le NCmod ."
900,Zola/1888_16_Le_reve._clean.txt,Eh !,INTJ !
901,Zola/1888_16_Le_reve._clean.txt,"quoi , vraiment , les lilas et les cytises invisibles de l' évêché avaient une odeur si douce , qu' elle ne la respirait plus , sans qu' un flot rose lui montât à les joues ?","quoi , ADVINT , le NCs et le NC ADJ de le NCmod avoir un NCo si ADJ , que il ne le VCOND plus , sans que un NCs VSUBP lui VSUBI à le NC ?"
902,Zola/1888_16_Le_reve._clean.txt,"Jamais encore elle ne s' était aperçue de cette tiédeur de les parfums , qui , maintenant , l' effleuraient d' une haleine vivante .","ADVTEMPS encore il ne se être PPAS de ce NC de le NCmod , qui , ADVT , le NC de un NCmod ADJ ."
903,Zola/1888_16_Le_reve._clean.txt,"Et , aussi , comment n' avait -elle pas remarqué , les années précédentes , un grand paulownia en fleur , dont l' énorme bouquet violâtre apparaissait entre deux ormes de le jardin de les Voincourt ?","et , aussi , comment ne avoir il pas PPAS , le NCT ADJ , un ADJ NCo en NCmod , dont le ADJ NCs ADJ VIMP entre NUM NC de le NCmod de le NP ?"
904,Zola/1888_16_Le_reve._clean.txt,"Cette année , dès qu' elle le regardait , une émotion troublait ses yeux , tellement ce violet pâle lui allait à le cœur .","ce NCT , dès que il le VCOG , un NCSENT VIMP DETPOSS NCCOR , ADVINT ce ADJCOL ADJ lui aller à le NC ."
905,Zola/1888_16_Le_reve._clean.txt,"De même , elle ne se souvenait point d' avoir entendu la Chevrotte causer si haut sur les cailloux , parmi les joncs de ses rives .","de même , il ne se VIMP ADV de avoir VCOG le NP INF si ADJ sur le NC , parmi le NC de DETPOSS NCmod ."
906,Zola/1888_16_Le_reve._clean.txt,"Le ruisseau parlait sûrement , elle l' écoutait dire de les mots vagues , toujours répétés , qui l' emplissaient de trouble .","le NCs VIMP ADVINT , il le VCOG VDIC de le NC ADJ , ADVTEMPS PPAS , qui le VIMP de NCSENT ."
907,Zola/1888_16_Le_reve._clean.txt,"N' était -ce donc plus le champ d' autrefois , que tout l' y étonnait et y prenait de la sorte de les sens nouveaux ?","ne être ce donc plus le NC de ADVT , que tout le y VSENT et y VIMP de le sorte de le NCmod ADJ ?"
908,Zola/1888_16_Le_reve._clean.txt,"ou bien était -ce elle , plutôt , qui changeait , pour y sentir , y voir et y entendre germer la vie ?","ou bien être ce il , plutôt , qui VIMP , pour y sentir , y VCOG et y VCOG INF le NCo ?"
909,Zola/1888_16_Le_reve._clean.txt,"Mais la cathédrale , à sa droite , la masse énorme qui bouchait le ciel , la surprenait plus encore .","mais le NC , à DETPOSS NCmod , le NCs ADJ qui VIMP le NCo , le VIMP plus encore ."
910,Zola/1888_16_Le_reve._clean.txt,"Chaque matin , elle s' imaginait la voir pour la première fois , émue de sa découverte , comprenant que ces vieilles pierres aimaient et pensaient comme elle .","chaque NCT , il se VCOG le VCOG pour le ADJ fois , VSENT de DETPOSS NC , VCOG que ce ADJ NCs VIMP et VCOG comme il ."
911,Zola/1888_16_Le_reve._clean.txt,"Cela n' était point raisonné , elle n' avait aucune science , elle s' abandonnait à l' envolée mystique de la géante , dont l' enfantement avait duré trois siècles et où se superposaient les croyances de les générations .","cela ne être ADV PPAS , il ne avoir aucun NCo , il se VIMP à le NC ADJ de le NCmod , dont le NCs avoir PPAS NUM NCT et où se VIMP le NCs de le NCmod ."
912,Zola/1888_16_Le_reve._clean.txt,"En bas , elle était agenouillée , écrasée par la prière , avec les chapelles romanes de le pourtour , à les fenêtres à plein cintre , nues , ornées seulement de minces colonnettes , sous les archivoltes .","en NC , il être PPAS , PPAS par le NC , avec le NC ADJ de le NCmod , à le NC à ADJ NCmod , NC , PPAS seulement un ADJ NCo , sous le NC ."
913,Zola/1888_16_Le_reve._clean.txt,"Puis , elle se sentait soulevée , la face et les mains à le ciel , avec les fenêtres ogivales de la nef , construites quatre-vingts ans plus tard , de hautes fenêtres légères , divisées par de les meneaux qui portaient de les arcs brisés et de les roses .","puis , il se sentir PPAS , le NC et le NCCOR à le NCmod , avec le NC ADJ de le NCmod , PPAS NCo ADJ plus tard , un ADJ NC ADJ , PPAS par un le NC qui VIMP de le NC PPAS et de le ADJCOL ."
914,Zola/1888_16_Le_reve._clean.txt,"Puis , elle quittait le sol , ravie , toute droite , avec les contreforts et les arcs-boutants de le chœur , repris et ornementés deux siècles après , en plein flamboiement de le gothique , chargés de clochetons , d' aiguilles et de pinacles .","puis , il VIMP le NCo , NC , tout NC , avec le NC et le NC de le NCmod , PPAS et PPAS NUM NCT PHASE , en ADJ NC de le NCmod , PPAS de NC , de NC et de NC ."
915,Zola/1888_16_Le_reve._clean.txt,"De les gargouilles , à le pied de les arcs-boutants , déversaient les eaux de les toitures .","de le NC , à le NCCOR de le NCmod , VIMP le NCo de le NCmod ."
916,Zola/1888_16_Le_reve._clean.txt,"On avait ajouté une balustrade garnie de trèfles , bordant la terrasse , sur les chapelles absidales .","on avoir PPAS un NCo ADJ de NCmod , PPRES le NCo , sur le NC ADJ ."
917,Zola/1888_16_Le_reve._clean.txt,"Le comble , également , était orné de fleurons .","le NCspas , également , être PPAS de NC ."
918,Zola/1888_16_Le_reve._clean.txt,"Et tout l' édifice fleurissait , à mesure qu' il se rapprochait de le ciel , dans un élancement continu , délivré de l' antique terreur sacerdotale , allant se perdre à le sein d' un Dieu de pardon et d' amour .","et tout le NCs VIMP , à NC que il se VIMP de le NC , dans un NC ADJ , PPAS de le ADJ NCSENT ADJ , aller se INF à le NC de un NP de NCmod et de NCSENT ."
919,Zola/1888_16_Le_reve._clean.txt,"Elle en avait la sensation physique , elle en était allégée et heureuse , comme d' un cantique qu' elle aurait chanté , très pur , très fin , se perdant très haut .","il en avoir le NCSENT ADJ , il en être ADJ et ADJ , comme de un NC que il avoir PPAS , très ADJ , très NC , se PPRES très ADJ ."
920,Zola/1888_16_Le_reve._clean.txt,"D' ailleurs , la cathédrale vivait .","de ADVLIEU , le NCs VIMP ."
921,Zola/1888_16_Le_reve._clean.txt,"De les hirondelles , par centaines , avaient maçonné leurs nids sous les ceintures de trèfles , jusque dans les creux de les clochetons et de les pinacles ; et , continuellement , leurs vols effleuraient les arcs-boutants et les contreforts , qu' ils peuplaient .","de le NC , par NCmod , avoir PPAS DETPOSS NCo sous le NC de NCmod , jusque dans le NC de le NCmod et de le NC ; et , ADVTEMPS , DETPOSS NCs VIMP le NCo et le NC , que il VIMP ."
922,Zola/1888_16_Le_reve._clean.txt,"C' étaient aussi les ramiers de les ormes de l' évêché , qui se rengorgeaient à le bord de les terrasses , allant à petits pas , ainsi que de les promeneurs .","ce être aussi le NC de le NCmod de le NCmod , qui se VIMP à le NC de le NCmod , aller à ADJ pas , ainsi que de le NC ."
923,Zola/1888_16_Le_reve._clean.txt,"Parfois , perdu dans le bleu , à peine gros comme une mouche , un corbeau se lissait les plumes , à la pointe d' une aiguille .","ADVTEMPS , PPAS dans le ADJCOL , à NCSENT ADJ comme un NC , un NC se VIMP le NCs , à le NC de un NCmod ."
924,Zola/1888_16_Le_reve._clean.txt,"De les plantes , toute une flore , les lichens , les graminées qui poussent à les fentes de les murailles , animaient les vieilles pierres de le sourd travail de leurs racines .","de le NC , tout un NCs , le NC , le NC qui PRES à le NC de le NCmod , VIMP le ADJ NCo de le ADJ NCmod de DETPOSS NCmod ."
925,Zola/1888_16_Le_reve._clean.txt,"Les jours de grandes pluies , l' abside entière s' éveillait et grondait , dans le ronflement de l' averse battant les feuilles de plomb de le comble , se déversant par les rigoles de les galeries , roulant d' étage en étage avec la clameur d' un torrent débordé .","le NCT de ADJ NCmod , le NCs ADJ se VIMP et VIMP , dans le NC de le NCmod PPRES le NCo de NCmod de le NCmod , se PPRES par le NC de le NCmod , PPRES de NC en NC avec le NC de un NCmod PPAS ."
926,Zola/1888_16_Le_reve._clean.txt,"Même les coups de vent terribles d' octobre et de mars lui donnaient une âme , une voix de colère et de plainte , quand ils soufflaient à le travers de sa forêt de pignons et d' arcatures , de colonnettes et de roses .","même le NCs de NCmod ADJ de MOIS et de MOIS lui VIMP un NCo , un NCMAN de NCSENT et de NC , quand il VIMP à le travers de DETPOSS NCmod de NCmod et de NC , de NC et de ADJCOL ."
927,Zola/1888_16_Le_reve._clean.txt,"Le soleil enfin la faisait vivre , de le jeu mouvant de la lumière , depuis le matin , qui la rajeunissait d' une gaieté blonde , jusqu' à le soir , qui , sous les ombres lentement allongées , la noyait d' inconnu .","le NC PHASE le faire INF , de le NC ADJ de le NCmod , depuis le NCT , qui le VIMP de un NCSENT ADJCOL , jusque à le NCT , qui , sous le NC ADV PPAS , le VIMP de NC ."
928,Zola/1888_16_Le_reve._clean.txt,"Et elle avait son existence intérieure , comme le battement de ses veines , les cérémonies dont elle vibrait toute , avec le branle de les cloches , la musique de les orgues , le chant de les prêtres .","et il avoir DETPOSS NCo ADJ , comme le NC de DETPOSS NCmod , le NC dont il VCOND tout , avec le NCmod de le NCmod , le NC de le NCmod , le NC de le NCmod ."
929,Zola/1888_16_Le_reve._clean.txt,"Toujours la vie frémissait en elle : de les bruits perdus , le murmure d' une messe basse , l' agenouillement léger d' une femme , un frisson à peine deviné , rien que l' ardeur dévote d' une prière , dite sans paroles , bouche close .","ADVTEMPS le NCs VIMP en il : de le NC PPAS , le NC de un NCmod ADJ , le NC ADJ de un NCmod , un NCSENT à NCSENT VCOG , rien que le NCs ADJ de un NCmod , VDIC sans NC , NCCOR ADJ ."
930,Zola/1888_16_Le_reve._clean.txt,"Maintenant que les jours croissaient , Angélique , le matin et le soir , restait longuement accoudée à le balcon , côte à côte avec sa grande amie la cathédrale .","ADVT que le NCT VIMP , NP , le NCT et le NCT , VIMP ADV PPAS à le NC , NC à NCmod avec DETPOSS ADJ NCmod le NC ."
931,Zola/1888_16_Le_reve._clean.txt,"Elle l' aimait plus encore le soir , quand elle n' en voyait que la masse énorme se détacher d' un bloc sur le ciel étoilé .","il le VSENT plus encore le NCT , quand il ne en VCOG que le NCs ADJ se INF de un NC sur le NCmod PPAS ."
932,Zola/1888_16_Le_reve._clean.txt,"Les plans se perdaient , à peine distinguait -elle les arcs-boutants jetés comme de les ponts dans le vide .","le NCs se VIMP , à NCSENT VCOG il le NCo PPAS comme de le NC dans le NCmod ."
933,Zola/1888_16_Le_reve._clean.txt,"Elle la sentait éveillée sous les ténèbres , pleine d' une songerie de sept siècles , grande de les foules qui avaient espéré et désespéré devant ses autels .","il le sentir PPAS sous le NC , ADJ de un NC de NUM NCT , ADJ de le NC qui avoir VCOG et VSENT ADVLIEU DETPOSS NC ."
934,Zola/1888_16_Le_reve._clean.txt,"C' était une veille continue , venant de l' infini de le passé , allant à l' éternité de l' avenir , la veille mystérieuse et terrifiante d' une maison où Dieu ne pouvait dormir .","ce être un NC ADJ , venir de le NC de le NCmod , aller à le NC de le NCmod , le NC ADJ et ADJ de un NCmod où NP ne pouvoir INF ."
935,Zola/1888_16_Le_reve._clean.txt,"Et , dans la masse noire , immobile et vivante , ses regards retournaient toujours à la fenêtre d' une chapelle de le chœur , à le ras de les arbustes de le Clos-Marie , la seule qui s' allumât , ainsi qu' un œil vague ouvert sur la nuit .","et , dans le NC ADJ , ADJ et ADJ , DETPOSS NCMAN VIMP ADVTEMPS à le NC de un NCmod de le NCmod , à le NC de le NCmod de le NP , le ADJ qui se VSUBI , ainsi que un NC ADJ PPAS sur le NCT ."
936,Zola/1888_16_Le_reve._clean.txt,"Derrière , à l' angle d' un pilier , brûlait une lampe de sanctuaire .","ADVLIEU , à le NC de un NCmod , VIMP un NCo de NCmod ."
937,Zola/1888_16_Le_reve._clean.txt,"Justement , cette chapelle était celle que les abbés d' autrefois avaient donnée à Jean V d' Hautecœur et à ses descendants , avec le droit d' y être ensevelis , en récompense de leur largesse .","ADVMAN , ce NCs être celui que le NCs de ADVT avoir PPAS à NP NUM de NP et à DETPOSS NC , avec le NC de y être PPAS , en NC de lui NCmod ."
938,Zola/1888_16_Le_reve._clean.txt,"Consacrée à saint Georges , elle avait un vitrail de le douzième siècle , où l' on voyait peinte la légende de le saint .","PPAS à NP NP , il avoir un NCo de le ADJ NCT , où l' on VCOG ADJ le NCs de le NCmod ."
939,Zola/1888_16_Le_reve._clean.txt,"Dès le crépuscule , la légende renaissait de l' ombre , lumineuse , comme une apparition ; et c' était pourquoi Angélique , les yeux rêveurs et charmés , aimait la fenêtre .","dès le NC , le NCs VIMP de le NC , NC , comme un NCmod ; et ce être pourquoi ADJ , le NCCOR ADJ et NC , VSENT le NCo ."
940,Zola/1888_16_Le_reve._clean.txt,"Le fond de le vitrail était bleu , la bordure , rouge .","le NCs de le NCmod être ADJCOL , le NC , ADJCOL ."
941,Zola/1888_16_Le_reve._clean.txt,"Sur ce fond d' une sombre richesse , les personnages , dont les draperies volantes indiquaient le nu , s' enlevaient en teintes vives , chaque partie faite de verres colorés , ombrés de noir , pris dans les plombs .","sur ce NC de un ADJ NCmod , le NCs , dont le NCs ADJ VIMP le NCo , se VIMP en NC ADJ , chaque NC faire de NCmod ADJ , PPAS de NC , PPAS dans le NC ."
942,Zola/1888_16_Le_reve._clean.txt,"Trois scènes de la légende , superposées , occupaient la fenêtre , jusqu' à l' archivolte .","NUM NCs de le NCmod , PPAS , VIMP le NCo , jusque à le NC ."
943,Zola/1888_16_Le_reve._clean.txt,"Dans le bas , la fille de le roi , sortie de la ville en habits royaux , pour être mangée , rencontrait saint Georges , près de l' étang , d' où émergeait déjà la tête de le monstre ; et une banderole portait ces mots : Bon chevalier , ne te péris pas pour moy , car tu ne me pourrois ayder ne delivrer , mais periroys avec moy .","dans le NC , le NCs de le NCmod , PPAS de le NC en NCmod ADJ , pour être PPAS , VCOND NP NP , ADVLIEU de le NC , de où VIMP déjà le NCCOR de le NCmod ; et un NCs VIMP ce NCo : NP NCmod , ne me PPAS pas pour NC , car je ne me PRES INF ne INF , mais NC avec NCmod ."
944,Zola/1888_16_Le_reve._clean.txt,"Puis , à le milieu , c' était le combat , le saint à cheval traversant le monstre de part en part , ce qu' expliquait cette phrase : George brandit tellement sa lance qu' il navra le dragon et le gecta à terre .","puis , à le milieu , ce être le NC , le NC à NCmod PPRES le NCo de NCmod en NC , ce que VDIC ce NCs : NP VPS ADVINT DETPOSS NCo que il VSENT le NCo et le NC à NCmod ."
945,Zola/1888_16_Le_reve._clean.txt,"Enfin , au-dessus , la fille de le roi emmenait à la ville le monstre vaincu : George dist : Gecte luy ta ceinture entour le col , et ne te doubte en rien , belle fille .","PHASE , ADVLIEU , le NCs de le NCmod VIMP à le NC le NCo PPAS : NP ADJ : NP luy ter NC entour le NCmod , et ne me PRES en rien , ADJ NC ."
946,Zola/1888_16_Le_reve._clean.txt,"Et quant elle eut ce faict , le dragon la suyvit comme un tres débonnaire chien .","et quant il avoir ce NCo , le NCs le VPS comme un ADJ NC ADJ ."
947,Zola/1888_16_Le_reve._clean.txt,"Lors de son exécution , le vitrail devait être surmonté , dans le plein cintre , d' un motif d' ornement .","lors de DETPOSS NC , le NCs devoir être PPAS , dans le ADJ NC , de un NC de NCmod ."
948,Zola/1888_16_Le_reve._clean.txt,"Mais , plus tard , quand la chapelle appartint à les Hautecœur , ils remplacèrent ce motif par leurs armes .","mais , plus tard , quand le NCs VPS à le NP , il VPS ce NCo par DETPOSS NC ."
949,Zola/1888_16_Le_reve._clean.txt,"Et c' était ainsi que , durant les nuits obscures , flambaient , au-dessus de la légende , de les armoiries de travail plus récent , éclatantes .","et ce être ainsi que , durant le NCT ADJ , VIMP , ADVLIEU de le NC , de le NC de NCmod plus ADJ , ADJ ."
950,Zola/1888_16_Le_reve._clean.txt,"Écartelé , un et quatre , deux et trois , de Jérusalem et d' Hautecœur ; de Jérusalem , qui est d' argent à la croix potencée d' or , cantonnée de quatre croisettes de même ; Hautecœur , qui est d' azur à la forteresse d' or , avec un écusson de sable à le cœur d' argent en abîme , le tout accompagné de trois fleurs de lis d' or , deux en chef , une en pointe .","PPAS , un et NUM , NUM et NUM , de NP et de NP ; de NP , qui être de NC à le NCmod PPAS de NC , PPAS de NUM NC de même ; NP , qui être de NC à le NCmod de NCmod , avec un NCmod de NCmod à le NCmod de NCmod en NCmod , le tout PPAS de NUM NC de NCmod de NCmod , NUM en NCmod , un en NCmod ."
951,Zola/1888_16_Le_reve._clean.txt,"L' écu était soutenu , de dextre et de senestre , par deux chimères d' or , et timbré , à le milieu d' un plumail d' azur , de le casque d' argent , damasquiné d' or , taré de front et fermé d' onze grilles , qui est le casque de les ducs , maréchaux de France , seigneurs titrés et chefs de compagnies souveraines .","le NCspas être PPAS , de NC et de NC , par NUM NC de NCmod , et PPAS , à le milieu de un NCmod de NCmod , de le NCmod de NCmod , PPAS de NC , PPAS de NCCOR et PPAS de NUM NC , qui être le NC de le NCmod , NC de NP , NC ADJ et NC de NCmod ADJ ."
952,Zola/1888_16_Le_reve._clean.txt,"Et , pour devise : Si Dieu volt je vueil .","et , pour NC : si NP NC je PRES ."
953,Zola/1888_16_Le_reve._clean.txt,"Peu à peu , à force de le voir perçant le monstre de sa lance , tandis que la fille de le roi levait ses mains jointes , Angélique s' était passionnée pour saint Georges .","peu à peu , à NCSENT de le VCOG PPRES le NCo de DETPOSS NCmod , PHASE que le NCs de le NCmod VIMP DETPOSS NCCOR ADJ , NP se être VSENT pour NP NP ."
954,Zola/1888_16_Le_reve._clean.txt,"À cette distance , elle distinguait mal les figures , elle les apercevait dans un agrandissement de songe , la fille mince , blonde , avec son propre visage , le saint candide et superbe , d' une beauté d' archange .","à ce NC , il VCOG mal le NCCOR , il le VIMP dans un NC de NCmod , le NC NC , NC , avec DETPOSS ADJ NCCOR , le NC ADJ et ADJ , de un NC de NCmod ."
955,Zola/1888_16_Le_reve._clean.txt,"C' était elle qu' il venait délivrer , elle lui aurait baisé les mains de gratitude .","ce être il que il venir INF , il lui avoir PPAS le NCCOR de NCSENT ."
956,Zola/1888_16_Le_reve._clean.txt,"Et , à cette aventure qu' elle rêvait confusément , une rencontre à le bord d' un lac , un grand péril dont la sauvait un jeune homme plus beau que le jour , se mêlait le souvenir de sa promenade à le château d' Hautecœur , toute une évocation de le donjon féodal , debout sur le ciel , peuplé de les hauts seigneurs de jadis .","et , à ce NC que il VIMP ADVMAN , un NCo à le NCmod de un NCmod , un ADJ NC dont le VIMP un ADJ NCs plus ADJ que le NCT , se VIMP le NCs de DETPOSS NCmod à le NC de NP , tout un NC de le NCmod ADJ , ADV sur le NC , PPAS de le ADJ NC de NCmod ."
