id,titre,phrase,motifs_phrase
1,Zola/1888_16_Le_reve._clean.txt,"Pendant le rude hiver de 1860 , l' Oise gela , de grandes neiges couvrirent les plaines de la basse Picardie ; et il en vint surtout une bourrasque de le nord-est , qui ensevelit presque Beaumont , le jour de la Noël .","PHASE le ADJ NC de NUM , le NP gela , un ADJ NC VPS le NCo de le NCmod NP ; et il en venir surtout un NCo de le NCmod , qui VPS presque NP , le NCT de le NP ."
2,Zola/1888_16_Le_reve._clean.txt,"La neige , s' étant mise à tomber dès le matin , redoubla vers le soir , s' amassa durant toute la nuit .","le NCs , se être mettre à INF dès le NCT , VPS vers le NCT , se VPS durant tout le NCT ."
3,Zola/1888_16_Le_reve._clean.txt,"Dans la ville haute , rue de les Orfèvres , à le bout de laquelle se trouve comme enclavée la façade nord de le transept de la cathédrale , elle s' engouffrait , poussée par le vent , et allait battre la porte Sainte-Agnès , l' antique porte romane , presque déjà gothique , très ornée de sculptures sous la nudité de le pignon .","dans le NC ADJ , NCs de le NP , à le NCmod de lequel se PRES comme NC le NCo NCmod de le NCmod de le NCmod , il se VCOND , PPAS par le NC , et aller INF le NCo NP , le ADJ NC ADJ , presque déjà ADJ , très PPAS de NC sous le NCmod de le NCmod ."
4,Zola/1888_16_Le_reve._clean.txt,"Le lendemain , à l' aube , il y en eut là près de trois pieds .","le NC , à le NCmod , il y en avoir ADVLIEU ADVLIEU de NUM NCCOR ."
5,Zola/1888_16_Le_reve._clean.txt,"La rue dormait encore , emparessée par la fête de la veille .","le NCs VIMP encore , PPAS par le NC de le NCmod ."
6,Zola/1888_16_Le_reve._clean.txt,Six heures sonnèrent .,NUM NCT VPS .
7,Zola/1888_16_Le_reve._clean.txt,"Dans les ténèbres , que bleuissait la chute lente et entêtée de les flocons , seule une forme indécise vivait , une fillette de neuf ans , qui , réfugiée sous les voussures de la porte , y avait passé la nuit à grelotter , en s' abritant de son mieux .","dans le NC , que VIMP le NCs ADJ et ADJ de le NCmod , ADJ un NC ADJ VIMP , un NCs de NUM NCT , qui , PPAS sous le NC de le NCmod , y avoir PPAS le NCT à INF , en se PPRES de DETPOSS mieux ."
8,Zola/1888_16_Le_reve._clean.txt,"Elle était vêtue de loques , la tête enveloppée d' un lambeau de foulard , les pieds nus dans de gros souliers d' homme .","il être PPAS de NC , le NCCOR PPAS de un NCmod de NCmod , le NCCOR ADJ dans un ADJ NCmod de NCmod ."
9,Zola/1888_16_Le_reve._clean.txt,"Sans doute elle n' avait échoué là qu' après avoir longtemps battu la ville , car elle y était tombée de lassitude .","sans NCSENT il ne avoir PPAS ADVLIEU que PHASE avoir longtemps PPAS le NCo , car il y être PPAS de NCSENT ."
10,Zola/1888_16_Le_reve._clean.txt,"Pour elle , c' était le bout de la terre , plus personne ni plus rien , l' abandon dernier , la faim qui ronge , le froid qui tue ; et , dans sa faiblesse , étouffée par le poids lourd de son cœur , elle cessait de lutter , il ne lui restait que le recul physique , l' instinct de changer de place , de s' enfoncer dans ces vieilles pierres , lorsqu' une rafale faisait tourbillonner la neige .","pour il , ce être le NC de le NCmod , plus PRES ni plus rien , le NC ADJ , le NC qui VSENT , le NC qui PRES ; et , dans DETPOSS NC , PPAS par le NC ADJ de DETPOSS NCmod , il VASP de INF , il ne lui VIMP que le NC ADJ , le NC de INF de NC , de se INF dans ce ADJ NC , lorsque un NC faire INF le NCo ."
11,Zola/1888_16_Le_reve._clean.txt,"Les heures , les heures coulaient .","le NCT , le NCT VIMP ."
12,Zola/1888_16_Le_reve._clean.txt,"Longtemps , entre le double vantail de les deux baies jumelles , elle s' était adossée à le trumeau , dont le pilier porte une statue de sainte Agnès , la martyre de treize ans , une petite fille comme elle , avec la palme et un agneau à ses pieds .","longtemps , entre le ADJ NC de le NUM NCmod ADJ , il se être PPAS à le NC , dont le NCs PRES un NCo de NCmod NP , le NC de NUM NCT , un ADJ NC comme il , avec le NC et un NC à DETPOSS NCCOR ."
13,Zola/1888_16_Le_reve._clean.txt,"Et , dans le tympan , au-dessus de le linteau , toute la légende de la vierge enfant , fiancée à Jésus , se déroule , en haut relief , d' une foi naïve : ses cheveux qui s' allongèrent et la vêtirent , lorsque le gouverneur , dont elle refusait le fils , l' envoya nue à les mauvais lieux ; les flammes de le bûcher qui , s' écartant de ses membres , brûlèrent les bourreaux , dès qu' ils eurent allumé le bois ; les miracles de ses ossements , Constance , fille de l' empereur , guérie de la lèpre , et les miracles d' une de ses figures peintes , le prêtre Paulin , tourmenté de le besoin de prendre femme , présentant , sur le conseil de le pape , l' anneau orné d' une émeraude à l' image , qui tendit le doigt , puis le rentra , gardant l' anneau qu' on y voit encore , ce qui délivra Paulin .","et , dans le NC , ADVLIEU de le NC , tout le NCs de le ADJ NCmod , PPAS à NP , se PRES , en NC NCmod , de un NC ADJ : DETPOSS NCCOR qui se PRES et le VPS , lorsque le NC , dont il VIMP le NCo , le NC ADJ à le ADJ NCmod ; le NC de le NCmod qui , se PPRES de DETPOSS NC , VPS le NCo , dès que il avoir PPAS le NCo ; le NC de DETPOSS NCmod , NP , NC de le NCmod , NC de le NCmod , et le NC de un de DETPOSS NCCOR ADJ , le NC NP , VSENT de le NC de INF NCo , PPRES , sur le NC de le NCmod , le NC PPAS de un ADJCOL à le NCmod , qui VPS le NCCOR , puis le VPS , PPRES le NCo que on y VCOG encore , ce qui VF NP ."
14,Zola/1888_16_Le_reve._clean.txt,"À le sommet de le tympan , dans une gloire , Agnès est enfin reçue à le ciel , où son fiancé Jésus l' épouse , toute petite et si jeune , en lui donnant le baiser de les éternelles délices .","à le NC de le NCmod , dans un NCmod , NP être PHASE PPAS à le NC , où DETPOSS NCs NP le NC , tout ADJ et si ADJ , en lui PPRES le NCo de le NCmod ADJ ."
15,Zola/1888_16_Le_reve._clean.txt,"Mais , lorsque le vent enfilait la rue , la neige fouettait de face , de les paquets blancs menaçaient de barrer le seuil ; et l' enfant , alors , se garait sur les côtés , contre les vierges posées au-dessus de le stylobate de l' ébrasement .","mais , lorsque le NCs VIMP le NCo , le NCs VIMP de NC , de le NCmod ADJCOL VIMP de INF le NCo ; et le NC , alors , se VCOND sur le NC , contre le NCmod PPAS ADVLIEU de le NC de le NCmod ."
16,Zola/1888_16_Le_reve._clean.txt,"Ce sont les compagnes d' Agnès , les saintes qui lui servent d' escorte : trois à sa droite , Dorothée , nourrie en prison de pain miraculeux , Barbe , qui vécut dans une tour , Geneviève , dont la virginité sauva Paris ; et trois à sa gauche , Agathe , les mamelles tordues et arrachées , Christine , torturée par son père , et qui lui jeta de sa chair à le visage , Cécile , qui fut aimée d' un ange .","ce être le NC de NP , le NC qui lui PRES de NC : NUM à DETPOSS NCmod , NP , NC en NCmod de NCmod ADJ , NP , qui VPS dans un NC , NP , dont le NCs VPS NP ; et NUM à DETPOSS NCmod , NP , le NCo PPAS et PPAS , NP , PPAS par DETPOSS NC , et qui lui VPS de DETPOSS NCCOR à le NCCOR , NP , qui être VSENT de un NC ."
17,Zola/1888_16_Le_reve._clean.txt,"Au-dessus d' elles , de les vierges encore , trois rangs serrés de vierges montent avec les arcs de les claveaux , garnissent les trois voussures d' une floraison de chairs triomphantes et chastes , en bas martyrisées , broyées dans les tourments , en haut accueillies par un vol de chérubins , ravies d' extase à le milieu de la cour céleste .","ADVLIEU de il , de le NC encore , NUM NCs PPAS de NC PRES avec le NC de le NCmod , PRES le NUM NCo de un NCmod de NCCOR ADJ et ADJ , en ADJ NCmod , PPAS dans le NCSENT , en NC PPAS par un NC de NCmod , NC de NCSENT à le milieu de le NCmod ADJ ."
18,Zola/1888_16_Le_reve._clean.txt,"Et rien ne la protégeait plus , depuis longtemps , lorsque huit heures sonnèrent et que le jour grandit .","et rien ne le VIMP plus , depuis longtemps , lorsque NUM NCT VPS et que le NCT ADJ ."
19,Zola/1888_16_Le_reve._clean.txt,"La neige , si elle ne l' eût foulée , lui serait allée à les épaules .","le NCs , si il ne le avoir PPAS , lui être aller à le NCCOR ."
20,Zola/1888_16_Le_reve._clean.txt,"L' antique porte , derrière elle , s' en trouvait tapissée , comme tendue d' hermine , toute blanche ainsi qu' un reposoir , à le bas de la façade grise , si nue et si lisse , que pas un flocon ne s' y accrochait .","le ADJ NC , ADVLIEU il , se en VIMP PPAS , comme NC de NCmod , tout ADJ ainsi que un NC , à le NC de le NCmod ADJ , si ADJ et si ADJ , que pas un NCs ne se y VIMP ."
21,Zola/1888_16_Le_reve._clean.txt,"Les grandes saintes de l' ébrasement surtout en étaient vêtues , de leurs pieds blancs à leurs cheveux blancs , éclatantes de candeur .","le ADJ NC de le NCmod surtout en être PPAS , de DETPOSS NCCOR ADJCOL à DETPOSS NCCOR ADJCOL , NC de NCmod ."
22,Zola/1888_16_Le_reve._clean.txt,"Plus haut , les scènes de le tympan , les petites saintes de les voussures s' enlevaient en arêtes vives , dessinées d' un trait de clarté sur le fond sombre ; et cela jusqu' à le ravissement final , à le mariage d' Agnès , que les archanges semblaient célébrer sous une pluie de roses blanches .","plus ADV , le NCs de le NCmod , le ADJ NC de le NCmod se VIMP en NC ADJ , PPAS de un NC de NCmod sur le NCmod ADJ ; et cela jusque à le NCSENT ADJ , à le NC de NP , que le NCs VIMP INF sous un NC de ADJCOL ADJCOL ."
23,Zola/1888_16_Le_reve._clean.txt,"Debout sur son pilier , avec sa palme blanche , son agneau blanc , la statue de la vierge enfant avait la pureté blanche , le corps de neige immaculé , dans cette raideur immobile de le froid , qui glaçait autour d' elle le mystique élancement de la virginité victorieuse .","ADV sur DETPOSS NC , avec DETPOSS NCmod ADJCOL , DETPOSS NCs ADJCOL , le NC de le ADJ NCmod avoir le NCo ADJCOL , le NCCOR de NCmod PPAS , dans ce NC ADJ de le NCmod , qui VIMP ADV de il le ADJ NCo de le NCmod ADJ ."
24,Zola/1888_16_Le_reve._clean.txt,"Et , à ses pieds , l' autre , l' enfant misérable , blanche de neige , elle aussi , raidie et blanche à croire qu' elle devenait de pierre , ne se distinguait plus de les grandes vierges .","et , à DETPOSS NCCOR , le autre , le NC ADJ , ADJCOL de NC , il aussi , PRES et PRES à VCOG que il devenir de NC , ne se VCOG plus de le ADJ NC ."
25,Zola/1888_16_Le_reve._clean.txt,"Cependant , le long de les façades endormies , une persienne qui se rabattit en claquant lui fit lever les yeux .","cependant , le NCmod de le NCmod ADJ , un NC qui se PRES en PPRES lui faire INF le NCCOR ."
26,Zola/1888_16_Le_reve._clean.txt,"C' était , à sa droite , à le premier étage de la maison qui touchait à la cathédrale .","ce être , à DETPOSS NC , à le ADJ NCmod de le NCmod qui VIMP à le NC ."
27,Zola/1888_16_Le_reve._clean.txt,"Une femme , très belle , une brune forte , d' environ quarante ans , venait de se pencher là; et , malgré la gelée terrible , elle laissa une minute son bras nu dehors , ayant vu remuer l' enfant .","un NCs , très ADJ , un NC fort , de environ NUM NCT , venir de se INF là; et , malgré le NC ADJ , il laisser un NCT DETPOSS NCCOR PPAS ADV , avoir VCOG INF le NCo ."
28,Zola/1888_16_Le_reve._clean.txt,Une surprise apitoyée attrista son calme visage .,un NCSENT VSENT VSENT DETPOSS NCSENT NCCOR .
29,Zola/1888_16_Le_reve._clean.txt,"Puis , dans un frisson , elle referma la fenêtre .","puis , dans un NCSENT , il VPS le NCo ."
30,Zola/1888_16_Le_reve._clean.txt,"Elle emportait la vision rapide , sous le lambeau de foulard , d' une gamine blonde , avec de les yeux couleur de violette ; la face allongée , le col surtout très long , d' une élégance de lis , sur de les épaules tombantes ; mais bleuie de froid , ses petites mains et ses petits pieds à moitié morts , n' ayant plus de vivant que la buée légère de son haleine .","il VIMP le NCo ADJ , sous le NC de NCmod , de un NC ADJCOL , avec de le NCCOR NCmod de NCmod ; le NC PPAS , le NC surtout très ADJ , de un NCmod de NCmod , sur un le NCCOR ADJ ; mais PPAS de NC , DETPOSS ADJ NCCOR et DETPOSS ADJ NCCOR à NCmod ADJ , ne avoir plus de PPRES que le NC ADJ de DETPOSS NCmod ."
31,Zola/1888_16_Le_reve._clean.txt,"L' enfant , machinale , était restée les yeux en l' air , regardant la maison , une étroite maison à un seul étage , très ancienne , bâtie vers la fin de le quinzième siècle .","le NCs , ADJ , être PPAS le NCCOR en le NCMAN , VCOG le NCo , un ADJ NC à un ADJ NCmod , très ADJ , PPAS vers le NC de le ADJ NCT ."
32,Zola/1888_16_Le_reve._clean.txt,"Elle se trouvait scellée à le flanc même de la cathédrale , entre deux contreforts , comme une verrue qui aurait poussé entre les deux doigts de pied d' un colosse .","il se VIMP PPAS à le NC même de le NCmod , entre NUM NC , comme un NCmod qui avoir PPAS entre le NUM NC de NCCOR de un NCmod ."
33,Zola/1888_16_Le_reve._clean.txt,"Et , accotée ainsi , elle s' était admirablement conservée , avec son soubassement de pierre , son étage en pans de bois , garnis de briques apparentes , son comble dont la charpente avançait d' un mètre sur le pignon , sa tourelle d' escalier saillante , à l' angle de gauche , et où la mince fenêtre gardait encore la mise en plomb de le temps .","et , PPAS ainsi , il se être ADVINT PPAS , avec DETPOSS NC de NCmod , DETPOSS NC en NCmod de NCmod , NC de ADJCOL ADJ , DETPOSS NC dont le NCs VIMP de un NC sur le NCmod , DETPOSS NC de NCmod ADJ , à le NC de NCmod , et où le NCs INF VIMP encore le NCo en NCmod de le temps ."
34,Zola/1888_16_Le_reve._clean.txt,L' âge toutefois avait nécessité de les réparations .,le NCs ADV avoir PPAS de le NC .
35,Zola/1888_16_Le_reve._clean.txt,La couverture de tuiles devait dater de Louis XIV .,le NCs de NCmod devoir INF de NP NUM .
36,Zola/1888_16_Le_reve._clean.txt,"On reconnaissait aisément les travaux faits vers cette époque : une lucarne percée dans l' acrotère de la tourelle , de les châssis à petits bois remplaçant partout ceux de les vitraux primitifs , les trois baies accolées de le premier étage réduites à deux , celle de le milieu bouchée avec de les briques , ce qui donnait à la façade la symétrie de les autres constructions de la rue , plus récentes .","on VCOG ADV le NCo faire vers ce NC : un NC PPAS dans le NC de le NCmod , de le NC à ADJ NCmod PPRES ADV celui de le NCmod ADJ , le NUM NC PPAS de le ADJ NC PPAS à NUM , celui de le milieu PPAS avec de le ADJCOL , ce qui VIMP à le NC le NCo de le autre NCmod de le NCmod , plus ADJ ."
37,Zola/1888_16_Le_reve._clean.txt,"À le rez-de-chaussée , les modifications étaient tout aussi visibles , une porte de chêne moulurée à la place de la vieille porte à ferrures , sous l' escalier , et la grande arcature centrale dont on avait maçonné le bas , les côtés et la pointe , de façon à n' avoir plus qu' une ouverture rectangulaire , une sorte de large fenêtre , à le lieu de la baie en ogive qui jadis débouchait sur le pavé .","à le NC , le NCs être tout aussi ADJ , un NC de NCmod PPAS à le NC de le ADJ NCmod à NCmod , sous le NC , et le ADJ NC ADJ dont on avoir PPAS le NCo , le NC et le NC , de façon à ne avoir plus que un NCo ADJ , un sorte de ADJ NCmod , à le NC de le NC en NCmod qui ADV VIMP sur le NC ."
38,Zola/1888_16_Le_reve._clean.txt,"Sans pensées , l' enfant regardait toujours ce logis vénérable de maître artisan , proprement tenu , et elle lisait , clouée à gauche de la porte , une enseigne jaune , portant ces mots : Hubert chasublier , en vieilles lettres noires , lorsque , de nouveau , le bruit d' un volet rabattu l' occupa .","sans NC , le NCs VCOG ADVTEMPS ce NCo ADJ de NCmod ADJ , ADVMAN PPAS , et il VIMP , PPAS à NC de le NCmod , un NCo ADJCOL , PPRES ce NCo : NP ADJ , en vieille NCmod ADJ , lorsque , de ADJ , le NC de un NCmod rabatil le VPS ."
39,Zola/1888_16_Le_reve._clean.txt,"Cette fois , c' était le volet de la fenêtre carrée de le rez-de-chaussée : un homme à son tour se penchait , le visage tourmenté , à le nez en bec d' aigle , à le front bossu , couronné de cheveux épais et blancs déjà , malgré ses quarante-cinq ans à peine ; et lui aussi s' oublia une minute à l' examiner , avec un pli douloureux de sa grande bouche tendre .","ce fois , ce être le NC de le NCmod ADJ de le NCmod : un NCs à DETPOSS NCmod se VIMP , le NCCOR ADJ , à le NCCOR en NCmod de NCmod , à le NCCOR ADJ , PPAS de NCCOR ADJ et ADJCOL déjà , malgré DETPOSS NUM NCT à NCSENT ; et lui aussi si VCOG un NCT à le INF , avec un NC ADJ de DETPOSS ADJ NCCOR INF ."
40,Zola/1888_16_Le_reve._clean.txt,"Ensuite , elle le vit qui demeurait debout , derrière les petites vitres verdâtres .","PHASE , il le VCOG qui VIMP ADV , ADVLIEU le ADJ NC ADJCOL ."
41,Zola/1888_16_Le_reve._clean.txt,"Il se tourna , il eut un geste , sa femme reparut , très belle .","il se VPS , il avoir un NCo , DETPOSS NCs VPS , très ADJ ."
42,Zola/1888_16_Le_reve._clean.txt,"Tous les deux , côte à côte , ne bougeaient plus , ne la quittaient plus de le regard , l' air profondément triste .","tout le NCs , NCmod à NCmod , ne VIMP plus , ne le VIMP plus de le NCMAN , le NCMAN ADVINT ADJ ."
43,Zola/1888_16_Le_reve._clean.txt,"Il y avait quatre cents ans que la lignée de les Hubert , brodeurs de père en fils , habitait cette maison .","il y avoir NUM ADJ NCT que le NCs de le NP , NC de NCmod en NCmod , VIMP ce NCo ."
44,Zola/1888_16_Le_reve._clean.txt,"Un maître chasublier l' avait fait construire sous Louis XI , un autre , réparer sous Louis XIV ; et l' Hubert actuel y brodait de les chasubles , comme tous ceux de sa race .","un NC ADJ le avoir faire INF sous NP NUM , un autre , INF sous NP NUM ; et le NP ADJ y VIMP de le NC , comme tout celui de DETPOSS NCmod ."
45,Zola/1888_16_Le_reve._clean.txt,"À vingt ans , il avait aimé une jeune fille de seize ans , Hubertine , d' une telle passion , que , sur le refus de la mère , veuve d' un magistrat , il l' avait enlevée , puis épousée .","à NUM NCT , il avoir VSENT un ADJ NCo de NUM NCT , NP , de un tel NCSENT , que , sur le NC de le NCmod , NC de un NCmod , il le avoir PPAS , puis PPAS ."
46,Zola/1888_16_Le_reve._clean.txt,"Elle était d' une beauté merveilleuse , ce fut tout leur roman , leur joie et leur malheur .","il être de un NC ADJ , ce être tout lui NC , lui NCSENT et lui NC ."
47,Zola/1888_16_Le_reve._clean.txt,"Lorsque , huit mois plus tard , enceinte , elle vint à le lit de mort de sa mère , celle-ci la déshérita et la maudit , si bien que l' enfant , né le même soir , mourut .","lorsque , NUM NCT plus tard , ADJ , il venir à le NC de NCmod de DETPOSS NCmod , celui-ci le VPS et le VPS , si bien que le NCs , PPAS le même NCT , VPS ."
48,Zola/1888_16_Le_reve._clean.txt,"Et , depuis , à le cimetière , dans son cercueil , l' entêtée bourgeoise ne pardonnait toujours pas , car le ménage n' avait plus eu d' enfant , malgré son ardent désir .","et , depuis , à le NC , dans DETPOSS NCmod , le NCs ADJ ne VIMP ADVTEMPS pas , car le NCs ne avoir plus avoir de NC , malgré DETPOSS ADJ NCSENT ."
49,Zola/1888_16_Le_reve._clean.txt,"Après vingt-quatre années , ils pleuraient encore celui qu' ils avaient perdu , ils désespéraient maintenant de jamais fléchir la morte .","PHASE NUM NCT , il VIMP encore celui que il avoir PPAS , il VIMP ADVT de ADVTEMPS VSENT le NCo ."
50,Zola/1888_16_Le_reve._clean.txt,"Troublée de leurs regards , la petite s' était renfoncée derrière le pilier de sainte Agnès .","VSENT de DETPOSS NCMAN , le ADJ se être PPAS ADVLIEU le NC de NCmod NP ."
51,Zola/1888_16_Le_reve._clean.txt,"Elle s' inquiétait aussi de le réveil de la rue : les boutiques s' ouvraient , de le monde commençait à sortir .","il se VSENT aussi de le NC de le NCmod : le NCs se VIMP , de le NC VASP à INF ."
52,Zola/1888_16_Le_reve._clean.txt,"Cette rue de les Orfèvres , dont le bout vient buter contre la façade latérale de l' église , serait une vraie impasse , bouchée de le côté de l' abside par la maison de les Hubert , si la rue Soleil , un étroit couloir , ne la dégageait de l' autre côté , en filant le long de le collatéral , jusqu' à la grande façade , place de le Cloître ; et il passa deux dévotes , qui eurent un coup d' œil étonné sur cette petite mendiante , qu' elles ne connaissaient pas , à Beaumont .","ce NCs de le NP , dont le NCs venir INF contre le NC ADJ de le NCmod , être un vrai NC , NC de le NCmod de le NCmod par le NCmod de le NP , si le NCs NP , un ADJ NC , ne le VIMP de le autre NC , en PPRES le NCo de le NCmod , jusque à le ADJ NC , NC de le NP ; et il VPS NUM NCo , qui avoir un NCo de NCmod VSENT sur ce ADJ NC , que il ne VIMP pas , à NP ."
53,Zola/1888_16_Le_reve._clean.txt,"La tombée lente et obstinée de la neige continuait , le froid semblait augmenter avec le jour blafard , on n' entendait qu' un lointain bruit de voix , dans la sourde épaisseur de le grand linceul blanc qui couvrait la ville .","le NCs ADJ et ADJ de le NCmod VIMP , le NCs sembler INF avec le NCT ADJ , on ne VCOG que un ADJ NCo de NCMAN , dans le ADJ NCmod de le ADJ NCmod ADJCOL qui VIMP le NCo ."
54,Zola/1888_16_Le_reve._clean.txt,"Mais , sauvage , honteuse de son abandon comme d' une faute , l' enfant se recula encore , lorsque , tout d' un coup , elle reconnut devant elle Hubertine , qui , n' ayant pas de bonne , était sortie chercher son pain .","mais , ADJ , ADJ de DETPOSS NC comme de un NC , le NCs se VPS encore , lorsque , tout de un NC , il VCOG ADVLIEU il NP , qui , ne avoir pas de ADJ , être PPAS INF DETPOSS NCo ."
55,Zola/1888_16_Le_reve._clean.txt,"Petite , que fais -tu là ?","ADJ , que faire il ADVLIEU ?"
56,Zola/1888_16_Le_reve._clean.txt,qui es-tu ?,qui es-il ?
57,Zola/1888_16_Le_reve._clean.txt,"Et elle ne répondit point , elle se cachait le visage .","et il ne VDIC ADV , il se VIMP le NCCOR ."
58,Zola/1888_16_Le_reve._clean.txt,"Cependant elle ne sentait plus ses membres , son être s' évanouissait , comme si son cœur , devenu de glace , se fût arrêté .","cependant il ne sentir plus DETPOSS NCo , DETPOSS être se VIMP , comme si DETPOSS NCs , devenir de NC , se être PPAS ."
59,Zola/1888_16_Le_reve._clean.txt,"Quand la bonne dame eut tourné le dos , avec un geste de pitié discrète , elle s' affaissa sur les genoux , à bout de forces , glissa ainsi qu' une chiffe dans la neige , dont les flocons , silencieusement , l' ensevelirent .","quand le ADJ NCs avoir PPAS le NCCOR , avec un NC de VSENT ADJ , il se VPS sur le NCCOR , à NC de NCSENT , VPS ainsi que un NCs dans le NCmod , dont le NC , ADV , le VPS ."
60,Zola/1888_16_Le_reve._clean.txt,"Et la dame , qui revenait avec son pain tout chaud , l' apercevant ainsi par terre , de nouveau s' approcha .","et le NCs , qui VIMP avec DETPOSS NC tout NCo , le PPRES ainsi par NC , de ADJ se VPS ."
61,Zola/1888_16_Le_reve._clean.txt,"Voyons , petite , tu ne peux rester sous cette porte .","VCOG , ADJ , je ne pouvoir INF sous ce NC ."
62,Zola/1888_16_Le_reve._clean.txt,"Alors , Hubert , qui était sorti à son tour , debout à le seuil de la maison , la débarrassa de le pain , en disant : Prends -la donc , apporte-la !","alors , NP , qui être PPAS à DETPOSS NC , ADV à le NC de le NCmod , le NC de le NCmod , en VDIC : prends -la donc , NC !"
63,Zola/1888_16_Le_reve._clean.txt,"Hubertine , sans ajouter rien , la prit dans ses bras solides .","NP , sans INF rien , le VPS dans DETPOSS NCCOR ADJ ."
64,Zola/1888_16_Le_reve._clean.txt,"Et l' enfant ne se reculait plus , emportée comme une chose , les dents serrées , les yeux fermés , toute froide , d' une légèreté de petit oiseau tombé de son nid .","et le NCs ne se VIMP plus , PPAS comme un chose , le NCCOR PPAS , le NCCOR ADJ , tout NC , de un NC de ADJ NCmod PPAS de DETPOSS NC ."
65,Zola/1888_16_Le_reve._clean.txt,"On rentra , Hubert referma la porte , tandis qu' Hubertine , chargée de son fardeau , traversait la pièce sur la rue , qui servait de salon et où quelques pans de broderie étaient en montre , devant la grande fenêtre carrée .","on VF , NP VPS le NCo , PHASE que NP , PPAS de DETPOSS NC , VIMP le NCo sur le NCmod , qui VIMP de NC et où quelque NCs de NCmod être en NC , ADVLIEU le ADJ NCmod ADJ ."
66,Zola/1888_16_Le_reve._clean.txt,"Puis , elle passa dans la cuisine , l' ancienne salle commune , conservée presque intacte , avec ses poutres apparentes , son dallage raccommodé en vingt endroits , sa vaste cheminée à le manteau de pierre .","puis , il VPS dans le NC , le ADJ NC ADJ , PPAS presque ADJ , avec DETPOSS NC ADJ , DETPOSS NC PPAS en NUM NC , DETPOSS ADJ NC à le NCmod de NCmod ."
67,Zola/1888_16_Le_reve._clean.txt,"Sur les planches , les ustensiles , pots , bouilloires , bassines , dataient d' un ou deux siècles , de vieilles faïences , de vieux grès , de vieux étains .","sur le NC , le NCs , NC , NC , NC , VIMP de NUM ou NUM NCT , un ADJ NC , de ADJ NC , un ADJ NC ."
68,Zola/1888_16_Le_reve._clean.txt,"Mais , occupant l' âtre de la cheminée , il y avait un fourneau moderne , un large fourneau de fonte , dont les garnitures de cuivre luisaient .","mais , PPRES le NCo de le NCmod , il y avoir un NCo ADJ , un ADJ NC de NCmod , dont le NCs de NCmod VIMP ."
69,Zola/1888_16_Le_reve._clean.txt,"Il était rouge , on entendait bouillir l' eau de le coquemar .","il être ADJCOL , on VCOG INF le NCo de le NCmod ."
70,Zola/1888_16_Le_reve._clean.txt,"Une casserole , pleine de café à le lait , se tenait chaude , à l' un de les bouts .","un NCs , ADJ de NCmod à le NCmod , se VIMP NC , à le un de le NCmod ."
71,Zola/1888_16_Le_reve._clean.txt,Fichtre !,NP !
