id,titre,phrase,motifs_phrase
1817,Zola/1888_16_Le_reve._clean.txt,"Elles entraient avec le rayon de lune , elles venaient de les grands arbres mystérieux de l' évêché , à les cimes bleues , de les coins perdus de la cathédrale , enchevêtrant sa forêt de pierres .","il VIMP avec le NC de NCmod , il venir de le ADJ NC ADJ de le NCmod , à le NC ADJCOL , de le NC PPAS de le NC , PPRES DETPOSS NCo de NCmod ."
1818,Zola/1888_16_Le_reve._clean.txt,"De tout l' horizon connu et aimé , de la Chevrotte , de les saules , de les herbes , la jeune fille entendait ses rêves qui lui revenaient , les espoirs , les désirs , ce qu' elle avait mis d' elle dans les choses , à les voir chaque jour , et que les choses lui renvoyaient .","de tout le NC PPAS et PPAS , de le NP , de le NC , de le NC , le ADJ NCs VCOG DETPOSS NCo qui lui VIMP , le NCSENT , le NCSENT , ce que il avoir mettre de il dans le chose , à le VCOG chaque NCT , et que le chose lui VIMP ."
1819,Zola/1888_16_Le_reve._clean.txt,"Jamais les voix de l' invisible n' avaient parlé si haut , elle écoutait l' au-delà , elle reconnaissait , à le fond de la nuit brûlante , sans un souffle d' air , le léger frisson qui était pour elle le frôlement de la robe d' Agnès , quand la gardienne de son corps se tenait à son côté .","ADVTEMPS le NCMAN de le NCmod ne avoir PPAS si ADJ , il VCOG le ADV , il VCOG , à le NC de le NCT ADJ , sans un NC de NCMAN , le ADJ NCSENT qui être pour il le NC de le NCmod de NP , quand le NCs de DETPOSS NCCOR se VIMP à DETPOSS NC ."
1820,Zola/1888_16_Le_reve._clean.txt,"Elle s' égayait , de savoir Agnès là , avec les autres .","il se VSENT , de VCOG NP ADVLIEU , avec le autre ."
1821,Zola/1888_16_Le_reve._clean.txt,Et elle attendait .,et il VIMP .
1822,Zola/1888_16_Le_reve._clean.txt,"De le temps s' écoula encore , Angélique n' en avait pas conscience .","de le temps se VPS encore , NP ne en avoir pas NCo ."
1823,Zola/1888_16_Le_reve._clean.txt,"Cela lui parut naturel , lorsque Félicien arriva , enjambant la balustrade de le balcon .","cela lui paraître ADJ , lorsque NP VPS , PPRES le NCo de le NCmod ."
1824,Zola/1888_16_Le_reve._clean.txt,"Sur le ciel blanc , sa taille haute se détachait .","sur le NC ADJCOL , DETPOSS NCs ADJ se VIMP ."
1825,Zola/1888_16_Le_reve._clean.txt,"Il n' entra pas , il resta dans le cadre lumineux de la fenêtre .","il ne VPS pas , il VPS dans le NC ADJ de le NCmod ."
1826,Zola/1888_16_Le_reve._clean.txt,"N' ayez pas peur ... C' est moi , je suis venu .","ne avoir pas NCSENT ... ce être soi , je être venir ."
1827,Zola/1888_16_Le_reve._clean.txt,"Elle n' avait pas peur , elle le trouvait simplement exact .","il ne avoir pas NCSENT , il le VIMP ADVMAN ADJ ."
1828,Zola/1888_16_Le_reve._clean.txt,"C' est par les charpentes , n' est -ce pas , que vous êtes monté ?","ce être par le NC , ne être ce pas , que vous être PPAS ?"
1829,Zola/1888_16_Le_reve._clean.txt,"Oui , par les charpentes .","oui , par le NC ."
1830,Zola/1888_16_Le_reve._clean.txt,Ce moyen si aisé la fit rire .,ce NC si PPAS le faire INF .
1831,Zola/1888_16_Le_reve._clean.txt,"Il s' était hissé d' abord sur l' auvent de la porte ; puis , de là , grimpant le long de la console , dont le pied s' appuyait à le bandeau de le rez-de-chaussée , il avait sans peine atteint le balcon .","il se être PPAS de NC sur le NC de le NCmod ; puis , de ADVLIEU , PPRES le NCo de le NCmod , dont le NCCOR se VIMP à le NC de le NCmod , il avoir sans NCSENT PRES le NCo ."
1832,Zola/1888_16_Le_reve._clean.txt,"Je vous attendais , venez près de moi .","je vous VIMP , venir ADVLIEU de soi ."
1833,Zola/1888_16_Le_reve._clean.txt,"Félicien , qui arrivait violent , jeté à les résolutions folles , ne bougea pas , étourdi de cette félicité brusque .","NP , qui VIMP ADJ , PPAS à le NC ADJ , ne VPS pas , NCo de ce NCSENT ADJ ."
1834,Zola/1888_16_Le_reve._clean.txt,"Et Angélique , maintenant , était certaine que les saintes ne lui défendaient pas d' aimer , car elle les entendait l' accueillir avec elle , d' un rire d' affection , léger comme une haleine de la nuit .","et NP , ADVT , être ADJ que le NCs ne lui VIMP pas de VSENT , car il le VCOG le INF avec il , de un NCMAN de NCSENT , INF comme un NC de le NCT ."
1835,Zola/1888_16_Le_reve._clean.txt,Où avait -elle eu la sottise de prendre qu' Agnès se fâcherait ?,où avoir il avoir le NCo de INF que NP se VSENT ?
1836,Zola/1888_16_Le_reve._clean.txt,"À son côté , Agnès était radieuse d' une joie qu' elle sentait descendre sur ses épaules et l' envelopper , pareille à la caresse de deux grandes ailes .","à DETPOSS NC , NP être ADJ de un NCSENT que il sentir INF sur DETPOSS NCCOR et le INF , ADJ à le NC de NUM ADJ NCmod ."
1837,Zola/1888_16_Le_reve._clean.txt,"Toutes , qui étaient mortes d' amour , se montraient compatissantes à les peines de les vierges , et ne revenaient errer , par les nuits chaudes , que pour veiller , invisibles , sur leurs tendresses en larmes .","tout , qui être ADJ de NCSENT , se VIMP ADJ à le NCSENT de le NCmod , et ne VIMP INF , par le NCT ADJ , que pour INF , ADJ , sur DETPOSS NCSENT en NCmod ."
1838,Zola/1888_16_Le_reve._clean.txt,"Venez près de moi , je vous attendais .","venir ADVLIEU de soi , je vous VIMP ."
1839,Zola/1888_16_Le_reve._clean.txt,"Alors , chancelant , Félicien entra .","alors , NCs , NP VPS ."
1840,Zola/1888_16_Le_reve._clean.txt,"Il s' était dit qu' il la voulait , qu' il la saisirait entre ses bras , à l' étouffer , malgré ses cris .","il se être VDIC que il le vouloir , que il le VCOND entre DETPOSS NCCOR , à le INF , malgré DETPOSS NC ."
1841,Zola/1888_16_Le_reve._clean.txt,"Et voilà qu' en la trouvant si douce , voilà qu' en pénétrant dans cette chambre toute blanche et si pure , il redevenait plus candide et plus faible qu' un enfant .","et voilà que en le PPRES si ADJ , voilà que en PPRES dans ce NC tout ADJCOL et si ADJ , il VIMP plus ADJ et plus ADJ que un NC ."
1842,Zola/1888_16_Le_reve._clean.txt,Il avait fait trois pas .,il avoir faire NUM pas .
1843,Zola/1888_16_Le_reve._clean.txt,"Mais il frissonnait , il tomba sur les deux genoux , loin d' elle .","mais il VIMP , il VPS sur le NUM NCCOR , ADVLIEU de il ."
1844,Zola/1888_16_Le_reve._clean.txt,Si vous saviez quelle abominable torture !,si vous PRES quel ADJ NCo !
1845,Zola/1888_16_Le_reve._clean.txt,"Je n' avais jamais souffert ainsi , l' unique douleur est de ne se croire pas aimé! ... Je veux bien tout perdre , être un misérable , mourant de faim , tordu par la maladie .","je ne avoir ADVTEMPS VSENT ainsi , le ADJ NCSENT être de ne se VCOG pas aimé! ... je vouloir bien tout INF , être un NC , PPRES de NC , PPAS par le NC ."
1846,Zola/1888_16_Le_reve._clean.txt,"Mais je ne veux plus passer une journée , avec ce mal dévorant dans le cœur , de me dire que vous ne m' aimez pas ... Soyez bonne , épargnez -moi ... Elle l' écoutait , muette , bouleversée de pitié , bienheureuse cependant .","mais je ne vouloir plus INF un NCT , avec ce mal VSENT dans le NC , de me VDIC que vous ne le VSENT pas ... être ADJ , IMP soi ... il le VIMP , NC , VSENT de VSENT , ADJ cependant ."
1847,Zola/1888_16_Le_reve._clean.txt,"Ce matin , comme vous m' avez laissé partir !","ce NCT , comme vous se avoir laisser INF !"
1848,Zola/1888_16_Le_reve._clean.txt,"Je m' imaginais que vous étiez devenue meilleure , que vous aviez compris .","je lui PRES que vous PRES devenir meilleur , que vous PRES VCOG ."
1849,Zola/1888_16_Le_reve._clean.txt,"Et je vous ai retrouvée telle qu' à le premier jour , indifférente , me traitant en simple client qui passe , me rappelant durement à les questions basses de la vie ... Dans l' escalier , je trébuchais .","et je vous avoir PPAS tel que à le ADJ NCT , ADJ , me PPRES en ADJ NC qui PRES , me PPRES ADVINT à le NC ADJ de le NCmod ... dans le NC , je VIMP ."
1850,Zola/1888_16_Le_reve._clean.txt,"Dehors , j' ai couru , j' avais peur d' éclater en larmes .","ADV , je avoir PPAS , je avoir NCSENT de INF en NC ."
1851,Zola/1888_16_Le_reve._clean.txt,"Puis , à le moment de monter chez moi , il m' a semblé que j' allais étouffer , si je m' enfermais ... Alors , je me suis sauvé en rase campagne , j' ai marché à le hasard , un chemin , puis un autre .","puis , à le NC de INF chez soi , il lui avoir sembler que je aller INF , si je se enfermais ... alors , je me être PPAS en ADJ NC , je avoir PPAS à le NC , un NCo , puis un autre ."
1852,Zola/1888_16_Le_reve._clean.txt,"La nuit s' est faite , je marchais encore .","le NCT se être faire , je VIMP encore ."
1853,Zola/1888_16_Le_reve._clean.txt,Mais le tourment galopait aussi vite et me dévorait .,mais le NCSENT VIMP aussi ADV et me VSENT .
1854,Zola/1888_16_Le_reve._clean.txt,"Quand on aime , on ne peut fuir la peine de son amour ... Tenez !","quand on VSENT , on ne pouvoir INF le NCSENT de DETPOSS NCSENT ... NP !"
1855,Zola/1888_16_Le_reve._clean.txt,"c' était là que vous aviez planté le couteau , et la pointe s' enfonçait toujours plus avant .","ce être ADVLIEU que vous VSUBP NCo le NC , et le NCs se VIMP ADVTEMPS plus PHASE ."
1856,Zola/1888_16_Le_reve._clean.txt,"Il eut une longue plainte , à le souvenir de son supplice .","il avoir un ADJ NCo , à le NC de DETPOSS NCSENT ."
1857,Zola/1888_16_Le_reve._clean.txt,"Je suis resté de les heures dans l' herbe , abattu par le mal , comme un arbre arraché ... Et plus rien n' existait , il n' y avait que vous .","je être PPAS de le NCT dans le NCmod , PPAS par le mal , comme un NC PPAS ... et plus rien ne VIMP , il ne y avoir que vous ."
1858,Zola/1888_16_Le_reve._clean.txt,La pensée que je ne vous aurais pas me faisait mourir .,le NC que je ne vous avoir pas me faire INF .
1859,Zola/1888_16_Le_reve._clean.txt,"Déjà , mes membres s' engourdissaient , une folie emportait ma tête ... Et c' est pourquoi je suis revenu .","déjà , DETPOSS NCs se VIMP , un NCs VIMP DETPOSS NCCOR ... et ce être pourquoi je être PPAS ."
1860,Zola/1888_16_Le_reve._clean.txt,"Je ne sais par où j' ai passé , comment j' ai pu arriver jusqu' à cette chambre .","je ne VCOG par où je avoir PPAS , comment je avoir pouvoir INF jusque à ce NC ."
1861,Zola/1888_16_Le_reve._clean.txt,"Pardonnez -moi , j' aurais fendu les portes avec mes poings , je me serais hissé à votre fenêtre en plein jour ... Elle était dans l' ombre .","IMP soi , je avoir PPAS le NCo avec DETPOSS NCmod , je me être PPAS à DETPOSS NC en ADJ NCT ... il être dans le NC ."
1862,Zola/1888_16_Le_reve._clean.txt,"Lui , à genoux sous la lune , ne la voyait pas , toute pâlie de tendresse repentante , si émue , qu' elle ne pouvait parler .","il , à NCmod sous le NCmod , ne le VCOG pas , tout NC de NCSENT ADJ , si VSENT , que il ne pouvoir INF ."
1863,Zola/1888_16_Le_reve._clean.txt,"Il la crut insensible , il joignit les mains .","il le NC ADJ , il PRES le NCCOR ."
1864,Zola/1888_16_Le_reve._clean.txt,"Cela date de loin ... C' est un soir que je vous ai aperçue , ici , à cette fenêtre .","cela PRES de ADVLIEU ... ce être un NCT que je vous avoir PPAS , ADVLIEU , à ce NC ."
1865,Zola/1888_16_Le_reve._clean.txt,"Vous n' étiez qu' une blancheur vague , je distinguais à peine votre visage , et pourtant je vous voyais , je vous devinais telle que vous êtes .","vous ne VSUBP que un NCo ADJ , je VIMP à NCSENT DETPOSS NCCOR , et pourtant je vous VCOG , je vous PRES tel que vous être ."
1866,Zola/1888_16_Le_reve._clean.txt,"Mais j' avais très peur , j' ai rôdé , pendant de les nuits , sans trouver le courage de vous rencontrer en plein jour ... Et puis , vous me plaisiez dans ce mystère , mon bonheur était de rêver à vous , comme à une inconnue que je ne connaîtrais jamais ... Plus tard , j' ai su qui vous étiez , on ne peut résister à ce besoin de savoir , de posséder son rêve .","mais je avoir très NCSENT , je avoir PPAS , PHASE de le NCT , sans INF le NCo de vous INF en ADJ NCT ... et puis , vous me PRES dans ce NC , DETPOSS NCSENT être de INF à vous , comme à un NC que je ne VCOND ADVTEMPS ... plus tard , je avoir VCOG qui vous PRES , on ne pouvoir INF à ce NC de VCOG , de INF DETPOSS NCo ."
1867,Zola/1888_16_Le_reve._clean.txt,C' est alors que ma fièvre a commencé .,ce être alors que DETPOSS VSENT avoir VASP .
1868,Zola/1888_16_Le_reve._clean.txt,Elle a grandi à chaque rencontre .,il avoir PPAS à chaque NC .
1869,Zola/1888_16_Le_reve._clean.txt,"Vous vous rappelez , la première fois , dans ce champ , le matin où j' examinais le vitrail .","vous vous PRES , le ADJ fois , dans ce NC , le NCT où je PRES le NCo ."
1870,Zola/1888_16_Le_reve._clean.txt,"Jamais je ne m' étais senti si gauche , vous avez eu bien raison de vous moquer de moi ... Et je vous ai effrayée ensuite , j' ai continué à être maladroit , en vous poursuivant jusque chez vos pauvres .","ADVTEMPS je ne se être sentir si ADJ , vous avoir avoir bien NCo de vous INF de soi ... et je vous avoir VSENT PHASE , je avoir PPAS à être ADJ , en vous PPRES jusque chez DETPOSS NC ."
1871,Zola/1888_16_Le_reve._clean.txt,"Déjà , je cessais d' être le maître de ma volonté , je faisais les choses avec l' étonnement et la crainte de les faire ... Lorsque je me suis présenté pour la commande de cette mitre , c' est une force qui me poussait , car moi je n' osais point , j' étais certain de vous déplaire ... Si vous compreniez à quel point je suis misérable !","déjà , je VASP de être le NC de DETPOSS NCmod , je faire le chose avec le NCSENT et le NCSENT de le faire ... lorsque je me être PPAS pour le NC de ce NCmod , ce être un NCSENT qui me VIMP , car soi je ne VIMP ADV , je être ADJ de vous INF ... si vous PRES à quel NC je être ADJ !"
1872,Zola/1888_16_Le_reve._clean.txt,"Ne m' aimez pas , mais laissez -moi vous aimer .","ne le VSENT pas , mais laisser soi vous VSENT ."
1873,Zola/1888_16_Le_reve._clean.txt,"Soyez froide , soyez méchante , je vous aimerai comme vous serez .","être ADJ , être ADJ , je vous VSENT comme vous être ."
1874,Zola/1888_16_Le_reve._clean.txt,"Je ne vous demande que de vous voir , sans espoir aucun , pour l' unique joie d' être ainsi , à vos genoux .","je ne vous PRES que de vous VCOG , sans NCSENT aucun , pour le ADJ NCSENT de être ainsi , à DETPOSS NCCOR ."
1875,Zola/1888_16_Le_reve._clean.txt,"Il se tut , défaillant , perdant courage à croire qu' il ne trouvait rien pour la toucher .","il se PRES , PPRES , PPRES NCo à VCOG que il ne VIMP rien pour le INF ."
1876,Zola/1888_16_Le_reve._clean.txt,"Et il ne sentait pas qu' elle souriait , d' un sourire invincible , peu à peu grandi sur ses lèvres .","et il ne sentir pas que il VIMP , de un NCMAN ADJ , peu à peu PPAS sur DETPOSS NCCOR ."
1877,Zola/1888_16_Le_reve._clean.txt,Ah !,INTJ !
1878,Zola/1888_16_Le_reve._clean.txt,"le cher garçon , il était si naïf et si croyant , il récitait là sa prière de cœur tout neuf et passionné , en adoration devant elle , comme devant le rêve même de sa jeunesse !","le ADJ NC , il être si NC et si PPRES , il VIMP ADVLIEU DETPOSS NCo de NCmod tout ADJ et ADJ , en NCSENT ADVLIEU il , comme ADVLIEU le NC même de DETPOSS NCmod !"
1879,Zola/1888_16_Le_reve._clean.txt,"Dire qu' elle avait lutté d' abord pour ne pas le revoir , puis qu' elle s' était juré de l' aimer sans jamais qu' il le sût !","VDIC que il avoir PPAS de NC pour ne pas le VCOG , puis que il se être PPAS de le VSENT sans ADVTEMPS que il le VSUBI !"
1880,Zola/1888_16_Le_reve._clean.txt,"Un grand silence s' était fait , les saintes ne défendaient point d' aimer , lorsqu' on aimait ainsi .","un ADJ NCs se être faire , le NCs ne VIMP ADV de VSENT , lorsque on VSENT ainsi ."
1881,Zola/1888_16_Le_reve._clean.txt,"Derrière son dos , une gaieté avait couru , à peine un frisson , l' onde mouvante de la lune sur le carreau de la chambre .","ADVLIEU DETPOSS NCCOR , un NCSENT avoir PPAS , à NCSENT un NCSENT , le NCo ADJ de le NCmod sur le NCmod de le NCmod ."
1882,Zola/1888_16_Le_reve._clean.txt,"Un doigt invisible , sans doute celui de sa gardienne , se posa sur sa bouche , pour la desceller de son serment .","un NCCOR ADJ , sans NCSENT celui de DETPOSS NCmod , se VPS sur DETPOSS NCCOR , pour le INF de DETPOSS NC ."
1883,Zola/1888_16_Le_reve._clean.txt,"Elle pouvait parler désormais , tout ce qui flottait de puissant et de tendre à son entour lui soufflait de les paroles .","il pouvoir INF ADV , tout ce qui VIMP de ADJ et de INF à DETPOSS NC lui VIMP de le NC ."
1884,Zola/1888_16_Le_reve._clean.txt,Ah !,INTJ !
1885,Zola/1888_16_Le_reve._clean.txt,"oui , je me souviens , je me souviens ... Et Félicien , tout de suite , fut pris par la musique de cette voix , dont le charme était sur lui si fort , que son amour grandissait , rien qu' à l' entendre .","oui , je me PRES , je me PRES ... et NP , tout de NC , être PPAS par le NC de ce NCMAN , dont le NCs être sur lui si fort , que DETPOSS NCSENT VIMP , rien que à le VCOG ."
1886,Zola/1888_16_Le_reve._clean.txt,"Oui , je me souviens , quand vous êtes venu dans la nuit ... Vous étiez si loin , les premiers soirs , que le petit bruit de vos pas me laissait incertaine .","oui , je me PRES , quand vous être venir dans le NCT ... vous PRES si ADVLIEU , le ADJ NCT , que le ADJ NCs de DETPOSS pas me laisser ADJ ."
1887,Zola/1888_16_Le_reve._clean.txt,"Ensuite , je vous ai reconnu , et j' ai vu plus tard votre ombre , et un soir enfin vous vous êtes montré , par une belle nuit pareille à celle-ci , en pleine lumière blanche .","PHASE , je vous avoir VCOG , et je avoir VCOG plus tard DETPOSS NCo , et un NCT PHASE vous vous être PPAS , par un ADJ NCT ADJ à celui-ci , en ADJ NC ADJCOL ."
1888,Zola/1888_16_Le_reve._clean.txt,"Vous sortiez lentement de les choses , tel que je vous attendais depuis de les années ... Je me souviens de le grand rire que je retenais , qui a éclaté malgré moi , lorsque vous avez sauvé ce linge , emporté par la Chevrotte .","vous PRES ADV de le chose , tel que je vous VIMP depuis de le NCT ... je me PRES de le ADJ NCMAN que je PRES , qui avoir PPAS malgré soi , lorsque vous avoir PPAS ce NCo , PPAS par le NP ."
1889,Zola/1888_16_Le_reve._clean.txt,"Je me souviens de ma colère , lorsque vous me voliez mes pauvres , en leur donnant tant d' argent , que j' avais l' air d' une avare .","je me PRES de DETPOSS NCSENT , lorsque vous me PRES DETPOSS NCo , en lui PPRES tant de NC , que je avoir le NCMAN de un NCmod ."
1890,Zola/1888_16_Le_reve._clean.txt,"Je me souviens de ma peur , le soir où vous m' avez forcée à courir si vite , les pieds nus dans l' herbe ... Oui , je me souviens , je me souviens ... Sa voix de cristal s' était troublée un peu , dans le frisson de ce dernier souvenir qu' elle évoquait , comme si le Je vous aime eût de nouveau passé sur son visage .","je me PRES de DETPOSS NCSENT , le NCT où vous lui avoir PPAS à INF si ADV , le NCCOR ADJ dans le NCmod ... oui , je me PRES , je me PRES ... DETPOSS NCMAN de NCmod se être PPAS un peu , dans le NCSENT de ce ADJ NCmod que il VIMP , comme si le je vous VSENT avoir de ADJ PPAS sur DETPOSS NCCOR ."
1891,Zola/1888_16_Le_reve._clean.txt,"Et lui , l' écoutait avec ravissement .","et lui , le VCOG avec NCSENT ."
1892,Zola/1888_16_Le_reve._clean.txt,"J' ai été méchante , c' est bien vrai .","je avoir être ADJ , ce être bien vrai ."
1893,Zola/1888_16_Le_reve._clean.txt,"On est si sotte , quand on ne sait pas !","on être si ADJ , quand on ne VCOG pas !"
1894,Zola/1888_16_Le_reve._clean.txt,"On fait de les choses qu' on croit nécessaires , on a peur d' être en faute , dès qu' on obéit à son cœur .","on faire de le chose que on VCOG ADJ , on avoir NCSENT de être en NC , dès que on PRES à DETPOSS NC ."
1895,Zola/1888_16_Le_reve._clean.txt,"Mais que j' ai eu de les remords ensuite , que j' ai souffert de votre souffrance !","mais que je avoir avoir de le NCSENT PHASE , que je avoir VSENT de DETPOSS NCSENT !"
1896,Zola/1888_16_Le_reve._clean.txt,"... Si je voulais expliquer cela , je ne pourrais pas sans doute .","... si je VIMP VDIC cela , je ne pouvoir pas sans NCSENT ."
1897,Zola/1888_16_Le_reve._clean.txt,"Lorsque vous êtes venu , avec votre dessin de sainte Agnès , j' étais enchantée de travailler pour vous , je me doutais bien que vous reviendriez chaque jour .","lorsque vous être venir , avec DETPOSS NC de NCmod NP , je être VSENT de INF pour vous , je me VIMP bien que vous VSUBP chaque NCT ."
1898,Zola/1888_16_Le_reve._clean.txt,"Et , voyez un peu , j' ai affecté l' indifférence , comme si je prenais à tâche de vous chasser de la maison .","et , VCOG un peu , je avoir VSENT le VSENT , comme si je VIMP à NC de vous INF de le NC ."
1899,Zola/1888_16_Le_reve._clean.txt,On a donc le besoin de se rendre malheureux ?,on avoir donc le NC de se INF ADJ ?
1900,Zola/1888_16_Le_reve._clean.txt,"Tandis que j' aurais voulu vous accueillir les mains ouvertes , il y avait , à le fond de mon être , une autre femme qui se révoltait , qui avait crainte et méfiance de vous , qui se plaisait à vous torturer d' incertitude , dans l' idée vague d' une querelle à vider , dont elle aurait oublié la cause très ancienne .","PHASE que je avoir vouloir vous INF le NCCOR ADJ , il y avoir , à le NC de DETPOSS être , un autre NCo qui se VSENT , qui avoir NCSENT et NC de vous , qui se VIMP à vous INF de NC , dans le NC ADJ de un NCmod à INF , dont il avoir VCOG le NCo très ADJ ."
1901,Zola/1888_16_Le_reve._clean.txt,"Je ne suis pas toujours bonne , il repousse en moi de les choses que j' ignore ... Et , le pis , certes , est que je vous ai parlé d' argent .","je ne être pas ADVTEMPS ADJ , il PRES en soi de le chose que je VCOG ... et , le NCs , ADV , être que je vous avoir PPAS de NC ."
1902,Zola/1888_16_Le_reve._clean.txt,Ah !,INTJ !
1903,Zola/1888_16_Le_reve._clean.txt,"l' argent , moi qui n' y ai jamais songé , qui en accepterais seulement de pleins chariots pour la joie d' en faire pleuvoir où je voudrais !","le NC , soi qui ne y avoir ADVTEMPS PPAS , qui en VCOND seulement de ADJ NC pour le NCSENT de en faire INF où je vouloir !"
1904,Zola/1888_16_Le_reve._clean.txt,Quel amusement de malice ai-je pu prendre à me calomnier ainsi ?,quel NCSENT de NCmod ai-je pouvoir INF à me INF ainsi ?
1905,Zola/1888_16_Le_reve._clean.txt,Me pardonnerez-vous ?,me pardonnerez-vous ?
1906,Zola/1888_16_Le_reve._clean.txt,Félicien était à ses pieds .,NP être à DETPOSS NCCOR .
1907,Zola/1888_16_Le_reve._clean.txt,"Il avait marché sur les genoux , jusqu' à elle .","il avoir PPAS sur le NCCOR , jusque à il ."
1908,Zola/1888_16_Le_reve._clean.txt,C' était inespéré et sans bornes .,ce être PPAS et sans NC .
1909,Zola/1888_16_Le_reve._clean.txt,Il murmura : Ah !,il VF : INTJ !
1910,Zola/1888_16_Le_reve._clean.txt,"chère âme , inestimable , et belle , et bonne , d' une bonté de prodige qui m' a guéri d' un souffle !","ADJ NC , ADJ , et ADJ , et ADJ , de un NCSENT de NCmod qui lui avoir PPAS de un NC !"
1911,Zola/1888_16_Le_reve._clean.txt,"Je ne sais plus si j' ai souffert ... Et c' est à vous de me pardonner , car j' ai à vous faire un aveu , il faut que je vous dise qui je suis .","je ne VCOG plus si je avoir VSENT ... et ce être à vous de me INF , car je avoir à vous faire un NCo , il PRES que je vous PRES qui je être ."
1912,Zola/1888_16_Le_reve._clean.txt,"Un grand trouble le reprenait , à l' idée qu' il ne pouvait se cacher davantage , lorsqu' elle se confiait si franchement à lui .","un ADJ NCSENT le VIMP , à le NC que il ne pouvoir se INF davantage , lorsque il se VIMP si ADVMAN à lui ."
1913,Zola/1888_16_Le_reve._clean.txt,Cela devenait déloyal .,cela devenir ADJ .
1914,Zola/1888_16_Le_reve._clean.txt,"Il hésitait pourtant , dans la crainte de la perdre , si elle s' inquiétait de l' avenir , en le connaissant enfin .","il VIMP pourtant , dans le NCSENT de le INF , si il se VSENT de le NC , en le PPRES PHASE ."
1915,Zola/1888_16_Le_reve._clean.txt,"Et elle attendait qu' il parlât , de nouveau malicieuse , malgré elle .","et il VIMP que il VSUBI , de ADJ NCo , malgré il ."
1916,Zola/1888_16_Le_reve._clean.txt,"À voix très basse , il continua : J' ai menti à vos parents .","à NCMAN très ADJ , il VPS : je avoir PPAS à DETPOSS NC ."
1917,Zola/1888_16_Le_reve._clean.txt,"Oui , je sais , dit -elle , souriante .","oui , je VCOG , VDIC il , ADJ ."
1918,Zola/1888_16_Le_reve._clean.txt,"Non , vous ne savez pas , vous ne pouvez savoir , cela est trop loin ... Je ne peins sur verre que pour mon plaisir , il faut que vous sachiez ... Alors , d' un geste prompt , elle lui mit la main sur la bouche , elle arrêta sa confidence .","non , vous ne VCOG pas , vous ne pouvoir VCOG , cela être trop ADVLIEU ... je ne PRES sur NC que pour DETPOSS NCSENT , il PRES que vous PRES ... alors , de un NC ADJ , il lui mettre le NCCOR sur le NCCOR , il VPS DETPOSS NCo ."
1919,Zola/1888_16_Le_reve._clean.txt,"Je ne veux pas savoir ... Je vous attendais , et vous êtes venu .","je ne vouloir pas VCOG ... je vous VIMP , et vous être venir ."
1920,Zola/1888_16_Le_reve._clean.txt,Cela suffit .,cela PRES .
1921,Zola/1888_16_Le_reve._clean.txt,"Il ne parlait plus , cette petite main sur ses lèvres le suffoquait de bonheur .","il ne VIMP plus , ce ADJ NCCOR sur DETPOSS NCCOR le VIMP de NCSENT ."
1922,Zola/1888_16_Le_reve._clean.txt,"Je saurai plus tard , quand il sera temps ... Puis , je vous assure que je sais .","je VCOG plus tard , quand il être temps ... puis , je vous PRES que je VCOG ."
1923,Zola/1888_16_Le_reve._clean.txt,"Vous ne pouvez être que le plus beau , le plus riche , le plus noble , car ce rêve -là est le mien .","vous ne pouvoir être que le plus ADJ , le plus ADJ , le plus ADJ , car ce NCs ADVLIEU être le NC ."
