id,titre,phrase,motifs_phrase
630,Goncourt/Germinie Lacerteux copie_clean.txt,La jalousie était le fond de sa nature ; c' était la lie et l' amertume de ses tendresses .,le NCs être le NC de DETPOSS NCmod ; ce être le NC et le NCSENT de DETPOSS NCSENT .
631,Goncourt/Germinie Lacerteux copie_clean.txt,"Ceux qu' elle aimait , elle voulait les avoir tout à elle , les posséder absolument .","celui que il VSENT , il vouloir le avoir tout à il , le INF ADVINT ."
632,Goncourt/Germinie Lacerteux copie_clean.txt,Elle exigeait qu' ils n' aimassent qu' elle .,il VIMP que il ne VSUBP que il .
633,Goncourt/Germinie Lacerteux copie_clean.txt,"Elle ne pouvait admettre qu' ils pussent distraire et donner à d' autres la moindre parcelle de leur affection : cette affection , depuis qu' elle l' avait méritée , n' était plus à eux ; ils n' étaient plus maîtres d' en disposer .","il ne pouvoir INF que il VSUBP VSENT et INF à un autre le ADJ NCo de lui NCSENT : ce NCSENT , depuis que il le avoir PPAS , ne être plus à eux ; il ne être plus NC de en INF ."
634,Goncourt/Germinie Lacerteux copie_clean.txt,"Elle détestait les gens que sa maîtresse avait l' air de recevoir mieux que les autres , et d' accueillir intimement .","il VSENT le NCo que DETPOSS NCs avoir le NCMAN de INF mieux que le autre , et de INF ADV ."
635,Goncourt/Germinie Lacerteux copie_clean.txt,"Par sa mine de mauvaise humeur et son air rechigné , elle avait éloigné , à peu près chassé de la maison , deux ou trois vieilles amies de mademoiselle dont les visites la faisaient souffrir comme si ces vieilles femmes venaient dérober quelque chose dans l' appartement , lui prendre un peu de sa maîtresse .","par DETPOSS NC de ADJ NCmod et DETPOSS NCMAN PPAS , il avoir PPAS , à peu ADVLIEU PPAS de le NC , NUM ou NUM ADJ NC de monsieur dont le NC le faire VSENT comme si ce ADJ NCs venir INF quelque chose dans le NC , lui INF un peu de DETPOSS NCmod ."
636,Goncourt/Germinie Lacerteux copie_clean.txt,De les gens qu' elle avait aimés lui étaient devenus odieux : elle n' avait pas trouvé qu' ils l' aimassent assez ; elle les haïssait pour tout l' amour qu' elle avait voulu d' eux .,de le NC que il avoir VSENT lui être devenir ADJ : il ne avoir pas PPAS que il le PRES ADV ; il le VSENT pour tout le NCSENT que il avoir vouloir de eux .
637,Goncourt/Germinie Lacerteux copie_clean.txt,"En tout , son cœur était exigeant et despote .","en tout , DETPOSS NCs être ADJ et NC ."
638,Goncourt/Germinie Lacerteux copie_clean.txt,"Donnant tout , il demandait tout .","PPRES tout , il VIMP tout ."
639,Goncourt/Germinie Lacerteux copie_clean.txt,"Dans ses affections , à le moindre indice de refroidissement , à le moindre signe de partage , elle éclatait et se dévorait , passait de les nuits à pleurer , prenait le monde en exécration .","dans DETPOSS NCSENT , à le ADJ NC de NCmod , à le ADJ NCmod de NCmod , il VIMP et se VSENT , VIMP de le NCT à INF , VIMP le NCo en NC ."
640,Goncourt/Germinie Lacerteux copie_clean.txt,"Voyant cette femme s' installer dans la boutique , se familiariser avec le jeune homme , toutes les jalousies de Germinie s' inquiétèrent et se tournèrent en rage .","VCOG ce NCo se INF dans le NC , se INF avec le ADJ NC , tout le NC de NP se PRES et se PRES en NCSENT ."
641,Goncourt/Germinie Lacerteux copie_clean.txt,"Sa haine se souleva et se révolta , avec son dégoût , contre cette créature affichée , éhontée , que l' on voyait le dimanche attablée sur les boulevards extérieurs avec de les militaires , et qui avait le lundi de les bleus à le visage .","DETPOSS VSENT se VPS et se VSENT , avec DETPOSS NCSENT , contre ce NC PPAS , PPAS , que l' on VCOG le ADVT PPAS sur le NC ADJ avec de le NCmod , et qui avoir le ADVT de le ADJCOL à le NCCOR ."
642,Goncourt/Germinie Lacerteux copie_clean.txt,"Elle employa tout pour la faire éloigner par Mme Jupillon ; mais c' était une de les meilleures pratiques de la crémerie , et la crémière se refusa tout doucement à l' écarter .","il VPS tout pour le faire INF par madame NP ; mais ce être un de le meilleur NCmod de le NCmod , et le NCs se VPS tout ADVMAN à le INF ."
643,Goncourt/Germinie Lacerteux copie_clean.txt,"Germinie se retourna vers le fils , lui dit que c' était une malheureuse .","NP se VPS vers le NC , lui PRES que ce être un NC ."
644,Goncourt/Germinie Lacerteux copie_clean.txt,Mais cela ne fit qu' attacher le jeune homme à cette vilaine femme dont la mauvaise réputation le flattait .,mais cela ne faire que INF le ADJ NCo à ce ADJ NCmod dont le ADJ NCs le VSENT .
645,Goncourt/Germinie Lacerteux copie_clean.txt,"D' ailleurs , il avait les cruelles taquineries de la jeunesse , et il redoublait d' amabilité auprès d' elle , rien que pour voir le nez que faisait Germinie , et jouir de la désoler .","de ADVLIEU , il avoir le ADJ NCo de le NCmod , et il VIMP de NCSENT ADV de il , rien que pour VCOG le NCCOR que faire NP , et INF de le VSENT ."
646,Goncourt/Germinie Lacerteux copie_clean.txt,"Bientôt Germinie s' aperçut que cette femme avait de les intentions plus sérieuses qu' elle ne se l' était d' abord imaginé : elle comprit ce qu' elle voulait de cet enfant , car c' était toujours un enfant pour elle que ce grand jeune homme de dix-sept ans .","bientôt NP se VPS que ce NCs avoir de le NC plus ADJ que il ne se le être de NC PPAS : il VCOG ce que il vouloir de ce NC , car ce être ADVTEMPS un NC pour il que ce ADJ ADJ NCmod de NUM NCT ."
647,Goncourt/Germinie Lacerteux copie_clean.txt,"Dès lors , elle s' attacha à leurs pas ; elle ne les quitta plus , elle ne les laissa pas un moment seuls , elle se mit de leurs parties , à le théâtre , à la campagne , entra dans toutes leurs promenades , fut toujours là , présente et gênante , essayant de retenir la bonne et de lui rendre la pudeur avec un mot à voix basse : Un enfant !","dès lors , il se VPS à DETPOSS pas ; il ne le VPS plus , il ne le laisser pas un NCo ADJ , il se mettre de DETPOSS NC , à le NC , à le NC , VPS dans tout DETPOSS NC , être ADVTEMPS ADVLIEU , ADJ et ADJ , PPRES de INF le ADJ et de lui INF le NCo avec un NC à NCMAN ADJ : un NC !"
648,Goncourt/Germinie Lacerteux copie_clean.txt,tu n' as pas honte ?,je ne avoir pas NCSENT ?
649,Goncourt/Germinie Lacerteux copie_clean.txt,lui disait -elle .,lui VDIC il .
650,Goncourt/Germinie Lacerteux copie_clean.txt,"L' autre , comme à une bonne farce , partait d' un gros rire .","le autre , comme à un ADJ NC , VIMP de un ADJ NCMAN ."
651,Goncourt/Germinie Lacerteux copie_clean.txt,"Dans ces sorties de le spectacle , animées , échauffées par la fièvre de la représentation et l' excitation de le théâtre , dans ces retours de la campagne , chargés de le soleil de tout le jour , grisés de ciel et de grand air , fouettés de le vin de le dîner , à le milieu de les jeux et de les libertés à lesquels s' enhardissent à la nuit les ivresses de plaisir , les joies de ripaille et les sens en goguette de la femme de le peuple , Germinie essayait d' être toujours entre la bonne et Jupillon .","dans ce NC de le NCmod , NC , PPAS par le VSENT de le NCmod et le NCSENT de le NCmod , dans ce NC de le NCmod , PPAS de le NC de tout le NCT , VSENT de NC et de ADJ NCMAN , PPAS de le NC de le NCmod , à le milieu de le NCmod et de le NC à lequel se PRES à le NCT le NCSENT de NCSENT , le NCSENT de NCmod et le NC en NCmod de le NCmod de le NCmod , NP VIMP de être ADVTEMPS entre le ADJ et NP ."
652,Goncourt/Germinie Lacerteux copie_clean.txt,"Elle tâchait à chaque minute de rompre ces amours bras dessus , bras dessous , de les délier , de les désaccoupler .","il VIMP à chaque NCT de INF ce NCSENT NCCOR ADV , NCCOR NC , de le INF , de le INF ."
653,Goncourt/Germinie Lacerteux copie_clean.txt,"Sans se lasser , elle les séparait , les retirait continuellement l' un de l' autre .","sans se VSENT , il le VCOND , le VCOND ADVTEMPS le un de le autre ."
654,Goncourt/Germinie Lacerteux copie_clean.txt,Elle mettait son corps entre ces corps qui se cherchaient .,il mettre DETPOSS NCCOR entre ce NCCOR qui se VIMP .
655,Goncourt/Germinie Lacerteux copie_clean.txt,Elle se glissait entre ces gestes qui voulaient se toucher ; elle se glissait entre ces lèvres tendues et ces bouches qui s' offraient .,il se VIMP entre ce NC qui vouloir se INF ; il se VIMP entre ce NCCOR ADJ et ce NCCOR qui se VIMP .
656,Goncourt/Germinie Lacerteux copie_clean.txt,"Mais de tout ce qu' elle empêchait , elle avait l' effleurement et l' atteinte .","mais de tout ce que il VIMP , il avoir le NCo et le NC ."
657,Goncourt/Germinie Lacerteux copie_clean.txt,"Elle sentait le frôlement de ces mains qu' elle séparait , de ces caresses qu' elle arrêtait à le passage et qui se trompaient en s' égarant sur elle .","il sentir le NCo de ce NCCOR que il VIMP , de ce NCmod que il VIMP à le NC et qui se VIMP en se PPRES sur il ."
658,Goncourt/Germinie Lacerteux copie_clean.txt,"De les baisers qu' elle dénouait , il lui passait contre la joue le souffle et l' haleine .","de le NC que il VIMP , il lui VIMP contre le NCCOR le NC et le NC ."
659,Goncourt/Germinie Lacerteux copie_clean.txt,"Sans le vouloir , et troublée d' une certaine horreur , elle se mêlait à les étreintes , elle prenait une part de les désirs dans ce frottement et cette lutte qui diminuaient chaque jour autour de sa personne le respect et la retenue de le jeune homme .","sans le vouloir , et PPAS de un ADJ NC , il se VIMP à le NC , il VIMP un NCo de le NCSENT dans ce NCmod et ce NC qui VIMP chaque NCT ADV de DETPOSS NC le NCo et le NCSENT de le ADJ NCmod ."
660,Goncourt/Germinie Lacerteux copie_clean.txt,Il arriva qu' un jour elle fut moins forte contre elle-même qu' elle n' avait été jusque-là .,il PRES que un NCT il être moins fort contre elle-même que il ne avoir être ADV .
661,Goncourt/Germinie Lacerteux copie_clean.txt,"Cette fois , elle ne se déroba pas si brusquement à les avances .","ce fois , il ne se VPS pas si ADV à le NC ."
662,Goncourt/Germinie Lacerteux copie_clean.txt,Jupillon sentit qu' elle s' y arrêtait .,NP sentir que il se y VIMP .
663,Goncourt/Germinie Lacerteux copie_clean.txt,"Germinie le sentit mieux que lui ; mais elle était à bout d' efforts et de tourments , épuisée de souffrir .","NP le sentir mieux que lui ; mais il être à NC de NCmod et de NCSENT , PPAS de VSENT ."
664,Goncourt/Germinie Lacerteux copie_clean.txt,"Cet amour d' une autre , qu' elle avait détourné de Jupillon , elle se l' était lentement entré tout entier dans le cœur .","ce NCSENT de un autre , que il avoir PPAS de NP , il se le être ADV PPAS tout ADJ dans le NC ."
665,Goncourt/Germinie Lacerteux copie_clean.txt,"Maintenant , il y était enfoncé , et toute saignante de jalousie , elle se trouvait affaiblie , sans résistance , défaillante comme une personne blessée à mort devant le bonheur qui lui venait .","ADVT , il y être PPAS , et tout NC de NCmod , il se VIMP PPAS , sans NC , ADJ comme un NCmod VSENT à NC ADVLIEU le NCSENT qui lui venir ."
666,Goncourt/Germinie Lacerteux copie_clean.txt,"Pourtant elle repoussa les tentatives , les hardiesses de le jeune homme , sans rien dire , sans parler .","pourtant il VPS le NCo , le NC de le ADJ NCmod , sans rien VDIC , sans INF ."
667,Goncourt/Germinie Lacerteux copie_clean.txt,Elle ne songeait pas à lui appartenir autrement ni à se livrer davantage .,il ne VIMP pas à lui INF ADVINT ni à se INF davantage .
668,Goncourt/Germinie Lacerteux copie_clean.txt,"Elle vivait de la pensée d' aimer , croyant qu' elle en vivrait toujours .","il VIMP de le NC de VSENT , VCOG que il en VCOND ADVTEMPS ."
669,Goncourt/Germinie Lacerteux copie_clean.txt,"Et dans le ravissement qui lui soulevait l' âme , elle écartait sa chute et repoussait ses sens .","et dans le NCSENT qui lui VIMP le NCo , il VIMP DETPOSS NCo et VIMP DETPOSS NCo ."
670,Goncourt/Germinie Lacerteux copie_clean.txt,"Elle demeurait frémissante et pure , perdue et suspendue dans de les abîmes de tendresse , ne goûtant et ne voulant de l' amant que la caresse , comme si son cœur n' était fait que pour la douceur d' embrasser .","il PRES ADJ et ADJ , PPAS et PPAS dans de le NC de NCSENT , ne PPRES et ne vouloir de le NC que le NC , comme si DETPOSS NCs ne être PPAS que pour le NC de INF ."
671,Goncourt/Germinie Lacerteux copie_clean.txt,Cet amour heureux et non satisfait produisit dans l' être physique de Germinie un singulier phénomène physiologique .,ce NCSENT ADJ et non ADJ VPS dans le être ADJ de NP un ADJ NC ADJ .
672,Goncourt/Germinie Lacerteux copie_clean.txt,On aurait dit que la passion qui circulait en elle renouvelait et transformait son tempérament lymphatique .,on avoir VDIC que le NCSENT qui VIMP en il VIMP et VIMP DETPOSS NCo ADJ .
673,Goncourt/Germinie Lacerteux copie_clean.txt,"Il ne lui semblait plus puiser la vie comme autrefois , goutte à goutte , à une source avare : une force généreuse et pleine lui coulait dans les veines ; le feu d' un sang riche lui courait dans le corps .","il ne lui sembler plus INF le NCo comme ADVT , PRES à NC , à un NC ADJ : un NCSENT ADJ et ADJ lui VIMP dans le NC ; le NCs de un NCCOR ADJ lui VIMP dans le NCCOR ."
674,Goncourt/Germinie Lacerteux copie_clean.txt,"Elle sentait une chaude santé la remplir , et il lui passait de les joies de vivre qui battaient de les ailes dans sa poitrine comme un oiseau dans de le soleil .","il sentir un ADJ NCo le INF , et il lui VIMP de le NCSENT de INF qui VIMP de le NC dans DETPOSS NCmod comme un NCmod dans de le NCmod ."
675,Goncourt/Germinie Lacerteux copie_clean.txt,Une merveilleuse animation lui était venue .,un ADJ NCspas lui être venir .
676,Goncourt/Germinie Lacerteux copie_clean.txt,"La misérable énergie nerveuse qui la soutenait avait fait place à une activité bien portante , à une allégresse bruyante , remuante , débordante .","le ADJ NCs ADJ qui le VIMP avoir faire NCo à un NC bien ADJ , à un NCSENT ADJ , ADJ , ADJ ."
677,Goncourt/Germinie Lacerteux copie_clean.txt,"Elle ne connaissait plus ses anciennes faiblesses , l' accablement , la prostration , l' assoupissement , les molles paresses .","il ne VIMP plus DETPOSS ADJ NCo , le NCSENT , le NC , le NC , le ADJ NC ."
678,Goncourt/Germinie Lacerteux copie_clean.txt,Ses matins si lourds et si engourdis étaient aujourd'hui de les réveils vifs et clairs qui s' ouvraient en une seconde à la gaieté de le jour .,DETPOSS NCT si ADJ et si ADV être ADVT de le NC ADJ et ADJ qui se VIMP en un NCT à le NCSENT de le NCT .
679,Goncourt/Germinie Lacerteux copie_clean.txt,"Elle s' habillait en hâte , folâtrement ; ses doigts prestes allaient tout seuls , et elle s' étonnait d' être si vive , si pleine d' entrain à ces heures défaillantes de l' avant-déjeuner où elle s' était senti si souvent le cœur sur les lèvres .","il se VIMP en NC , ADV ; DETPOSS NCCOR ADJ aller tout ADJ , et il se VSENT de être si ADJ , si ADJ de NC à ce NCT ADJ de le NCmod où il se être sentir si ADVTEMPS le NCo sur le NCCOR ."
680,Goncourt/Germinie Lacerteux copie_clean.txt,"Et toute la journée c' était en elle la même bonne humeur de le corps , la même gaieté dans le mouvement .","et tout le NCT ce être en il le même ADJ NCs de le NCCOR , le même NCSENT dans le NCmod ."
681,Goncourt/Germinie Lacerteux copie_clean.txt,"Il lui fallait toujours aller , marcher , courir , agir , se dépenser .","il lui VIMP ADVTEMPS aller , INF , INF , INF , se INF ."
682,Goncourt/Germinie Lacerteux copie_clean.txt,"Par instant , ce qu' elle avait vécu lui paraissait éteint ; les sensations d' être qu' elle avait éprouvées jusque-là se reculaient pour elle dans le lointain d' un songe et dans le fond d' une mémoire endormie .","par NC , ce que il avoir PPAS lui VIMP PPAS ; le NCSENT de être que il avoir VSENT ADV se VIMP pour il dans le NC de un NCmod et dans le NC de un NCmod PPAS ."
683,Goncourt/Germinie Lacerteux copie_clean.txt,"Le passé était derrière elle , comme si elle l' avait traversé avec le voile d' un évanouissement et l' inconscience d' une somnambule .","le NCs être ADVLIEU il , comme si il le avoir PPAS avec le NC de un NCmod et le NC de un NCmod ."
684,Goncourt/Germinie Lacerteux copie_clean.txt,"C' était la première fois qu' elle avait le sentiment , l' impression à la fois âpre et douce , violente et divine , de le jeu de la vie éclatant dans sa plénitude , sa régularité , sa puissance .","ce être le ADJ fois que il avoir le NCSENT , le NC à le fois ADJ et ADJ , ADJ et ADJ , de le NC de le NCmod PPRES dans DETPOSS NC , DETPOSS NC , DETPOSS NC ."
685,Goncourt/Germinie Lacerteux copie_clean.txt,Elle montait et descendait pour un rien .,il VIMP et VIMP pour un rien .
686,Goncourt/Germinie Lacerteux copie_clean.txt,"Sur un mot de mademoiselle , elle dégringolait les cinq étages .","sur un NC de monsieur , il VIMP le NUM NCo ."
687,Goncourt/Germinie Lacerteux copie_clean.txt,"Quand elle était assise , ses pieds dansaient sur le parquet .","quand il être PPAS , DETPOSS NCCOR VIMP sur le NC ."
688,Goncourt/Germinie Lacerteux copie_clean.txt,"Elle frottait , nettoyait , rangeait , battait , secouait , lavait , sans repos ni trêve , toujours à l' ouvrage , remplissant l' appartement de ses allées , de ses venues , de le tapage incessant de sa personne .","il VIMP , VIMP , VIMP , VIMP , VIMP , VIMP , sans NC ni NC , ADVTEMPS à le NCs , PPRES le NCo de DETPOSS NCmod , de DETPOSS NC , de le NC ADJ de DETPOSS NCmod ."
689,Goncourt/Germinie Lacerteux copie_clean.txt,Mon Dieu !,NP NP !
690,Goncourt/Germinie Lacerteux copie_clean.txt,"lui disait sa maîtresse étourdie comme par le bruit d' un enfant , es - tu bousculante , Germinie !","lui VDIC DETPOSS NCo VSENT comme par le NC de un NCmod , es - je ADJ , NP !"
691,Goncourt/Germinie Lacerteux copie_clean.txt,l' es -tu assez !,le être -tre ADV !
692,Goncourt/Germinie Lacerteux copie_clean.txt,"Un jour , en entrant dans la cuisine de Germinie , mademoiselle vit un peu de terre dans une boîte à cigares posée dans le plomb .","un NCT , en PPRES dans le NC de NP , NCs VCOG un peu de NCmod dans un NC à NCmod PPAS dans le NC ."
693,Goncourt/Germinie Lacerteux copie_clean.txt,Qu' est -ce que c' est ça ?,que être ce que ce être ça ?
694,Goncourt/Germinie Lacerteux copie_clean.txt,lui dit -elle .,lui VDIC il .
695,Goncourt/Germinie Lacerteux copie_clean.txt,"C' est de le gazon … que j' ai semé … pour voir , fit Germinie .","ce être de le NC … que je avoir PPAS … pour VCOG , faire NP ."
696,Goncourt/Germinie Lacerteux copie_clean.txt,Tu aimes donc le gazon maintenant ?,je VSENT donc le NCo ADVT ?
697,Goncourt/Germinie Lacerteux copie_clean.txt,… Il ne te manque plus que d' avoir de les serins !,… il ne me PRES plus que de avoir de le NC !
698,Goncourt/Germinie Lacerteux copie_clean.txt,"À le bout de quelques mois , la vie , toute la vie de Germinie appartint à la crémière .","à le NC de quelque NCT , le NCs , tout le NC de NP VPS à le NC ."
699,Goncourt/Germinie Lacerteux copie_clean.txt,Le service de mademoiselle n' était guère assujettissant et lui prenait bien peu de temps .,le NCspas de monsieur ne être guère PPRES et lui VIMP bien peu de temps .
700,Goncourt/Germinie Lacerteux copie_clean.txt,"Un merlan , une côtelette , c' était toute la cuisine à faire .","un NC , un NC , ce être tout le NC à faire ."
701,Goncourt/Germinie Lacerteux copie_clean.txt,"Le soir , mademoiselle aurait pu la garder auprès d' elle pour lui tenir compagnie : elle aimait mieux l' envoyer promener , la pousser dehors , lui faire prendre un peu d' air , de distraction .","le NCT , monsieur avoir pouvoir le INF ADV de il pour lui INF NCo : il VSENT mieux le INF INF , le INF ADV , lui faire INF un peu de NCMAN , de NCSENT ."
702,Goncourt/Germinie Lacerteux copie_clean.txt,"Elle ne lui demandait que d' être rentrée à dix heures pour l' aider à se mettre à le lit; et encore quand Germinie se trouvait en retard , mademoiselle se déshabillait et se couchait fort bien toute seule .","il ne lui VIMP que de être PPAS à NUM NCT pour le INF à se mettre à le lit; et encore quand NP se VIMP en NC , monsieur se VIMP et se VIMP fort bien tout ADJ ."
703,Goncourt/Germinie Lacerteux copie_clean.txt,"Toutes ces heures que lui laissait sa maîtresse , Germinie vint les vivre et les passer dans la boutique .","tout ce NCT que lui laisser DETPOSS NCs , NP venir le INF et le INF dans le NC ."
704,Goncourt/Germinie Lacerteux copie_clean.txt,"Elle descendait maintenant à la crémerie , dès le matin , à l' ouverture de les volets que la plupart de le temps elle rentrait , prenait son café à le lait , restait jusqu' à neuf heures , remontait pour le chocolat de mademoiselle , et de le déjeuner à le dîner elle trouvait moyen de revenir deux ou trois fois , s' attardant et bavardant dans l' arrière-boutique pour la moindre commission .","il VIMP ADVT à le NC , dès le NCT , à le NC de le NCmod que le NC de le temps il VIMP , VIMP DETPOSS NCo à le NC , VIMP jusque à NUM NCT , VSENT pour le NC de monsieur , et de le NC à le NCmod il VIMP ADJ de INF NUM ou NUM fois , se PPRES et PPRES dans le NC pour le ADJ NCmod ."
705,Goncourt/Germinie Lacerteux copie_clean.txt,Quelle pie borgne tu fais !,quel NC ADJ je faire !
706,Goncourt/Germinie Lacerteux copie_clean.txt,lui disait mademoiselle avec une voix qui grognait et un regard qui souriait .,lui VDIC NCo avec un NCMAN qui VDIC et un NCMAN qui VIMP .
707,Goncourt/Germinie Lacerteux copie_clean.txt,"À cinq heures et demie , le petit dîner desservi , elle descendait quatre à quatre les escaliers , s' installait chez la mère Jupillon , y attendait dix heures , regrimpait les cinq étages , et en cinq minutes déshabillait sa maîtresse qui se laissait faire , tout en étant un peu étonnée de la voir si pressée d' aller se coucher : elle se rappelait le temps où Germinie avait la manie de porter son sommeil de fauteuil en fauteuil , et de ne jamais vouloir monter à sa chambre .","à NUM NCT et NC , le ADJ NCmod PPAS , il VIMP NUM à NUM le NCo , se VIMP chez le NC NP , y VIMP NUM NCT , VIMP le NUM NCo , et en NUM NCT VIMP DETPOSS NCo qui se laisser faire , tout en être un peu NCo de le VCOG si ADJ de aller se INF : il se VIMP le temps où NP avoir le NCo de INF DETPOSS NCo de NCmod en NCmod , et de ne ADVTEMPS vouloir INF à DETPOSS NC ."
708,Goncourt/Germinie Lacerteux copie_clean.txt,"La bougie soufflée fumait encore sur la table de nuit de mademoiselle que Germinie était déjà chez la crémière , cette fois pour jusqu' à minuit , une heure : elle ne partait souvent que quand un sergent de ville , voyant de la lumière , cognait à les volets et faisait fermer .","le NCs ADJ VIMP encore sur le NC de NCT de monsieur que NP être déjà chez le NC , ce fois pour jusque à NCmod , un NCT : il ne VIMP ADVTEMPS que quand un NCs de NCmod , VCOG de le NC , VIMP à le NC et faire INF ."
709,Goncourt/Germinie Lacerteux copie_clean.txt,"Pour être toujours là et avoir le droit de toujours y être , pour s' incruster dans cette boutique , ne jamais quitter de les yeux l' homme de son amour , le couver , le garder , se frotter perpétuellement à lui , elle s' était faite la domestique de la maison .","pour être ADVTEMPS ADVLIEU et avoir le NCo de ADVTEMPS y être , pour se INF dans ce NC , ne ADVTEMPS INF de le NCCOR le NCo de DETPOSS NCSENT , le INF , le INF , se INF ADVTEMPS à lui , il se être faire le NCo de le NCmod ."
710,Goncourt/Germinie Lacerteux copie_clean.txt,"Elle balayait la boutique , elle préparait la cuisine de la mère et la pâtée de les chiens .","il VIMP le NCo , il VIMP le NCo de le NCmod et le NC de le NCmod ."
711,Goncourt/Germinie Lacerteux copie_clean.txt,"Elle servait le fils ; elle faisait son lit , elle brossait ses habits , elle cirait ses chaussures , heureuse et fière de toucher à ce qu' il touchait , émue de mettre la main où il mettait son corps , prête à baiser sur le cuir de ses bottes la boue qui venait de lui !","il VIMP le NCo ; il faire DETPOSS NCo , il VIMP DETPOSS NCo , il VCOND DETPOSS NCo , ADJ et ADJ de INF à ce que il VIMP , VSENT de mettre le NCCOR où il mettre DETPOSS NCCOR , ADJ à INF sur le NC de DETPOSS NCmod le NCo qui venir de lui !"
712,Goncourt/Germinie Lacerteux copie_clean.txt,"Elle faisait l' ouvrage , elle tenait la boutique , elle servait les pratiques : Mme Jupillon se reposait de tout sur elle ; et tandis que la bonne fille travaillait et suait , la grosse femme , se donnant sur sa porte de majestueux loisirs de rentière , échouée sur une chaise en travers de le trottoir , humant la fraîcheur de la rue , tâtait et retâtait sous son tablier , dans sa poche de marchande , ce délicieux argent de gain , l' argent de la vente qui sonne si doux à l' oreille de le petit commerce de Paris que le boutiquier retiré reste tout mélancolique à les premiers jours de n' en avoir plus sous les doigts le tintement et le frétillement .","il faire le NCo , il VIMP le NCo , il VIMP le NCo : madame NP se VIMP de tout sur il ; et PHASE que le ADJ NCs VIMP et VIMP , le ADJ NCs , se PPRES sur DETPOSS NC de ADJ NCmod de NCmod , PPAS sur un NC en travers de le NC , PPRES le NCo de le NCmod , VIMP et VIMP sous DETPOSS NC , dans DETPOSS NC de NCmod , ce ADJ NCo de NCmod , le NC de le NCmod qui PRES si ADJ à le NCCOR de le ADJ NCmod de NP que le NCs PPAS PRES tout NC à le ADJ NCT de ne en avoir plus sous le NCCOR le NC et le NC ."
713,Goncourt/Germinie Lacerteux copie_clean.txt,Quand le printemps fut venu : Si nous allions à l' entrée de les champs ?,quand le NCspas être venir : si nous aller à le NC de le NCmod ?
714,Goncourt/Germinie Lacerteux copie_clean.txt,disait presque tous les soirs Germinie à Jupillon .,VDIC presque tout le NCT NP à NP .
