id,titre,phrase,motifs_phrase
2282,Goncourt/Germinie Lacerteux copie_clean.txt,"C' était , à mesure qu' elle allait , de les jardinets mortuaires , de les bâtisses de guingois , de les architectures ignobles , de grandes portes cochères moisies , de les palissades enfermant dans un terrain vague l' inquiétante blancheur de les pierres la nuit , de les angles de bâtisses à les puanteurs salpêtrées , de les murs salis d' affiches honteuses et de lambeaux d' annonces déchirées où la publicité pourrie était comme une lèpre .","ce être , à NC que il aller , de le NC ADJ , de le NC de NCmod , de le NC ADJ , un ADJ NC ADJ NC , de le NCmod PPRES dans un NC ADJ le ADJ NCo de le NCmod le NCT , de le NC de NCmod à le NCmod ADJ , de le NC ADJ de NCmod ADJ et de NC de NCmod PPAS où le NCs ADJ être comme un NC ."
2283,Goncourt/Germinie Lacerteux copie_clean.txt,"De temps en temps , à un brusque tournant , de les ruelles s' ouvraient qui semblaient à quelques pas s' enfouir dans un trou , et d' où sortait un souffle de cave ; de les culs-de-sac mettaient sur le bleu de le ciel la rigidité noire d' un grand mur; de les rues montaient vaguement , où suintait de loin en loin , sur le plâtre blafard de les maisons , la lueur d' un réverbère .","de temps en temps , à un NC ADJ , de le NCs se VIMP qui sembler à quelque pas se INF dans un NC , et de où VIMP un NCo de NCmod ; de le NC VIMP sur le ADJCOL de le NCmod le NCo ADJ de un ADJ mur; de le NC VIMP ADV , où VIMP de ADVLIEU en ADVLIEU , sur le NCs ADJ de le NCmod , le NC de un NCmod ."
2284,Goncourt/Germinie Lacerteux copie_clean.txt,Germinie continuait à aller .,NP VIMP à aller .
2285,Goncourt/Germinie Lacerteux copie_clean.txt,"Elle battait tout l' espace où la crapule soûle ses lundis et trouve ses amours , entre un hôpital , une tuerie et un cimetière : La Riboisière , l' Abattoir et Montmartre .","il VIMP tout le NCo où le NC ADJ DETPOSS ADVT et PRES DETPOSS NCSENT , entre un NC , un NC et un NC : le NP , le NP et NP ."
2286,Goncourt/Germinie Lacerteux copie_clean.txt,"Les passants qui passent là , l' ouvrier qui remonte de Paris en sifflant , l' ouvrière qui revient , sa journée finie , les mains sous les aisselles pour se tenir chaud , la prostituée en bonnet noir qui erre , la croisaient et la regardaient .","le NCs qui PRES ADVLIEU , le NC qui VSENT de NP en PPRES , le NC qui PRES , DETPOSS NCT ADJ , le NCCOR sous le NCmod pour se INF NCo , le NC en NCmod ADJ qui VSUBP , le VIMP et le VCOG ."
2287,Goncourt/Germinie Lacerteux copie_clean.txt,Les inconnus avaient l' air de la reconnaître ; la lumière lui faisait honte .,le NCs avoir le NCMAN de le VCOG ; le NCs lui faire NCSENT .
2288,Goncourt/Germinie Lacerteux copie_clean.txt,"Elle se sauvait de l' autre côté de le boulevard , et longeait contre le mur de ronde la chaussée ténébreuse et déserte ; mais elle en était bientôt chassée par d' horribles ombres d' hommes et de les mains brutalement amoureuses … Elle voulait s' en aller ; elle s' injuriait à le dedans d' elle ; elle s' appelait lâche et misérable ; elle se jurait que c' était le dernier tour , qu' elle irait encore jusqu' à cet arbre , et puis que ce serait tout , que s' il n' était pas rentré , c' était fini , elle s' en irait .","il se VIMP de le autre NC de le NCmod , et VIMP contre le NC de NCmod le NCo ADJ et ADJ ; mais il en être bientôt PPAS par un ADJ NC de NCmod et de le NCCOR ADVMAN ADJ … il vouloir se en aller ; il se VDIC à le NC de il ; il se VIMP ADJ et ADJ ; il se VCOND que ce être le ADJ NC , que il aller encore jusque à ce NC , et puis que ce être tout , que si il ne être pas PPAS , ce être PPAS , il se en aller ."
2289,Goncourt/Germinie Lacerteux copie_clean.txt,"Et elle ne s' en allait pas ; elle marchait toujours , elle attendait toujours , plus dévorée , à mesure qu' il tardait , de le désir et de la fureur de le voir .","et il ne se en aller pas ; il VIMP ADVTEMPS , il VIMP ADVTEMPS , plus VSENT , à NC que il VIMP , de le NCSENT et de le NC de le VCOG ."
2290,Goncourt/Germinie Lacerteux copie_clean.txt,"À la fin , les heures s' écoulant , le boulevard se dégarnissant de passants , Germinie épuisée , éreintée de fatigue , se rapprochait de les maisons .","à le NC , le NCT se PPRES , le NCs se PPRES de NC , NP PPAS , PPAS de NCSENT , se VIMP de le NC ."
2291,Goncourt/Germinie Lacerteux copie_clean.txt,"Elle se traînait de boutique en boutique , elle allait machinalement là où brûlait encore de le gaz , et elle restait stupide devant le flamboiement de les devantures .","il se VIMP de NC en NCmod , il aller ADV ADVLIEU où VIMP encore de le NC , et il VIMP NCo ADVLIEU le NC de le NCmod ."
2292,Goncourt/Germinie Lacerteux copie_clean.txt,"Elle s' étourdissait les yeux , elle tâchait de tuer son impatience en l' hébétant .","il se VIMP le NCCOR , il VIMP de INF DETPOSS NCSENT en le NC ."
2293,Goncourt/Germinie Lacerteux copie_clean.txt,"Ce qu' on voit à le travers de les carreaux suants de les marchands de vin , les batteries de cuisine , les bols de punch étagés entre deux bouteilles vides d' où sort un brin de laurier , les vitrines où les liqueurs mettent leurs couleurs dans un éclair , une choppe pleine de petites cuillers de Ruolz , cela l' arrêtait longuement .","ce que on VCOG à le travers de le NCmod ADJ de le NCmod de NCmod , le NC de NCmod , le NC de NCmod PPAS entre NUM NC ADJ de où PRES un NCs de NCmod , le NC où le NCs mettre DETPOSS NCo dans un NC , un NC ADJ de ADJ NCmod de NP , cela le VIMP ADV ."
2294,Goncourt/Germinie Lacerteux copie_clean.txt,"Elle épelait les vieux arrêtés de tirage de loterie placardés à le fond d' un cabaret , les annonces de gloria , les inscriptions portant en lettres jaunes : Vin nouveau , pur sang , 70 centimes .","il VIMP le ADJ NCo de NCmod de NCmod PPAS à le NC de un NCmod , le NC de NCmod , le NC PPRES en NC ADJCOL : NP ADJ , pur NCCOR , NUM NC ."
2295,Goncourt/Germinie Lacerteux copie_clean.txt,"Elle regardait un quart d' heure une arrière-salle où étaient un homme en blouse assis sur un tabouret devant une table , un tuyau de poêle , une ardoise et deux plateaux noirs à le mur .","il VCOG un NCo de NCT un NC où être un NC en NCmod PPAS sur un NC devoir un NCmod , un NC de NCmod , un NC et NUM NC ADJ à le NCmod ."
2296,Goncourt/Germinie Lacerteux copie_clean.txt,"Son regard fixe et perdu allait , à le travers d' une buée rousse , à de les silhouettes troubles de choumaques penchés sur leurs établis .","DETPOSS NCMAN ADJ et ADJ aller , à le travers de un NCmod ADJ , à un le NCmod NCSENT de NCmod PPAS sur DETPOSS NC ."
2297,Goncourt/Germinie Lacerteux copie_clean.txt,"Il tombait et s' oubliait sur un comptoir qu' on lavait , sur deux mains qui comptaient les sous de la journée , sur un entonnoir qu' on récurait , sur un broc qu' on passait à le grès .","il VIMP et se VIMP sur un NC que on VIMP , sur NUM NCCOR qui VIMP le NCo de le NCT , sur un NC que on VIMP , sur un NCmod que on VIMP à le NC ."
2298,Goncourt/Germinie Lacerteux copie_clean.txt,Elle ne pensait plus .,il ne VCOG plus .
2299,Goncourt/Germinie Lacerteux copie_clean.txt,"Elle demeurait là , clouée et faiblissante , sentant son cœur s' en aller de la fatigue d' être sur ses pieds , ne voyant plus que dans une sorte d' évanouissement , n' entendant plus que dans un bourdonnement les fiacres emboués roulant sur le boulevard mou , prête à tomber et forcée par instants de s' étayer de l' épaule à les murs .","il VIMP ADVLIEU , PPAS et ADJ , sentir DETPOSS NCo se en aller de le NCSENT de être sur DETPOSS NCCOR , ne VCOG plus que dans un sorte de NCmod , ne VCOG plus que dans un NC le NCo PPAS PPRES sur le NC ADJ , ADJ à INF et PPAS par NC de se INF de le NCCOR à le NCmod ."
2300,Goncourt/Germinie Lacerteux copie_clean.txt,"Dans l' état d' ébranlement et de maladie où elle était , avec cette demi-hallucination de le vertige qui la rendait si peureuse de passer la Seine et la faisait se cramponner à les balustrades de les ponts , il arrivait que certains soirs , lorsqu' il pleuvait , ces défaillances qu' elle avait sur le boulevard extérieur prenaient les terreurs d' un cauchemar .","dans le NC de NCmod et de NC où il être , avec ce NC de le NCmod qui le VIMP si ADJ de INF le NP et le faire se INF à le NC de le NCmod , il VIMP que certain NCT , lorsque il VIMP , ce NC que il avoir sur le NC ADJ VIMP le NCSENT de un NCmod ."
2301,Goncourt/Germinie Lacerteux copie_clean.txt,"Quand la flamme de les réverbères , tremblante dans une vapeur d' eau , allongeait et balançait , comme dans le miroitement d' une rivière , son reflet sur le sol mouillé ; quand les pavés , les trottoirs , la terre , semblaient disparaître et mollir sous la pluie , et que rien ne paraissait plus solide dans la nuit noyée , la pauvre misérable , presque folle de fatigue , croyait voir se gonfler un déluge dans le ruisseau .","quand le NCs de le NCmod , ADJ dans un NC de NCmod , VIMP et VIMP , comme dans le NC de un NCmod , DETPOSS NCo sur le NCmod PPAS ; quand le NCs , le NC , le NC , VIMP INF et INF sous le NC , et que rien ne paraître plus ADJ dans le NCT PPAS , le NC ADJ , presque ADJ de NCSENT , VCOG VCOG se INF un NC dans le NCmod ."
2302,Goncourt/Germinie Lacerteux copie_clean.txt,"Un mirage d' épouvante lui montrait tout à coup de l' eau tout autour d' elle , de l' eau qui marchait , de l' eau qui s' approchait de partout .","un NCs de NCmod lui VIMP tout à NC de le NC tout ADV de il , de le NC qui VIMP , de le NC qui se VIMP de ADV ."
2303,Goncourt/Germinie Lacerteux copie_clean.txt,"Elle fermait les yeux , n' osait plus bouger , craignait de sentir son pas glisser sous elle , se mettait à pleurer , et pleurait jusqu' à ce que quelqu'un passât et voulût bien lui donner le bras jusqu' à l' Hôtel de la petite main bleue .","il VIMP le NCCOR , ne VIMP plus INF , VSENT de sentir DETPOSS pas INF sous il , se mettre à INF , et VIMP jusque à ce que quelqu'un VSUBI et vouloir bien lui INF le NCCOR jusque à le NC de le ADJ NCCOR ADJCOL ."
2304,Goncourt/Germinie Lacerteux copie_clean.txt,"Elle montait alors dans l' escalier , c' était son dernier refuge .","il VIMP alors dans le NC , ce être DETPOSS ADJ NC ."
2305,Goncourt/Germinie Lacerteux copie_clean.txt,"Elle s' y sauvait de la pluie , de la neige , de le froid , de la peur , de le désespoir , de la fatigue .","il se y VIMP de le NC , de le NC , de le NC , de le NCSENT , de le NCSENT , de le NCSENT ."
2306,Goncourt/Germinie Lacerteux copie_clean.txt,"Elle montait et s' asseyait sur une marche contre la porte fermée de Gautruche , serrait son châle et sa jupe pour laisser passage à les allants et venants le long de cette raide échelle , ramassait sa personne et se rencognait pour rapetisser sur l' étroit palier la place de sa honte .","il VIMP et se VIMP sur un NC contre le NCmod PPAS de NP , VCOND DETPOSS NCo et DETPOSS NC pour laisser NCo à le NC et PPRES le NC de ce NCmod ADJ , VIMP DETPOSS NCo et se VIMP pour INF sur le ADJ NC le NCo de DETPOSS NCSENT ."
2307,Goncourt/Germinie Lacerteux copie_clean.txt,"De les portes ouvertes , sortait et se répandait sur l' escalier l' odeur de les cabinets sans air , de les familles tassées dans une seule chambre , l' exhalaison de les industries malsaines , les fumées graisseuses et animalisées de les cuisines de réchaud chauffées sur le carré , une puanteur de loques , l' humide fadeur de linges séchant sur de les ficelles .","de le NC ADJ , VIMP et se VIMP sur le INF le NCs de le NCmod sans NCMAN , de le NC PPAS dans un ADJ NC , le NC de le NCmod ADJ , le NC ADJ et ADJ de le NCmod de NCmod PPAS sur le NC , un NC de NCmod , le ADJ NC de NCmod PPRES sur de le NC ."
2308,Goncourt/Germinie Lacerteux copie_clean.txt,La fenêtre à les carreaux cassés que Germinie avait derrière elle lui envoyait la fétidité d' un plomb où toute la maison vidait ses ordures et son fumier coulant .,le NCs à le NCmod ADJ que NP avoir ADVLIEU il lui VIMP le NCo de un NCmod où tout le NCs VIMP DETPOSS NCo et DETPOSS NC ADJ .
2309,Goncourt/Germinie Lacerteux copie_clean.txt,"À tout moment , sous une bouffée d' infection , son cœur se levait : elle était obligée de prendre dans sa poche un flacon d' eau de mélisse qu' elle avait toujours sur elle , et d' en boire une gorgée pour ne pas se trouver mal .","à tout NC , sous un NCmod de NCmod , DETPOSS NCs se VIMP : il être PPAS de INF dans DETPOSS NC un NCo de NCmod de NCmod que il avoir ADVTEMPS sur il , et de en INF un NCo pour ne pas se INF mal ."
2310,Goncourt/Germinie Lacerteux copie_clean.txt,"Mais l' escalier avait , lui aussi , ses passants : d' honnêtes femmes d' ouvriers remontaient avec un boisseau de charbon ou le litre de le souper .","mais le NCs avoir , lui aussi , DETPOSS NCo : de ADJ NCs de NCmod VIMP avec un NC de NCmod ou le NC de le NCmod ."
2311,Goncourt/Germinie Lacerteux copie_clean.txt,"Elles la frôlaient de le pied , et tout le temps qu' elles mettaient à monter , Germinie sentait leur regard de mépris tourner autour de la cage de l' escalier et l' écraser de plus haut à chaque étage .","il le VIMP de le NCCOR , et tout le temps que il VIMP à INF , NP sentir lui NCMAN de NCmod INF ADV de le NC de le NCmod et le INF de plus ADJ à chaque NC ."
2312,Goncourt/Germinie Lacerteux copie_clean.txt,"De les enfants , de les petites filles en fanchon qui passaient dans l' escalier noir avec la lumière d' une fleur , de les petites filles qui lui faisaient revoir , comme la lui montraient souvent ses rêves , sa petite fille vivante et grandie , elle les voyait s' arrêter à la regarder avec de grands yeux qui se reculaient d' elle ; puis les petites se sauvaient et s' essoufflaient à monter , et quand elles étaient tout en haut , se penchant presque par-dessus la rampe , elles lui jetaient de les sottises impures , de les injures d' enfants de le peuple … L' insulte , crachée par ces bouches de roses , tombait sur Germinie plus douloureusement que tout .","de le NC , de le ADJ NCmod en NCmod qui VIMP dans le NC ADJ avec le NC de un NCmod , de le ADJ NCs qui lui faire VCOG , comme le lui VIMP ADVTEMPS DETPOSS NCo , DETPOSS ADJ NC ADJ et ADJ , il le VCOG se INF à le VCOG avec un ADJ NCCOR qui se VIMP de il ; puis le ADJ se VIMP et se VIMP à INF , et quand il être tout en NC , se PPRES presque ADV le NCo , il lui VIMP de le NC ADJ , de le NCmod de NCmod de le NCmod … le NCs , PPAS par ce NCCOR de ADJCOL , VIMP sur NP plus ADV que tout ."
2313,Goncourt/Germinie Lacerteux copie_clean.txt,"Elle se soulevait à demi , un moment ; puis accablée , s' abandonnant , elle retombait sur elle-même , et remontant son tartan sur sa tête pour s' y cacher et s' y ensevelir , elle restait comme une morte , affaissée , inerte , insensible , repliée sur son ombre , pareille à un paquet jeté là et sur lequel tout le monde pouvait marcher , n' ayant plus de sens , ne vivant plus de tout le corps que pour un bruit de pas qu' elle écoutait venir et qui ne venait pas .","il se VIMP à ADJ , un NC ; puis VSENT , se PPRES , il VIMP sur elle-même , et VSENT DETPOSS NCo sur DETPOSS NCCOR pour se y INF et se y INF , il VIMP comme un NC , PPAS , PPAS , ADJ , PPAS sur DETPOSS NC , PRES à un NC PPAS ADVLIEU et sur lequel tout le NCs pouvoir INF , ne avoir plus de NC , ne PPRES plus de tout le NCCOR que pour un NC de pas que il VIMP venir et qui ne venir pas ."
2314,Goncourt/Germinie Lacerteux copie_clean.txt,"Enfin , après de les heures , de les heures qu' elle ne pouvait pas compter , il lui semblait entendre , dans la rue , un trébuchement de pas ; puis une voix avinée montait l' escalier en bégayant : Canaille !… canaille ed ' d' marchand de vin !","PHASE , PHASE de le NCT , de le NCT que il ne pouvoir pas INF , il lui sembler VCOG , dans le NC , un NCo de pas ; puis un NCMAN ADJ VIMP le NCo en VDIC : NP !… NC ed ' de NC de NCmod !"
2315,Goncourt/Germinie Lacerteux copie_clean.txt,… tu m' as vendu de le vin qui soûle !,… je le avoir PPAS de le NC qui PRES !
2316,Goncourt/Germinie Lacerteux copie_clean.txt,C' était lui .,ce être lui .
2317,Goncourt/Germinie Lacerteux copie_clean.txt,Et presque tous les jours recommençait la même scène .,et presque tout le NCT VIMP le même NCo .
2318,Goncourt/Germinie Lacerteux copie_clean.txt,Ah !,INTJ !
2319,Goncourt/Germinie Lacerteux copie_clean.txt,"t' étais là , ma Germinie , disait -il en la reconnaissant .","le être ADVLIEU , DETPOSS NP , VDIC il en le VCOG ."
2320,Goncourt/Germinie Lacerteux copie_clean.txt,"Voilà ce que c'est … je vais te dire … On s' est un peu submergé … Et mettant la clef dans la serrure : Je vas te dire … C' est pas ma faute … Il entrait , repoussait d' un coup de pied une tourterelle à les ailes rognées qui sautillait en boitant , et fermant la porte : Vois -tu? Ce n' est pas moi … C' est Paillon , tu sais bien Paillon ?… ce petit gros qui est gras comme un chien de fou … Eh bien !","voilà ce que PRES … je aller me VDIC … on se être un peu PPAS … et mettre le NCo dans le NC : je ADV me VDIC … ce être pas DETPOSS NC … il VIMP , VIMP de un NC de NCCOR un tourterelle à le NCmod ADJ qui VIMP en NC , et PPRES le NCo : NP -tu? ce ne être pas soi … ce être NP , je VCOG bien NP ?… ce ADJ NC qui être ADJ comme un NC de NCmod … INTJ bien !"
2321,Goncourt/Germinie Lacerteux copie_clean.txt,"c' est lui , vrai d' honneur … Il a voulu me payer un litre à seize … Il m' a offert l' honnêteté , j' y ai roffert la politesse … Là-dessus naturellement , nous avons consolé notre café , consolé consoleras -tu! … Et d' alors en alors … nous nous sommes tombés dessus !… Un carnage de possédé !","ce être lui , vrai de NCSENT … il avoir vouloir me INF un NCo à NUM … il lui avoir PPAS le NCo , je y avoir PPAS le NCo … ADV ADVINT , nous avoir PPAS DETPOSS NCo , PPAS NC -tu! … et de alors en alors … nous nous être PPAS ADV !… un NC de NCmod !"
2322,Goncourt/Germinie Lacerteux copie_clean.txt,… À preuve que ce carcan de marchand de vin nous a jetés à la porte comme de les épluchures d' homard !,… à NC que ce NCmod de NCmod de NCmod nous avoir PPAS à le NC comme de le NC de NCmod !
2323,Goncourt/Germinie Lacerteux copie_clean.txt,"Germinie , pendant l' explication , avait allumé la chandelle fichée dans un chandelier de cuivre jaune .","NP , PHASE le NCmod , avoir PPAS le NCo PPAS dans un NC de NCmod ADJCOL ."
2324,Goncourt/Germinie Lacerteux copie_clean.txt,"À la lueur de la lumière vacillante , apparaissait le sale papier de la chambre , couvert de caricatures de le Charivari , déchirées de le journal et collées à le mur .","à le NC de le NCmod ADJ , VIMP le ADJ NCo de le NCmod , ADJ de NCmod de le NP , PPAS de le NC et PPAS à le NC ."
2325,Goncourt/Germinie Lacerteux copie_clean.txt,Tiens !,tenir !
2326,Goncourt/Germinie Lacerteux copie_clean.txt,"t' es un amour , lui disait Gautruche en lui voyant poser sur la table un poulet froid et trois bouteilles de vin .","le être un NCSENT , lui VDIC NP en lui VCOG INF sur le NC un NCo ADJ et NUM NC de NCmod ."
2327,Goncourt/Germinie Lacerteux copie_clean.txt,Car faut te dire … pour ce que j' ai dans l' estomac… un méchant bouillon … voilà tout … Ah !,car PRES me VDIC … pour ce que je avoir dans le NP un ADJ NC … voilà tout … INTJ !
2328,Goncourt/Germinie Lacerteux copie_clean.txt,"celui-là , il aurait fallu un fier maître d' armes pour lui crever les yeux !","celui-là , il avoir PPAS un ADJ NCo de NCmod pour lui INF le NCCOR !"
2329,Goncourt/Germinie Lacerteux copie_clean.txt,Et il se mettait à manger .,et il se mettre à INF .
2330,Goncourt/Germinie Lacerteux copie_clean.txt,"Germinie buvait , les coudes sur la table , en le regardant , et son regard devenait noir .","NP VIMP , le NCCOR sur le NCmod , en le NC , et DETPOSS NCMAN devenir ADJ ."
2331,Goncourt/Germinie Lacerteux copie_clean.txt,Bon !,NP !
2332,Goncourt/Germinie Lacerteux copie_clean.txt,toutes les négresses sont mortes … faisait à la fin Gautruche en égouttant une à une les bouteilles .,tout le NCs être ADJ … faire à le NC NP en PPRES un à un le NCmod .
2333,Goncourt/Germinie Lacerteux copie_clean.txt,"À le dodo , les enfants !","à le NC , le NC !"
2334,Goncourt/Germinie Lacerteux copie_clean.txt,"Et c' étaient , entre ces deux êtres , de les amours terribles , acharnés et funèbres , de les ardeurs et de les assouvissements sauvages , de les voluptés furieuses , de les caresses qui avaient les brutalités et les colères de le vin , de les baisers qui semblaient chercher le sang sous la peau comme la langue d' une bête féroce , de les anéantissements qui les engloutissaient et ne leur laissaient que le cadavre de leurs corps .","et ce être , entre ce NUM être , de le NCSENT ADJ , PPAS et NC , de le NC et de le NC ADJ , de le NC ADJ , de le NC qui avoir le NCo et le NCSENT de le NCmod , de le NCmod qui sembler INF le NCCOR sous le NCCOR comme le NCCOR de un ADJ NCmod , de le NCmod qui le VIMP et ne lui VIMP que le NC de DETPOSS NCCOR ."
2335,Goncourt/Germinie Lacerteux copie_clean.txt,"À cette débauche , Germinie apportait je ne sais quoi de fou , de délirant , de désespéré , une sorte de frénésie suprême .","à ce NC , NP VIMP je ne VCOG quoi de ADJ , de PPRES , de NC , un sorte de NCmod ADJ ."
2336,Goncourt/Germinie Lacerteux copie_clean.txt,"Ses sens exaspérés se retournaient contre eux-mêmes , et , sortant de les appétits de leur nature , ils se poussaient à souffrir .","DETPOSS NCs ADJ se VIMP contre soi-même , et , PPRES de le NC de lui NCmod , il se VIMP à VSENT ."
2337,Goncourt/Germinie Lacerteux copie_clean.txt,"La satiété les usait , sans les éteindre; et dépassant l' excès , ils se forçaient jusqu' à le déchirement .","le NCs le VIMP , sans le éteindre; et PPRES le NCo , il se VIMP jusque à le NCSENT ."
2338,Goncourt/Germinie Lacerteux copie_clean.txt,"Dans le paroxysme d' excitation où était la malheureuse créature , sa tête , ses nerfs , l' imagination de son corps enragé , ne cherchaient plus même le plaisir dans le plaisir , mais quelque chose au-delà de plus âpre , de plus poignant , de plus cuisant : la douleur dans la volupté .","dans le NC de NCSENT où être le ADJ NC , DETPOSS NCCOR , DETPOSS NCCOR , le NC de DETPOSS NCCOR VSENT , ne VIMP plus même le NCSENT dans le NCSENT , mais quelque chose ADV de plus ADJ , de plus ADJ , de plus ADJ : le NCSENT dans le NCmod ."
2339,Goncourt/Germinie Lacerteux copie_clean.txt,"Et à tout moment , le mot mourir s' échappait de ses lèvres serrées , comme si tout bas elle invoquait la mort et cherchait à l' étreindre dans les agonies de l' amour !","et à tout NC , le NCs ADJ se VIMP de DETPOSS NCCOR ADJ , comme si tout ADJ il VIMP le NCo et VIMP à le NC dans le NC de le NCSENT !"
2340,Goncourt/Germinie Lacerteux copie_clean.txt,"Quelquefois , la nuit , tout à coup , se dressant sur le bord de le lit , elle mettait ses pieds nus sur le froid de le carreau , et restait là , farouche , penchée sur ce qui respire dans une chambre qui dort .","ADVTEMPS , le NCT , tout à NC , se PPRES sur le NC de le NCmod , il mettre DETPOSS NCCOR ADJ sur le NCmod de le NCmod , et VIMP ADVLIEU , ADJ , PPAS sur ce qui PRES dans un NC qui PRES ."
2341,Goncourt/Germinie Lacerteux copie_clean.txt,"Et peu à peu ce qui était autour d' elle , l' obscurité de l' heure , semblait l' envelopper .","et peu à peu ce qui être ADV de il , le NC de le NCT , sembler le INF ."
2342,Goncourt/Germinie Lacerteux copie_clean.txt,Elle se paraissait à elle-même tomber et rouler dans l' inconscience et l' aveuglement de la nuit .,il se paraître à elle-même INF et INF dans le NC et le NC de le NCT .
2343,Goncourt/Germinie Lacerteux copie_clean.txt,La volonté de ses idées s' éteignait .,le NCs de DETPOSS NCmod se VIMP .
2344,Goncourt/Germinie Lacerteux copie_clean.txt,"Toutes sortes de choses noires , ayant comme de les ailes et de les voix , lui battaient contre les tempes .","tout sorte de chose ADJ , avoir comme de le NC et de le NCMAN , lui VIMP contre le NCCOR ."
2345,Goncourt/Germinie Lacerteux copie_clean.txt,"Les sombres tentations qui montrent vaguement le crime à la folie lui faisaient passer devant les yeux , tout près d' elle , une lumière rouge , l' éclair d' un meurtre ; et il y avait dans son dos de les mains qui la poussaient , par derrière , vers la table sur laquelle étaient les couteaux … Elle fermait les yeux , bougeait un pied; puis , ayant peur , se retenait à les draps ; et à la fin , se retournant , elle retombait dans le lit , et renouait son sommeil à le sommeil de l' homme qu' elle avait voulu assassiner; pourquoi ?","le ADJ NCSENT qui PRES ADV le NCo à le NCmod lui faire INF ADVLIEU le NCCOR , tout ADVLIEU de il , un NCo ADJCOL , le NC de un NCmod ; et il y avoir dans DETPOSS NCCOR de le NCCOR qui le VIMP , par ADVLIEU , vers le NC sur lequel être le NC … il VIMP le NCCOR , VIMP un pied; puis , avoir NCSENT , se VIMP à le NC ; et à le NC , se PPRES , il VIMP dans le NC , et VIMP DETPOSS NCo à le NC de le NCmod que il avoir vouloir assassiner; pourquoi ?"
2346,Goncourt/Germinie Lacerteux copie_clean.txt,elle ne le savait ; pour rien pour tuer !,il ne le VCOG ; pour rien pour INF !
