id,titre,phrase,motifs_phrase
1477,Goncourt/Germinie Lacerteux copie_clean.txt,"non , elle ne voudra jamais revenir ici .","non , il ne VF ADVTEMPS INF ADVLIEU ."
1478,Goncourt/Germinie Lacerteux copie_clean.txt,Eh bien !,INTJ bien !
1479,Goncourt/Germinie Lacerteux copie_clean.txt,"moi je te la ramènerai … et pas plus tard que ce soir , fit Jupillon en se levant , et roulant une cigarette entre les doigts : Tu sais , dit -il à sa mère , pas d' excuses , c' est inutile … Et de la froideur … Aie l' air de la recevoir seulement pour moi , par faiblesse … On ne sait pas ce qui peut arriver : faut toujours se garder à carreau .","soi je me le VF … et pas plus tard que ce NCT , faire NP en se PPRES , et PPRES un NCo entre le NCCOR : je VIMP , VDIC il à DETPOSS NC , pas de NC , ce être ADJ … et de le NC … avoir le NCMAN de le INF seulement pour soi , par NCmod … on ne VCOG pas ce qui pouvoir INF : ADV ADVTEMPS se INF à NC ."
1480,Goncourt/Germinie Lacerteux copie_clean.txt,"Jupillon se promenait de long en large , sur le trottoir , devant la maison de Germinie , quand Germinie sortit .","NP se VIMP de NC en NCmod , sur le NC , ADVLIEU le NC de NP , quand NP VPS ."
1481,Goncourt/Germinie Lacerteux copie_clean.txt,"Bonsoir , Germinie , lui dit -il dans le dos .","NP , NP , lui VDIC il dans le NCCOR ."
1482,Goncourt/Germinie Lacerteux copie_clean.txt,"Elle se retourna comme sous un coup , et fit instinctivement en avant , sans lui répondre , deux ou trois pas qui se sauvaient .","il se VPS comme sous un NC , et faire ADV en PHASE , sans lui VDIC , NUM ou NUM pas qui se VIMP ."
1483,Goncourt/Germinie Lacerteux copie_clean.txt,Germinie !,NP !
1484,Goncourt/Germinie Lacerteux copie_clean.txt,"Jupillon ne lui dit que cela , sans bouger , sans la suivre .","NP ne lui VDIC que cela , sans NC , sans le NC ."
1485,Goncourt/Germinie Lacerteux copie_clean.txt,Elle revint à lui comme une bête ramenée à la main et dont on retire la corde .,il VPS à lui comme un NC PPAS à le NCCOR et dont on PRES le NCo .
1486,Goncourt/Germinie Lacerteux copie_clean.txt,Quoi ?,quoi ?
1487,Goncourt/Germinie Lacerteux copie_clean.txt,fit -elle .,faire il .
1488,Goncourt/Germinie Lacerteux copie_clean.txt,"C' est -il encore de l' argent , hein ?… ou de les sottises de ta mère à me dire ?","ce être il encore de le NCs , NC ?… ou de le NC de ter NC à me VDIC ?"
1489,Goncourt/Germinie Lacerteux copie_clean.txt,"Non , c' est que je m' en vais , lui dit Jupillon d' un air sérieux .","non , ce être que je se en aller , lui VDIC NP de un NCMAN ADJ ."
1490,Goncourt/Germinie Lacerteux copie_clean.txt,Je suis tombé à le sort… et je pars .,je être PPAS à le NP et je PRES .
1491,Goncourt/Germinie Lacerteux copie_clean.txt,Tu pars ?,je PRES ?
1492,Goncourt/Germinie Lacerteux copie_clean.txt,dit -elle .,VDIC il .
1493,Goncourt/Germinie Lacerteux copie_clean.txt,Ses idées avaient l' air de n' être pas éveillées .,DETPOSS NCs avoir le NCMAN de ne être pas PPAS .
1494,Goncourt/Germinie Lacerteux copie_clean.txt,"Tiens , Germinie , reprit Jupillon … Je t' ai fait de la peine … Je n' ai pas été gentil avec toi … je sais bien … Il y a eu un peu de ma cousine … Qu' est -ce que tu veux ?","ADJ , NP , VPS NP … je lui avoir faire de le NCSENT … je ne avoir pas être ADJ avec soi … je VCOG bien … il y avoir avoir un peu de DETPOSS NCo … que être ce que je vouloir ?"
1495,Goncourt/Germinie Lacerteux copie_clean.txt,… Tu pars ?,… je PRES ?
1496,Goncourt/Germinie Lacerteux copie_clean.txt,reprit Germinie en lui prenant le bras .,VPS NP en lui PPRES le NCCOR .
1497,Goncourt/Germinie Lacerteux copie_clean.txt,Ne mens pas … tu pars ?,ne ADJ pas … je PRES ?
1498,Goncourt/Germinie Lacerteux copie_clean.txt,"Puisque je te dis qu' oui… et que c' est vrai … Je n' attends plus que ma feuille de route … Il faut plus de deux mille francs pour un homme cette année … On dit qu' il va y avoir la guerre : enfin , c' est une chance … Et , tout en parlant , il faisait descendre la rue à Germinie .","puisque je me VDIC que NP et que ce être vrai … je ne PRES plus que DETPOSS NC de NCmod … il PRES plus de NUM NUM NC pour un NC ce NCT … on VDIC que il aller y avoir le NCo : PHASE , ce être un NC … et , tout en PPRES , il faire INF le NCo à NP ."
1499,Goncourt/Germinie Lacerteux copie_clean.txt,Où me mènes -tu? lui dit -elle .,où me ADJ -tu? lui VDIC il .
1500,Goncourt/Germinie Lacerteux copie_clean.txt,"Chez m' man donc … pour qu' on se raccommode toutes les deux , et que ça finisse , les histoires … Après ce qu' elle m' a dit ?","chez le NC donc … pour que on se PRES tout le NUM , et que ça VSUBP , le NC … PHASE ce que il lui avoir VDIC ?"
1501,Goncourt/Germinie Lacerteux copie_clean.txt,Jamais !,ADVTEMPS !
1502,Goncourt/Germinie Lacerteux copie_clean.txt,Et Germinie repoussa le bras de Jupillon .,et NP VPS le NCCOR de NP .
1503,Goncourt/Germinie Lacerteux copie_clean.txt,"Alors , si c' est comme ça , adieu … Et Jupillon leva sa casquette .","alors , si ce être comme ça , NC … et NP PRES DETPOSS NCo ."
1504,Goncourt/Germinie Lacerteux copie_clean.txt,Faudra -t -il que je t' écrive de le régiment ?,VF t il que je le VSUBP de le NC ?
1505,Goncourt/Germinie Lacerteux copie_clean.txt,"Germinie eut un instant de silence , un moment d' hésitation .","NP avoir un NCo de NCmod , un NC de NCmod ."
1506,Goncourt/Germinie Lacerteux copie_clean.txt,"Puis brusquement : Marchons , dit -elle , et faisant signe à Jupillon de marcher à côté d' elle , elle remonta la rue .","puis ADV : NP , VDIC il , et faire NCo à NP de INF à NC de il , il VSENT le NCo ."
1507,Goncourt/Germinie Lacerteux copie_clean.txt,"Tous deux se mirent à aller à côté l' un de l' autre , sans rien se dire .","tout NUM se VPS à aller à NC le un de le autre , sans rien se VDIC ."
1508,Goncourt/Germinie Lacerteux copie_clean.txt,"Ils arrivèrent à une route pavée qui se reculait et s' allongeait éternellement entre deux lignes de réverbères , entre deux rangées d' arbres tortillés jetant à le ciel une poignée de branches sèches et plaquant à de grands murs plats leur ombre immobile et maigre .","il VPS à un NC PPAS qui se VIMP et se VIMP ADV entre NUM NC de NCmod , entre NUM NCmod de NCmod ADJ PPRES à le NC un NCo de NCmod ADJ et PPRES à un ADJ NC ADJ lui NCo ADJ et ADJ ."
1509,Goncourt/Germinie Lacerteux copie_clean.txt,"Là , sous le ciel aigu et glacé d' une réverbération de neige , ils marchaient longtemps , s' enfonçant dans le vague , l' infini , l' inconnu d' une rue qui suit toujours le même mur , les mêmes arbres , les mêmes réverbères , et conduit toujours à la même nuit .","ADVLIEU , sous le NC PPAS et PPAS de un NC de NCmod , il VIMP longtemps , se PPRES dans le NC , le ADJ , le NC de un NCmod qui PRES ADVTEMPS le même NC , le même NCo , le même NC , et PRES ADVTEMPS à le même NCT ."
1510,Goncourt/Germinie Lacerteux copie_clean.txt,"L' air humide et chargé qu' ils respiraient sentait le sucre , le suif et la charogne .","le NCMAN ADJ et PPAS que il VIMP sentir le NCo , le NC et le NC ."
1511,Goncourt/Germinie Lacerteux copie_clean.txt,"Par moments , il leur passait comme un flamboiement devant les yeux : c' était une tapissière dont la lanterne donnait sur de les bestiaux éventrés et de les carrés de viande saignante jetés sur la croupe d' un cheval blanc : ce feu sur ces chairs , dans l' obscurité , ruisselait en incendie de pourpre , en fournaise de sang .","par NC , il lui VIMP comme un NC ADVLIEU le NCCOR : ce être un NC dont le NCs VIMP sur de le NC PPAS et de le NC de NCmod ADJ PPAS sur le NC de un NCmod ADJCOL : ce NC sur ce NCCOR , dans le NCmod , VIMP en NC de ADJCOL , en NC de NCCOR ."
1512,Goncourt/Germinie Lacerteux copie_clean.txt,Eh bien !,INTJ bien !
1513,Goncourt/Germinie Lacerteux copie_clean.txt,as -tu fait tes réflexions ?,avoir il faire DETPOSS NCo ?
1514,Goncourt/Germinie Lacerteux copie_clean.txt,fit Jupillon .,faire NP .
1515,Goncourt/Germinie Lacerteux copie_clean.txt,"Ce n' est pas gai , sais-tu? ta petite avenue Trudaine .","ce ne être pas ADJ , sais-tu? ta ADJ NC NP ."
1516,Goncourt/Germinie Lacerteux copie_clean.txt,"Marchons , répondit Germinie .","NP , VDIC NP ."
1517,Goncourt/Germinie Lacerteux copie_clean.txt,"Et elle recommença , sans parler , sa marche saccadée , violente , agitée de tous les tumultes de son âme .","et il VPS , sans INF , DETPOSS NCo ADJ , ADJ , PPAS de tout le NC de DETPOSS NCmod ."
1518,Goncourt/Germinie Lacerteux copie_clean.txt,Ses pensées passaient dans ses gestes .,DETPOSS NCs VIMP dans DETPOSS NC .
1519,Goncourt/Germinie Lacerteux copie_clean.txt,"L' égarement venait à son pas , la folie à ses mains .","le NCs venir à DETPOSS pas , le NC à DETPOSS NCCOR ."
1520,Goncourt/Germinie Lacerteux copie_clean.txt,"Par moments , elle avait , derrière elle , l' ombre d' une femme de la Salpêtrière .","par NC , il avoir , ADVLIEU il , le NCo de un NCmod de le NP ."
1521,Goncourt/Germinie Lacerteux copie_clean.txt,"Deux ou trois passants s' arrêtèrent un instant , la regardèrent , puis , comme ils étaient de Paris , passèrent .","NUM ou NUM NCs se VPS un NC , le VCOG , puis , comme il être de NP , VPS ."
1522,Goncourt/Germinie Lacerteux copie_clean.txt,"Tout à coup elle s' arrêta , et faisant un geste de résolution désespérée : Ah !","tout à NC il se VPS , et faire un NCo de NCmod ADJ : INTJ !"
1523,Goncourt/Germinie Lacerteux copie_clean.txt,"mon Dieu , une épingle de plus dans la pelote , fit -elle .","DETPOSS NP , un NC de plus dans le NCmod , faire il ."
1524,Goncourt/Germinie Lacerteux copie_clean.txt,Allons !,NP !
1525,Goncourt/Germinie Lacerteux copie_clean.txt,Et elle prit le bras de Jupillon .,et il VPS le NCCOR de NP .
1526,Goncourt/Germinie Lacerteux copie_clean.txt,Oh !,INTJ !
1527,Goncourt/Germinie Lacerteux copie_clean.txt,"je sais bien , lui dit Jupillon quand ils furent près de la crémerie , ma mère n' a pas été juste pour toi .","je VCOG bien , lui VDIC NP quand il être ADVLIEU de le NC , DETPOSS NCs ne avoir pas être ADV pour soi ."
1528,Goncourt/Germinie Lacerteux copie_clean.txt,"Vois -tu , elle a été trop honnête toute sa vie , cette femme … Elle ne sait pas , elle ne comprend pas … Et puis , tiens , je vais te dire , moi , le fond de tout : c' est qu' elle m' aime tant qu' elle est jalouse de les femmes qui m' aiment … Entre donc , va !","ADV -tu , il avoir être trop ADJ tout DETPOSS NC , ce NC … il ne VCOG pas , il ne VCOG pas … et puis , ADJ , je aller me VDIC , soi , le NC de tout : ce être que il lui VSENT tant que il être ADJ de le NC qui lui PRES … entre donc , aller !"
1529,Goncourt/Germinie Lacerteux copie_clean.txt,"Et il la poussa dans les bras de Mme Jupillon qui l' embrassa , lui marmotta quelques paroles de regret , et se dépêcha de pleurer pour se tirer d' embarras et faire la scène plus attendrissante .","et il le VPS dans le NCCOR de madame NP qui le VPS , lui VPS quelque NCo de NCSENT , et se VPS de INF pour se INF de NCSENT et faire le NCo plus ADJ ."
1530,Goncourt/Germinie Lacerteux copie_clean.txt,"Tout ce soir -là , Germinie resta les yeux fixés sur Jupillon , l' effrayant presque avec son regard .","tout ce NCT ADVLIEU , NP VPS le NCCOR PPAS sur NP , le VSENT presque avec DETPOSS NCMAN ."
1531,Goncourt/Germinie Lacerteux copie_clean.txt,"Allons , lui dit -il en la reconduisant , ne sois donc pas bonnet de nuit comme ça … Il faut une philosophie en ce monde … Eh bien !","NP , lui VDIC il en le PPRES , ne ADJ donc pas ADJ de NCT comme ça … il PRES un NCs en ce NCmod … INTJ bien !"
1532,Goncourt/Germinie Lacerteux copie_clean.txt,me voilà soldat… voilà tout !,me voilà NP voilà tout !
1533,Goncourt/Germinie Lacerteux copie_clean.txt,"On n' en revient pas toujours , c' est vrai … Mais enfin … Tiens !","on ne en PRES pas ADVTEMPS , ce être vrai … mais PHASE … tenir !"
1534,Goncourt/Germinie Lacerteux copie_clean.txt,"je veux que nous nous amusions , les quinze jours qui me restent … parce que c' est autant de pris… et que si je ne reviens pas … Eh bien !","je vouloir que nous nous VIMP , le NUM NCT qui me PRES … parce que ce être autant de NP et que si je ne PRES pas … INTJ bien !"
1535,Goncourt/Germinie Lacerteux copie_clean.txt,je t' aurai à le moins laissé sur un bon souvenir de moi … Germinie ne répondit rien .,je lui avoir à le moins laisser sur un ADJ NC de soi … NP ne VDIC rien .
1536,Goncourt/Germinie Lacerteux copie_clean.txt,"De huit jours , Germinie ne remit pas les pieds dans la boutique .","de NUM NCT , NP ne PRES pas le NCCOR dans le NC ."
1537,Goncourt/Germinie Lacerteux copie_clean.txt,"Les Jupillon , ne la voyant pas revenir , commençaient à désespérer .","le NP , ne le VCOG pas INF , VIMP à VSENT ."
1538,Goncourt/Germinie Lacerteux copie_clean.txt,"Enfin , un soir , sur les dix heures et demie , elle poussa la porte , entra sans dire bonjour ni bonsoir , alla à la petite table où étaient assis la mère et le fils à demi sommeillants , posa sous sa main , fermée avec un serrement de griffe , un vieux morceau de toile qui sonna .","PHASE , un NCT , sur le NUM NCT et NC , il VPS le NCo , VPS sans VDIC NCo ni NC , aller à le ADJ NC où être PPAS le NCo et le NC à NCmod ADJ , VPS sous DETPOSS NCCOR , PPAS avec un NC de NCmod , un ADJ NC de NCmod qui VPS ."
1539,Goncourt/Germinie Lacerteux copie_clean.txt,Voilà !,voilà !
1540,Goncourt/Germinie Lacerteux copie_clean.txt,fit -elle .,faire il .
1541,Goncourt/Germinie Lacerteux copie_clean.txt,"Et lâchant les coins de le morceau de toile , elle répandit ce qui était dedans : il coula sur la table de gras billets de banque recollés par derrière , rattachés avec de les épingles , de vieux louis à l' or verdi , de les pièces de cent sous toutes noires , de les pièces de quarante sous , de les pièces de dix sous , de l' argent de pauvre , de l' argent de travail , de l' argent de tirelire , de l' argent sali par de les mains sales , fatigué dans le porte-monnaie de cuir , usé dans le comptoir plein de sous , de l' argent sentant la sueur .","et PPRES le NCo de le NCmod de NCmod , il VPS ce qui être dedans : il VPS sur le NC de ADJ NCmod de NCmod PPAS par ADVLIEU , PPAS avec de le NC , de ADJ NC à le NCmod NCmod , de le NC de NUM sous tout NCmod , de le NC de NUM NCmod , de le NC de NUM NCmod , de le NC de NCmod , de le NC de NCmod , de le NC de NCmod , de le NC PPAS par de le NCCOR ADJ , VSENT dans le NC de NCmod , PPAS dans le NC ADJ de NCmod , de le NC sentir le NCo ."
1542,Goncourt/Germinie Lacerteux copie_clean.txt,"Un moment , elle regarda tout ce qui était étalé comme pour se convaincre les yeux ; puis avec une voix triste et douce , la voix de son sacrifice , elle dit simplement à Mme Jupillon : Ça y est … C' est les deux mille trois cents francs … pour qu' il se rachète … Ah !","un NC , il VCOG tout ce qui être PPAS comme pour se INF le NCCOR ; puis avec un NCMAN ADJ et ADJ , le NCMAN de DETPOSS NCmod , il VDIC ADVMAN à madame NP : ça y être … ce être le NUM NUM NUM NC ADJ … pour que il se PRES … INTJ !"
1543,Goncourt/Germinie Lacerteux copie_clean.txt,ma bonne Germinie !,DETPOSS ADJ NP !
1544,Goncourt/Germinie Lacerteux copie_clean.txt,fit la grosse femme en suffoquant sous une première émotion ; et elle se jeta à le cou de Germinie qui se laissa embrasser .,faire le ADJ NCo en PPRES sous un ADJ NCSENT ; et il se VPS à le NCCOR de NP qui se laisser INF .
1545,Goncourt/Germinie Lacerteux copie_clean.txt,Oh !,INTJ !
1546,Goncourt/Germinie Lacerteux copie_clean.txt,"vous allez prendre quelque chose avec nous , une tasse de café … Non , merci , dit Germinie , je suis rompue … Dame !","vous aller INF quelque chose avec nous , un NC de NCmod … non , INTJ , VDIC NP , je être PPAS … NP !"
1547,Goncourt/Germinie Lacerteux copie_clean.txt,"j' ai eu à courir , allez , pour les trouver … Je vais me coucher … Une autre fois … Et elle sortit .","je avoir avoir à INF , aller , pour le INF … je aller me INF … un autre fois … et il VPS ."
1548,Goncourt/Germinie Lacerteux copie_clean.txt,"Elle avait eu à courir , comme elle disait , pour rassembler une pareille somme , réaliser cette chose impossible : trouver deux mille trois cents francs , deux mille trois cents francs dont elle n' avait pas les premiers cinq francs !","il avoir avoir à INF , comme il VDIC , pour INF un ADJ NCo , VCOG ce chose ADJ : INF NUM NUM NUM NCo ADJ , NUM NUM NUM NCmod ADJ dont il ne avoir pas le ADJ NUM NCo !"
1549,Goncourt/Germinie Lacerteux copie_clean.txt,"Elle les avait quêtés , mendiés , arrachés pièce à pièce , presque sou à sou .","il le avoir PPAS , PPAS , PPAS NC à NCmod , presque NP à NP ."
1550,Goncourt/Germinie Lacerteux copie_clean.txt,"Elle les avait ramassés , grattés ici et là , sur les uns , sur les autres , par emprunts de deux cents , de cent francs , de cinquante francs , de vingt francs , de ce qu' on avait voulu .","il le avoir PPAS , PPAS ADVLIEU et ADVLIEU , sur le NC , sur le autre , par NC de NUM NCmod , de NUM NC , de NUM NC , de NUM NC , de ce que on avoir vouloir ."
1551,Goncourt/Germinie Lacerteux copie_clean.txt,"Elle avait emprunté à son portier , à son épicier , à sa fruitière , à sa marchande de volaille , à sa blanchisseuse ; elle avait emprunté à les fournisseurs de le quartier , à les fournisseurs de les quartiers qu' elle avait d' abord habités avec mademoiselle .","il avoir PPAS à DETPOSS NC , à DETPOSS NC , à DETPOSS NC , à DETPOSS NC de NCmod , à DETPOSS NC ; il avoir PPAS à le NC de le NCmod , à le NC de le NCmod que il avoir de NC ADJ avec monsieur ."
1552,Goncourt/Germinie Lacerteux copie_clean.txt,"Elle avait fait entrer dans la somme tous les argents , jusqu' à la misérable monnaie de son porteur d' eau .","il avoir faire INF dans le NC tout le NCo , jusque à le ADJ NC de DETPOSS NCmod de NCmod ."
1553,Goncourt/Germinie Lacerteux copie_clean.txt,"Elle avait quémandé partout , extorqué humblement , prié , supplié , inventé de les histoires , dévoré la honte de mentir et de voir qu' on ne la croyait pas .","il avoir VDIC ADV , PPAS ADVMAN , PPAS , PPAS , PPAS de le NC , VSENT le NCSENT de INF et de VCOG que on ne le VCOG pas ."
1554,Goncourt/Germinie Lacerteux copie_clean.txt,"L' humiliation d' avouer qu' elle n' avait pas d' argent placé , comme on le croyait et comme par orgueil elle le laissait croire , la commisération de gens qu' elle méprisait , les refus , les aumônes , elle avait tout subi , essuyé ce qu' elle n' aurait pas essuyé pour trouver de le pain , et non une fois auprès d' une personne , mais auprès de trente , de quarante , auprès de tous ceux qui lui avaient donné ou dont elle avait espéré quelque chose .","le NCSENT de VDIC que il ne avoir pas un NCo PPAS , comme on le VCOG et comme par NCSENT il le laisser VCOG , le NCSENT de NCmod que il VSENT , le NC , le NC , il avoir tout PPAS , PPAS ce que il ne avoir pas PPAS pour INF de le NC , et non un fois ADV de un NC , mais ADV de NUM , de NUM , ADV de tout celui qui lui avoir PPAS ou dont il avoir VCOG quelque chose ."
1555,Goncourt/Germinie Lacerteux copie_clean.txt,"Enfin cet argent , elle l' avait réuni ; mais il était son maître et la possédait pour toujours .","PHASE ce NC , il le avoir PPAS ; mais il être DETPOSS NC et le VIMP pour ADVTEMPS ."
1556,Goncourt/Germinie Lacerteux copie_clean.txt,"Elle appartenait à les obligations qu' elle avait à les gens , à le service que lui avaient rendu ses fournisseurs en sachant bien ce qu' ils faisaient .","il VIMP à le NC que il avoir à le NC , à le NCmod que lui avoir PPAS DETPOSS NCo en VCOG bien ce que il faire ."
1557,Goncourt/Germinie Lacerteux copie_clean.txt,"Elle appartenait à sa dette , à ce qu' elle aurait à payer chaque année .","il VIMP à DETPOSS NC , à ce que il avoir à INF chaque NCT ."
1558,Goncourt/Germinie Lacerteux copie_clean.txt,"Elle le savait ; elle savait que tous ses gages y passeraient , qu' avec les arrangements usuraires laissés par elle à le gré de ses créanciers , les reconnaissances exigées par eux , les trois cents francs de mademoiselle ne feraient guère que payer les intérêts de les deux mille trois cents francs de son emprunt .","il le VCOG ; il VCOG que tout DETPOSS NCs y VIMP , que avec le NC ADJ laisser par il à le NC de DETPOSS NCmod , le NC PPAS par eux , le NUM NCo ADJ de monsieur ne faire guère que INF le NCSENT de le NUM NUM NUM NC ADJ de DETPOSS NCmod ."
1559,Goncourt/Germinie Lacerteux copie_clean.txt,"Elle savait qu' elle devrait , qu' elle devrait toujours , qu' elle était à jamais vouée à les privations , à la gêne , à tous les retranchements de l' entretien , de la toilette .","il VCOG que il devoir , que il devoir ADVTEMPS , que il être à ADVTEMPS PPAS à le NC , à le NCSENT , à tout le NC de le NCmod , de le NC ."
1560,Goncourt/Germinie Lacerteux copie_clean.txt,"Sur les Jupillon , elle n' avait pas beaucoup plus d' illusions que sur son avenir .","sur le NP , il ne avoir pas beaucoup plus de NC que sur DETPOSS NC ."
1561,Goncourt/Germinie Lacerteux copie_clean.txt,"Son argent avec eux était perdu , elle en avait le pressentiment .","DETPOSS NCspas avec eux être PPAS , il en avoir le NCSENT ."
1562,Goncourt/Germinie Lacerteux copie_clean.txt,Elle n' avait pas même fait le calcul que ce sacrifice toucherait le jeune homme .,il ne avoir pas même faire le NCo que ce NCs VCOND le ADJ NCo .
1563,Goncourt/Germinie Lacerteux copie_clean.txt,Elle avait agi d' un premier mouvement .,il avoir PPAS de un ADJ NC .
1564,Goncourt/Germinie Lacerteux copie_clean.txt,"On lui aurait dit de mourir pour qu' il ne partît pas , qu' elle fût morte .","on lui avoir VDIC de INF pour que il ne PRES pas , que il être PPAS ."
1565,Goncourt/Germinie Lacerteux copie_clean.txt,"L' idée de le voir militaire , cette idée de le champ de bataille , de le canon , de les blessés , devant laquelle , de terreur , la femme ferme les yeux , l' avait décidée à faire plus que mourir: à vendre sa vie pour cet homme , à signer pour lui sa misère éternelle !","le NCs de le VCOG ADJ , ce NC de le NCmod de NCmod , de le NC , de le NC , ADVLIEU lequel , de NCSENT , le NCs PRES le NCCOR , le avoir PPAS à faire plus que mourir: à INF DETPOSS NCo pour ce NC , à INF pour lui DETPOSS NCo ADJ !"
1566,Goncourt/Germinie Lacerteux copie_clean.txt,"C' est un effet ordinaire de les désordres nerveux de l' organisme de dérégler les joies et les peines humaines , de leur ôter la proportion et l' équilibre , et de les pousser à l' extrémité de leur excès .","ce être un NC ADJ de le NCmod ADJ de le NCmod de INF le NCSENT et le NCSENT ADJ , de lui INF le NCo et le NCSENT , et de le INF à le NC de lui NCmod ."
1567,Goncourt/Germinie Lacerteux copie_clean.txt,"Il semble que , sous l' influence de cette maladie d' impressionnabilité , les sensations aiguisées , raffinées , spiritualisées , dépassent leur mesure et leur limite naturelles , atteignent au-delà d' elles-mêmes , et mettent une sorte d' infini dans la jouissance et la souffrance de la créature .","il sembler que , sous le NC de ce NCmod de NCmod , le NCSENT PPAS , NC , PPAS , PRES lui NCo et lui NC ADJ , PRES ADV de soi-même , et mettre un sorte de ADJ dans le NCSENT et le NCSENT de le NCmod ."
1568,Goncourt/Germinie Lacerteux copie_clean.txt,"Maintenant les rares joies qu' avait encore Germinie étaient de les joies folles , de les joies dont elle sortait ivre et avec les caractères physiques de l' ivresse .","PPRES le ADJ NCSENT que avoir encore NP être de le NCSENT ADJ , de le NCSENT dont il VIMP INF et avec le NC ADJ de le NCSENT ."
1569,Goncourt/Germinie Lacerteux copie_clean.txt,"Mais , ma fille , ne pouvait s' empêcher de lui dire Mademoiselle , on croirait que tu es grise .","mais , DETPOSS NCs , ne pouvoir se INF de lui VDIC NP , on VCOG que je être PPAS ."
1570,Goncourt/Germinie Lacerteux copie_clean.txt,"Pour une fois qu' on s' amuse , répondait Germinie , mademoiselle vous le fait bien payer .","pour un fois que on se VSENT , VDIC NP , NC vous le PRES bien INF ."
1571,Goncourt/Germinie Lacerteux copie_clean.txt,"Et quand elle retombait dans ses peines , dans ses chagrins , dans ses inquiétudes , c' était une désolation plus intense encore , plus furieuse et délirante que sa gaieté .","et quand il VIMP dans DETPOSS NCSENT , dans DETPOSS NCSENT , dans DETPOSS NCSENT , ce être un NC plus ADJ encore , plus ADJ et ADJ que DETPOSS NCSENT ."
1572,Goncourt/Germinie Lacerteux copie_clean.txt,"Le moment était arrivé où la terrible vérité , entrevue , puis voilée par de les illusions dernières , finissait par apparaître à Germinie .","le NCs être PPAS où le ADJ NCs , NC , puis PPAS par de le NC ADJ , VASP par INF à NP ."
1573,Goncourt/Germinie Lacerteux copie_clean.txt,"Elle voyait qu' elle n' avait pu attacher Jupillon par le dévouement de son amour , le dépouillement de tout ce qu' elle avait , tous ces sacrifices d' argent qui engageaient sa vie dans l' embarras et les transes d' une dette impossible à payer .","il VCOG que il ne avoir pouvoir INF NP par le NC de DETPOSS NCSENT , le NC de tout ce que il avoir , tout ce NC de NCmod qui VIMP DETPOSS NCo dans le NCSENT et le NC de un NCmod ADJ à INF ."
1574,Goncourt/Germinie Lacerteux copie_clean.txt,"Elle sentait qu' il lui apportait à regret son amour , un amour où il mettait l' humiliation d' une charité .","il sentir que il lui VIMP à NCSENT DETPOSS NCSENT , un NCSENT où il mettre le NCSENT de un NCmod ."
